,pid,Title,Brand,Price,Description,category,mfpartnumber,whatisincluded,Image,Attachment 1,Attachment 2,Attachment 3,Attachment 4,Attachment 5,Attachment 6,Attachment 7,Hazardous,Pack Type,Supplier Product Code,Type,WEEE Compliant,Application,Feature 1,Feature 2,Feature 3,Feature 4,Feature 5,Feature 6,Feature 7,Feature 8,Colour,Volume,Physical State / Form,Feature 9,Feature 10,Feature 11,Feature 12,Range
0,P609939,Center Heating system inhibitor 500ml,Center,5.49,"This high performance Center inhibitor is formulated to protect your heating system from both corrosion and limescale deposits. This 500ml supply will be enough to provide ongoing protection for a typical 100L system, the equivalent of 10 radiators.",Heating/Water Treatment Products/Central Heating Inhibitors/Central Heating Inhibitors.csv -> Center Heating system inhibitor 500ml,,,https://www.wolseley.co.uk/wcsstore/ExtendedSitesCatalogAssetStore/images/products/AssetPush/wol-web-proof-medium-w/std.lang.all/99/39/609939_wm.jpg,https://www.wolseley.co.uk/wcsstore/ExtendedSitesCatalogAssetStore/images/products/AssetPush/DTP_AssetPushHighRes/std.lang.all/ms/ds/CenterCB_609939_MSDS.pdf,https://www.wolseley.co.uk/wcsstore/ExtendedSitesCatalogAssetStore/images/products/AssetPush/DTP_AssetPushHighRes/std.lang.all/he/et/609939 Safety_Data_Sheet.pdf,https://www.wolseley.co.uk/wcsstore/ExtendedSitesCatalogAssetStore/images/products/AssetPush/DTP_AssetPushHighRes/std.lang.all/ic/al/Center_609939_Technical.pdf,https://www.wolseley.co.uk/wcsstore/ExtendedSitesCatalogAssetStore/images/products/AssetPush/DTP_AssetPushHighRes/std.lang.all/25/49/492549.pdf,https://www.wolseley.co.uk/wcsstore/ExtendedSitesCatalogAssetStore/images/products/AssetPush/DTP_AssetPushHighRes/std.lang.all/ms/ds/609939_Center_MSDS.pdf,https://www.wolseley.co.uk/wcsstore/ExtendedSitesCatalogAssetStore/images/products/AssetPush/DTP_AssetPushHighRes/std.lang.all/ms/ds/Center_609939_MSDS.pdf,https://www.wolseley.co.uk/wcsstore/ExtendedSitesCatalogAssetStore/images/products/AssetPush/DTP_AssetPushHighRes/std.lang.all/ci/as/609939_Center_NSF_CIAS.pdf,,,,,,,,,,,,,,,,,,,,,,
1,P604000,Fernox F1 F1 C/Heating Protector 500ml,Fernox,16.26,"Preventing corrosion and limescale in central heating systems, this Fernox F1 Express protector offers high levels of protection through a unique combination of three inhibitors of organic particles. These inhibitors work by simply binding to the metal used in the heating system, protecting from debris while anodic inhibitors react with those surfaces to create a protective layer. Additionally, cathodic inhibitors combine with hard water salts to form an insoluble layer.",Heating/Water Treatment Products/Central Heating Inhibitors/Central Heating Inhibitors.csv -> Fernox F1 F1 C/Heating Protector 500ml,,,https://www.wolseley.co.uk/wcsstore/ExtendedSitesCatalogAssetStore/images/products/AssetPush/wol-web-proof-medium-w/std.lang.all/40/00/NW-604000_wm.jpg,https://www.wolseley.co.uk/wcsstore/ExtendedSitesCatalogAssetStore/images/products/AssetPush/DTP_AssetPushHighRes/std.lang.all/ic/al/Fernox_56599_ProtectorF1_Technical.pdf,https://www.wolseley.co.uk/wcsstore/ExtendedSitesCatalogAssetStore/images/products/AssetPush/DTP_AssetPushHighRes/std.lang.all/hu/re/Fernox_Brochure.pdf,https://www.wolseley.co.uk/wcsstore/ExtendedSitesCatalogAssetStore/images/products/AssetPush/DTP_AssetPushHighRes/std.lang.all/_h/&s/Fernox_ConcentrateCH_ProtectorF1_H&S.pdf,https://www.wolseley.co.uk/wcsstore/ExtendedSitesCatalogAssetStore/images/products/AssetPush/DTP_AssetPushHighRes/std.lang.all/_s/ds/Fernox_56599_SDS.pdf,https://www.wolseley.co.uk/wcsstore/ExtendedSitesCatalogAssetStore/images/products/AssetPush/DTP_AssetPushHighRes/std.lang.all/sd/s9/Alpha_SDS9.pdf,,,,,,,,,,,,,,,,,,,,,,,,
2,P608071,Adey MC1+ central heating protector 500ml,Adey,11.25,"Wave goodbye to the damaging effects of magnetite and other unwelcome deposits with Adey MC1+ protector, supplied in a 500ml bottle. Formulated to prevent wear and tear and the debris that gathers in central heating systems, MC1+ helps to extend your system's lifetime and keep your boiler working at maximum efficiency.",Heating/Water Treatment Products/Central Heating Inhibitors/Central Heating Inhibitors.csv -> Adey MC1+ central heating protector 500ml,,,https://www.wolseley.co.uk/wcsstore/ExtendedSitesCatalogAssetStore/images/products/AssetPush/wol-web-proof-medium-w/std.lang.all/80/71/NW-608071_wm.jpg,https://www.wolseley.co.uk/wcsstore/ExtendedSitesCatalogAssetStore/images/products/AssetPush/DTP_AssetPushHighRes/std.lang.all/_s/ds/Adey_MC1+_SDS.pdf,https://www.wolseley.co.uk/wcsstore/ExtendedSitesCatalogAssetStore/images/products/AssetPush/DTP_AssetPushHighRes/std.lang.all/hu/re/Adey_Domestic_Product_Range_Brochure.pdf,https://www.wolseley.co.uk/wcsstore/ExtendedSitesCatalogAssetStore/images/products/AssetPush/DTP_AssetPushHighRes/std.lang.all/s_/v2/Adey_MC1+MSDS_V2.pdf,,,,,,,,,,,,,,,,,,,,,,,,,,
3,P602996,Fernox F1 Express F1 Protector F1 Express 400ml,Fernox,17.85,"Preventing corrosion and limescale in central heating systems, this Fernox F1 Express protector offers high levels of protection through a unique combination of three inhibitors of organic particles. These inhibitors work by simply binding to the metal used in the heating system, protecting from debris while anodic inhibitors react with those surfaces to create a protective layer. Additionally, cathodic inhibitors combine with hard water salts to form an insoluble layer. On top of that, F1 also includes pH buffering, keeping the system water pH level between 6.5 and 8.5, the optimum range for the prevention of corrosion and limescale. It is recommended that concentration levels are checked annually during boiler or system services.",Heating/Water Treatment Products/Central Heating Inhibitors/Central Heating Inhibitors.csv -> Fernox F1 Express F1 Protector F1 Express 400ml,,,https://www.wolseley.co.uk/wcsstore/ExtendedSitesCatalogAssetStore/images/products/AssetPush/wol-web-proof-medium-w/std.lang.all/29/96/NW-602996_wm.jpg,https://www.wolseley.co.uk/wcsstore/ExtendedSitesCatalogAssetStore/images/products/AssetPush/DTP_AssetPushHighRes/std.lang.all/_s/ds/Fernox_62418_SDS.pdf,https://www.wolseley.co.uk/wcsstore/ExtendedSitesCatalogAssetStore/images/products/AssetPush/DTP_AssetPushHighRes/std.lang.all/he/et/602996_Fernox_Datasheet.pdf,https://www.wolseley.co.uk/wcsstore/ExtendedSitesCatalogAssetStore/images/products/AssetPush/DTP_AssetPushHighRes/std.lang.all/ms/ds/602996_Fernox_MSDS.pdf,https://www.wolseley.co.uk/wcsstore/ExtendedSitesCatalogAssetStore/images/products/AssetPush/DTP_AssetPushHighRes/std.lang.all/ic/al/Fernox_62418_Protector_Technical.pdf,,,,,,,,,,,,,,,,,,,,,,,,,
4,P609942,Center Quick Dose inhibitor 300ml,Center,13.75,"Helping to prolong the life of your heating system, Center Quick Dose inhibitor protects from the damage caused by corrosion and limescale deposits. This 300ml supply will be enough to clean a typical 100L system, the equivalent of 10 radiators.",Heating/Water Treatment Products/Central Heating Inhibitors/Central Heating Inhibitors.csv -> Center Quick Dose inhibitor 300ml,,,https://www.wolseley.co.uk/wcsstore/ExtendedSitesCatalogAssetStore/images/products/AssetPush/wol-web-proof-medium-w/std.lang.all/99/42/NW-609942_wm.jpg,https://www.wolseley.co.uk/wcsstore/ExtendedSitesCatalogAssetStore/images/products/AssetPush/DTP_AssetPushHighRes/std.lang.all/ci/as/Center_609942_NSF_CIAS.pdf,https://www.wolseley.co.uk/wcsstore/ExtendedSitesCatalogAssetStore/images/products/AssetPush/DTP_AssetPushHighRes/std.lang.all/he/et/609942 Safety_Data_Sheet.pdf,https://www.wolseley.co.uk/wcsstore/ExtendedSitesCatalogAssetStore/images/products/AssetPush/DTP_AssetPushHighRes/std.lang.all/ic/al/Center_609942_Technical.pdf,https://www.wolseley.co.uk/wcsstore/ExtendedSitesCatalogAssetStore/images/products/AssetPush/DTP_AssetPushHighRes/std.lang.all/ms/ds/CenterCB_609942_MSDS.pdf,,,,,,,,,,,,,,,,,,,,,,,,,
5,P608100,Sentinel X100 X100 Inhibitor 1Ltr,Sentinel,17.12,"Suitable for use in all types of indirect central heating systems, Sentinel X100 inhibitor, supplied in a 1L bottle, protects clean central heating systems from the damage that can be caused by limescale and corrosion. This inhibitor will helps to maximise efficiency while minimising fuel use and extending the life of your boiler.",Heating/Water Treatment Products/Central Heating Inhibitors/Central Heating Inhibitors.csv -> Sentinel X100 X100 Inhibitor 1Ltr,,,https://www.wolseley.co.uk/wcsstore/ExtendedSitesCatalogAssetStore/images/products/AssetPush/wol-web-proof-medium-w/std.lang.all/_n/ew/608100_NEW_wm.jpg,https://www.wolseley.co.uk/wcsstore/ExtendedSitesCatalogAssetStore/images/products/AssetPush/DTP_AssetPushHighRes/std.lang.all/_h/&s/Sentinel_X100Liquid_H&S.pdf,https://www.wolseley.co.uk/wcsstore/ExtendedSitesCatalogAssetStore/images/products/AssetPush/DTP_AssetPushHighRes/std.lang.all/_h/&s/Sentinel_X100_H&S.pdf,https://www.wolseley.co.uk/wcsstore/ExtendedSitesCatalogAssetStore/images/products/AssetPush/DTP_AssetPushHighRes/std.lang.all/he/et/Sentinel_X100L_Safetydatasheet.pdf,https://www.wolseley.co.uk/wcsstore/ExtendedSitesCatalogAssetStore/images/products/AssetPush/DTP_AssetPushHighRes/std.lang.all/hu/re/Sentinel_X100Inhibitor_Brochure.pdf,https://www.wolseley.co.uk/wcsstore/ExtendedSitesCatalogAssetStore/images/products/AssetPush/DTP_AssetPushHighRes/std.lang.all/_s/ds/Sentinel_FastActingCleaner_SDS.pdf,https://www.wolseley.co.uk/wcsstore/ExtendedSitesCatalogAssetStore/images/products/AssetPush/DTP_AssetPushHighRes/std.lang.all/ic/al/Sentinel_X100_Technical.pdf,,,,,,,,,,,,,,,,,,,,,,,
6,P503908,Fernox TF1 sigma UB filter installer pack,Fernox,128.26,"An all-in-one pack for cleaning and protection, the Fernox TF1 Sigma UB filter installer pack includes a composite under-boiler filter with brass manifold, 265ml each of Fernox Protector F1 and Fernox Cleaner F3 and an inhibitor test pack. Easy to work with, this complete system helps to clean and protect a central heating system by maintaining the pH of system water, removing problematic contaminants and preventing the build-up of debris and scale.",Heating/Water Treatment Products/Central Heating Inhibitors/Central Heating Inhibitors.csv -> Fernox TF1 sigma UB filter installer pack,,,https://www.wolseley.co.uk/wcsstore/ExtendedSitesCatalogAssetStore/images/products/AssetPush/wol-web-proof-medium-w/std.lang.all/39/08/503908_wm.jpg,,,,,,,,N,Box,62677,System Filter and Inhibitor,N,Central Heating System Filter and Inhibitor,Easy installation in restricted areas and with concealed pipework,"Treats an average sized UK home of up to 100L, 12x radiators and 190sqm of underfloor heating",Reduced packaging waste and lower environmental impact,Includes 2x test strips Fernox Express Inhibitor test foil pack,Protector provides long-term protection against internal corrosion and limescale,Universal cleaner is fast acting and pH neutral,"Cleaner removes debris, sludge and scale from existing systems",Helps a system to meet BS 7593:2019 and the Benchmark Commissioning Checklist,,,,,,,,
7,P605526,Fernox F range Central Heating Protector F1 10L,Fernox,260.2,"Providing reliable pH buffering as well as protecting against corrosion and limescale, Fernox F1 protector is suitable for use in light commercial and HVAC heating and cooling systems and ensures that water maintains an optimum pH range in mixed-metal systems. Compatible with all other Fernox commercial products, Fernox F1 is safe for use on the materials usually found in heating and cooling systems, including steel and aluminium. For optimum effects, product concentration levels should be checked regularly, topping up as required.",Heating/Water Treatment Products/Central Heating Inhibitors/Central Heating Inhibitors.csv -> Fernox F range Central Heating Protector F1 10L,,,https://www.wolseley.co.uk/wcsstore/ExtendedSitesCatalogAssetStore/images/products/AssetPush/wol-web-proof-medium-w/std.lang.all/55/26/NW-605526_wm.jpg,https://www.wolseley.co.uk/wcsstore/ExtendedSitesCatalogAssetStore/images/products/AssetPush/DTP_AssetPushHighRes/std.lang.all/ic/al/Fernox_F1_Protector_Technical.pdf,https://www.wolseley.co.uk/wcsstore/ExtendedSitesCatalogAssetStore/images/products/AssetPush/DTP_AssetPushHighRes/std.lang.all/_s/ds/Fernox_F1_Protector_SDS.pdf,,,,,,,,,,,,,,,,,,,,,,,,,,,
8,P609284,Adey MC1+ central heating protector 500ml pack,Adey,10.0,"Wave goodbye to the damaging effects of magnetite and other unwelcome deposits with Adey MC1+ protector, supplied in a 500ml bottle. Formulated to prevent wear and tear and the debris that gathers in central heating systems, MC1+ helps to extend your system's lifetime and keep your boiler working at maximum efficiency.",Heating/Water Treatment Products/Central Heating Inhibitors/Central Heating Inhibitors.csv -> Adey MC1+ central heating protector 500ml pack,,,https://www.wolseley.co.uk/wcsstore/ExtendedSitesCatalogAssetStore/images/products/AssetPush/wol-web-proof-medium-w/std.lang.all/92/84/NW-609284_wm.jpg,https://www.wolseley.co.uk/wcsstore/ExtendedSitesCatalogAssetStore/images/products/AssetPush/DTP_AssetPushHighRes/std.lang.all/_s/ds/Adey_MC1+_SDS.pdf,https://www.wolseley.co.uk/wcsstore/ExtendedSitesCatalogAssetStore/images/products/AssetPush/DTP_AssetPushHighRes/std.lang.all/hu/re/Adey_Domestic_Product_Range_Brochure.pdf,https://www.wolseley.co.uk/wcsstore/ExtendedSitesCatalogAssetStore/images/products/AssetPush/DTP_AssetPushHighRes/std.lang.all/s_/v2/Adey_MC1+MSDS_V2.pdf,,,,,,,,,,,,,,,,,,,,,,,,,,
9,P292247,Scalemaster Magnetic Gold magnetic inhibitor 15mm Gold,Scalemaster,46.46,"Protecting individual appliances, the Scalemaster Magnetic Gold 15mm limescale inhibitor prevents limescale build-up by influencing the crystal structure of limescale. Harnessing the results of laboratory research, which has shown that the growth of limescale crystals can be affected by a magnetic field, this inhibitor uses magnet technology to adapt forming crystals into needle-shaped aragonite. This aragonite is less damaging than the more commonly seen calcite, and is less likely to stick hard to the surfaces of heat exchangers.",Heating/Water Treatment Products/Central Heating Inhibitors/Central Heating Inhibitors.csv -> Scalemaster Magnetic Gold magnetic inhibitor 15mm Gold,,,https://www.wolseley.co.uk/wcsstore/ExtendedSitesCatalogAssetStore/images/products/AssetPush/wol-web-proof-medium-w/std.lang.all/22/47/NW-292247_wm.jpg,https://www.wolseley.co.uk/wcsstore/ExtendedSitesCatalogAssetStore/images/products/AssetPush/DTP_AssetPushHighRes/std.lang.all/hu/re/Scalemaster_MagneticGold_Brochure.pdf,https://www.wolseley.co.uk/wcsstore/ExtendedSitesCatalogAssetStore/images/products/AssetPush/DTP_AssetPushHighRes/std.lang.all/ic/al/Scalemaster_Magnetic_Gold_Technical.pdf,,,,,,,,,,,,,,,,,,,,,,,,,,,
10,P608058,Adey MC1+ central heating protector 5ltr,Adey,164.58,"Wave goodbye to the damaging effects of magnetite and other unwelcome deposits with Adey MC1+ protector, supplied in a 5L can. Formulated to prevent wear and tear and the debris that gathers in central heating systems, MC1+ helps to extend your system's lifetime and keep your boiler working at maximum efficiency.",Heating/Water Treatment Products/Central Heating Inhibitors/Central Heating Inhibitors.csv -> Adey MC1+ central heating protector 5ltr,,,https://www.wolseley.co.uk/wcsstore/ExtendedSitesCatalogAssetStore/images/products/AssetPush/wol-web-proof-medium-w/std.lang.all/80/58/NW-608058_wm.jpg,https://www.wolseley.co.uk/wcsstore/ExtendedSitesCatalogAssetStore/images/products/AssetPush/DTP_AssetPushHighRes/std.lang.all/_s/ds/Adey_MC1+_SDS.pdf,https://www.wolseley.co.uk/wcsstore/ExtendedSitesCatalogAssetStore/images/products/AssetPush/DTP_AssetPushHighRes/std.lang.all/hu/re/Adey_Domestic_Product_Range_Brochure.pdf,https://www.wolseley.co.uk/wcsstore/ExtendedSitesCatalogAssetStore/images/products/AssetPush/DTP_AssetPushHighRes/std.lang.all/s_/v2/Adey_MC1+MSDS_V2.pdf,,,,,,,,,,,,,,,,,,,,,,,,,,
11,P606009,Fernox F1 protector F1 265ml pack,Fernox,8.9,"Supplying long term protection against corrosion and limescale, the Fernox F1 protector can help to extend the life of a central heating systems. Safe for use on all of the materials commonly used in central heating installations, including aluminium, F1 is compatible with all types of boilers, radiators and pipework and can be used in underfloor heating systems.",Heating/Water Treatment Products/Central Heating Inhibitors/Central Heating Inhibitors.csv -> Fernox F1 protector F1 265ml pack,,,https://www.wolseley.co.uk/wcsstore/ExtendedSitesCatalogAssetStore/images/products/AssetPush/wol-web-proof-medium-w/std.lang.all/92/75/NW-609275_wm.jpg,,,,,,,,N,Bottle,606009 PK,Protector,N,BoilerRadiatorPipework System,265ml bottle,Yellow liquid,Prevents corrosion and scale,Helps to extend system life and efficiency,For use in mixed metal heating systems,pH buffering for optimum system pH control,Prevents radiator cold spots,Prevents sticking pumps and boiler noise,Yellow,265ml,Liquid,"Treats up to 100L, 12 radiators or 190M² of underfloor heating",Less packaging waste,Lower environmental impact,Can be dosed via any Fernox TF1 Filter,
12,P606688,Sentinel X100 inhibitor promo 1ltr,Sentinel,12.0,"Suitable for use in all types of indirect central heating systems, Sentinel X100 inhibitor, supplied in a 1L bottle, protects clean central heating systems from the damage that can be caused by limescale and corrosion. This inhibitor will helps to maximise efficiency while minimising fuel use and extending the life of your boiler.",Heating/Water Treatment Products/Central Heating Inhibitors/Central Heating Inhibitors.csv -> Sentinel X100 inhibitor promo 1ltr,,,https://www.wolseley.co.uk/wcsstore/ExtendedSitesCatalogAssetStore/images/products/AssetPush/wol-web-proof-medium-w/std.lang.all/66/88/606688_wm.jpg,https://www.wolseley.co.uk/wcsstore/ExtendedSitesCatalogAssetStore/images/products/AssetPush/DTP_AssetPushHighRes/std.lang.all/he/et/Sentinel_X100L_Safetydatasheet.pdf,https://www.wolseley.co.uk/wcsstore/ExtendedSitesCatalogAssetStore/images/products/AssetPush/DTP_AssetPushHighRes/std.lang.all/hu/re/Sentinel_X100Inhibitor_Brochure.pdf,https://www.wolseley.co.uk/wcsstore/ExtendedSitesCatalogAssetStore/images/products/AssetPush/DTP_AssetPushHighRes/std.lang.all/ic/al/Sentinel_X100_Technical.pdf,,,,,,,,,,,,,,,,,,,,,,,,,,
13,P606171,Fernox F1 Express F1 protector pack 400ml,Fernox,16.75,"Preventing corrosion and limescale in central heating systems, this Fernox F1 Express protector pack offers high levels of protection through a unique combination of three inhibitors of organic particles. These inhibitors work by simply binding to the metal used in the heating system, protecting from debris while anodic inhibitors react with those surfaces to create a protective layer. Additionally, cathodic inhibitors combine with hard water salts to form an insoluble layer. On top of that, F1 also includes pH buffering keeping the system water pH level between 6.5 and 8.5, the optimum range for the prevention of corrosion and limescale. It is recommended that concentration levels are checked annually during boiler or system services.",Heating/Water Treatment Products/Central Heating Inhibitors/Central Heating Inhibitors.csv -> Fernox F1 Express F1 protector pack 400ml,,,https://www.wolseley.co.uk/wcsstore/ExtendedSitesCatalogAssetStore/images/products/AssetPush/wol-web-proof-medium-w/std.lang.all/61/71/NW-606171_wm.jpg,https://www.wolseley.co.uk/wcsstore/ExtendedSitesCatalogAssetStore/images/products/AssetPush/DTP_AssetPushHighRes/std.lang.all/_s/ds/Fernox_62418_SDS.pdf,https://www.wolseley.co.uk/wcsstore/ExtendedSitesCatalogAssetStore/images/products/AssetPush/DTP_AssetPushHighRes/std.lang.all/ic/al/Fernox_62418_Protector_Technical.pdf,,,,,,,,,,,,,,,,,,,,,,,,,,,
14,P603303,Fernox system health check postal kit,Fernox,69.89,"The Fernox Postal Sampling Service provides an invaluable facility for those who want to ascertain the cause of central heating problems and to determine the necessary remedial action required to resolve them, particularly where on-site results are inconclusive. Analytical water testing works because the water in the system contains all the information required for diagnosis of the most common problems. The Fernox laboratory will carry out a full analysis of the system water as part of the Postal Sampling Service, establishing the root of the problem and prescribing the correct Fernox treatment. Following treatment with Fernox products, the Postal Sampling Service will provide confirmation that the system has been correctly treated. This service is not available if competitor products have been used.",Heating/Water Treatment Products/Central Heating Inhibitors/Central Heating Inhibitors.csv -> Fernox system health check postal kit,,,https://www.wolseley.co.uk/wcsstore/ExtendedSitesCatalogAssetStore/images/products/AssetPush/wol-web-proof-medium-w/std.lang.all/33/03/NW-603303_wm.jpg,https://www.wolseley.co.uk/wcsstore/ExtendedSitesCatalogAssetStore/images/products/AssetPush/DTP_AssetPushHighRes/std.lang.all/ti/on/Fernox_EBenefits_Installation.pdf,https://www.wolseley.co.uk/wcsstore/ExtendedSitesCatalogAssetStore/images/products/AssetPush/DTP_AssetPushHighRes/std.lang.all/hu/re/Fernox_Brochure.pdf,https://www.wolseley.co.uk/wcsstore/ExtendedSitesCatalogAssetStore/images/products/AssetPush/DTP_AssetPushHighRes/std.lang.all/ic/al/Fernox_61161_System_Health_Technical.pdf,,,,,,,,,,,,,,,,,,,,,,,,,,
15,P606686,Sentinel best practice protection pack,Sentinel,75.0,"The Sentinel Best Practice protection pack is a simple, one-pack solution for the effective protection of central heating systems.",Heating/Water Treatment Products/Central Heating Inhibitors/Central Heating Inhibitors.csv -> Sentinel best practice protection pack,,Eliminator Vortex300 filter with 22mm direct fit GRP T-piece;X800 fast acting cleaner 1l;X100 inhibitor 1l,https://www.wolseley.co.uk/wcsstore/ExtendedSitesCatalogAssetStore/images/products/AssetPush/wol-web-proof-medium-w/std.lang.all/66/86/NW-606686_wm.jpg,,,,,,,,N,,606686 PK,Best Practice Protection Pack,N,Suitable for Central Heating Systems,Unique Vortex Core with powerful neodymium magnet assembly,Retains more magnetite than other filters,Ensures filter cannot block,Compact filter design,In-line installation and 360° rotating T-piece for reduced space,Unique anti-corrosion formulation with multiple heavy duty inhibitors,Intelligent formulation with pH stabilisers,Reduces circulation time to just 1 hour,,,,,,,,
16,P609290,Adey MC1+ Rapide MC1+ central heating protector 300ml,Adey,17.5,"Offering fast and effective corrosion protection, Adey MC1+ Rapide protector effectively protects central heating systems from debris. With the 300ml quick-dose bottle, this useful heating treatment can be added through a radiator, air vent or boiler filling loop, taking just 20 seconds to administer, minimising wait times and costs.",Heating/Water Treatment Products/Central Heating Inhibitors/Central Heating Inhibitors.csv -> Adey MC1+ Rapide MC1+ central heating protector 300ml,,,https://www.wolseley.co.uk/wcsstore/ExtendedSitesCatalogAssetStore/images/products/AssetPush/wol-web-proof-medium-w/std.lang.all/92/90/NW-609290_wm.jpg,https://www.wolseley.co.uk/wcsstore/ExtendedSitesCatalogAssetStore/images/products/AssetPush/DTP_AssetPushHighRes/std.lang.all/hu/re/Adey_Domestic_Product_Range_Brochure.pdf,https://www.wolseley.co.uk/wcsstore/ExtendedSitesCatalogAssetStore/images/products/AssetPush/DTP_AssetPushHighRes/std.lang.all/ms/ds/Adey_MC1+ RapideProtector_MSDS.pdf,https://www.wolseley.co.uk/wcsstore/ExtendedSitesCatalogAssetStore/images/products/AssetPush/DTP_AssetPushHighRes/std.lang.all/_s/ds/Adey_MC1+_Rapide_SDS.pdf,,,,,,,,,,,,,,,,,,,,,,,,,,
17,P640283,EndoTherm energy saving additive 500ml,EndoTherm,50.4,"Supplied in a 500ml can, EndoTherm energy saving additive is independently shown to help customers save up to 15% on their home heating bills thanks to higher levels of efficiency.",Heating/Water Treatment Products/Central Heating Inhibitors/Central Heating Inhibitors.csv -> EndoTherm energy saving additive 500ml,,,https://www.wolseley.co.uk/wcsstore/ExtendedSitesCatalogAssetStore/images/products/AssetPush/wol-web-proof-medium-w/std.lang.all/02/83/NW-640283_wm.jpg,,,,,,,,N,Can,10-10-000,Energy Saving Additive,N,Suitable for Central Heating Systems,Non-corrosive,Compatible with all corrosion inhibitors,Easy installation,Suitable for old and new heating systems,Helps to deliver savings,With free applicator,,,,,,,,,,Energy
18,P608207,Fernox Express 62514 inhibitor test,Fernox,35.28,"Easy to use, this Fernox express inhibitor test offers fast on-site analysis of the concentration of all Fernox protectors, as well as other molybdate based inhibitors, in the water of your central heating system. This quick testing method is ideal for establishing the presence of inhibitor within the system, helping you to make treatment decisions.",Heating/Water Treatment Products/Central Heating Inhibitors/Central Heating Inhibitors.csv -> Fernox Express 62514 inhibitor test,,,https://www.wolseley.co.uk/wcsstore/ExtendedSitesCatalogAssetStore/images/products/AssetPush/wol-web-proof-medium-w/std.lang.all/82/07/NW-608207_wm.jpg,https://www.wolseley.co.uk/wcsstore/ExtendedSitesCatalogAssetStore/images/products/AssetPush/DTP_AssetPushHighRes/std.lang.all/ic/al/Fernox_62514_Express_Technical.pdf,,,,,,,,,,,,,,,,,,,,,,,,,,,,
