,pid,Title,Brand,Price,Description,category,mfpartnumber,whatisincluded,Image,Attachment 1,Attachment 2,Attachment 3
0,PA03243,Nabis D-Shape F0098 floor standing bath 1700 x 800 x 580mm,Nabis,1035.72,"Designed for use with bath ledge mounted taps, the Nabis 1700 x 800 x 580mm D-shaped back-to-wall bath is made of durable white acrylic. It is supplied with a click-clack waste and slotted overflow for faster, simpler installation.",Bathrooms and Kitchens/Baths and Bath Panels/Freestanding Baths/Freestanding Baths.csv -> Nabis D-Shape F0098 floor standing bath 1700 x 800 x 580mm,,,https://www.wolseley.co.uk/wcsstore/ExtendedSitesCatalogAssetStore/images/products/AssetPush/wol-web-proof-medium-w/std.lang.all/32/43/NW-A03243_wm.jpg,https://www.wolseley.co.uk/wcsstore/ExtendedSitesCatalogAssetStore/images/products/AssetPush/DTP_AssetPushHighRes/std.lang.all/ta/ll/Nabis_A03066_067_242_243_Install.pdf,https://www.wolseley.co.uk/wcsstore/ExtendedSitesCatalogAssetStore/images/products/AssetPush/DTP_AssetPushHighRes/std.lang.all/ic/al/A03243_Technical.pdf,
1,PA03067,Nabis Modern Freestanding contemporary freestanding bath plus waste,Nabis,842.44,"Nabis bath is free standing mounted, including waste, no tap hole.",Bathrooms and Kitchens/Baths and Bath Panels/Freestanding Baths/Freestanding Baths.csv -> Nabis Modern Freestanding contemporary freestanding bath plus waste,,,https://www.wolseley.co.uk/wcsstore/ExtendedSitesCatalogAssetStore/images/products/AssetPush/wol-web-proof-medium-w/std.lang.all/30/67/A03067_wm.jpg,https://www.wolseley.co.uk/wcsstore/ExtendedSitesCatalogAssetStore/images/products/AssetPush/DTP_AssetPushHighRes/std.lang.all/ta/ll/Nabis_A03066_067_242_243_Install.pdf,https://www.wolseley.co.uk/wcsstore/ExtendedSitesCatalogAssetStore/images/products/AssetPush/DTP_AssetPushHighRes/std.lang.all/wi/ng/Nabis_A03067_Technical_Drawing.pdf,https://www.wolseley.co.uk/wcsstore/ExtendedSitesCatalogAssetStore/images/products/AssetPush/DTP_AssetPushHighRes/std.lang.all/ic/al/A03067_Nabis_Technical.pdf
2,PA03242,Nabis Modern F0097 round floor standing bath 1700 x 800 x 580mm,Nabis,981.19,"With a narrow rim and smooth design, the Nabis Modern 1700 x 800 x 580mm oval freestanding bath brings understated elegance to a modern bathroom. Made of a white acrylic, this double-ended bath is supplied with a click-clack waste and slotted overflow.",Bathrooms and Kitchens/Baths and Bath Panels/Freestanding Baths/Freestanding Baths.csv -> Nabis Modern F0097 round floor standing bath 1700 x 800 x 580mm,,,https://www.wolseley.co.uk/wcsstore/ExtendedSitesCatalogAssetStore/images/products/AssetPush/wol-web-proof-medium-w/std.lang.all/32/42/NW-A03242_wm.jpg,https://www.wolseley.co.uk/wcsstore/ExtendedSitesCatalogAssetStore/images/products/AssetPush/DTP_AssetPushHighRes/std.lang.all/st/al/Nabis_A03066_067_242_243_Instal.pdf,https://www.wolseley.co.uk/wcsstore/ExtendedSitesCatalogAssetStore/images/products/AssetPush/DTP_AssetPushHighRes/std.lang.all/ic/al/A03242_Technical.pdf,
3,PA03066,Nabis Modern square freestanding bath including waste and overflow 1700 x 800 x 580mm White,Nabis,931.55,"Nabis bath is free standing mounted, including waste, no tap hole.",Bathrooms and Kitchens/Baths and Bath Panels/Freestanding Baths/Freestanding Baths.csv -> Nabis Modern square freestanding bath including waste and overflow 1700 x 800 x 580mm White,,,https://www.wolseley.co.uk/wcsstore/ExtendedSitesCatalogAssetStore/images/products/AssetPush/wol-web-proof-medium-w/std.lang.all/30/66/NW-A03066_wm.jpg,https://www.wolseley.co.uk/wcsstore/ExtendedSitesCatalogAssetStore/images/products/AssetPush/DTP_AssetPushHighRes/std.lang.all/ta/ll/Nabis_A03066_067_242_243_Install.pdf,https://www.wolseley.co.uk/wcsstore/ExtendedSitesCatalogAssetStore/images/products/AssetPush/DTP_AssetPushHighRes/std.lang.all/ic/al/A03066_Nabis_Technical.pdf,
4,PA03064,Nabis Traditional double ended freestanding bath with chrome ball and claw feet 1695 x 755 x 620mm,Nabis,696.43,Nabis bath is free standing mounted. Digitally modelled claw feet for a perfect fit and authentic traditional appearance in chrome.,Bathrooms and Kitchens/Baths and Bath Panels/Freestanding Baths/Freestanding Baths.csv -> Nabis Traditional double ended freestanding bath with chrome ball and claw feet 1695 x 755 x 620mm,,,https://www.wolseley.co.uk/wcsstore/ExtendedSitesCatalogAssetStore/images/products/AssetPush/wol-web-proof-medium-w/std.lang.all/30/64/NW-A03064_wm.jpg,https://www.wolseley.co.uk/wcsstore/ExtendedSitesCatalogAssetStore/images/products/AssetPush/DTP_AssetPushHighRes/std.lang.all/ti/on/Nabis_A03064-A03065_Installation.pdf,,
