27,PC21029,Ideal Standard Concept Sphere 1 tap hole sphere shaped countertop basin 380mm White,Ideal Standard,151.48,"Modern and practical, the Ideal Standard Concept Space Sphere 380mm countertop washbasin with single tap hole is made of tough vitreous china. Designed to maximise your bathroom space, this luxury basin sits on a countertop for a smart contemporary look.",Bathrooms and Kitchens/Bathroom Sinks/Countertop Basins/Countertop Basins.csv -> Ideal Standard Concept Sphere 1 tap hole sphere shaped countertop basin 380mm White,,,https://www.wolseley.co.uk/wcsstore/ExtendedSitesCatalogAssetStore/images/products/AssetPush/wol-web-proof-medium-w/std.lang.all/10/29/NW-C21029_wm.jpg,https://www.wolseley.co.uk/wcsstore/ExtendedSitesCatalogAssetStore/images/products/AssetPush/DTP_AssetPushHighRes/std.lang.all/ic/al/C21029_Technical.pdf,https://www.wolseley.co.uk/wcsstore/ExtendedSitesCatalogAssetStore/images/products/AssetPush/DTP_AssetPushHighRes/std.lang.all/ic/al/IS_Concept_Sphere_38cm_Technical.pdf,,,,,,,,,,,,,,,,,,,,,https://www.wolseley.co.uk/wcsstore/ExtendedSitesCatalogAssetStore/images/products/AssetPush/DTP_AssetPushHighRes/std.lang.all/e_/16/IS_Bathroom_Brochure_16.pdf,
28,PD81424,Ideal Standard iLife semi countertop washbasin 1 taphole 50cm,Ideal Standard,136.82,"A simple, stylish design suitable for any contemporary bathroom, the Ideal Standard iLife 500mm semi-countertop washbasin is intended for installation into a countertop or vanity unit. Finished in smart white, this handwash basin includes one pre-drilled taphole for your choice of mixer tap.",Bathrooms and Kitchens/Bathroom Sinks/Countertop Basins/Countertop Basins.csv -> Ideal Standard iLife semi countertop washbasin 1 taphole 50cm,,,https://www.wolseley.co.uk/wcsstore/ExtendedSitesCatalogAssetStore/images/products/AssetPush/wol-web-proof-medium-w/std.lang.all/24/_a/D81424_A_wm.jpg,,,White,440,N,440,No,Surface Mounted,Vitreous China,1,E246701,Countertop Basin,N,Designed by Palomba Serafini Associati,Suitable for in-furniture or countertop installation,Vitreous china manufacture,White finish,With single taphole,,iLIFE,,,,
29,PC21025,CONCEPT E5004 550MM 1TH OVAL CTOP BSN WH,Ideal Standard,178.4,"Suitable for installation in both commercial and domestic bathrooms, the versatile Ideal Standard Concept 550mm countertop basin is a smart choice for a modern space. Oval in shape, this basin is made of tough white vitreous china and has a single tap hole for a mixer tap.",Bathrooms and Kitchens/Bathroom Sinks/Countertop Basins/Countertop Basins.csv -> CONCEPT E5004 550MM 1TH OVAL CTOP BSN WH,,Countertop basin,https://www.wolseley.co.uk/wcsstore/ExtendedSitesCatalogAssetStore/images/products/AssetPush/wol-web-proof-medium-w/std.lang.all/10/25/NW-C21025_wm.jpg,https://www.wolseley.co.uk/wcsstore/ExtendedSitesCatalogAssetStore/images/products/AssetPush/DTP_AssetPushHighRes/std.lang.all/ic/al/IS_Concept_Oval_Washbasin_Technical.pdf,https://www.wolseley.co.uk/wcsstore/ExtendedSitesCatalogAssetStore/images/products/AssetPush/DTP_AssetPushHighRes/std.lang.all/hu/re/IStandard_Concept_Brochure.pdf,,,,,,,,,,,,,,,,,,,,,,
30,PD04645,Ideal Standard Tempo countertop basin 500mm White,Ideal Standard,128.74,"Designed for use in bespoke worktops, this Ideal Standard Tempo 500mm countertop washbasin with single tap hole is made of durable vitreous china material for a longer life in home or commercial bathrooms.",Bathrooms and Kitchens/Bathroom Sinks/Countertop Basins/Countertop Basins.csv -> Ideal Standard Tempo countertop basin 500mm White,,,https://www.wolseley.co.uk/wcsstore/ExtendedSitesCatalogAssetStore/images/products/AssetPush/wol-web-proof-medium-w/std.lang.all/46/45/NW-D04645_wm.jpg,https://www.wolseley.co.uk/wcsstore/ExtendedSitesCatalogAssetStore/images/products/AssetPush/DTP_AssetPushHighRes/std.lang.all/20/19/IS_Bathrooms_Brchr_2019.pdf,https://www.wolseley.co.uk/wcsstore/ExtendedSitesCatalogAssetStore/images/products/AssetPush/DTP_AssetPushHighRes/std.lang.all/ic/al/D04645_Technical.pdf,,,,,,,,,,,,,,,,,,,,,,
31,PD41803,Roca The Gap A327478000 one tap hole cloakroom/countertop basin 400mm White,Roca,81.61,"Compact, functional and smart, this Roca The Gap 400mm wall-hung basin with a single central tap hole has a modern design and robust, easy-clean vitreous china build, ideal for family bathrooms.",Bathrooms and Kitchens/Bathroom Sinks/Countertop Basins/Countertop Basins.csv -> Roca The Gap A327478000 one tap hole cloakroom/countertop basin 400mm White,,,https://www.wolseley.co.uk/wcsstore/ExtendedSitesCatalogAssetStore/images/products/AssetPush/wol-web-proof-medium-w/std.lang.all/18/03/NW-D41803_wm.jpg,https://www.wolseley.co.uk/wcsstore/ExtendedSitesCatalogAssetStore/images/products/AssetPush/DTP_AssetPushHighRes/std.lang.all/hu/re/Roca_Discovery_Brochure.pdf,https://www.wolseley.co.uk/wcsstore/ExtendedSitesCatalogAssetStore/images/products/AssetPush/DTP_AssetPushHighRes/std.lang.all/io/ns/Roca_Care_Instructions.pdf,,,,,,,,,,,,,,,,,,,,,https://www.wolseley.co.uk/wcsstore/ExtendedSitesCatalogAssetStore/images/products/AssetPush/DTP_AssetPushHighRes/std.lang.all/ta/ll/Roca_Basins_Generic_Install.pdf,https://www.wolseley.co.uk/wcsstore/ExtendedSitesCatalogAssetStore/images/products/AssetPush/DTP_AssetPushHighRes/std.lang.all/ic/al/D41803_Technical.pdf
32,PD81423,Ideal Standard iLife handrise basin 1tap hole left hand handrise 35cm,Ideal Standard,58.04,"A simple, clean-lined design, the Ideal Standard i.Life 350mm single taphole handwash basin blends practicality with style. Suitable for wall-mounted installation, this smart basin has a high gloss finish for an always clean appearance.",Bathrooms and Kitchens/Bathroom Sinks/Countertop Basins/Countertop Basins.csv -> Ideal Standard iLife handrise basin 1tap hole left hand handrise 35cm,,,https://www.wolseley.co.uk/wcsstore/ExtendedSitesCatalogAssetStore/images/products/AssetPush/wol-web-proof-medium-w/std.lang.all/23/_a/D81423_A_wm.jpg,,,White/Gloss,185,N,300,No,Wall,Ceramic,1,E246201,Contemporary,N,Designed by Palomba Serafini Associati,Suitable for wall mounting,With single left-hand taphole,Ceramic construction,Gloss white finish,,iLIFE,,,,
33,PD02379,Ideal Standard Sandringham 21 2 tap hole countertop basin without chain hole 500mm White,Ideal Standard,109.76,"Stylish and cost-effective, the Ideal Standard Sandringham 21 500mm countertop washbasin with two tap holes is made of durable vitreous china with a smart, contemporary design.",Bathrooms and Kitchens/Bathroom Sinks/Countertop Basins/Countertop Basins.csv -> Ideal Standard Sandringham 21 2 tap hole countertop basin without chain hole 500mm White,,,https://www.wolseley.co.uk/wcsstore/ExtendedSitesCatalogAssetStore/images/products/AssetPush/wol-web-proof-medium-w/std.lang.all/23/79/NW-D02379_wm.jpg,https://www.wolseley.co.uk/wcsstore/ExtendedSitesCatalogAssetStore/images/products/AssetPush/DTP_AssetPushHighRes/std.lang.all/rc/hr/IS_Sandringham21_Brchr.pdf,https://www.wolseley.co.uk/wcsstore/ExtendedSitesCatalogAssetStore/images/products/AssetPush/DTP_AssetPushHighRes/std.lang.all/ic/al/D02379_Technical.pdf,,,,,,,,,,,,,,,,,,,,,,
34,PB09425,Ideal Standard Concept one tap hole semi countertop basin 500 x 450mm White,Ideal Standard,300.41,"A modern design that will stand the test of time, this Ideal Standard Concept 500mm semi-countertop washbasin has a subtle geometric feel that suits contemporary bathrooms. Made of fine fireclay with a glossy white finish, this basin is supplied with a single tap hole and overflow.",Bathrooms and Kitchens/Bathroom Sinks/Countertop Basins/Countertop Basins.csv -> Ideal Standard Concept one tap hole semi countertop basin 500 x 450mm White,,,https://www.wolseley.co.uk/wcsstore/ExtendedSitesCatalogAssetStore/images/products/AssetPush/wol-web-proof-medium-w/std.lang.all/94/25/NW-B09425_wm.jpg,https://www.wolseley.co.uk/wcsstore/ExtendedSitesCatalogAssetStore/images/products/AssetPush/DTP_AssetPushHighRes/std.lang.all/dr/aw/IStandard_Create_Line_Draw.pdf,https://www.wolseley.co.uk/wcsstore/ExtendedSitesCatalogAssetStore/images/products/AssetPush/DTP_AssetPushHighRes/std.lang.all/hu/re/IStandard_Hotel_Solutions_Brochure.pdf,,,,,,,,,,,,,,,,,,,,,https://www.wolseley.co.uk/wcsstore/ExtendedSitesCatalogAssetStore/images/products/AssetPush/DTP_AssetPushHighRes/std.lang.all/ic/al/IStandard_Concept_50cm_Technical.pdf,
