67,PD90811,Mira Vie electric shower 8.5kw White,Mira,128.16,"Offering consistent shower performance in any conditions and any system, the reliable 8.5kW Mira Vie white electric shower ensures consistent performance via advanced pressure stabilised temperature control, hassle-free fitting in any location and great usability, with an on/off button and choice of flow settings to suit your needs. The A-rated Vie has an eco mode for less waste and improved efficiency while Mira Clearscale™ technology reduces the build-up of limescale by up to 50% for cleaner, more reliable performance.",Showering/Showers/Electric Showers/Electric Showers.csv -> Mira Vie electric shower 8.5kw White,,,https://www.wolseley.co.uk/wcsstore/ExtendedSitesCatalogAssetStore/images/products/AssetPush/wol-web-proof-medium-w/std.lang.all/08/11/NW-D90811_wm.jpg,,,,,,,,,,,,,,,,,,,,,,,,,,,,,,https://www.wolseley.co.uk/wcsstore/ExtendedSitesCatalogAssetStore/images/products/AssetPush/DTP_AssetPushHighRes/std.lang.all/ti/on/Mira_Vie_Go_Installation.pdf,https://www.wolseley.co.uk/wcsstore/ExtendedSitesCatalogAssetStore/images/products/AssetPush/DTP_AssetPushHighRes/std.lang.all/te/ch/Mira_Vie_Electrical_Shower_Tech.pdf,https://www.wolseley.co.uk/wcsstore/ExtendedSitesCatalogAssetStore/images/products/AssetPush/DTP_AssetPushHighRes/std.lang.all/wi/ng/Mira_Vie_Shower_Drawing.pdf,https://www.wolseley.co.uk/wcsstore/ExtendedSitesCatalogAssetStore/images/products/AssetPush/DTP_AssetPushHighRes/std.lang.all/ui/de/Mira_Vie_Shower_Spare_Guide.pdf,,,,,,,,,,,,
68,PD52942,Gainsborough Slim Duo electric shower 8.5kw Piano Black,Gainsborough,110.43,"Offering advanced functions for powerfully indulgent operation, the Gainsborough Slim Duo 8.5kW dual electric shower in Piano Black offers manual operation via a simple single lever for complete pressure and temperature control. Compatible with all approved cold mains UK water systems, this straightforward yet stylish shower offers three power settings and an easy to use start/stop button for reliable set-and-forget operation. Attractively designed to look great in any bathroom, the Slim's all-chrome wall-mounted valve is supplied with a stainless steel hose and rub-clean showerhead along with a convenient slider rail for easier hands-free showering.",Showering/Showers/Electric Showers/Electric Showers.csv -> Gainsborough Slim Duo electric shower 8.5kw Piano Black,,,https://www.wolseley.co.uk/wcsstore/ExtendedSitesCatalogAssetStore/images/products/AssetPush/wol-web-proof-medium-w/std.lang.all/29/42/D52942_wm.jpg,Piano Black,Min- 1.7-2.3l/minMax - Approx 9.0l/min,10,0.9,0.9 to 10 bar,Slim Duo,2,N,XS,A,15 dB,97.5,Manual,95,340,225,97.5,1500,3,"Right and left hand side, top, bottom, side and rear",38,Left - Back / Bottom / Side / Top,GSDPB85,N,Piano black colour,On/off push-button operation,3x power settings,Includes 95mm handset with 3x spray options,Rub-clean nozzles,,,,,,,With polished stainless steel hose,Includes soap dish,Top/bottom/rear pipework and cable installation,8x Multifit installation options,,A rated for efficiency,2 year warranty,,,
69,PD53229,Aqualisa eVolve black/satin silver 10.5kW,Aqualisa,267.57,"Combining style and quality in a robust package, the streamlined Aqualisa eVolve electric shower has a smart Midnight Black casing with a contoured silver satin trim. Offering flexible installation, this modern unit is a suitable retrofit for most older electric showers thanks to multi-fit connection options while connection to an existing cold water supply at 240V is simple. With a variety of power settings and three spray patterns, this 10.5kW shower provides the perfect shower experience for everybody and every situation. Meanwhile, individual temperature control along with a digital temperature display allows for smooth, precise adjustment. For safety and practicality, the eVolve incorporates an over-temperature stop function as well as an automatic phased shutdown to reduce the build-up of limescale.",Showering/Showers/Electric Showers/Electric Showers.csv -> Aqualisa eVolve black/satin silver 10.5kW,,,https://www.wolseley.co.uk/wcsstore/ExtendedSitesCatalogAssetStore/images/products/AssetPush/wol-web-proof-medium-w/std.lang.all/32/29/D53229_wm.jpg,Black / Satin Silver,"'@3 bar Min 2.7-3.3ltr/min, max 11ltr/min",10,0.85,0.85-10 bar,Evolve,2 Year,N,XS,A,15 dB,89,Manual,105,379,244,89,1500,3,"Right & left hand side, top, bottom, side & rear",38,Left - Bottom / Side / Top,VOTZ27,N,Digital temperature display and control dial,Satin silver trim,Illuminated push power button and Low water pressure indicator,3 power settings,Stainless steel hose,,,,,,,Universal multifit: 8 water & electric entry points,"105mm Flow Handset with 3 spray settings, rub clean nozzles and a push button slider",Over temperature protection and phased shut down safety features,Retrofitable,,,,,,
70,PD52944,GB SLIM DUO 8.5KW TITANIUM GREY,Gainsborough,129.92,"Offering advanced functions for powerfully indulgent operation, the Gainsborough Slim Duo 8.5kW dual electric shower in Titanium Grey offers manual operation via a simple single lever for complete pressure and temperature control. Compatible with all approved cold mains UK water systems, this straightforward yet stylish shower offers three power settings and an easy to use start/stop button for reliable set-and-forget operation. Attractively designed to look great in any bathroom, the Slim's all-chrome wall-mounted valve is supplied with a stainless steel hose and rub-clean showerhead along with a convenient slider rail for easier hands-free showering.",Showering/Showers/Electric Showers/Electric Showers.csv -> GB SLIM DUO 8.5KW TITANIUM GREY,,,https://www.wolseley.co.uk/wcsstore/ExtendedSitesCatalogAssetStore/images/products/AssetPush/wol-web-proof-medium-w/std.lang.all/29/44/D52944_wm.jpg,Titanium Grey,Min- 1.7-2.3l/minMax - Approx 9.0l/min,10,0.9,0.9 to 10 bar,Slim Duo,2,N,XS,A,15 dB,97.5,Manual,95,340,225,97.5,1500,3,"Right and left hand side, top, bottom, side and rear",38,Left - Back / Bottom / Side / Top,GSDTG85,N,Titanium grey colour,On/off push-button operation,3x power settings,Includes 95mm handset with 3x spray options,Rub-clean nozzles,,,,,,,With polished stainless steel hose,Includes soap dish,Top/bottom/rear pipework and cable installation,8x Multifit installation options,,A rated for efficiency,2 year warranty,,,
71,PD52940,Gainsborough Slim Duo electric shower 8.5kw White,Gainsborough,90.94,"Made of high quality stainless steel, the Gainsborough Slim Duo 8.5kW electric shower offers advanced functions and powerful operation via three settings. Suitable for use with all approved UK cold mains water systems, this manually operated single lever shower with on/off button provides effortless control of temperature and flow as well as power, while reliable safety features ensure safe use for the entire family. The Slim Duo incorporates a chrome valve for fixing directly to a wall, a rub-clean handset and a flexible stainless steel hose, while an adjustable shower rail makes hands-free showering possible for all heights.",Showering/Showers/Electric Showers/Electric Showers.csv -> Gainsborough Slim Duo electric shower 8.5kw White,,,https://www.wolseley.co.uk/wcsstore/ExtendedSitesCatalogAssetStore/images/products/AssetPush/wol-web-proof-medium-w/std.lang.all/29/40/D52940_wm.jpg,White,Min- 1.7-2.3l/minMax - Approx 9.0l/min,10,0.9,0.9 to 10 bar,Slim Duo,2 Year,N,XS,A,15 dB,97.5,Manual,95,340,225,97.5,1500,3,"Right and left hand side, top, bottom, side and rear",38,Left - Bottom / Side / Top,GSD85,N,On/Off Button,3 Power Settings & Temperature Control,Top/bottom/rear pipework and cable installation,8 multifit fitting options,Polished stainless steel hose,,,,,,,95mm 3 spray rub clean Shower handset,,,,,,,,,
72,PD53224,Aqualisa Evolve electric shower 8.5kW White Satin Silver,Aqualisa,227.43,"Blending style with practicality, the contoured Aqualisa eVolve 8.5kW electric shower has a simple Arctic White finish with satin silver trim to suit most bathroom schemes. With a range of power settings and three optional spray patterns, users are treated to a totally bespoke shower experience while a separate temperature control with digital display and over-temperature stop function provides reliable, precision comfort and safety. Connecting to an existing 240V domestic supply, the eVolve has multifit connections for ease of installation. Meanwhile, features such as the limescale-reducing phased shutdown improve performance and reduced ongoing maintenance.",Showering/Showers/Electric Showers/Electric Showers.csv -> Aqualisa Evolve electric shower 8.5kW White Satin Silver,,,https://www.wolseley.co.uk/wcsstore/ExtendedSitesCatalogAssetStore/images/products/AssetPush/wol-web-proof-medium-w/std.lang.all/32/24/D53224_wm.jpg,Grey,"@3 bar Min 2.7-3.3lpm, Max 11lpm",10,0.85,"0.85 bar, 10 bar",Evolve,2 years,N,N/A,A,N/A,89,No,105,379,244,89,1500,3,"Right & left hand side, top, bottom, side & rear",38,Ambidextrous - Back / Bottom / Side / Top,VOPZ25,N,Digital temperature display and control dial,Satin silver trim,Illuminated push power button and low water pressure indicator,With 3x power settings,Stainless steel hose,,,,,,,Universal multifit with 8x water and electric entry points,105mm Flow handset with 3x spray settings,With rub-clean nozzles,Push button slider,,Over-temperature protection and phased shut down safety features,Retrofittable design,2 year warranty,,
73,PD62114,Mira Vie electric shower with clearscale 8.5kW Chrome,Mira,138.31,"Offering consistent shower performance in any conditions and any system, the reliable 8.5kW Mira Vie chrome electric shower ensures consistent performance via advanced pressure stabilised temperature control, hassle-free fitting in any location and great usability, with an on/off button and choice of flow settings to suit your needs. The A-rated Vie has an eco mode for less waste and improved efficiency while Mira Clearscale™ technology reduces the build-up of limescale by up to 50% for cleaner, more reliable performance.",Showering/Showers/Electric Showers/Electric Showers.csv -> Mira Vie electric shower with clearscale 8.5kW Chrome,,,https://www.wolseley.co.uk/wcsstore/ExtendedSitesCatalogAssetStore/images/products/AssetPush/wol-web-proof-medium-w/std.lang.all/21/15/NW-D62114_D62115_wm.jpg,,,,,,,,,,,,,,,,,,,,,,,,,,,,,,https://www.wolseley.co.uk/wcsstore/ExtendedSitesCatalogAssetStore/images/products/AssetPush/DTP_AssetPushHighRes/std.lang.all/ti/on/Mira_Vie_Go_Installation.pdf,https://www.wolseley.co.uk/wcsstore/ExtendedSitesCatalogAssetStore/images/products/AssetPush/DTP_AssetPushHighRes/std.lang.all/20/18/Mira_UKConsumerShowers_Brochure_2018.pdf,,,,,,,,,,,,,,
74,PD53231,Aqualisa eVolve grey/satin silver 9.5kW,Aqualisa,247.5,"Combining style and quality in a robust package, the streamlined Aqualisa eVolve electric shower has a modern Space Grey casing with a contoured silver satin trim. Offering flexible installation, this modern unit is a suitable retrofit for most older electric showers thanks to multi-fit connection options while connection to an existing cold water supply at 240V is simple. With a variety of power settings and three spray patterns, this 9.5kW shower provides the perfect shower experience for everybody and every situation. Meanwhile, individual temperature control along with a digital temperature display allows for smooth, precise adjustment. For safety and practicality, the eVolve incorporates an over-temperature stop function as well as an automatic phased shutdown to reduce the build-up of limescale.",Showering/Showers/Electric Showers/Electric Showers.csv -> Aqualisa eVolve grey/satin silver 9.5kW,,,https://www.wolseley.co.uk/wcsstore/ExtendedSitesCatalogAssetStore/images/products/AssetPush/wol-web-proof-medium-w/std.lang.all/32/31/D53231_wm.jpg,Grey / Satin Silver,"'@3 bar Min 2.7-3.3ltr/min, max 11ltr/min",10,0.85,0.85-10 bar,Evolve,2 Year,N,XS,A,15 dB,89,Manual,105,379,244,89,1500,3,"Right & left hand side, top, bottom, side & rear",38,Left - Bottom / Side / Top,VOXZ26,N,Digital temperature display and control dial,Satin silver trim,Illuminated push power button and Low water pressure indicator,3 power settings,Stainless steel hose,,,,,,,Universal multifit: 8 water & electric entry points,"105mm Flow Handset with 3 spray settings, rub clean nozzles and a push button slider",Over temperature protection and phased shut down safety features,Retrofitable,,,,,,
75,PD62115,Mira Vie electric shower with clearscale 9.5kW Chrome,Mira,148.45,"Offering consistent shower performance in any conditions and any system, the reliable 9.5kW Mira Vie chrome electric shower ensures consistent performance via advanced pressure stabilised temperature control, hassle-free fitting in any location and great usability, with an on/off button and choice of flow settings to suit your needs. The A-rated Vie has an eco mode for less waste and improved efficiency while Mira Clearscale™ technology reduces the build-up of limescale by up to 50% for cleaner, more reliable performance.",Showering/Showers/Electric Showers/Electric Showers.csv -> Mira Vie electric shower with clearscale 9.5kW Chrome,,,https://www.wolseley.co.uk/wcsstore/ExtendedSitesCatalogAssetStore/images/products/AssetPush/wol-web-proof-medium-w/std.lang.all/21/15/NW-D62114_D62115_wm.jpg,,,,,,,,,,,,,,,,,,,,,,,,,,,,,,https://www.wolseley.co.uk/wcsstore/ExtendedSitesCatalogAssetStore/images/products/AssetPush/DTP_AssetPushHighRes/std.lang.all/ti/on/Mira_Vie_Go_Installation.pdf,https://www.wolseley.co.uk/wcsstore/ExtendedSitesCatalogAssetStore/images/products/AssetPush/DTP_AssetPushHighRes/std.lang.all/20/18/Mira_UKConsumerShowers_Brochure_2018.pdf,,,,,,,,,,,,,,
76,PD00446,Triton T80Z fast fit thermostatic electric shower 9.5kw,Triton,222.87,"Attractively designed for a modern, stylish look, the chrome and white 8.5kW Triton T80Z Fast-Fit thermostatic shower is an ideal replacement for outdated shower units, offering multiple cable and water entry points located to the left and right side of the unit for straightforward refitting. Simple start/stop controls, a rub clean showerhead with a range of spray patterns and a sleek adjustable riser rail kit make the A-rated T80Z as popular with homeowners as it is with installers.",Showering/Showers/Electric Showers/Electric Showers.csv -> Triton T80Z fast fit thermostatic electric shower 9.5kw,,,https://www.wolseley.co.uk/wcsstore/ExtendedSitesCatalogAssetStore/images/products/AssetPush/wol-web-proof-medium-w/std.lang.all/04/47/NW-D00445_D00447_wm.jpg,,,,,,,,,,,,,,,,,,,,,,,,,,,,,,https://www.wolseley.co.uk/wcsstore/ExtendedSitesCatalogAssetStore/images/products/AssetPush/DTP_AssetPushHighRes/std.lang.all/_e/rp/Triton_T80Z_Fast-Fit_Thermo_ErP.pdf,https://www.wolseley.co.uk/wcsstore/ExtendedSitesCatalogAssetStore/images/products/AssetPush/DTP_AssetPushHighRes/std.lang.all/te/ch/Triton_T80Z_Fast-Fit_Thermo_Tech.pdf,https://www.wolseley.co.uk/wcsstore/ExtendedSitesCatalogAssetStore/images/products/AssetPush/DTP_AssetPushHighRes/std.lang.all/ta/ll/Triton_Lewis_Riser_Rail_Assy_Install.pdf,https://www.wolseley.co.uk/wcsstore/ExtendedSitesCatalogAssetStore/images/products/AssetPush/DTP_AssetPushHighRes/std.lang.all/ti/on/Triton_T80Z_Fast-Fit_Installation.pdf,,,,,,,,,,,,
77,PD00445,Triton T80Z fast fit thermostatic electric shower  8.5kw,Triton,256.13,"Attractively designed for a modern, stylish look, the chrome and white 8.5kW Triton T80Z Fast-Fit thermostatic shower is an ideal replacement for outdated shower units, offering multiple cable and water entry points located to the left and right side of the unit for straightforward refitting. Simple start/stop controls, a rub clean showerhead with a range of spray patterns and a sleek adjustable riser rail kit make the A-rated T80Z as popular with homeowners as it is with installers.",Showering/Showers/Electric Showers/Electric Showers.csv -> Triton T80Z fast fit thermostatic electric shower  8.5kw,,,https://www.wolseley.co.uk/wcsstore/ExtendedSitesCatalogAssetStore/images/products/AssetPush/wol-web-proof-medium-w/std.lang.all/04/47/NW-D00445_D00447_wm.jpg,,,,,,,,,,,,,,,,,,,,,,,,,,,,,,https://www.wolseley.co.uk/wcsstore/ExtendedSitesCatalogAssetStore/images/products/AssetPush/DTP_AssetPushHighRes/std.lang.all/_e/rp/Triton_T80Z_Fast-Fit_Thermo_ErP.pdf,https://www.wolseley.co.uk/wcsstore/ExtendedSitesCatalogAssetStore/images/products/AssetPush/DTP_AssetPushHighRes/std.lang.all/te/ch/Triton_T80Z_Fast-Fit_Thermo_Tech.pdf,https://www.wolseley.co.uk/wcsstore/ExtendedSitesCatalogAssetStore/images/products/AssetPush/DTP_AssetPushHighRes/std.lang.all/ta/ll/Triton_Lewis_Riser_Rail_Assy_Install.pdf,https://www.wolseley.co.uk/wcsstore/ExtendedSitesCatalogAssetStore/images/products/AssetPush/DTP_AssetPushHighRes/std.lang.all/ti/on/Triton_T80Z_Fast-Fit_Installation.pdf,,,,,,,,,,,,
78,PD78065,Triton T70Z electric shower 8.5kw White/Chrome Plated,Triton,138.46,"The 8.5kW Triton T70Z electric shower offers a simple, user-friendly design, providing good value for money with its understated design suited to just about any bathroom, modern or traditional. Based on a proven Z range design blueprint, the efficient A-rated T70Z offers easy cleaning, adaptable fitting and hassle-free cleaning.",Showering/Showers/Electric Showers/Electric Showers.csv -> Triton T70Z electric shower 8.5kw White/Chrome Plated,,,https://www.wolseley.co.uk/wcsstore/ExtendedSitesCatalogAssetStore/images/products/AssetPush/wol-web-proof-medium-w/std.lang.all/80/66/NW-D78065_D78066_wm.jpg,,,,,,,,,,,,,,,,,,,,,,,,,,,,,,https://www.wolseley.co.uk/wcsstore/ExtendedSitesCatalogAssetStore/images/products/AssetPush/DTP_AssetPushHighRes/std.lang.all/ta/ll/Triton_LARA_3-Pos_Showerhead_Install.pdf,https://www.wolseley.co.uk/wcsstore/ExtendedSitesCatalogAssetStore/images/products/AssetPush/DTP_AssetPushHighRes/std.lang.all/_e/rp/Triton_T70Z_Electric_Shower_ErP.pdf,https://www.wolseley.co.uk/wcsstore/ExtendedSitesCatalogAssetStore/images/products/AssetPush/DTP_AssetPushHighRes/std.lang.all/ta/ll/Triton_T70Z_Electric_Shower_Install.pdf,https://www.wolseley.co.uk/wcsstore/ExtendedSitesCatalogAssetStore/images/products/AssetPush/DTP_AssetPushHighRes/std.lang.all/ta/ll/Triton_David_Riser_Rail_Assy_Install.pdf,,,,,,,,,,,,
79,PD90832,Mira Sport manual single outlet electric shower 7.5kW,Mira,274.22,"Enjoy a luxurious showering experience with the Mira Sport 7.5kW manual single outlet electric shower. A simple chrome and white design, this shower is supplied complete with separated power and temperature controls and a four-mode handset, allowing every user to enjoy a bespoke showering experience, whether that's an invigorating post-workout cool down or a relaxing warm deluge.",Showering/Showers/Electric Showers/Electric Showers.csv -> Mira Sport manual single outlet electric shower 7.5kW,,,https://www.wolseley.co.uk/wcsstore/ExtendedSitesCatalogAssetStore/images/products/AssetPush/wol-web-proof-medium-w/std.lang.all/08/33/D90832_D90833_wm.jpg,White / Chrome,N/A (conditions apply),10.0,0.7,10 BAR,Sport,2 years,N,XS,A,15 dB,90,Manual,120,358,215,90,1.25m,4,"Left (rising, falling & rear)",39,"Left (rising, falling & rear)",1.1746.820,N,With 120mm handset,Includes 4x spray modes,White and chrome finish,A-rated efficiency,2 year warranty,,,,,,,,,,,,,,,,
80,PD80342,Triton Danzi DuElec™ Electric Shower 9.5kW White (1),Triton,330.33,"Supplied with two individual showerheads, the DuElec™ electric shower allows you to choose between the convenience of a targeted handheld spray with a range of spray patterns and the luxury of an overhead rainfall shower. This 9.5kW shower is supplied with a long anti-twist hose",Showering/Showers/Electric Showers/Electric Showers.csv -> Triton Danzi DuElec™ Electric Shower 9.5kW White (1),,,https://www.wolseley.co.uk/wcsstore/ExtendedSitesCatalogAssetStore/images/products/AssetPush/wol-web-proof-medium-w/std.lang.all/03/43/D80343_wm.jpg,White,1 bar @ 8 l/min,10,1,9.5kW,Danzi DuElec™,2 years,N,XS,A,15 dB,90,Manual,110203,328,215,90,1.5m anti-twist (main hose)0.75m (connector hose),51,Bottom Back/Bottom/Bottom Side - Right,39,Right - Back / Top,GEDADU91,N,White unit with chrome kit,Includes dual diverter,Rub clean nozzles for easy maintenance,With 5 spray pattern handheld showerhead,With single spray pattern fixed shower head,,,,,,,Includes 1.5M shower hose,2 year warranty,,,1,,,,,
81,PD51405,Aqualisa Aquastream 813.40.20 thermostatic integrated pump system White,Aqualisa,670.21,"Supplying high levels of showering performance, even at the lowest pressures, the white Aqualisa Aquastream power shower is designed for installation in homes on gravity-fed water systems. Featuring an integrated pump, this reliable shower boosts water flow while its patented bi-metallic cartridge makes use of thermostatic technology for safe precision mixing of hot and cold water. Supplied with an adjustable showerhead, the Aquastream gives users total control over their showering comfort with separate flow and temperature dials and a choice of two flow settings, from a gentle 10LPM to an intense 18LPM. Surface-mounted, Aquastream showers are easy to install, minimising the need for re-tiling.",Showering/Showers/Electric Showers/Electric Showers.csv -> Aqualisa Aquastream 813.40.20 thermostatic integrated pump system White,,,https://www.wolseley.co.uk/wcsstore/ExtendedSitesCatalogAssetStore/images/products/AssetPush/wol-web-proof-medium-w/std.lang.all/14/05/NW-D51405_wm.jpg,,,,,,,,,,,,,,,,,,,,,,,,,,,,,,https://www.wolseley.co.uk/wcsstore/ExtendedSitesCatalogAssetStore/images/products/AssetPush/DTP_AssetPushHighRes/std.lang.all/ti/on/Aqualisa_Aquastream_Installation.pdf,https://www.wolseley.co.uk/wcsstore/ExtendedSitesCatalogAssetStore/images/products/AssetPush/DTP_AssetPushHighRes/std.lang.all/20/19/Aqualisa_Product_Guide_2019.pdf,https://www.wolseley.co.uk/wcsstore/ExtendedSitesCatalogAssetStore/images/products/AssetPush/DTP_AssetPushHighRes/std.lang.all/te/ch/Aqualisa_Aquastream_813_40_20_Tech.pdf,,,,,,,,,,,,,
82,PD00469,Triton T80Z fast fit shower 8.5kw Chrome Plated,Triton,293.46,"Attractively designed for a modern, stylish look, the chrome and white 8.5kW Triton T80Z Fast-Fit manual shower is an ideal replacement for outdated shower units, offering multiple cable and water entry points located to the left and right side of the unit for straightforward refitting. Simple start/stop controls, a rub clean showerhead with a range of spray patterns and a sleek adjustable riser rail kit make the A-rated T80Z as popular with homeowners as it is with installers.",Showering/Showers/Electric Showers/Electric Showers.csv -> Triton T80Z fast fit shower 8.5kw Chrome Plated,,,https://www.wolseley.co.uk/wcsstore/ExtendedSitesCatalogAssetStore/images/products/AssetPush/wol-web-proof-medium-w/std.lang.all/04/70/NW-D00464_D00470_wm.jpg,,,,,,,,,,,,,,,,,,,,,,,,,,,,,,https://www.wolseley.co.uk/wcsstore/ExtendedSitesCatalogAssetStore/images/products/AssetPush/DTP_AssetPushHighRes/std.lang.all/ta/ll/Triton_Lewis_Riser_Rail_Assy_Install.pdf,https://www.wolseley.co.uk/wcsstore/ExtendedSitesCatalogAssetStore/images/products/AssetPush/DTP_AssetPushHighRes/std.lang.all/t_/v4/T80Z Fast-Fit DuElec Technical Sheet v4.pdf,https://www.wolseley.co.uk/wcsstore/ExtendedSitesCatalogAssetStore/images/products/AssetPush/DTP_AssetPushHighRes/std.lang.all/ic/al/Triton_T80Z_Fast-Fit_Technical.pdf,https://www.wolseley.co.uk/wcsstore/ExtendedSitesCatalogAssetStore/images/products/AssetPush/DTP_AssetPushHighRes/std.lang.all/_e/rp/Triton_T80Z_Fast-Fit_ErP.pdf,https://www.wolseley.co.uk/wcsstore/ExtendedSitesCatalogAssetStore/images/products/AssetPush/DTP_AssetPushHighRes/std.lang.all/ti/on/Triton_T80Z_Fast-Fit_Installation.pdf,,,,,,,,,,,
83,PD00464,Triton T80Z fast fit shower 7.5kw White/Chrome Plated,Triton,160.73,"Attractively designed for a modern, stylish look, the chrome and white 7.5kW Triton T80Z Fast-Fit manual shower is an ideal replacement for outdated shower units, offering multiple cable and water entry points located to the left and right side of the unit for straightforward refitting. Simple start/stop controls, a rub clean showerhead with a range of spray patterns and a sleek adjustable riser rail kit make the A-rated T80Z as popular with homeowners as it is with installers.",Showering/Showers/Electric Showers/Electric Showers.csv -> Triton T80Z fast fit shower 7.5kw White/Chrome Plated,,,https://www.wolseley.co.uk/wcsstore/ExtendedSitesCatalogAssetStore/images/products/AssetPush/wol-web-proof-medium-w/std.lang.all/04/64/D00464_wm.jpg,,,,,,,,,,,,,,,,,,,,,,,,,,,,,,https://www.wolseley.co.uk/wcsstore/ExtendedSitesCatalogAssetStore/images/products/AssetPush/DTP_AssetPushHighRes/std.lang.all/ta/ll/Triton_Lewis_Riser_Rail_Assy_Install.pdf,https://www.wolseley.co.uk/wcsstore/ExtendedSitesCatalogAssetStore/images/products/AssetPush/DTP_AssetPushHighRes/std.lang.all/t_/v4/T80Z Fast-Fit DuElec Technical Sheet v4.pdf,https://www.wolseley.co.uk/wcsstore/ExtendedSitesCatalogAssetStore/images/products/AssetPush/DTP_AssetPushHighRes/std.lang.all/ic/al/Triton_T80Z_Fast-Fit_Technical.pdf,https://www.wolseley.co.uk/wcsstore/ExtendedSitesCatalogAssetStore/images/products/AssetPush/DTP_AssetPushHighRes/std.lang.all/_e/rp/Triton_T80Z_Fast-Fit_ErP.pdf,https://www.wolseley.co.uk/wcsstore/ExtendedSitesCatalogAssetStore/images/products/AssetPush/DTP_AssetPushHighRes/std.lang.all/ti/on/Triton_T80Z_Fast-Fit_Installation.pdf,,,,,,,,,,,
