,pid,Title,Brand,Price,Description,category,mfpartnumber,whatisincluded,Image,Attachment 1,Attachment 2,Attachment 3,Attachment 4,Colour,Shower Tray Shape,Warranty,Hazardous,Depth (mm),Anti Slip Surface,Material,Supplier Product Code,Type,WEEE Compliant,Feature 1,Feature 2,Feature 3,Feature 4,Feature 5,Feature 6,Position,Range,Style,Waste Kit Included
24,PD08502,Classic Marble ClassiSeal flexible self adhesive upstand 2.5mtr,Classic Marble,25.87,"A professional waterproofing system, the patented Classic Marble ClassiSeal 2.5M flexible self-adhesive waterproof upstand is suitable for shower installation but can also be used elsewhere in the home, including the kitchen. Accommodating 15mm of movement, this EPDM upstand is applied by hand to the sides of a shower tray or bath ahead of installation for reliable sealing with less effort. It can be used in new build installations as well as being suitable for renovation and refit jobs.",Showering/Shower Trays and Bases/Shower Tray Accessories/Shower Tray Accessories.csv -> Classic Marble ClassiSeal flexible self adhesive upstand 2.5mtr,,,https://www.wolseley.co.uk/wcsstore/ExtendedSitesCatalogAssetStore/images/products/AssetPush/wol-web-proof-medium-w/std.lang.all/85/04/NW-D08501_D08504_wm.jpg,https://www.wolseley.co.uk/wcsstore/ExtendedSitesCatalogAssetStore/images/products/AssetPush/DTP_AssetPushHighRes/std.lang.all/hu/re/Classic_Marble_ClassiSeal_Brochure.pdf,,,,,,,,,,,,,,,,,,,,,,,
25,PE28298,JT FLEXI FIX 3.2M,Just Trays,63.8,"Flexible and easy to use, Just Trays Flexi-Fix tiling upstand tape is self-adhesive, wraps around corners in a single piece and creates a watertight seal accommodating vertical movement of 15mm minimum.",Showering/Shower Trays and Bases/Shower Tray Accessories/Shower Tray Accessories.csv -> JT FLEXI FIX 3.2M,,,https://www.wolseley.co.uk/wcsstore/ExtendedSitesCatalogAssetStore/images/products/AssetPush/wol-web-proof-medium-w/std.lang.all/82/98/NW-E28298_wm.jpg,https://www.wolseley.co.uk/wcsstore/ExtendedSitesCatalogAssetStore/images/products/AssetPush/DTP_AssetPushHighRes/std.lang.all/he/et/JustTrays_Accessories_Spec_Sheet.pdf,https://www.wolseley.co.uk/wcsstore/ExtendedSitesCatalogAssetStore/images/products/AssetPush/DTP_AssetPushHighRes/std.lang.all/20/18/JustTrays_Brochure_2018.pdf,,,,,,,,,,,,,,,,,,,,,,
26,PD85773,Coram shower tray waste 90mm Chrome Cover,Coram,42.34,This Coram 90mm shower tray waste offers horizontal fitting and gravity-type operation. Its chrome cover ensures compatibility with most bathroom design schemes.,Showering/Shower Trays and Bases/Shower Tray Accessories/Shower Tray Accessories.csv -> Coram shower tray waste 90mm Chrome Cover,,,https://www.wolseley.co.uk/wcsstore/ExtendedSitesCatalogAssetStore/images/products/AssetPush/wol-web-proof-medium-w/std.lang.all/57/73/D85773_wm.jpg,,,,,Black/Chrome,,,N,,,,STA90TRAP,,N,Plastic construction,Chrome cover finish,10 year warranty,,,,,,,
27,PD52579,Mira Flight Low pentangle riser kit,Mira,90.21,"The Mira Flight Low pentagonal riser conversion kit is designed for use on uneven floor surfaces, creating a level finish. The kit includes corner and end pieces, along with clip-on fixings for a seamless, neat look.",Showering/Shower Trays and Bases/Shower Tray Accessories/Shower Tray Accessories.csv -> Mira Flight Low pentangle riser kit,,Corner;End pieces;Simple clip-on fixings,https://www.wolseley.co.uk/wcsstore/ExtendedSitesCatalogAssetStore/images/products/AssetPush/wol-web-proof-medium-w/std.lang.all/25/80/NW-D52579_D52580_wm.jpg,https://www.wolseley.co.uk/wcsstore/ExtendedSitesCatalogAssetStore/images/products/AssetPush/DTP_AssetPushHighRes/std.lang.all/ti/on/Mira_Flight_Installation.pdf,https://www.wolseley.co.uk/wcsstore/ExtendedSitesCatalogAssetStore/images/products/AssetPush/DTP_AssetPushHighRes/std.lang.all/ti/on/Mira_FlightLLShowerTray_Installation.pdf,https://www.wolseley.co.uk/wcsstore/ExtendedSitesCatalogAssetStore/images/products/AssetPush/DTP_AssetPushHighRes/std.lang.all/hu/re/Mira_Shower_Trays_Brochure.pdf,https://www.wolseley.co.uk/wcsstore/ExtendedSitesCatalogAssetStore/images/products/AssetPush/DTP_AssetPushHighRes/std.lang.all/20/18/Mira_UKConsumerShowers_Brochure_2018.pdf,,,,,,,,,,,,,,,,,,,,
28,PD56818,Mira Flight rectangular riser conversion kit 1200mm,Mira,58.2,"This Mira Flight 1200mm rectangular riser conversion kit includes corner and end pieces along with clip-on fixings to give a neat, seamless finish.",Showering/Shower Trays and Bases/Shower Tray Accessories/Shower Tray Accessories.csv -> Mira Flight rectangular riser conversion kit 1200mm,,,https://www.wolseley.co.uk/wcsstore/ExtendedSitesCatalogAssetStore/images/products/AssetPush/wol-web-proof-medium-w/std.lang.all/68/21/NW-D56815_D56821_wm.jpg,https://www.wolseley.co.uk/wcsstore/ExtendedSitesCatalogAssetStore/images/products/AssetPush/DTP_AssetPushHighRes/std.lang.all/ti/on/Mira_FlightLLShowerTray_Installation.pdf,https://www.wolseley.co.uk/wcsstore/ExtendedSitesCatalogAssetStore/images/products/AssetPush/DTP_AssetPushHighRes/std.lang.all/st/al/Mira_1192074_W2_B_Flight_Tray_Instal.pdf,https://www.wolseley.co.uk/wcsstore/ExtendedSitesCatalogAssetStore/images/products/AssetPush/DTP_AssetPushHighRes/std.lang.all/hu/re/Mira_Shower_Trays_Brochure.pdf,https://www.wolseley.co.uk/wcsstore/ExtendedSitesCatalogAssetStore/images/products/AssetPush/DTP_AssetPushHighRes/std.lang.all/20/18/Mira_UKConsumerShowers_Brochure_2018.pdf,,,,,,,,,,,,,,,,,,,,
29,PD07365,Just Trays offset quadrant shower tray panel kit 2 1200 x 900mm,Just Trays,37.18,"This Just Trays 1200 x 900mm Offset Quadrant Panel Kit 2 riser kit maintains and protects a shower tray for long lasting durability, preventing floods, splashes, and unexpected damage. Constructed from ABS acrylic, this riser kit contains all required fittings.",Showering/Shower Trays and Bases/Shower Tray Accessories/Shower Tray Accessories.csv -> Just Trays offset quadrant shower tray panel kit 2 1200 x 900mm,,,https://www.wolseley.co.uk/wcsstore/ExtendedSitesCatalogAssetStore/images/products/AssetPush/wol-web-proof-medium-w/std.lang.all/73/68/NW-D07364_D07368_wm.jpg,https://www.wolseley.co.uk/wcsstore/ExtendedSitesCatalogAssetStore/images/products/AssetPush/DTP_AssetPushHighRes/std.lang.all/ic/al/JustTrays_HP1290Q100_Technical.pdf,https://www.wolseley.co.uk/wcsstore/ExtendedSitesCatalogAssetStore/images/products/AssetPush/DTP_AssetPushHighRes/std.lang.all/ic/al/JustTrays_D07365_KIT3_Technical.pdf,,,,,,,,,,,,,,,,,,,,,,
30,PD07367,Just Trays shower tray panel kit 6 1800 x 1000mm,Just Trays,37.18,"This Just Trays 1800 x 1000mm Panel Kit 4 riser kit maintains and protects a shower tray for long lasting durability, preventing floods, splashes, and unexpected damage. Constructed from ABS acrylic, this riser kit contains all required fittings.",Showering/Shower Trays and Bases/Shower Tray Accessories/Shower Tray Accessories.csv -> Just Trays shower tray panel kit 6 1800 x 1000mm,,,https://www.wolseley.co.uk/wcsstore/ExtendedSitesCatalogAssetStore/images/products/AssetPush/wol-web-proof-medium-w/std.lang.all/73/68/NW-D07364_D07368_wm.jpg,https://www.wolseley.co.uk/wcsstore/ExtendedSitesCatalogAssetStore/images/products/AssetPush/DTP_AssetPushHighRes/std.lang.all/ic/al/JustTrays_D07367_KIT4_Technical.pdf,,,,,,,,,,,,,,,,,,,,,,,
31,PD56815,Mira Flight pentagon conversion kit 900 x 1200mm,Mira,99.52,"This Mira Flight 900 + 1200mm pentagonal riser conversion kit includes corner and end pieces along with clip-on fixings to give a neat, seamless finish.",Showering/Shower Trays and Bases/Shower Tray Accessories/Shower Tray Accessories.csv -> Mira Flight pentagon conversion kit 900 x 1200mm,,Corner;End piece;Simple clip on fixings,https://www.wolseley.co.uk/wcsstore/ExtendedSitesCatalogAssetStore/images/products/AssetPush/wol-web-proof-medium-w/std.lang.all/68/21/NW-D56815_D56821_wm.jpg,https://www.wolseley.co.uk/wcsstore/ExtendedSitesCatalogAssetStore/images/products/AssetPush/DTP_AssetPushHighRes/std.lang.all/ti/on/Mira_FlightLLShowerTray_Installation.pdf,https://www.wolseley.co.uk/wcsstore/ExtendedSitesCatalogAssetStore/images/products/AssetPush/DTP_AssetPushHighRes/std.lang.all/st/al/Mira_1192074_W2_B_Flight_Tray_Instal.pdf,https://www.wolseley.co.uk/wcsstore/ExtendedSitesCatalogAssetStore/images/products/AssetPush/DTP_AssetPushHighRes/std.lang.all/hu/re/Mira_Shower_Trays_Brochure.pdf,https://www.wolseley.co.uk/wcsstore/ExtendedSitesCatalogAssetStore/images/products/AssetPush/DTP_AssetPushHighRes/std.lang.all/20/18/Mira_UKConsumerShowers_Brochure_2018.pdf,,,,,,,,,,,,,,,,,,,,
32,PD23896,Just Trays Fusion panel kit-6 1800 x 1000mm,Just Trays,135.67,This Just Trays Fusion 1800 x 1000mm panel kit is suitable for use with square and rectangular shower trays.,Showering/Shower Trays and Bases/Shower Tray Accessories/Shower Tray Accessories.csv -> Just Trays Fusion panel kit-6 1800 x 1000mm,,,https://www.wolseley.co.uk/wcsstore/ExtendedSitesCatalogAssetStore/images/products/AssetPush/wol-web-proof-medium-w/std.lang.all/38/96/NW-D23896_wm.jpg,https://www.wolseley.co.uk/wcsstore/ExtendedSitesCatalogAssetStore/images/products/AssetPush/DTP_AssetPushHighRes/std.lang.all/20/17/Fusion_Spec_Sheet_2017.pdf,,,,,,,,,,,,,,,,,,,,,,,
33,PD33530,Just Trays Fusion quadrant panel kit 1,Just Trays,135.67,"Suitable for quadrant trays, this Just Trays Fusion 1000mm panel kit is made of a tough ABS-capped acrylic stone resin with a white gloss finish.",Showering/Shower Trays and Bases/Shower Tray Accessories/Shower Tray Accessories.csv -> Just Trays Fusion quadrant panel kit 1,,,https://www.wolseley.co.uk/wcsstore/ExtendedSitesCatalogAssetStore/images/products/AssetPush/wol-web-proof-medium-w/std.lang.all/35/31/NW-D33530_D33531_wm.jpg,https://www.wolseley.co.uk/wcsstore/ExtendedSitesCatalogAssetStore/images/products/AssetPush/DTP_AssetPushHighRes/std.lang.all/ic/al/JustTrays_Fusion_Technical.pdf,https://www.wolseley.co.uk/wcsstore/ExtendedSitesCatalogAssetStore/images/products/AssetPush/DTP_AssetPushHighRes/std.lang.all/ti/on/JustTrays_JT40Fusion_Installation.pdf,https://www.wolseley.co.uk/wcsstore/ExtendedSitesCatalogAssetStore/images/products/AssetPush/DTP_AssetPushHighRes/std.lang.all/hu/re/JustTrays_Brochure.pdf,https://www.wolseley.co.uk/wcsstore/ExtendedSitesCatalogAssetStore/images/products/AssetPush/DTP_AssetPushHighRes/std.lang.all/20/17/Fusion_Spec_Sheet_2017.pdf,,,,,,,,,,,,,,,,,,,,
34,PD56819,Mira Flight rectangular riser conversion kit 1700mm,Mira,81.81,"This Mira Flight 1700mm rectangular riser conversion kit includes corner and end pieces along with clip-on fixings to give a neat, seamless finish.",Showering/Shower Trays and Bases/Shower Tray Accessories/Shower Tray Accessories.csv -> Mira Flight rectangular riser conversion kit 1700mm,,,https://www.wolseley.co.uk/wcsstore/ExtendedSitesCatalogAssetStore/images/products/AssetPush/wol-web-proof-medium-w/std.lang.all/68/21/NW-D56815_D56821_wm.jpg,https://www.wolseley.co.uk/wcsstore/ExtendedSitesCatalogAssetStore/images/products/AssetPush/DTP_AssetPushHighRes/std.lang.all/ti/on/Mira_FlightLLShowerTray_Installation.pdf,https://www.wolseley.co.uk/wcsstore/ExtendedSitesCatalogAssetStore/images/products/AssetPush/DTP_AssetPushHighRes/std.lang.all/st/al/Mira_1192074_W2_B_Flight_Tray_Instal.pdf,https://www.wolseley.co.uk/wcsstore/ExtendedSitesCatalogAssetStore/images/products/AssetPush/DTP_AssetPushHighRes/std.lang.all/hu/re/Mira_Shower_Trays_Brochure.pdf,,,,,,,,,,,,,,,,,,,,,
35,PD56817,Mira Flight quadrant riser conversion kit 1200mm,Mira,99.52,"This Mira Flight 1200mm quadrant riser conversion kit includes corner and end pieces along with clip-on fixings to give a neat, seamless finish.",Showering/Shower Trays and Bases/Shower Tray Accessories/Shower Tray Accessories.csv -> Mira Flight quadrant riser conversion kit 1200mm,,Corner;End piece;Simple clip on fixings,https://www.wolseley.co.uk/wcsstore/ExtendedSitesCatalogAssetStore/images/products/AssetPush/wol-web-proof-medium-w/std.lang.all/68/21/NW-D56815_D56821_wm.jpg,https://www.wolseley.co.uk/wcsstore/ExtendedSitesCatalogAssetStore/images/products/AssetPush/DTP_AssetPushHighRes/std.lang.all/ti/on/Mira_FlightLLShowerTray_Installation.pdf,https://www.wolseley.co.uk/wcsstore/ExtendedSitesCatalogAssetStore/images/products/AssetPush/DTP_AssetPushHighRes/std.lang.all/st/al/Mira_1192074_W2_B_Flight_Tray_Instal.pdf,https://www.wolseley.co.uk/wcsstore/ExtendedSitesCatalogAssetStore/images/products/AssetPush/DTP_AssetPushHighRes/std.lang.all/hu/re/Mira_Shower_Trays_Brochure.pdf,,,,,,,,,,,,,,,,,,,,,
36,PD08504,Classic Marble ClassiSeal flexible self adhesive upstand 4mtr,Classic Marble,41.14,"A professional waterproofing system, the patented Classic Marble ClassiSeal 4M flexible self-adhesive waterproof upstand is suitable for shower installation but can also be used elsewhere in the home, including kitchens. Accommodating 15mm of movement, this EPDM upstand is applied by hand to the sides of a shower tray or bath ahead of installation for reliable sealing with less effort. It can be used in new build installations as well as being suitable for renovation and refit jobs.",Showering/Shower Trays and Bases/Shower Tray Accessories/Shower Tray Accessories.csv -> Classic Marble ClassiSeal flexible self adhesive upstand 4mtr,,,https://www.wolseley.co.uk/wcsstore/ExtendedSitesCatalogAssetStore/images/products/AssetPush/wol-web-proof-medium-w/std.lang.all/85/04/NW-D08501_D08504_wm.jpg,https://www.wolseley.co.uk/wcsstore/ExtendedSitesCatalogAssetStore/images/products/AssetPush/DTP_AssetPushHighRes/std.lang.all/hu/re/Classic_Marble_ClassiSeal_Brochure.pdf,,,,,,,,,,,,,,,,,,,,,,,
37,PD28994,Merlyn MStone square riser kit 1200 x 1000mm,Merlyn,143.43,"This easy-install Merlyn MStone quadrant tray panel kit, for 1200 x 9000 quadrants is used for shower installation where a waste can't be run under the floor. Compatible with MStone and Merlyn Ionic shower trays, the panel is made from durable high-impact polystyrene and legs and clips are included, making the panels effortless to remove if maintenance access is required.",Showering/Shower Trays and Bases/Shower Tray Accessories/Shower Tray Accessories.csv -> Merlyn MStone square riser kit 1200 x 1000mm,,,https://www.wolseley.co.uk/wcsstore/ExtendedSitesCatalogAssetStore/images/products/AssetPush/wol-web-proof-medium-w/std.lang.all/89/94/NW-D28994_wm.jpg,https://www.wolseley.co.uk/wcsstore/ExtendedSitesCatalogAssetStore/images/products/AssetPush/DTP_AssetPushHighRes/std.lang.all/ta/ll/Merlyn_LowLevelShowerTray_Install.pdf,https://www.wolseley.co.uk/wcsstore/ExtendedSitesCatalogAssetStore/images/products/AssetPush/DTP_AssetPushHighRes/std.lang.all/ic/al/Merlyn_Essence_DRK4_Technical.pdf,https://www.wolseley.co.uk/wcsstore/ExtendedSitesCatalogAssetStore/images/products/AssetPush/DTP_AssetPushHighRes/std.lang.all/ic/al/Merlyn_MStone_LR_Quadrant_Technical.pdf,,,,,,,,,,,,,,,,,,,,,
38,PD07364,Just Trays quadrant shower tray panel kit 1 1000mm,Just Trays,37.18,"This Just Trays 1000mm Panel Kit 1 riser kit maintains and protects a shower tray for long lasting durability, preventing floods, splashes, and unexpected damage. Constructed from ABS acrylic, this riser kit contains all required fittings.",Showering/Shower Trays and Bases/Shower Tray Accessories/Shower Tray Accessories.csv -> Just Trays quadrant shower tray panel kit 1 1000mm,,,https://www.wolseley.co.uk/wcsstore/ExtendedSitesCatalogAssetStore/images/products/AssetPush/wol-web-proof-medium-w/std.lang.all/73/68/NW-D07364_D07368_wm.jpg,https://www.wolseley.co.uk/wcsstore/ExtendedSitesCatalogAssetStore/images/products/AssetPush/DTP_AssetPushHighRes/std.lang.all/ic/al/JustTrays_D07364_1000_KIT1_Technical.pdf,,,,,,,,,,,,,,,,,,,,,,,
39,PD07368,Just Trays shower tray panel kit 5 760 x 760mm,Just Trays,37.18,"This Just Trays 760 x 760mm Panel Kit 5 riser kit maintains and protects a shower tray for long lasting durability, preventing floods, splashes, and unexpected damage. Constructed from ABS acrylic, this riser kit contains all required fittings.",Showering/Shower Trays and Bases/Shower Tray Accessories/Shower Tray Accessories.csv -> Just Trays shower tray panel kit 5 760 x 760mm,,,https://www.wolseley.co.uk/wcsstore/ExtendedSitesCatalogAssetStore/images/products/AssetPush/wol-web-proof-medium-w/std.lang.all/73/68/NW-D07364_D07368_wm.jpg,https://www.wolseley.co.uk/wcsstore/ExtendedSitesCatalogAssetStore/images/products/AssetPush/DTP_AssetPushHighRes/std.lang.all/ic/al/JustTrays_D07368_KIT5_Technical.pdf,,,,,,,,,,,,,,,,,,,,,,,
