32,PD73808,Heatrae Sadia Handy 7 hand wash unit and spout 7.2kW pack,Heatrae Sadia,129.99,"Supplying on-demand hot water to a sink or basin, the slimline Heatrae Sadia Handy 7 instantaneous handwash unit is ideal for fitting where space is at a premium and requires only a cold water supply and mains electrical connection for flexibility of installation. With push-fit connections and a concealed electrical supply neat installation is quick and easy too. Ideal for use in workplace washrooms, this 7.2kW single point instantaneous heater unit with spout offers integrated safety features including a pressure relief device and a safety cut-out to prevent scalding.",Water Heating and Storage/Water Heaters/Point Of Use Water Heaters/Undersink Water Heaters/Undersink Water Heaters.csv -> Heatrae Sadia Handy 7 hand wash unit and spout 7.2kW pack,,Water heater;Spout assembly;Fixing screws ;plugs;Installation ;user Instructions,https://www.wolseley.co.uk/wcsstore/ExtendedSitesCatalogAssetStore/images/products/AssetPush/wol-web-proof-medium-w/std.lang.all/38/08/NW-D73808_wm.jpg,https://www.wolseley.co.uk/wcsstore/ExtendedSitesCatalogAssetStore/images/products/AssetPush/DTP_AssetPushHighRes/std.lang.all/ni/ng/HS_Safety_Warning.pdf,https://www.wolseley.co.uk/wcsstore/ExtendedSitesCatalogAssetStore/images/products/AssetPush/DTP_AssetPushHighRes/std.lang.all/_e/rp/D73808_ErP.pdf,https://www.wolseley.co.uk/wcsstore/ExtendedSitesCatalogAssetStore/images/products/AssetPush/DTP_AssetPushHighRes/std.lang.all/ti/on/HS_Handy_Installation.pdf,,,,,,,,,,,,,,,,,,,,,,,,,,,,,,,,,,,,,,,,,,,,
33,P112166,Hyco Powerflow PF50S unvented multipoint water heater 50 ltr 3kW,Hyco,458.45,"A slimline unit designed for installation in smaller spaces, the 50L capacity Hyco Powerflow PF50S 3kW unvented multipoint water heater is supplied complete with an unvented accessory kit for ease of installation. Highly efficient, this electrical water heater offers mains flow rates and incorporates smart technology for ease of use, improved convenience and less waste.",Water Heating and Storage/Water Heaters/Point Of Use Water Heaters/Undersink Water Heaters/Undersink Water Heaters.csv -> Hyco Powerflow PF50S unvented multipoint water heater 50 ltr 3kW,,"PF30S w/ Factory Fitted Temperature Pressure Relief Valve;Wall Mounting Brackets;Dialectrics;Unvented Accessory Kit (5L Expansion Vessel w/ Fixing Bracket;Inlet Group incorporating Check Valve, Pressure Reducing Valve & Pressure Relief Valve;Flexible Hos",https://www.wolseley.co.uk/wcsstore/ExtendedSitesCatalogAssetStore/images/products/AssetPush/wol-web-proof-medium-w/std.lang.all/63/35/596335_wm.jpg,,,,,,,White,"Inlet/ Outlet 2 x 1/2 BSP male,  2 x 15mm compression to 1/2 BSP female adapter",Adjustable between 50°C to 70,Powerflow,1 year parts or replacement warranty on electrical components3 year tank warranty,28,N,M,15 dB,3 kW,396,25 min,N/A,3,Adjustable between 50°C to 70,Multi Point,Electronic,Yes,B,IPX4,White Powder Coated Steel,174.05,14.50,Wall Mounted,Inlet/ Outlet 2 x 1/2 BSP male (100mm apart centre to centre). Fittings required (not supplied): 2 x 15mm compression to 1/2 BSP female adapter.,PF50S,N,50 l,Slimline design ideal for smaller spaces,Offers mains pressure flow rates,With 50L tank,Smart technology for high levels of efficiency,"With 3x modes of operation, standard, smart and eco",Eco mode operates at 50°C,"Compatible with regular taps, including mixer taps",Digital control panel for ease of use,ErP A rating,IPX4 rated,1 year parts or replacement warranty on electrical components,3 year tank warranty,
34,PD69010,Zip Aquapoint 3 AP3/05 water heater 5ltr 2kw,Zip,264.4,"Supplying fast hot water to multiple outlets, the 5L Zip Aquapoint III AP3/5 unvented water heater connects to the mains water supply and operates with your existing conventional taps and mixers. Tested to ensure robustness and reliability, this 2kW water heater is ErP A-rated, helping to minimise energy waste and contributing to reduced bills.",Water Heating and Storage/Water Heaters/Point Of Use Water Heaters/Undersink Water Heaters/Undersink Water Heaters.csv -> Zip Aquapoint 3 AP3/05 water heater 5ltr 2kw,,,https://www.wolseley.co.uk/wcsstore/ExtendedSitesCatalogAssetStore/images/products/AssetPush/wol-web-proof-medium-w/std.lang.all/90/12/D69010_D69012_wm.jpg,https://www.wolseley.co.uk/wcsstore/ExtendedSitesCatalogAssetStore/images/products/AssetPush/DTP_AssetPushHighRes/std.lang.all/ti/on/Zip_AquapointIII_Installation.pdf,https://www.wolseley.co.uk/wcsstore/ExtendedSitesCatalogAssetStore/images/products/AssetPush/DTP_AssetPushHighRes/std.lang.all/hu/re/Zip_DL_spreads_Brochure.pdf,https://www.wolseley.co.uk/wcsstore/ExtendedSitesCatalogAssetStore/images/products/AssetPush/DTP_AssetPushHighRes/std.lang.all/ic/al/Zip_Aquapoint_III_Technical.pdf,https://www.wolseley.co.uk/wcsstore/ExtendedSitesCatalogAssetStore/images/products/AssetPush/DTP_AssetPushHighRes/std.lang.all/hu/re/Zip_DL spreads_Brochure.pdf,https://www.wolseley.co.uk/wcsstore/ExtendedSitesCatalogAssetStore/images/products/AssetPush/DTP_AssetPushHighRes/std.lang.all/hu/re/Zip_Brochure.pdf,https://www.wolseley.co.uk/wcsstore/ExtendedSitesCatalogAssetStore/images/products/AssetPush/DTP_AssetPushHighRes/std.lang.all/ti/on/Zip_Aquapoint_III_Installation.pdf,,,,,,,,,,,,,,,,,,,,,,,,,,,,,,,,,,,,,,,,,
35,PD69164,Zip InLine CEX instantaneous under sink water heater 6.6 or 8.8kw,Zip,421.62,"Microprocessor controlled, the 8.8kW Zip InLine CEX-U instantaneous undersink water heater delivers immediate hot water to one or more outlets without the waste that can be created while you wait for the supply to warm up. This pressure-resistant water heater incorporates a heating element that will automatically switch on when a tap is opened and switch off when the tap is closed. Keeping water and energy use to an absolute minimum, the ErP A-rated CEX-U is also compatible with solar-heated water for even better efficiency.",Water Heating and Storage/Water Heaters/Point Of Use Water Heaters/Undersink Water Heaters/Undersink Water Heaters.csv -> Zip InLine CEX instantaneous under sink water heater 6.6 or 8.8kw,,,https://www.wolseley.co.uk/wcsstore/ExtendedSitesCatalogAssetStore/images/products/AssetPush/wol-web-proof-medium-w/std.lang.all/91/64/NW_D69164_wm.jpg,https://www.wolseley.co.uk/wcsstore/ExtendedSitesCatalogAssetStore/images/products/AssetPush/DTP_AssetPushHighRes/std.lang.all/ic/al/Zip_Inline_CEX_Technical.pdf,https://www.wolseley.co.uk/wcsstore/ExtendedSitesCatalogAssetStore/images/products/AssetPush/DTP_AssetPushHighRes/std.lang.all/hu/re/Zip_Inline_Brochure.pdf,https://www.wolseley.co.uk/wcsstore/ExtendedSitesCatalogAssetStore/images/products/AssetPush/DTP_AssetPushHighRes/std.lang.all/ti/on/Zip_Inline_CEX_Installation.pdf,https://www.wolseley.co.uk/wcsstore/ExtendedSitesCatalogAssetStore/images/products/AssetPush/DTP_AssetPushHighRes/std.lang.all/hu/re/Zip_Brochure.pdf,,,,,,,,,,,,,,,,,,,,,,,,,,,,,,,,,,,,,,,,,,,
36,PD70028,Ariston Andris Lux 6 undersink electric water heater 1.5kw 6ltr,Ariston,189.97,"Featuring cutting-edge Italian design, the Ariston Andris Lux 6L unvented electric undersink water heater offers excellent hot water performance and simple, straightforward operation. This easy to install 1.5kW unit includes a tough titanium-enamel tank insulated with eco-friendly materials for high levels of efficiency and heat retention alongside reliable durability.",Water Heating and Storage/Water Heaters/Point Of Use Water Heaters/Undersink Water Heaters/Undersink Water Heaters.csv -> Ariston Andris Lux 6 undersink electric water heater 1.5kw 6ltr,,,https://www.wolseley.co.uk/wcsstore/ExtendedSitesCatalogAssetStore/images/products/AssetPush/wol-web-proof-medium-w/std.lang.all/00/28/D70028_wm.jpg,https://www.wolseley.co.uk/wcsstore/ExtendedSitesCatalogAssetStore/images/products/AssetPush/DTP_AssetPushHighRes/std.lang.all/hu/re/Ariston_AndrisLux_Brochure.pdf,https://www.wolseley.co.uk/wcsstore/ExtendedSitesCatalogAssetStore/images/products/AssetPush/DTP_AssetPushHighRes/std.lang.all/ti/on/Ariston_AndrisLux_Installation.pdf,https://www.wolseley.co.uk/wcsstore/ExtendedSitesCatalogAssetStore/images/products/AssetPush/DTP_AssetPushHighRes/std.lang.all/x_/ds/Ariston_AndrisLux_DS.pdf,,,,,,,,,,,,,,,,,,,,,,,,,,,,,,,,,,,,,,,,,,,,
37,P112158,Hyco Speedflow SF05K unvented water heater 5 L 2kW 320 x 280 x 245 White,Hyco,135.38,"Supplying hot water to a single basin, the Hyco Speedflow SF05L 5L 2kW unvented single point electric storage water heater offers a range of convenient features including a robust glass-lined tank and a frost protection setting for safety when temperatures drop.",Water Heating and Storage/Water Heaters/Point Of Use Water Heaters/Undersink Water Heaters/Undersink Water Heaters.csv -> Hyco Speedflow SF05K unvented water heater 5 L 2kW 320 x 280 x 245 White,,SF05K;Pressure Relief Valve;Wall Mounting Brackets,https://www.wolseley.co.uk/wcsstore/ExtendedSitesCatalogAssetStore/images/products/AssetPush/wol-web-proof-medium-w/std.lang.all/63/27/596327_wm.jpg,,,,,,,White,Inlet/ Outlet 2 x 1/2 BSP Male (100mm apart centre to centre),Adjustable between approx. 50°C to 75,Speedflow,1 Year Parts or Replacement Warranty.,55 kg,N,XXS,15 dB,2 kW,245,6,No,4.2,Adjustable between approx. 50°C to 75,Single Point,Manual,No,B,IPX4,"Easy Clean, High Impact Plastic",60.92,7.25,Floor StandingWall Mounted,Inlet/ Outlet 2 x 1/2 BSP male (100mm apart centre to centre). Fittings required (not supplied): 2 x 15mm compression to 1/2 BSP female adapter.,SF05K,N,5 l,White colour,"Suitable for use with any regular taps, including mixers",Offers mains pressure flow rates,External temperature control with frost protection setting,Cables are pre-wired,With glass-lined tank,Pressure relief valve included,PRV must be fitted,Supplied with mounting brackets,1 year parts or replacement warranty,,,
38,PD70411,Heatrae Sadia Hotflo 15 water heater 15litre 2.2kw,Heatrae Sadia,453.71,"The Heatrae Sadia Hotflo 15L unvented water heater is the ideal handwash choice for small to medium commercial businesses, providing reliable hot water in washrooms with two or three sinks. Installed anywhere were there's no need for a cold water cistern, the 2.2kW Hotflo provides flexible, straightforward installation thanks to its compatibility with both standard and mixer taps. With a high-grade copper inner container and integral element, this reliable, functional handwash unit is built to last.",Water Heating and Storage/Water Heaters/Point Of Use Water Heaters/Undersink Water Heaters/Undersink Water Heaters.csv -> Heatrae Sadia Hotflo 15 water heater 15litre 2.2kw,,,https://www.wolseley.co.uk/wcsstore/ExtendedSitesCatalogAssetStore/images/products/AssetPush/wol-web-proof-medium-w/std.lang.all/04/11/D70411_wm.jpg,https://www.wolseley.co.uk/wcsstore/ExtendedSitesCatalogAssetStore/images/products/AssetPush/DTP_AssetPushHighRes/std.lang.all/ni/ng/HS_General_Safety_Warning.pdf,https://www.wolseley.co.uk/wcsstore/ExtendedSitesCatalogAssetStore/images/products/AssetPush/DTP_AssetPushHighRes/std.lang.all/hu/re/Heatrae Sadia_Megalife_Brochure.pdf,https://www.wolseley.co.uk/wcsstore/ExtendedSitesCatalogAssetStore/images/products/AssetPush/DTP_AssetPushHighRes/std.lang.all/ta/ll/HS_Hotflo_10_15_Pack_Install.pdf,https://www.wolseley.co.uk/wcsstore/ExtendedSitesCatalogAssetStore/images/products/AssetPush/DTP_AssetPushHighRes/std.lang.all/ti/on/HS_Hotflo_10_15_Installation.pdf,https://www.wolseley.co.uk/wcsstore/ExtendedSitesCatalogAssetStore/images/products/AssetPush/DTP_AssetPushHighRes/std.lang.all/hu/re/HS_Unvented_PoU_Hot_Water_Brochure.pdf,,,,,,,,,,,,,,,,,,,,,,,,,,,,,,,,,,,,,,,,,,
39,PD69931,Ariston Andris Lux Eco 3100718 undersink electric water heater 2.5kw 10 ltr pack,Ariston,149.0,"Ideal for use in those places where safety is of utmost concern, the Ariston Andris Lux Eco 10L electric storage water heater with built-in anti-Legionella system is suitable for installation in schools, hospitals and care homes, as well as homes and light commercial premises. Extremely efficient, this 2.5kW storage water heater has a tough titanium enamelled tank and offers fast reheat times. With the Lux Eco's 'Eco Evo' function daily usage is remembered for comfort and savings of up to 15% on energy bills.",Water Heating and Storage/Water Heaters/Point Of Use Water Heaters/Undersink Water Heaters/Undersink Water Heaters.csv -> Ariston Andris Lux Eco 3100718 undersink electric water heater 2.5kw 10 ltr pack,,Unvented water heater;Wall bracket;Pressure relief valve set at 6 bar;2x dielectric junctions,https://www.wolseley.co.uk/wcsstore/ExtendedSitesCatalogAssetStore/images/products/AssetPush/wol-web-proof-medium-w/std.lang.all/99/31/NW-D69931_wm.jpg,https://www.wolseley.co.uk/wcsstore/ExtendedSitesCatalogAssetStore/images/products/AssetPush/DTP_AssetPushHighRes/std.lang.all/_e/rp/Ariston_AndrisLuxEco10U_2_5KW_EU_ErP.pdf,https://www.wolseley.co.uk/wcsstore/ExtendedSitesCatalogAssetStore/images/products/AssetPush/DTP_AssetPushHighRes/std.lang.all/ic/al/Ariston_Andris_Lux_Eco_Technical.pdf,https://www.wolseley.co.uk/wcsstore/ExtendedSitesCatalogAssetStore/images/products/AssetPush/DTP_AssetPushHighRes/std.lang.all/st/al/Ariston_Unvented_Water_Heater_Instal.pdf,https://www.wolseley.co.uk/wcsstore/ExtendedSitesCatalogAssetStore/images/products/AssetPush/DTP_AssetPushHighRes/std.lang.all/hu/re/Ariston_Andris_Lux_Eco_Brochure.pdf,,,,,,,,,,,,,,,,,,,,,,,,,,,,,,,,,,,,,,,,,,,
40,PD69088,Zip Aquapoint 5 AP480S smart universal water heater 80ltr,Zip,699.46,"Connecting directly to the mains water supply, the feature-packed Zip Aquapoint IV 80L smart universal unvented water heater is capable of delivering reliable hot water to multiple conventional taps. Designed to maximise efficiency, this large 2kW water heater incorporates a robust powder-coated steel casing and polyurethane foam insulation for less heat loss while an anti-Legionella function ensures an always healthy water delivery.",Water Heating and Storage/Water Heaters/Point Of Use Water Heaters/Undersink Water Heaters/Undersink Water Heaters.csv -> Zip Aquapoint 5 AP480S smart universal water heater 80ltr,,"Water heater, installation kit",https://www.wolseley.co.uk/wcsstore/ExtendedSitesCatalogAssetStore/images/products/AssetPush/wol-web-proof-medium-w/std.lang.all/90/89/D69086_D69089_wm.jpg,https://www.wolseley.co.uk/wcsstore/ExtendedSitesCatalogAssetStore/images/products/AssetPush/DTP_AssetPushHighRes/std.lang.all/ti/on/Zip_Aquapoint_IV_Installation.pdf,https://www.wolseley.co.uk/wcsstore/ExtendedSitesCatalogAssetStore/images/products/AssetPush/DTP_AssetPushHighRes/std.lang.all/ic/al/D69088_Technical.pdf,,,,,,,,,,,,,,,,,,,,,,,,,,,,,,,,,,,,,,,,,,,,,
41,PD70440,Heatrae Sadia Handy 3 hand wash unit and spout 3.1kw,Heatrae Sadia,149.85,"The manually operated Heatrae Sadia Handy 3 unvented handwash unit requires only a cold water supply and a mains electrical connection and includes push-fit connections for fast, convenient and neat installation over a basin or sink. Providing instant on-demand hot water, this practical, slimline and compact 3.2kW unit is ideal for use in workplace washrooms, offering high levels of protection from scalding and pressure build-up and an ErP A rating for improved efficiency.",Water Heating and Storage/Water Heaters/Point Of Use Water Heaters/Undersink Water Heaters/Undersink Water Heaters.csv -> Heatrae Sadia Handy 3 hand wash unit and spout 3.1kw,,,https://www.wolseley.co.uk/wcsstore/ExtendedSitesCatalogAssetStore/images/products/AssetPush/wol-web-proof-medium-w/std.lang.all/04/40/D70440_wm.jpg,https://www.wolseley.co.uk/wcsstore/ExtendedSitesCatalogAssetStore/images/products/AssetPush/DTP_AssetPushHighRes/std.lang.all/ti/on/HS_Handy_Handwash_Installation.pdf,https://www.wolseley.co.uk/wcsstore/ExtendedSitesCatalogAssetStore/images/products/AssetPush/DTP_AssetPushHighRes/std.lang.all/ni/ng/HS_General_Safety_Warning.pdf,https://www.wolseley.co.uk/wcsstore/ExtendedSitesCatalogAssetStore/images/products/AssetPush/DTP_AssetPushHighRes/std.lang.all/hu/re/Heatrae Sadia_Megalife_Brochure.pdf,https://www.wolseley.co.uk/wcsstore/ExtendedSitesCatalogAssetStore/images/products/AssetPush/DTP_AssetPushHighRes/std.lang.all/hu/re/HS_Unvented_PoU_Hot_Water_Brochure.pdf,,,,,,,,,,,,,,,,,,,,,,,,,,,,,,,,,,,,,,,,,,,
42,PD69089,Zip Aquapoint 5 AP4100S smart universal water heater 100ltr,Zip,760.29,"Connecting directly to the mains water supply, the feature-packed Zip Aquapoint IV 100L smart universal unvented water heater is capable of delivering reliable hot water to multiple conventional taps. Designed to maximise efficiency, this large 2kW water heater incorporates a robust powder-coated steel casing and polyurethane foam insulation for less heat loss while an anti-Legionella function ensures an always healthy water delivery.",Water Heating and Storage/Water Heaters/Point Of Use Water Heaters/Undersink Water Heaters/Undersink Water Heaters.csv -> Zip Aquapoint 5 AP4100S smart universal water heater 100ltr,,"Water heater, installation kit",https://www.wolseley.co.uk/wcsstore/ExtendedSitesCatalogAssetStore/images/products/AssetPush/wol-web-proof-medium-w/std.lang.all/90/89/D69086_D69089_wm.jpg,https://www.wolseley.co.uk/wcsstore/ExtendedSitesCatalogAssetStore/images/products/AssetPush/DTP_AssetPushHighRes/std.lang.all/ti/on/Zip_Aquapoint_IV_Installation.pdf,https://www.wolseley.co.uk/wcsstore/ExtendedSitesCatalogAssetStore/images/products/AssetPush/DTP_AssetPushHighRes/std.lang.all/ic/al/D69089_Technical.pdf,,,,,,,,,,,,,,,,,,,,,,,,,,,,,,,,,,,,,,,,,,,,,
43,PD70441,Heatrae Sadia Handy 7 hand wash unit and spout 7.2kw,Heatrae Sadia,165.14,"The manually operated Heatrae Sadia Handy unvented handwash unit with spout requires only a cold water supply and a mains electrical connection and includes push-fit connections for fast, convenient and neat installation over a basin or sink. Providing instant on-demand hot water, this practical, slimline and compact 7.2kW unit is ideal for use in workplace washrooms, offering high levels of protection from scalding and pressure build-up and an ErP A rating for improved efficiency.",Water Heating and Storage/Water Heaters/Point Of Use Water Heaters/Undersink Water Heaters/Undersink Water Heaters.csv -> Heatrae Sadia Handy 7 hand wash unit and spout 7.2kw,,,https://www.wolseley.co.uk/wcsstore/ExtendedSitesCatalogAssetStore/images/products/AssetPush/wol-web-proof-medium-w/std.lang.all/04/41/D70441_wm.jpg,https://www.wolseley.co.uk/wcsstore/ExtendedSitesCatalogAssetStore/images/products/AssetPush/DTP_AssetPushHighRes/std.lang.all/ti/on/HS_Handy_Handwash_Installation.pdf,https://www.wolseley.co.uk/wcsstore/ExtendedSitesCatalogAssetStore/images/products/AssetPush/DTP_AssetPushHighRes/std.lang.all/ni/ng/HS_General_Safety_Warning.pdf,https://www.wolseley.co.uk/wcsstore/ExtendedSitesCatalogAssetStore/images/products/AssetPush/DTP_AssetPushHighRes/std.lang.all/hu/re/HS_Unvented_PoU_Hot_Water_Brochure.pdf,,,,,,,,,,,,,,,,,,,,,,,,,,,,,,,,,,,,,,,,,,,,
44,PD69162,Zip InLine ES4 instant water heater 4.4kw,Zip,379.1,"Boasting an energy efficient ErP A rating, the Zip InLine ES4 water heater helps to reduce waste while supplying reliable instantaneous hot water. With a compact footprint, the 4.4kW output ES4 is easy to install and incorporates both temperature stabilisation technology and flow adjustment control, ensuring safe, comfortable use.",Water Heating and Storage/Water Heaters/Point Of Use Water Heaters/Undersink Water Heaters/Undersink Water Heaters.csv -> Zip InLine ES4 instant water heater 4.4kw,,,https://www.wolseley.co.uk/wcsstore/ExtendedSitesCatalogAssetStore/images/products/AssetPush/wol-web-proof-medium-w/std.lang.all/91/60/NW_D69160_wm.jpg,https://www.wolseley.co.uk/wcsstore/ExtendedSitesCatalogAssetStore/images/products/AssetPush/DTP_AssetPushHighRes/std.lang.all/hu/re/Zip_Brochure.pdf,https://www.wolseley.co.uk/wcsstore/ExtendedSitesCatalogAssetStore/images/products/AssetPush/DTP_AssetPushHighRes/std.lang.all/ic/al/Zip_InLineES_Technical.pdf,https://www.wolseley.co.uk/wcsstore/ExtendedSitesCatalogAssetStore/images/products/AssetPush/DTP_AssetPushHighRes/std.lang.all/ti/on/Zip_Inline_ES_Installation.pdf,,,,,,,,,,,,,,,,,,,,,,,,,,,,,,,,,,,,,,,,,,,,
45,PD69923,Ariston Andris Lux Eco 3100722 15L Under Sink 2.5kW,Ariston,283.96,"Ariston's 15L storage Andris Lux Eco is a compact unvented electric water heater, designed to suit a wide range of locations, from building sites to office bathrooms or coffee shop kitchens. Incorporating Italian design alongside ErP A-rated energy efficiency, plus durability and performance you can rely on, the premium 2.5kW undersink Andris Lux Eco includes cutting-edge anti-legionella and anti-overheating functions for safe commercial use.",Water Heating and Storage/Water Heaters/Point Of Use Water Heaters/Undersink Water Heaters/Undersink Water Heaters.csv -> Ariston Andris Lux Eco 3100722 15L Under Sink 2.5kW,,,https://www.wolseley.co.uk/wcsstore/ExtendedSitesCatalogAssetStore/images/products/AssetPush/wol-web-proof-medium-w/std.lang.all/99/24/D69920_D69924_wm.jpg,https://www.wolseley.co.uk/wcsstore/ExtendedSitesCatalogAssetStore/images/products/AssetPush/DTP_AssetPushHighRes/std.lang.all/o_/ds/Ariston_AndrisLuxEco_DS.pdf,https://www.wolseley.co.uk/wcsstore/ExtendedSitesCatalogAssetStore/images/products/AssetPush/DTP_AssetPushHighRes/std.lang.all/ic/al/Ariston_AndrisLuxEco_Technical.pdf,https://www.wolseley.co.uk/wcsstore/ExtendedSitesCatalogAssetStore/images/products/AssetPush/DTP_AssetPushHighRes/std.lang.all/ti/on/Ariston_AndrisLuxEco_Installation.pdf,,,,,,,,,,,,,,,,,,,,,,,,,,,,,,,,,,,,,,,,,,,,
46,PD70518,Heatrae Sadia Streamline 7 under sink water heater 7ltr 1kw,Heatrae Sadia,276.16,"The contemporary, slimline 1kW Heatrae Sadia Streamline 7L undersink vented water heater is designed for mounting beneath a basin for convenient handwashing and cup filling in washrooms or office breakrooms. Quick and straightforward to install, the Streamline requires only a cold water supply and mains electricity and with a range of safety features and requiring minimal maintenance it's an ideal choice for spots where small amounts of water are regularly required.",Water Heating and Storage/Water Heaters/Point Of Use Water Heaters/Undersink Water Heaters/Undersink Water Heaters.csv -> Heatrae Sadia Streamline 7 under sink water heater 7ltr 1kw,,,https://www.wolseley.co.uk/wcsstore/ExtendedSitesCatalogAssetStore/images/products/AssetPush/wol-web-proof-medium-w/std.lang.all/05/18/D70518_wm.jpg,https://www.wolseley.co.uk/wcsstore/ExtendedSitesCatalogAssetStore/images/products/AssetPush/DTP_AssetPushHighRes/std.lang.all/ni/ng/HS_General_Safety_Warning.pdf,https://www.wolseley.co.uk/wcsstore/ExtendedSitesCatalogAssetStore/images/products/AssetPush/DTP_AssetPushHighRes/std.lang.all/20/17/HS_VentedPoUHotWater_Brochure_2017.pdf,https://www.wolseley.co.uk/wcsstore/ExtendedSitesCatalogAssetStore/images/products/AssetPush/DTP_AssetPushHighRes/std.lang.all/ta/ll/HS_Streamline_Undersink_Install.pdf,https://www.wolseley.co.uk/wcsstore/ExtendedSitesCatalogAssetStore/images/products/AssetPush/DTP_AssetPushHighRes/std.lang.all/ti/on/HS_Streamline_Taps_Installation.pdf,https://www.wolseley.co.uk/wcsstore/ExtendedSitesCatalogAssetStore/images/products/AssetPush/DTP_AssetPushHighRes/std.lang.all/hu/re/Heatrae Sadia_Streamline_Brochure.pdf,,,,,,,,,,,,,,,,,,,,,,,,,,,,,,,,,,,,,,,,,,
47,PD68182,Santon Aquaheat AH15/2.2 unvented water heater 15ltr 2.2kw,Santon,315.51,"The small 15L Santon Aquaheat AH15/2.2 is a cost-effective unvented water heater well-suited to handwashing, food preparation and dishwashing in canteens, workshops or other commercial premises With a robust copper inner container and expansion relief valve, the 2.2kW Aquaheat combines safety and reliability.",Water Heating and Storage/Water Heaters/Point Of Use Water Heaters/Undersink Water Heaters/Undersink Water Heaters.csv -> Santon Aquaheat AH15/2.2 unvented water heater 15ltr 2.2kw,,,https://www.wolseley.co.uk/wcsstore/ExtendedSitesCatalogAssetStore/images/products/AssetPush/wol-web-proof-medium-w/std.lang.all/nt/on/D68180_santon_wm.jpg,https://www.wolseley.co.uk/wcsstore/ExtendedSitesCatalogAssetStore/images/products/AssetPush/DTP_AssetPushHighRes/std.lang.all/ti/on/Santon_Aquaheat_Installation.pdf,https://www.wolseley.co.uk/wcsstore/ExtendedSitesCatalogAssetStore/images/products/AssetPush/DTP_AssetPushHighRes/std.lang.all/hu/re/Santon_Aquaheat_Brochure.pdf,https://www.wolseley.co.uk/wcsstore/ExtendedSitesCatalogAssetStore/images/products/AssetPush/DTP_AssetPushHighRes/std.lang.all/ni/ng/HS_General_Safety_Warning.pdf,,,,,,,,,,,,,,,,,,,,,,,,,,,,,,,,,,,,,,,,,,,,
