,pid,Title,Brand,Price,Description,category,mfpartnumber,whatisincluded,Image,Attachment 1,Attachment 2,Attachment 3
0,PD02634,Saracen padded wall shower seat with legs,Saracen,207.03,The padded wall shower seat with drop down legs is available in white and provides a comfortable seat that is height adjustable to match every users individual needs.,Showering/Shower Parts and Accessories/Shower Seats/Shower Seats.csv -> Saracen padded wall shower seat with legs,,,https://www.wolseley.co.uk/wcsstore/ExtendedSitesCatalogAssetStore/images/products/AssetPush/wol-web-proof-medium-w/std.lang.all/26/34/NW-D02634_wm.jpg,https://www.wolseley.co.uk/wcsstore/ExtendedSitesCatalogAssetStore/images/products/AssetPush/DTP_AssetPushHighRes/std.lang.all/r_/ld/Saracen_Shower_Chair_LD.pdf,https://www.wolseley.co.uk/wcsstore/ExtendedSitesCatalogAssetStore/images/products/AssetPush/DTP_AssetPushHighRes/std.lang.all/ti/on/D02634_Installation.pdf,https://www.wolseley.co.uk/wcsstore/ExtendedSitesCatalogAssetStore/images/products/AssetPush/DTP_AssetPushHighRes/std.lang.all/ic/al/D02634_Technical.pdf
1,PD60722,Mira folding shower seat White,Mira,124.75,"Suitable for use inside or outside the showering area, this Mira white shower seat provides additional security for bathroom users requiring additional support.",Showering/Shower Parts and Accessories/Shower Seats/Shower Seats.csv -> Mira folding shower seat White,,,https://www.wolseley.co.uk/wcsstore/ExtendedSitesCatalogAssetStore/images/products/AssetPush/wol-web-proof-medium-w/std.lang.all/07/22/NW-D60722_wm.jpg,https://www.wolseley.co.uk/wcsstore/ExtendedSitesCatalogAssetStore/images/products/AssetPush/DTP_AssetPushHighRes/std.lang.all/ti/on/Mira_ShowerSeat_Installation.pdf,,
2,PD60721,Mira folding shower seat White/Chrome Plated,Mira,135.29,"Suitable for use inside or outside the showering area, this Mira white and chrome shower seat provides additional security for bathroom users requiring additional support.",Showering/Shower Parts and Accessories/Shower Seats/Shower Seats.csv -> Mira folding shower seat White/Chrome Plated,,,https://www.wolseley.co.uk/wcsstore/ExtendedSitesCatalogAssetStore/images/products/AssetPush/wol-web-proof-medium-w/std.lang.all/07/21/NW-D60721_wm.jpg,https://www.wolseley.co.uk/wcsstore/ExtendedSitesCatalogAssetStore/images/products/AssetPush/DTP_AssetPushHighRes/std.lang.all/ti/on/Mira_ShowerSeat_Installation.pdf,,
3,PD02635,Saracen padded back rest White,Saracen,98.14,The padded back rest is available in white and is designed to aid side transfer. The padded back is made from polyurethane foam to allow for easy cleaning and has a cushion thickness of 60mm.,Showering/Shower Parts and Accessories/Shower Seats/Shower Seats.csv -> Saracen padded back rest White,,,https://www.wolseley.co.uk/wcsstore/ExtendedSitesCatalogAssetStore/images/products/AssetPush/wol-web-proof-medium-w/std.lang.all/26/35/NW-D02635_wm.jpg,https://www.wolseley.co.uk/wcsstore/ExtendedSitesCatalogAssetStore/images/products/AssetPush/DTP_AssetPushHighRes/std.lang.all/ti/on/D02635_Installation.pdf,https://www.wolseley.co.uk/wcsstore/ExtendedSitesCatalogAssetStore/images/products/AssetPush/DTP_AssetPushHighRes/std.lang.all/ic/al/D02635_Technical.pdf,https://www.wolseley.co.uk/wcsstore/ExtendedSitesCatalogAssetStore/images/products/AssetPush/DTP_AssetPushHighRes/std.lang.all/t_/ld/Saracen_Back_Rest_LD.pdf
4,PE69900,Ideal Standard Contour 21 back support cushion Satin Chrome,Ideal Standard,100.63,This new design Ideal Standard Contour 21 145 x 360mm white back rest cushion is supplied with support and clips.,Showering/Shower Parts and Accessories/Shower Seats/Shower Seats.csv -> Ideal Standard Contour 21 back support cushion Satin Chrome,,,https://www.wolseley.co.uk/wcsstore/ExtendedSitesCatalogAssetStore/images/products/AssetPush/wol-web-proof-medium-w/std.lang.all/99/00/NW-E69900_wm.jpg,https://www.wolseley.co.uk/wcsstore/ExtendedSitesCatalogAssetStore/images/products/AssetPush/DTP_AssetPushHighRes/std.lang.all/ic/al/Ideal_S6481_Technical.pdf,https://www.wolseley.co.uk/wcsstore/ExtendedSitesCatalogAssetStore/images/products/AssetPush/DTP_AssetPushHighRes/std.lang.all/hu/re/IStandard_BlueBook_Brochure.pdf,
