66,PG40386,Liff Limebeater electrolytic filter compression fitting 15mm (1),Liff,41.72,"The Liff Limebeater 2 Compact from LIFF uses electrolytic principles, designed for easy installation into existing, or new installations. Due to its compact size, and high quality finish, the Limebeater is ideal for use in restricted spaces, and where the finished installation is visible for the user to see. This electrolytic inhibitor requires no chemicals, or power supply, and is both environmentally friendly, and maintenance free. The scale reducer works by changing the structure of the hardness salts, inducing coagulation, and providing benefits to a range of appliances and as a result, provides protection for the whole house against scale, providing a more efficient central heating system. A more efficient system allows for a warmer, longer life boiler system, allowing for lower fuel bills and less maintenance costs. As well as your heating system, the LimeBeater will help protect household, kitchen and bathroom appliances from limescale build up, such as kettles and showers.",Heating/Water Treatment Products/Central Heating Filters/Central Heating Filters.csv -> Liff Limebeater electrolytic filter compression fitting 15mm (1),,,https://www.wolseley.co.uk/wcsstore/ExtendedSitesCatalogAssetStore/images/products/AssetPush/wol-web-proof-medium-w/std.lang.all/03/87/NW-G40386_G40387_wm.jpg,https://www.wolseley.co.uk/wcsstore/ExtendedSitesCatalogAssetStore/images/products/AssetPush/DTP_AssetPushHighRes/std.lang.all/hu/re/Liff_Water_Treatment_Brochure.pdf,,,,,,,,,,,,,,,,,,,,,,,,,,,,,,,
67,P116200,"BoilerMag XL magnetic filter 1.1/2"" Black",BoilerMag,823.07,"The Boilermag XL 1 1/2"" magnetic filter helps to prevent the damaging build up of black sludge (also known as ferrous oxide) in heating systems. This sludge can reduce heating efficiency and lead to premature boiler, pump or valve failure.","Heating/Water Treatment Products/Central Heating Filters/Central Heating Filters.csv -> BoilerMag XL magnetic filter 1.1/2"" Black",,,https://www.wolseley.co.uk/wcsstore/ExtendedSitesCatalogAssetStore/images/products/AssetPush/wol-web-proof-medium-w/std.lang.all/62/00/NW-116200_wm.jpg,,,,Boilermag,N,BMXL/AAV,Magnetic filter,N,Black colour,Normally cleaning is only required during annual servicing,Suitable for Heating Systems,Ideal for medium-sized commercial and large residential properties,,,,,,,,,,,,,,,,,,6260.00000,,
68,P608155,Fernox TF1 filter with valves 28mm,Fernox,190.57,"A precision-engineered in-line system filter, the Fernox TF1 Sigma 28mm filter incorporates a sealed, lidless design for best ever reliability and strength. Suitable for positioning in multiple orientations up to 45° and for fitting on either horizontal or vertical pipework, this filter is ideal for use in restricted spaces. Easy to install, this composite plastic filter with valve connections uses hydronic particle separation (HPS) action to herd contaminants towards a powerful magnet assembly for safe and complete removal.",Heating/Water Treatment Products/Central Heating Filters/Central Heating Filters.csv -> Fernox TF1 filter with valves 28mm,,,https://www.wolseley.co.uk/wcsstore/ExtendedSitesCatalogAssetStore/images/products/AssetPush/wol-web-proof-medium-w/std.lang.all/81/55/NW-608154_608155_wm.jpg,https://www.wolseley.co.uk/wcsstore/ExtendedSitesCatalogAssetStore/images/products/AssetPush/DTP_AssetPushHighRes/std.lang.all/ic/al/Fernox_62417_Sigmafilter_Technical.pdf,,,,,,,,,,,,,,,,,,,,,,,,,,,,,,,
69,PM12590,JET Range Mag nitrile insulation jacket,JET Range,308.61,A JET Range Mag insulation jacket for use with a side stream system hub filter.,Heating/Water Treatment Products/Central Heating Filters/Central Heating Filters.csv -> JET Range Mag nitrile insulation jacket,,,https://www.wolseley.co.uk/wcsstore/ExtendedSitesCatalogAssetStore/images/products/AssetPush/wol-web-proof-medium-w/std.lang.all/25/90/NW-M12590_wm.jpg,https://www.wolseley.co.uk/wcsstore/ExtendedSitesCatalogAssetStore/images/products/AssetPush/DTP_AssetPushHighRes/std.lang.all/he/et/M12578_M12590_Datasheet.pdf,https://www.wolseley.co.uk/wcsstore/ExtendedSitesCatalogAssetStore/images/products/AssetPush/DTP_AssetPushHighRes/std.lang.all/he/et/M12578_M12590_JetRange_Datasheet.pdf,https://www.wolseley.co.uk/wcsstore/ExtendedSitesCatalogAssetStore/images/products/AssetPush/DTP_AssetPushHighRes/std.lang.all/io/ns/M12578_M12590_Instructions.pdf,,,,,,,,,,,,,,,,,,,,,https://www.wolseley.co.uk/wcsstore/ExtendedSitesCatalogAssetStore/images/products/AssetPush/DTP_AssetPushHighRes/std.lang.all/ic/al/JET_M12578-M12579-M12580_Technical.pdf,,,,,,,,
70,P610115,Adey MagnaClean Professional3 Sense sense magnetic filter,Adey,190.78,"Monitoring the health of your central heating system, the Adey MagnaClean Professional3 Sense filter gives installers the ability to predict heating system breakdowns before they happen. A smart solution for protective and preventative heating system maintenance, this system incorporates Sense technology to detect dangerously high levels of magnetite before effects are seen. Using this smart filter can help to minimise costly and time consuming call-outs.",Heating/Water Treatment Products/Central Heating Filters/Central Heating Filters.csv -> Adey MagnaClean Professional3 Sense sense magnetic filter,,,https://www.wolseley.co.uk/wcsstore/ExtendedSitesCatalogAssetStore/images/products/AssetPush/wol-web-proof-medium-w/std.lang.all/01/15/NW-610115_wm.jpg,https://www.wolseley.co.uk/wcsstore/ExtendedSitesCatalogAssetStore/images/products/AssetPush/DTP_AssetPushHighRes/std.lang.all/ti/on/Adey_MagnaClean_Profe_Installation.pdf,https://www.wolseley.co.uk/wcsstore/ExtendedSitesCatalogAssetStore/images/products/AssetPush/DTP_AssetPushHighRes/std.lang.all/hu/re/Adey_Domestic_Product_Range_Brochure.pdf,,,,,,,,,,,,,,,,,,,,,,,,,,,,,,
71,P610480,SENTINEL NEW BUILD PK SOFT WATER,Sentinel,109.54,"Helping heating engineers to meet best practice, the Sentinel New Build Pack contains new system cleaner, inhibitor liquid and the Vortex250 22mm compact system filter. While new system cleaner provides thorough cleaning in systems under six months old, the inhibitor protects pipes and components from the damaging effects of limescale and corrosion. Fitted to a newly installed domestic heating system, the Vortex250 filter provides effective filtration of both magnetic and non-magnetic debris.",Heating/Water Treatment Products/Central Heating Filters/Central Heating Filters.csv -> SENTINEL NEW BUILD PK SOFT WATER,,,https://www.wolseley.co.uk/wcsstore/ExtendedSitesCatalogAssetStore/images/products/AssetPush/wol-web-proof-medium-w/std.lang.all/04/80/610480_wm.jpg,,,,,N,NBP-ELIMV250D-B-SW,Water Treatment Filters,N,All-in-one pack,Includes 1L X300 new system cleaner,Water Treatment best practice pack to clean and protect newly installed heating systems.,With 1L X100 inhibitor,Includes Vortex250 22mm ultra-compact system filter,Filter offers filtration of magnetic and non-magnetic debris,,,,,,,,,,,,,,,,,,
72,P608030,"Adey MagnaClean Commercial industrial filter 2""",Adey,2481.45,"Available in five sizes, the Adey MagnaClean Commercial industrial filter protects from the damage caused by system debris, offering suitability for all systems, from light commercial to heavy-duty industrial. This MagnaClean Commercial filter is supplied in a 2"" size.","Heating/Water Treatment Products/Central Heating Filters/Central Heating Filters.csv -> Adey MagnaClean Commercial industrial filter 2""",,,https://www.wolseley.co.uk/wcsstore/ExtendedSitesCatalogAssetStore/images/products/AssetPush/wol-web-proof-medium-w/std.lang.all/80/32/NW-608030_608032_wm.jpg,https://www.wolseley.co.uk/wcsstore/ExtendedSitesCatalogAssetStore/images/products/AssetPush/DTP_AssetPushHighRes/std.lang.all/ti/on/Adey_MagnaClean_Installation.pdf,,,,,,,,,,,,,,,,,,,,,,,,,,,,,,,
73,PG79820,Liff NDL2G deluxe filter with cartridge,Liff,111.85,"A Liff deluxe 10"" filter with carbon cartridge and automatic cut-off.",Heating/Water Treatment Products/Central Heating Filters/Central Heating Filters.csv -> Liff NDL2G deluxe filter with cartridge,,,https://www.wolseley.co.uk/wcsstore/ExtendedSitesCatalogAssetStore/images/products/AssetPush/wol-web-proof-medium-w/std.lang.all/98/20/NW-G79820_wm.jpg,https://www.wolseley.co.uk/wcsstore/ExtendedSitesCatalogAssetStore/images/products/AssetPush/DTP_AssetPushHighRes/std.lang.all/ti/on/Liff_WaterSoftner_Installation.pdf,,,,,,,,,,,,,,,,,,,,,,,,,,,,,,,
74,P609279,Adey MagnaClean Atom filter,Adey,99.97,"This Adey MagnaClean Atom filter is designed to protect a central heating system against the potentially damaging effects of black iron oxide sludge. With an ultra-compact design, this filter can be installed in spaces previously unsuitable for a filter.",Heating/Water Treatment Products/Central Heating Filters/Central Heating Filters.csv -> Adey MagnaClean Atom filter,,,https://www.wolseley.co.uk/wcsstore/ExtendedSitesCatalogAssetStore/images/products/AssetPush/wol-web-proof-medium-w/std.lang.all/92/79/NW-609279_wm.jpg,https://www.wolseley.co.uk/wcsstore/ExtendedSitesCatalogAssetStore/images/products/AssetPush/DTP_AssetPushHighRes/std.lang.all/hu/re/Adey_Domestic_Product_Range_Brochure.pdf,https://www.wolseley.co.uk/wcsstore/ExtendedSitesCatalogAssetStore/images/products/AssetPush/DTP_AssetPushHighRes/std.lang.all/ti/on/Adey_MagnaCleanAtom_Installation.pdf,,,,,,,,,,,,,,,,,,,,,,,,,,,,,,
75,P608203,"MagnaClean DRX magnetic filter 2""",MagnaClean,1403.81,"Protecting commercial heating systems, the MagnaClean DRX 2"" magnetic filter removes debris and black iron oxide sludge. This compact filter incorporates a design based on industry-proven magnetic filtration technologies and components. It consists of an innovative magnetic belt made up of high-performing neodymium magnets which have been wrapped around a robust, precision-engineered stainless steel canister.","Heating/Water Treatment Products/Central Heating Filters/Central Heating Filters.csv -> MagnaClean DRX magnetic filter 2""",,,https://www.wolseley.co.uk/wcsstore/ExtendedSitesCatalogAssetStore/images/products/AssetPush/wol-web-proof-medium-w/std.lang.all/82/05/NW-608203_608205_wm.jpg,https://www.wolseley.co.uk/wcsstore/ExtendedSitesCatalogAssetStore/images/products/AssetPush/DTP_AssetPushHighRes/std.lang.all/hu/re/MagnaClean_DRX_Brochure.pdf,,,,,,,,,,,,,,,,,,,,,,,,,,,,,,,
76,P608032,"Adey MagnaClean Commercial industrial filter 4""",Adey,3427.55,"Available in five sizes, the Adey MagnaClean Commercial industrial filter protects from the damage caused by system debris, offering suitability for all systems, from light commercial to heavy-duty industrial. This MagnaClean Commercial filter is supplied in a 4"" size.","Heating/Water Treatment Products/Central Heating Filters/Central Heating Filters.csv -> Adey MagnaClean Commercial industrial filter 4""",,,https://www.wolseley.co.uk/wcsstore/ExtendedSitesCatalogAssetStore/images/products/AssetPush/wol-web-proof-medium-w/std.lang.all/80/32/NW-608030_608032_wm.jpg,https://www.wolseley.co.uk/wcsstore/ExtendedSitesCatalogAssetStore/images/products/AssetPush/DTP_AssetPushHighRes/std.lang.all/ti/on/Adey_MagnaClean_Installation.pdf,,,,,,,,,,,,,,,,,,,,,,,,,,,,,,,
77,PM12578,"JET Range Mag side stream system hub 1/2""",JET Range,1315.94,"The magnetic JET Range Mag 1/2"" side stream system hub contains a magnetic dirt separator with integral filter basket, an automatic air vent, manual air venting point, a draining valve and a chemical dosing point. This hub can help improve the efficiency of industrial and commercial systems by removing damaging particles of corrosion and other debris, which can form during the day-to-day operation of a heating or cooling system.","Heating/Water Treatment Products/Central Heating Filters/Central Heating Filters.csv -> JET Range Mag side stream system hub 1/2""",,,https://www.wolseley.co.uk/wcsstore/ExtendedSitesCatalogAssetStore/images/products/AssetPush/wol-web-proof-medium-w/std.lang.all/25/80/NW-M12578_M12580_wm.jpg,https://www.wolseley.co.uk/wcsstore/ExtendedSitesCatalogAssetStore/images/products/AssetPush/DTP_AssetPushHighRes/std.lang.all/he/et/M12578_M12590_Datasheet.pdf,https://www.wolseley.co.uk/wcsstore/ExtendedSitesCatalogAssetStore/images/products/AssetPush/DTP_AssetPushHighRes/std.lang.all/ti/on/Jet_Mag_Installation.pdf,https://www.wolseley.co.uk/wcsstore/ExtendedSitesCatalogAssetStore/images/products/AssetPush/DTP_AssetPushHighRes/std.lang.all/he/et/M12578_M12590_JetRange_Datasheet.pdf,,,,,,,,,,,,,,,,,,,,,https://www.wolseley.co.uk/wcsstore/ExtendedSitesCatalogAssetStore/images/products/AssetPush/DTP_AssetPushHighRes/std.lang.all/io/ns/M12578_M12590_Instructions.pdf,https://www.wolseley.co.uk/wcsstore/ExtendedSitesCatalogAssetStore/images/products/AssetPush/DTP_AssetPushHighRes/std.lang.all/ic/al/JET_M12578-M12579-M12580_Technical.pdf,,,,,,,
78,P609305,Sentinel Vortex250 eliminator vortex v250 drain,Sentinel,151.83,"Easy to use and compact in size for flexible fitting, the Sentinel Vortex 250 filter protects a central heating system from magnetic contaminants for improved efficiency. Fitted with a drain cap, collected debris is simply flushed away by removing the magnet from its sleeve and opening the cap.",Heating/Water Treatment Products/Central Heating Filters/Central Heating Filters.csv -> Sentinel Vortex250 eliminator vortex v250 drain,,,https://www.wolseley.co.uk/wcsstore/ExtendedSitesCatalogAssetStore/images/products/AssetPush/wol-web-proof-medium-w/std.lang.all/93/05/NW-609305_wm.jpg,https://www.wolseley.co.uk/wcsstore/ExtendedSitesCatalogAssetStore/images/products/AssetPush/DTP_AssetPushHighRes/std.lang.all/ic/al/Sentinel_Vortex250_Technical.pdf,,,,,,,,,,,,,,,,,,,,,,,,,,,,,,,
79,P612589,Adey MagnaClean CMX Maxi filter maxi,Adey,4974.42,"Constructed in high-quality polished 316L steel, the Adey MagnaClean CMX Maxi filter has been designed to work in large industrial and commercial heating and chilled system. Delivering magnetic and non-magnetic filtration performance, this filter incorporates a powerful neodymium magnet assembly seated in a needlefelt bag filter and stainless steel basket strainer. Each of these components can be independently configured.",Heating/Water Treatment Products/Central Heating Filters/Central Heating Filters.csv -> Adey MagnaClean CMX Maxi filter maxi,,,https://www.wolseley.co.uk/wcsstore/ExtendedSitesCatalogAssetStore/images/products/AssetPush/wol-web-proof-medium-w/std.lang.all/25/89/NW-612589_wm.jpg,https://www.wolseley.co.uk/wcsstore/ExtendedSitesCatalogAssetStore/images/products/AssetPush/DTP_AssetPushHighRes/std.lang.all/ic/al/Adey_MagnaClean_CMX_Technical.pdf,,,,,,,,,,,,,,,,,,,,,,,,,,,,,,,
80,P105523,Worcester Bosch Greenstar system filter 22mtr Brass,Worcester Bosch,164.49,"Protecting boilers and heat pumps without costly intervention, the Worcester Bosch Greenstar 22mm system filter protects from damage caused by system debris and pollutants. The high-quality brass system filter is built to provide unrivalled protection for all boiler systems.",Heating/Water Treatment Products/Central Heating Filters/Central Heating Filters.csv -> Worcester Bosch Greenstar system filter 22mtr Brass,,,https://www.wolseley.co.uk/wcsstore/ExtendedSitesCatalogAssetStore/images/products/AssetPush/wol-web-proof-medium-w/std.lang.all/55/23/NW-105523_wm.jpg,,,,Greenstar,N,7733600476,System Filter,N,Magnetic and non-magnetic filtration collects a range of system debris,"Can be installed under or over the boiler, or remotely",Suitable for Central Heating Systems,One-way valve makes adding system chemicals easy,Isolation valve indicators visually assist when isolating filter,Over-tightening prevention feature,Detachable body for easier service and power flushing,Drainage point at bottom for access during servicing,Brass construction,,,,,,,,,,,,,,22 mm,Compression
81,P608984,Sentinel Vortex300 hydrocyclone filter 300ml valves 22mm T-piece brass,Sentinel,162.28,The Sentinel Vortex300 22mm filter with brass T-piece protects your central heating system from damage caused by all types of debris.,Heating/Water Treatment Products/Central Heating Filters/Central Heating Filters.csv -> Sentinel Vortex300 hydrocyclone filter 300ml valves 22mm T-piece brass,,,https://www.wolseley.co.uk/wcsstore/ExtendedSitesCatalogAssetStore/images/products/AssetPush/wol-web-proof-medium-w/std.lang.all/89/84/NW-608984_wm.jpg,https://www.wolseley.co.uk/wcsstore/ExtendedSitesCatalogAssetStore/images/products/AssetPush/DTP_AssetPushHighRes/std.lang.all/ic/al/Sentinel_Vortex300_Technical.pdf,,,,,,,,,,,,,,,,,,,,,,,,,,,,,,,
82,P610107,Adey Magna Clean Atoms Flt+Chem & Test & Electros,Adey,159.95,"Protecting heating systems and helping with Building Regulations Part L compliance, the Adey MagnaClean AtomSL Compliance Pack includes the MagnaClean AtomSL filter, MC1+ inhibitor, MC3+ cleaner, ProCheck water test strips and, optionally, the Electroscale2 or Magnascale2 scale reducer. Using the items in this pack and following Adey's best guidance could reduce heating bills by up to 7% while also improving efficiency and minimising the risk of breakdown due to damaging limescale and other contaminants.",Heating/Water Treatment Products/Central Heating Filters/Central Heating Filters.csv -> Adey Magna Clean Atoms Flt+Chem & Test & Electros,,,https://www.wolseley.co.uk/wcsstore/ExtendedSitesCatalogAssetStore/images/products/AssetPush/wol-web-proof-medium-w/std.lang.all/01/07/610107_wm.jpg,,,,,N,FL1-03-06485,Central heating water filters,N,Immediate test results using ADEY ProCheck,Compact design,Domestic,"Bi-directional, either port can be an inlet",Rotatable filter can be fitted at any angle,Supplied ready for quick installation,Easy access to air vent and drain valve for ease of servicing,ProCheck water test results via ADEY Sense portal,Flushing adapter available,Internal water operating temperature 3°C - 95°C,Internal operating water pressure up to 4.5 bar,Maximum flow rate of 50LPM,,,,,,,,,,,,
83,P606166,Fernox TF1 installer pack,Fernox,84.25,This handy Fernox TF1 Sigma installer pack contains everything you'll need for complete cleaning and protection of a central heating system.,Heating/Water Treatment Products/Central Heating Filters/Central Heating Filters.csv -> Fernox TF1 installer pack,,TF1 sigma filter;F1 protector 500ml;F3 cleaner 500ml,https://www.wolseley.co.uk/wcsstore/ExtendedSitesCatalogAssetStore/images/products/AssetPush/wol-web-proof-medium-w/std.lang.all/61/66/NW-606166_wm.jpg,,,,TF1,N,606166 PK,Sigma Installer Pack,N,Cleans and protects central heating systems,With F1 protector and F3 cleaner,Suitable for Central Heating Systems,,,,,,,,,,,,,,,,,,,,,
84,PM10756,JET Range A&D M10756 air and dirt separator flange125mm,JET Range,1239.15,"Fitted with 125mm flanged connections, this Jet Range air and dirt separator is designed for use in sealed heating and cooling systems. Removing air and dirt from the system, this separator protects against the damage that can be caused by particle deposits or by dissolved or undissolved air.",Heating/Water Treatment Products/Central Heating Filters/Central Heating Filters.csv -> JET Range A&D M10756 air and dirt separator flange125mm,,,https://www.wolseley.co.uk/wcsstore/ExtendedSitesCatalogAssetStore/images/products/AssetPush/wol-web-proof-medium-w/std.lang.all/07/57/M10752_M10757_wm.jpg,https://www.wolseley.co.uk/wcsstore/ExtendedSitesCatalogAssetStore/images/products/AssetPush/DTP_AssetPushHighRes/std.lang.all/te/ch/Jet_Air-Dirt_Separator_Tech.pdf,,,,,,,,,,,,,,,,,,,,,,,,,,,,,,,
85,PM10755,JET Range A&D M10755 air and dirt separator flange 100mm,JET Range,839.76,"Fitted with 100mm flanged connections, this Jet Range air and dirt separator is designed for use in sealed heating and cooling systems. Removing air and dirt from the system, this separator protects against the damage that can be caused by particle deposits or by dissolved or undissolved air.",Heating/Water Treatment Products/Central Heating Filters/Central Heating Filters.csv -> JET Range A&D M10755 air and dirt separator flange 100mm,,,https://www.wolseley.co.uk/wcsstore/ExtendedSitesCatalogAssetStore/images/products/AssetPush/wol-web-proof-medium-w/std.lang.all/07/57/M10752_M10757_wm.jpg,https://www.wolseley.co.uk/wcsstore/ExtendedSitesCatalogAssetStore/images/products/AssetPush/DTP_AssetPushHighRes/std.lang.all/te/ch/Jet_Air-Dirt_Separator_Tech.pdf,,,,,,,,,,,,,,,,,,,,,,,,,,,,,,,
86,PM10753,JET Range A&D M10753 air and dirt separator flange 65mm,JET Range,634.94,"Fitted with 65mm flanged connections, this Jet Range air and dirt separator is designed for use in sealed heating and cooling systems. Removing air and dirt from the system, this separator protects against the damage that can be caused by particle deposits or by dissolved or undissolved air.",Heating/Water Treatment Products/Central Heating Filters/Central Heating Filters.csv -> JET Range A&D M10753 air and dirt separator flange 65mm,,,https://www.wolseley.co.uk/wcsstore/ExtendedSitesCatalogAssetStore/images/products/AssetPush/wol-web-proof-medium-w/std.lang.all/07/57/M10752_M10757_wm.jpg,https://www.wolseley.co.uk/wcsstore/ExtendedSitesCatalogAssetStore/images/products/AssetPush/DTP_AssetPushHighRes/std.lang.all/te/ch/Jet_Air-Dirt_Separator_Tech.pdf,,,,,,,,,,,,,,,,,,,,,,,,,,,,,,,
87,PG79817,Liff NP1 standard filter housing only,Liff,54.34,"This Liff filter housing is suitable for any standard 10"" cartridge. The unit incorporates an air release mechanism, helping to relieve water pressure during a cartridge change.",Heating/Water Treatment Products/Central Heating Filters/Central Heating Filters.csv -> Liff NP1 standard filter housing only,,,https://www.wolseley.co.uk/wcsstore/ExtendedSitesCatalogAssetStore/images/products/AssetPush/wol-web-proof-medium-w/std.lang.all/98/17/NW-G79817_wm.jpg,https://www.wolseley.co.uk/wcsstore/ExtendedSitesCatalogAssetStore/images/products/AssetPush/DTP_AssetPushHighRes/std.lang.all/io/ns/NP1_NDL2_Instructions.pdf,https://www.wolseley.co.uk/wcsstore/ExtendedSitesCatalogAssetStore/images/products/AssetPush/DTP_AssetPushHighRes/std.lang.all/ic/al/Liff_Np1_Technical.pdf,,,,,,,,,,,,,,,,,,,,,,,,,,,,,,
88,PM10754,JET Range A&D M10754 air and dirt separator flange 80mm,JET Range,778.31,"Fitted with 80mm flanged connections, this Jet Range air and dirt separator is designed for use in sealed heating and cooling systems. Removing air and dirt from the system, this separator protects against the damage that can be caused by particle deposits or by dissolved or undissolved air.",Heating/Water Treatment Products/Central Heating Filters/Central Heating Filters.csv -> JET Range A&D M10754 air and dirt separator flange 80mm,,,https://www.wolseley.co.uk/wcsstore/ExtendedSitesCatalogAssetStore/images/products/AssetPush/wol-web-proof-medium-w/std.lang.all/07/57/M10752_M10757_wm.jpg,https://www.wolseley.co.uk/wcsstore/ExtendedSitesCatalogAssetStore/images/products/AssetPush/DTP_AssetPushHighRes/std.lang.all/te/ch/Jet_Air-Dirt_Separator_Tech.pdf,,,,,,,,,,,,,,,,,,,,,,,,,,,,,,,
89,P610105,Adey MagnaClean Atom atom chemical pack rapide 22mm,Adey,136.62,Adey MagnaClean Atom 22mm protects central heating systems from the damaging effects of black iron oxide sludge. This filter and chemical pack contains water treatment products selected to keep heating systems running efficiently and reliably.,Heating/Water Treatment Products/Central Heating Filters/Central Heating Filters.csv -> Adey MagnaClean Atom atom chemical pack rapide 22mm,,,https://www.wolseley.co.uk/wcsstore/ExtendedSitesCatalogAssetStore/images/products/AssetPush/wol-web-proof-medium-w/std.lang.all/01/05/NW-610105_wm.jpg,https://www.wolseley.co.uk/wcsstore/ExtendedSitesCatalogAssetStore/images/products/AssetPush/DTP_AssetPushHighRes/std.lang.all/hu/re/Adey_Domestic_Product_Range_Brochure.pdf,,,,,,,,,,,,,,,,,,,,,,,,,,,,,,,
90,P116201,"BoilerMag XT magnetic filter 2"" Black",BoilerMag,1941.11,"Suitable for demanding large scale applications, the Boilermag XT 2"" magnetic filter is recommended for use in the automotive and aviation industries. Efficient and highly reliable, this robust high power system is built to meet the requirements of large-sized industrial heating systems.","Heating/Water Treatment Products/Central Heating Filters/Central Heating Filters.csv -> BoilerMag XT magnetic filter 2"" Black",,,https://www.wolseley.co.uk/wcsstore/ExtendedSitesCatalogAssetStore/images/products/AssetPush/wol-web-proof-medium-w/std.lang.all/62/02/NW-116201_116202_wm.jpg,https://www.wolseley.co.uk/wcsstore/ExtendedSitesCatalogAssetStore/images/products/AssetPush/DTP_AssetPushHighRes/std.lang.all/hu/re/Eclipse_Boilermag_Brochure.pdf,,,,,,,,,,,,,,,,,,,,,,,,,,,,,,,
