,pid,Title,Brand,Price,Description,category,mfpartnumber,whatisincluded,Image,Attachment 1,Attachment 2,Attachment 3,Range,Hazardous,Supplier Product Code,Type,WEEE Compliant,Feature 1,Feature 2,Application,Feature 3,Feature 4,Feature 5,Feature 6,Feature 7,Feature 8,Feature 9,Feature 10,Feature 11,Range For Use With,Boiler Section,Boiler Range,Attachment 4,Attachment 5,Attachment 6,Attachment 7,Pack Quantity,Pack Type,Weight,Connection Size,Connection Type
0,P609932,Center CB system filter 22mm Black,Center,58.49,"Highly efficient, the Center CB 22mm system filter provides low maintenance protection from the potentially damaging effects of magnetite and other debris in a heating system. Easy to fit and maintain, this filter has an innovative horizontal design, ideal for tight spaces or installations where the filter may be visible, such as in the kitchen boiler cupboard. Incorporating a unique, single bypass valve, the filter can be serviced quickly and easily without ceasing running of the heating system. Offering an exceptional first pass capture rate, the Center System Filter helps to minimise the risks of debris in both brand new and existing heating systems.",Heating/Water Treatment Products/Central Heating Filters/Central Heating Filters.csv -> Center CB system filter 22mm Black,,,https://www.wolseley.co.uk/wcsstore/ExtendedSitesCatalogAssetStore/images/products/AssetPush/wol-web-proof-medium-w/std.lang.all/99/32/609932_wm.jpg,https://www.wolseley.co.uk/wcsstore/ExtendedSitesCatalogAssetStore/images/products/AssetPush/DTP_AssetPushHighRes/std.lang.all/ti/on/Center_609932_Installation.pdf,https://www.wolseley.co.uk/wcsstore/ExtendedSitesCatalogAssetStore/images/products/AssetPush/DTP_AssetPushHighRes/std.lang.all/ic/al/Center_609932_Technical.pdf,,,,,,,,,,,,,,,,,,,,,,,,,,,,,,
1,P609406,Adey MagnaClean Micro2 Magnaclean Micro 2 & Chemical Box,Adey,100.56,"The Adey MagnaClean Micro2 filter and chemical pack contains Magnaclean Micro2 with two essential installation chemicals, the MC1 protector and MC3 cleaner make installing a new central heating system simple.",Heating/Water Treatment Products/Central Heating Filters/Central Heating Filters.csv -> Adey MagnaClean Micro2 Magnaclean Micro 2 & Chemical Box,,,https://www.wolseley.co.uk/wcsstore/ExtendedSitesCatalogAssetStore/images/products/AssetPush/wol-web-proof-medium-w/std.lang.all/94/06/NW-609406_wm.jpg,https://www.wolseley.co.uk/wcsstore/ExtendedSitesCatalogAssetStore/images/products/AssetPush/DTP_AssetPushHighRes/std.lang.all/hu/re/Adey_Domestic_Product_Range_Brochure.pdf,,,,,,,,,,,,,,,,,,,,,,,,,,,,,,,
2,P609405,Adey MagnaClean Micro2 Magnaclean Micro 2 Filter,Adey,83.63,"The compact Adey MagnaClean Micro2 filter is designed for installation in the smallest spaces. Though small in size, this filter delivers powerful protection from damaging magnetite and other system debris.",Heating/Water Treatment Products/Central Heating Filters/Central Heating Filters.csv -> Adey MagnaClean Micro2 Magnaclean Micro 2 Filter,,,https://www.wolseley.co.uk/wcsstore/ExtendedSitesCatalogAssetStore/images/products/AssetPush/wol-web-proof-medium-w/std.lang.all/94/05/NW-609405_wm.jpg,https://www.wolseley.co.uk/wcsstore/ExtendedSitesCatalogAssetStore/images/products/AssetPush/DTP_AssetPushHighRes/std.lang.all/hu/re/Adey_Domestic_Product_Range_Brochure.pdf,,,,,,,,,,,,,,,,,,,,,,,,,,,,,,,
3,P105287,Worcester Bosch Greenstar  G/Star System Filter Mini 22mm,Worcester Bosch,157.99,"Protecting Greenstar boilers from common pollutants and debris, this Worcester Bosch Greenstar 22mm mini system filter range is effective against debris, magnetite and iron oxide. A filter of this kind limits system damage, minimising the need for expensive repairs and reducing the risk of system failure. For use with sealed or open vented central heating systems with 22mm central heating pipes.",Heating/Water Treatment Products/Central Heating Filters/Central Heating Filters.csv -> Worcester Bosch Greenstar  G/Star System Filter Mini 22mm,,,https://www.wolseley.co.uk/wcsstore/ExtendedSitesCatalogAssetStore/images/products/AssetPush/wol-web-proof-medium-w/std.lang.all/52/87/105287_wm.jpg,https://www.wolseley.co.uk/wcsstore/ExtendedSitesCatalogAssetStore/images/products/AssetPush/DTP_AssetPushHighRes/std.lang.all/ui/de/Worcester_Bosch_Gas_Product_Guide.pdf,https://www.wolseley.co.uk/wcsstore/ExtendedSitesCatalogAssetStore/images/products/AssetPush/DTP_AssetPushHighRes/std.lang.all/52/87/105287.pdf,https://www.wolseley.co.uk/wcsstore/ExtendedSitesCatalogAssetStore/images/products/AssetPush/DTP_AssetPushHighRes/std.lang.all/ic/al/WB_Greenstar_System_Filter_Technical.pdf,,,,,,,,,,,,,,,,,,,,,,,,,,,,,
4,P100303,Worcester Bosch Greenstar Greenstar System Filter 22mm,Worcester Bosch,133.49,"Protecting against the damage that can be caused by system debris and pollutants, the Worcester Bosch Greenstar 22mm system filter helps homeowners to avoid costly maintenance. Extensively tested in systems, this filter is proven effective in removing iron oxide, magnetite and non-magnetic metal flakes as well as other system pollutants.",Heating/Water Treatment Products/Central Heating Filters/Central Heating Filters.csv -> Worcester Bosch Greenstar Greenstar System Filter 22mm,,,https://www.wolseley.co.uk/wcsstore/ExtendedSitesCatalogAssetStore/images/products/AssetPush/wol-web-proof-medium-w/std.lang.all/03/04/NW-100303_100304_wm.jpg,https://www.wolseley.co.uk/wcsstore/ExtendedSitesCatalogAssetStore/images/products/AssetPush/DTP_AssetPushHighRes/std.lang.all/hu/re/Worcester_Systemfilter_Brochure.pdf,,,,,,,,,,,,,,,,,,,,,,,,,,,,,,,
5,P609534,Adey MagnaClean Professional2 Magnaclean Pro2 22Mm & Chemicl Pk,Adey,110.93,"Harnessing new technology, the Adey MagnaClean Professional2 filter and chemical pack provides excellent central heating protection and ease of installation. Not only will MagnaClean Pro help to extend the lifespan of your central heating system, it will also reduce maintenance costs, reduce fuel bills and minimise your boiler's impact on the environment. With a removable spacer positioned between the valves, this in-line push-fit filter is easy to fit in the most convenient spot.",Heating/Water Treatment Products/Central Heating Filters/Central Heating Filters.csv -> Adey MagnaClean Professional2 Magnaclean Pro2 22Mm & Chemicl Pk,,,https://www.wolseley.co.uk/wcsstore/ExtendedSitesCatalogAssetStore/images/products/AssetPush/wol-web-proof-medium-w/std.lang.all/95/34/609534_wm.jpg,https://www.wolseley.co.uk/wcsstore/ExtendedSitesCatalogAssetStore/images/products/AssetPush/DTP_AssetPushHighRes/std.lang.all/hu/re/Adey_Domestic_Product_Range_Brochure.pdf,https://www.wolseley.co.uk/wcsstore/ExtendedSitesCatalogAssetStore/images/products/AssetPush/DTP_AssetPushHighRes/std.lang.all/ti/on/Adey_MagnaCleanProf2_Installation.pdf,,,,,,,,,,,,,,,,,,,,,,,,,,,,,,
6,P609530,Adey MagnaClean Professional O ring service kit,Adey,15.75,"Replace filter seals as required with this Adey MagnaClean Professional O-ring seal kit, suitable for MagnaClean Professional and Micro 22 or 28mm filters.",Heating/Water Treatment Products/Central Heating Filters/Central Heating Filters.csv -> Adey MagnaClean Professional O ring service kit,,,https://www.wolseley.co.uk/wcsstore/ExtendedSitesCatalogAssetStore/images/products/AssetPush/wol-web-proof-medium-w/std.lang.all/95/30/NW-609530_wm.jpg,https://www.wolseley.co.uk/wcsstore/ExtendedSitesCatalogAssetStore/images/products/AssetPush/DTP_AssetPushHighRes/std.lang.all/ti/on/Adey_MCProfessional_Installation.pdf,https://www.wolseley.co.uk/wcsstore/ExtendedSitesCatalogAssetStore/images/products/AssetPush/DTP_AssetPushHighRes/std.lang.all/hu/re/Adey_MagnaCleanProf_Brochure.pdf,,,,,,,,,,,,,,,,,,,,,,,,,,,,,,
7,P608246,Fernox TF1 range seal and O ring kit,Fernox,2.88,"This useful Fernox seal and O-ring kit spares pack contains all the seals required to ensure a TF1 filter remains watertight following chemical dosing, servicing and maintenance.",Heating/Water Treatment Products/Central Heating Filters/Central Heating Filters.csv -> Fernox TF1 range seal and O ring kit,,,https://www.wolseley.co.uk/wcsstore/ExtendedSitesCatalogAssetStore/images/products/AssetPush/wol-web-proof-medium-w/std.lang.all/82/46/NW-608246_wm.jpg,,,,TF1,N,59288,Seal and O-Ring kit,N,Includes cap O-ring and bleed valve O-ring,With 2x valve washers,,,,,,,,,,,,,,,,,,,,,,
8,P600698,Center filter and chemical pack,Center,53.0,"Featuring a 500ml inhibitor and 500ml of cleaner, this Center CB filter and chemical pack makes the dosing of heating systems, easier, faster and cleaner.",Heating/Water Treatment Products/Central Heating Filters/Central Heating Filters.csv -> Center filter and chemical pack,,,https://www.wolseley.co.uk/wcsstore/ExtendedSitesCatalogAssetStore/images/products/AssetPush/wol-web-proof-medium-w/std.lang.all/8_/pk/600698 PK_wm.jpg,https://www.wolseley.co.uk/wcsstore/ExtendedSitesCatalogAssetStore/images/products/AssetPush/DTP_AssetPushHighRes/std.lang.all/20/21/Wolseley_Plumbing-Heating_Guide_2021.pdf,,,,,,,,,,,,,,,,,,,,,,,,,,,,,,,
9,P606211,Fernox SIG mini filter with 265 ml chemical pack,Fernox,55.0,TBC,Heating/Water Treatment Products/Central Heating Filters/Central Heating Filters.csv -> Fernox SIG mini filter with 265 ml chemical pack,,,https://www.wolseley.co.uk/wcsstore/ExtendedSitesCatalogAssetStore/images/products/AssetPush/wol-web-proof-medium-w/std.lang.all/62/11/606211_wm.jpg,,,,,N,606211 PK,,N,,,,,,,,,,,,,,,,,,,,,,,,
10,P609277,Adey MagnaClean Professional2 filter and chemical pack,Adey,78.0,"Removing almost 100% of the suspended black oxide sludge found in your heating system, the Adey MagnaClean Professional2 filter and chemical pack helps to extend the life of your system and improve efficiency. For easy installation, the dual-action filter can be installed anywhere on the main circuit, although for best protection, it's advised to fit MagnaClean Pro between the last radiator and the boiler.",Heating/Water Treatment Products/Central Heating Filters/Central Heating Filters.csv -> Adey MagnaClean Professional2 filter and chemical pack,,MagnaClean Professional2 filter;MC1 protector;MC3 cleaner,https://www.wolseley.co.uk/wcsstore/ExtendedSitesCatalogAssetStore/images/products/AssetPush/wol-web-proof-medium-w/std.lang.all/92/77/NW-609277_wm.jpg,https://www.wolseley.co.uk/wcsstore/ExtendedSitesCatalogAssetStore/images/products/AssetPush/DTP_AssetPushHighRes/std.lang.all/hu/re/Adey_Domestic_Product_Range_Brochure.pdf,https://www.wolseley.co.uk/wcsstore/ExtendedSitesCatalogAssetStore/images/products/AssetPush/DTP_AssetPushHighRes/std.lang.all/ti/on/Adey_MagnaCleanProf2_Installation.pdf,,,,,,,,,,,,,,,,,,,,,,,,,,,,,,
11,P608158,Fernox TF1 Tf1 Sigma 22mm Slipsocket Install Pack (4),Fernox,142.49,"The Fernox TF1 Sigma Filter Installer Pack includes everything needed to successfully clean and protect a domestic central heating system in line with BS 7593:2019 and the Benchmark Commissioning Checklist. It includes the industry leading TF1 Sigma Filter with 22mm slip socket connection, Fernox Cleaner F3 and Fernox Protector F1 265ml. The complete solution to cleaning, protecting and guarding central heating systems.",Heating/Water Treatment Products/Central Heating Filters/Central Heating Filters.csv -> Fernox TF1 Tf1 Sigma 22mm Slipsocket Install Pack (4),,,https://www.wolseley.co.uk/wcsstore/ExtendedSitesCatalogAssetStore/images/products/AssetPush/wol-web-proof-medium-w/std.lang.all/81/58/NW-608158_wm.jpg,https://www.wolseley.co.uk/wcsstore/ExtendedSitesCatalogAssetStore/images/products/AssetPush/DTP_AssetPushHighRes/std.lang.all/ic/al/Fernox_62509_SigmaInstalle_Technical.pdf,https://www.wolseley.co.uk/wcsstore/ExtendedSitesCatalogAssetStore/images/products/AssetPush/DTP_AssetPushHighRes/std.lang.all/he/et/608158_Fernox_Datasheet.pdf,https://www.wolseley.co.uk/wcsstore/ExtendedSitesCatalogAssetStore/images/products/AssetPush/DTP_AssetPushHighRes/std.lang.all/fl/et/608154_608158_Fernox_Leaflet.pdf,,,,,,,,,,,,,,,,,,,,,,,,,,,,,
12,P609281,Adey MagnaClean Professional2 filter 22mm pack,Adey,74.0,"Capturing the maximum amount of magnetite possible, the Adey MagnaClean Professional2 22mm filter provides reliable protection from potentially damaging debris, helping to extend the life of your central heating system.",Heating/Water Treatment Products/Central Heating Filters/Central Heating Filters.csv -> Adey MagnaClean Professional2 filter 22mm pack,,,https://www.wolseley.co.uk/wcsstore/ExtendedSitesCatalogAssetStore/images/products/AssetPush/wol-web-proof-medium-w/std.lang.all/92/81/NW-609281_wm.jpg,https://www.wolseley.co.uk/wcsstore/ExtendedSitesCatalogAssetStore/images/products/AssetPush/DTP_AssetPushHighRes/std.lang.all/hu/re/Adey_Domestic_Product_Range_Brochure.pdf,https://www.wolseley.co.uk/wcsstore/ExtendedSitesCatalogAssetStore/images/products/AssetPush/DTP_AssetPushHighRes/std.lang.all/ti/on/Adey_MagnaCleanProf2_Installation.pdf,,,,,,,,,,,,,,,,,,,,,,,,,,,,,,
13,P610106,Adey Magna Clean Atom SL Compliance Pack,Adey,132.53,"Protecting heating systems and helping with Building Regulations Part L compliance, the Adey MagnaClean AtomSL Compliance Pack includes the MagnaClean AtomSL filter, MC1+ inhibitor, MC3+ cleaner, ProCheck water test strips and, optionally, the Electroscale2 or Magnascale2 scale reducer. Using the items in this pack and following Adey's best guidance could reduce heating bills by up to 7% while also improving efficiency and minimising the risk of breakdown due to damaging limescale and other contaminants.",Heating/Water Treatment Products/Central Heating Filters/Central Heating Filters.csv -> Adey Magna Clean Atom SL Compliance Pack,,,https://www.wolseley.co.uk/wcsstore/ExtendedSitesCatalogAssetStore/images/products/AssetPush/wol-web-proof-medium-w/std.lang.all/01/06/610106_wm.jpg,,,,,N,FL1-03-06484,Central heating water filters,N,Immediate test results using ADEY ProCheck,Compact design,Domestic,"Bi-directional, either port can be an inlet",Rotatable filter can be fitted at any angle,Supplied ready for quick installation,Easy access to air vent and drain valve for ease of servicing,ProCheck water test results via ADEY Sense portal,Flushing adapter available,Internal water operating temperature 3°C - 95°C,Internal operating water pressure up to 4.5 bar,Maximum flow rate of 50LPM,,,,,,,,,,,,
14,P609494,Adey MagnaClean Professional2XP filter 28mm,Adey,183.75,The Adey MagnaClean Professional2XP 28mm filter offers additional filtering capacity to help deal with the larger volume of debris found in larger central heating systems.,Heating/Water Treatment Products/Central Heating Filters/Central Heating Filters.csv -> Adey MagnaClean Professional2XP filter 28mm,,,https://www.wolseley.co.uk/wcsstore/ExtendedSitesCatalogAssetStore/images/products/AssetPush/wol-web-proof-medium-w/std.lang.all/94/94/NW-609494_wm.jpg,https://www.wolseley.co.uk/wcsstore/ExtendedSitesCatalogAssetStore/images/products/AssetPush/DTP_AssetPushHighRes/std.lang.all/ti/on/Adey_MagnaClean_Pro2XP_Installation.pdf,https://www.wolseley.co.uk/wcsstore/ExtendedSitesCatalogAssetStore/images/products/AssetPush/DTP_AssetPushHighRes/std.lang.all/hu/re/Adey_Domestic_Product_Range_Brochure.pdf,https://www.wolseley.co.uk/wcsstore/ExtendedSitesCatalogAssetStore/images/products/AssetPush/DTP_AssetPushHighRes/std.lang.all/ic/al/Adey_Magna_Professional2XP_Technical.pdf,,,,,,,,,,,,,,,,,,,,,,,,,,,,,
15,P609280,Adey MagnaClean Micro2 filter,Adey,79.25,"The compact Adey MagnaClean Micro2 filter is designed for installation in the smallest spaces. Though small in size, this filter delivers powerful protection from damaging magnetite and other system debris.",Heating/Water Treatment Products/Central Heating Filters/Central Heating Filters.csv -> Adey MagnaClean Micro2 filter,,,https://www.wolseley.co.uk/wcsstore/ExtendedSitesCatalogAssetStore/images/products/AssetPush/wol-web-proof-medium-w/std.lang.all/92/80/NW-609280_wm.jpg,https://www.wolseley.co.uk/wcsstore/ExtendedSitesCatalogAssetStore/images/products/AssetPush/DTP_AssetPushHighRes/std.lang.all/hu/re/Adey_Domestic_Product_Range_Brochure.pdf,,,,,,,,,,,,,,,,,,,,,,,,,,,,,,,
16,P608043,Adey MagnaClean DualXP FL1-0-02028 XP dual filter 35/42mm,Adey,708.14,"Designed to eliminate the magnetite and debris commonly created by larger systems, the Adey MagnaClean DualXP 35/42mm filter incorporates two powerful magnetic capture zones. This effective system offers reliable protection from the damaging effects of black iron oxide sludge and non-magnetic debris.",Heating/Water Treatment Products/Central Heating Filters/Central Heating Filters.csv -> Adey MagnaClean DualXP FL1-0-02028 XP dual filter 35/42mm,,,https://www.wolseley.co.uk/wcsstore/ExtendedSitesCatalogAssetStore/images/products/AssetPush/wol-web-proof-medium-w/std.lang.all/80/43/NW-608043_wm.jpg,https://www.wolseley.co.uk/wcsstore/ExtendedSitesCatalogAssetStore/images/products/AssetPush/DTP_AssetPushHighRes/std.lang.all/ti/on/Adey_MagnaCleandualXP_Installation.pdf,,,,,,,,,,,,,,,,,,,,,,,,,,,,,,,
17,P333077,Worcester Bosch Greenstar system filter pack 28mm,Worcester Bosch,200.5,"Informed by installer feedback, the Worcester Bosch Greenstar 28mm system filter pack provides easier installation and simpler servicing compared to the brand's previous model.",Heating/Water Treatment Products/Central Heating Filters/Central Heating Filters.csv -> Worcester Bosch Greenstar system filter pack 28mm,,,https://www.wolseley.co.uk/wcsstore/ExtendedSitesCatalogAssetStore/images/products/AssetPush/wol-web-proof-medium-w/std.lang.all/30/77/NW-333077_wm.jpg,,,,Greenstar,N,333077 PK,System Filter Pack,N,Removable lid prevents over-tightening and damage to O-ring seal,Eliminates risk of leaks,Suitable for Central Heating Systems,Isolation valves can be activated using a 90° turn,Allows bi-directional flow,Install anywhere on return circulation pipework between last radiator and boiler,"Large, powerful internal magnet safeguards boiler and components",,,,,,,,,,,,,,,,,
18,P333150,Worcester Bosch Greenstar system filter only pack 22mm,Worcester Bosch,133.5,"Helping to improve installation and servicing for a faster, simpler job, the Worcester Bosch Greenstar 22mm system filter pack uses a powerful internal magnet to protect both a boiler and its associated heating system.",Heating/Water Treatment Products/Central Heating Filters/Central Heating Filters.csv -> Worcester Bosch Greenstar system filter only pack 22mm,,,https://www.wolseley.co.uk/wcsstore/ExtendedSitesCatalogAssetStore/images/products/AssetPush/wol-web-proof-medium-w/std.lang.all/lt/er/Worcester_System Filter_wm.jpg,,,,Greenstar,N,333150 PK,System Filter Only Pack,N,"Removable lid designed to prevent over-tightening and damage to O-ring seal, eliminating risk of leaks",Isolation valves are activated using a single 90° turn,Suitable for Heating Systems,Red and green indicators indicate when the filter is in operation,Engineered to allow bi-directional flow for installation anywhere along return circulation pipework between last radiator and boiler,"Large, powerful internal magnet safeguards the boiler and wider system components",,,,,,,Greenstar Ri ErP,Pump,Greenstar,,,,,,,,,
19,P610104,Adey MagnaClean Atom Magnaclean Atom Filter - Black,Adey,99.99,"This Adey MagnaClean Atom filter is designed to protect a central heating system against the potentially damaging effects of black iron oxide sludge. With an ultra-compact design, this filter can be installed in spaces previously unsuitable for a filter.",Heating/Water Treatment Products/Central Heating Filters/Central Heating Filters.csv -> Adey MagnaClean Atom Magnaclean Atom Filter - Black,,,https://www.wolseley.co.uk/wcsstore/ExtendedSitesCatalogAssetStore/images/products/AssetPush/wol-web-proof-medium-w/std.lang.all/01/04/NW-610104_wm.jpg,https://www.wolseley.co.uk/wcsstore/ExtendedSitesCatalogAssetStore/images/products/AssetPush/DTP_AssetPushHighRes/std.lang.all/hu/re/Adey_Domestic_Product_Range_Brochure.pdf,https://www.wolseley.co.uk/wcsstore/ExtendedSitesCatalogAssetStore/images/products/AssetPush/DTP_AssetPushHighRes/std.lang.all/ti/on/Adey_MagnaCleanAtom_Installation.pdf,,,,,,,,,,,,,,,,,,,,,,,,,,,,,,
20,P608001,Adey MagnaClean Professional filter 22mm Black,Adey,152.73,"An efficient magnetic filter, the Adey MagnaClean Professional 22mm filter is suitable for installation in any existing or new domestic central heating system. It removes almost all suspended black iron oxide and some non-magnetic debris for greater system efficiency.",Heating/Water Treatment Products/Central Heating Filters/Central Heating Filters.csv -> Adey MagnaClean Professional filter 22mm Black,,,https://www.wolseley.co.uk/wcsstore/ExtendedSitesCatalogAssetStore/images/products/AssetPush/wol-web-proof-medium-w/std.lang.all/80/01/NW-608001_wm.jpg,https://www.wolseley.co.uk/wcsstore/ExtendedSitesCatalogAssetStore/images/products/AssetPush/DTP_AssetPushHighRes/std.lang.all/hu/re/Adey_MagnaClean_Brochure.pdf,https://www.wolseley.co.uk/wcsstore/ExtendedSitesCatalogAssetStore/images/products/AssetPush/DTP_AssetPushHighRes/std.lang.all/ti/on/Adey_MCProfessional_Installation.pdf,,,,,,,,,,,,,,,,,,,,,,,,,,,,,,
21,P602531,Fernox TF1 Tf1 Compact Filter 22mm,Fernox,102.63,A high performance in-line system filter,Heating/Water Treatment Products/Central Heating Filters/Central Heating Filters.csv -> Fernox TF1 Tf1 Compact Filter 22mm,,,https://www.wolseley.co.uk/wcsstore/ExtendedSitesCatalogAssetStore/images/products/AssetPush/wol-web-proof-medium-w/std.lang.all/25/31/NW-602531_wm.jpg,https://www.wolseley.co.uk/wcsstore/ExtendedSitesCatalogAssetStore/images/products/AssetPush/DTP_AssetPushHighRes/std.lang.all/hu/re/Fernox_Brochure.pdf,https://www.wolseley.co.uk/wcsstore/ExtendedSitesCatalogAssetStore/images/products/AssetPush/DTP_AssetPushHighRes/std.lang.all/ic/al/Fernox_62131_Compactfilter_Technical.pdf,https://www.wolseley.co.uk/wcsstore/ExtendedSitesCatalogAssetStore/images/products/AssetPush/DTP_AssetPushHighRes/std.lang.all/ti/on/Fernox_TF1_Range_Installation.pdf,,,,,,,,,,,,,,,,,,,,,https://www.wolseley.co.uk/wcsstore/ExtendedSitesCatalogAssetStore/images/products/AssetPush/DTP_AssetPushHighRes/std.lang.all/fl/et/TF1 Range Installer Leaflet.pdf,,,,,,,,
22,P606204,Fernox TF1 filter with slip socket connections 22mm,Fernox,76.0,"Ideal for installation in even the most restricted spots, the Fernox TF1 22mm filter with slip socket connection is a compact, easy to fit filter unit for central heating systems. Removing both magnetic and non-magnetic debris, this robust nickel-plated brass filter uses hydronic particle separation for highly effective protection from damage. The sealed, inline TF1 is easy to maintain too, with no need to dismantle the unit or replace O-rings when it's time to service.",Heating/Water Treatment Products/Central Heating Filters/Central Heating Filters.csv -> Fernox TF1 filter with slip socket connections 22mm,,,https://www.wolseley.co.uk/wcsstore/ExtendedSitesCatalogAssetStore/images/products/AssetPush/wol-web-proof-medium-w/std.lang.all/89/55/NW-608955_wm.jpg,https://www.wolseley.co.uk/wcsstore/ExtendedSitesCatalogAssetStore/images/products/AssetPush/DTP_AssetPushHighRes/std.lang.all/hu/re/TF1_Omega_Filter_Brochure.pdf,https://www.wolseley.co.uk/wcsstore/ExtendedSitesCatalogAssetStore/images/products/AssetPush/DTP_AssetPushHighRes/std.lang.all/ic/al/Fernox_62248_Omegafilter_Technical.pdf,,,,,,,,,,,,,,,,,,,,,,,,,,,,,,
23,P608955,Fernox TF1 Omeg Tf1 Filter 22mm/Slipsocket Connct,Fernox,89.29,"Specifically designed for small or restricted access spaces, the Fernox TF1 Omega 22mm filter with slip socket connections is an easy to install sealed, in-line system filter. Manufactured from robust nickel-plated brass, this award-winning filter uses hydronic particle separation (HPS) technology along with magnetic filtration to remove both magnetic and-non magnetic debris from the central heating system. Offering simple cleaning, there's no need to dismantle the unit or replace O-rings during servicing.",Heating/Water Treatment Products/Central Heating Filters/Central Heating Filters.csv -> Fernox TF1 Omeg Tf1 Filter 22mm/Slipsocket Connct,,,https://www.wolseley.co.uk/wcsstore/ExtendedSitesCatalogAssetStore/images/products/AssetPush/wol-web-proof-medium-w/std.lang.all/89/55/NW-608955_wm.jpg,https://www.wolseley.co.uk/wcsstore/ExtendedSitesCatalogAssetStore/images/products/AssetPush/DTP_AssetPushHighRes/std.lang.all/hu/re/TF1_Omega_Filter_Brochure.pdf,https://www.wolseley.co.uk/wcsstore/ExtendedSitesCatalogAssetStore/images/products/AssetPush/DTP_AssetPushHighRes/std.lang.all/ic/al/Fernox_62248_Omegafilter_Technical.pdf,,,,,,,,,,,,,,,,,,,,,,,,,,,,,,
24,P609278,Adey MagnaClean Micro2 filter and chemical pack,Adey,129.14,"The Adey MagnaClean Micro2 filter and chemical pack contains Magnaclean Micro2 with two essential installation chemicals, the MC1 protector and MC3 cleaner make installing a new central heating system simple.",Heating/Water Treatment Products/Central Heating Filters/Central Heating Filters.csv -> Adey MagnaClean Micro2 filter and chemical pack,,MagnaClean Professional2 filter;MC1 protector;MC3 cleaner,https://www.wolseley.co.uk/wcsstore/ExtendedSitesCatalogAssetStore/images/products/AssetPush/wol-web-proof-medium-w/std.lang.all/92/78/NW-609278_wm.jpg,https://www.wolseley.co.uk/wcsstore/ExtendedSitesCatalogAssetStore/images/products/AssetPush/DTP_AssetPushHighRes/std.lang.all/hu/re/Adey_Domestic_Product_Range_Brochure.pdf,,,,,,,,,,,,,,,,,,,,,,,,,,,,,,,
