134,P670049,"Aspen Pumps Xtra quick positioning clip 1.1/8"" (Pack of 10)",Aspen Pumps,28.07,"Made of black nylon, these Aspen Pumps Xtra 1 1/8"" quick positioning clips can be fitted into standard unistrut channels with a simple twist. Ideal for smaller installations, these QPCs are suitable to be used both externally and internally, giving a neat, professional finish to any installation while the thickness of the pipe clip is manufactured to be equal to the wall thickness of an insulation in order to maintain the vapour barrier.","Refrigeration/Refrigeration Parts and Accessories/Accessories/Accessories.csv -> Aspen Pumps Xtra quick positioning clip 1.1/8"" (Pack of 10)",,,https://www.wolseley.co.uk/wcsstore/ExtendedSitesCatalogAssetStore/images/products/AssetPush/wol-web-proof-medium-w/std.lang.all/00/49/NW-670047_670049_wm.jpg,https://www.wolseley.co.uk/wcsstore/ExtendedSitesCatalogAssetStore/images/products/AssetPush/DTP_AssetPushHighRes/std.lang.all/te/ch/Aspen_Pumps_QPC_Tech.pdf,https://www.wolseley.co.uk/wcsstore/ExtendedSitesCatalogAssetStore/images/products/AssetPush/DTP_AssetPushHighRes/std.lang.all/og/ue/Aspen_Pumps_APG_Catalogue.pdf,,,,,,,,,,,,,,,,,,,,,,,,,,,,,,,,,,
135,P691592,Bluemay M12 washer faced nut for nylon rod,Bluemay,0.82,This Bluemay M12 washer faced nut is made of strong yet lightweight nylon.,Refrigeration/Refrigeration Parts and Accessories/Accessories/Accessories.csv -> Bluemay M12 washer faced nut for nylon rod,,,https://www.wolseley.co.uk/wcsstore/ExtendedSitesCatalogAssetStore/images/products/AssetPush/wol-web-proof-medium-w/std.lang.all/15/92/NW-691591_691592_wm.jpg,,,,N,NN6WFM12N,Washer Faced Nut,N,Lightweight thermoplastic construction,Strong design,Resistant to vibration,,,,Natural,M12,Nylon,,,,M12,14.2mm,n/a,,,,,,,,,,,,,,
136,P690671,"Javac SAE ball valves 1/4"" Red/Blue/Yellow (Pack of 3)",Javac,54.95,"This Javac ball valve set includes 1/4"" SAE connections.","Refrigeration/Refrigeration Parts and Accessories/Accessories/Accessories.csv -> Javac SAE ball valves 1/4"" Red/Blue/Yellow (Pack of 3)",,,https://www.wolseley.co.uk/wcsstore/ExtendedSitesCatalogAssetStore/images/products/AssetPush/wol-web-proof-medium-w/std.lang.all/06/71/NW-690671_wm.jpg,https://www.wolseley.co.uk/wcsstore/ExtendedSitesCatalogAssetStore/images/products/AssetPush/DTP_AssetPushHighRes/std.lang.all/te/ch/Javac_Ballvalve-Adaptor_Tech.pdf,,,,,,,,,,,,,,,,,,,,,,,,,,,,,,,,,,,
137,P686628,Aspen Pumps Smartlock elbow swage union 3/4,Aspen Pumps,212.64,"Doing away with the need for brazing or flaring, this Aspen Pumps Smartlock 3/4"" elbow swage union fits securely and quickly without complex tools or a hot works permit. Coming off the swage at a 90 angle, the ELSW fitting is ideal for tight corners meaning there's no need to buy both a swage union and an elbow union.",Refrigeration/Refrigeration Parts and Accessories/Accessories/Accessories.csv -> Aspen Pumps Smartlock elbow swage union 3/4,,,https://www.wolseley.co.uk/wcsstore/ExtendedSitesCatalogAssetStore/images/products/AssetPush/wol-web-proof-medium-w/std.lang.all/66/28/686628_wm.jpg,,,,N,ELSW3400,Elbow Swage Union,N,Connects swage valves to copper or aluminum tube,Allows for 90 angle straight from valve without brazing,Design pressure 1000 psig,Burst pressure 5100 psig,Temperature range of -40°C to 150°C,Suitable for copper and aluminium tubing,Red,Smartlock,Metal ferrule,Compatible with soft and hard copper tubes,No dissimilar metal corrosion issues,No brazing required,0.772(internal) 1.26(external),,,,,,,,,No need for a hot works permit,No flaring,No specialist tools required,Leak-free connection,No nitrogen purging or oxidation,,,
138,P690845,"Javac high pressure male auto coupler flared 1/4 """,Javac,66.95,"This Javac high pressure automotive coupler with 1/4"" flare male connection is compatible with R1234YF refrigerant.","Refrigeration/Refrigeration Parts and Accessories/Accessories/Accessories.csv -> Javac high pressure male auto coupler flared 1/4 """,,,https://www.wolseley.co.uk/wcsstore/ExtendedSitesCatalogAssetStore/images/products/AssetPush/wol-web-proof-medium-w/std.lang.all/08/45/NW-690845_wm.jpg,https://www.wolseley.co.uk/wcsstore/ExtendedSitesCatalogAssetStore/images/products/AssetPush/DTP_AssetPushHighRes/std.lang.all/20/21/Javac_Product_Guide_2021.pdf,,,,,,,,,,,,,,,,,,,,,,,,,,,,,,,,,,,
139,P667584,Aspen Pumps silent + mini white,Aspen Pumps,113.65,"Offering ease of installation and maintenance, the Aspen Pumps Silent+ Mini White can be fitted either side of the evaporator unit. Designed with an unclippable double insulated reservoir to eliminate condensation and ensure easy cleaning, the Silent+ Mini runs incredibly quietly for less disruption during operation.",Refrigeration/Refrigeration Parts and Accessories/Accessories/Accessories.csv -> Aspen Pumps silent + mini white,,,https://www.wolseley.co.uk/wcsstore/ExtendedSitesCatalogAssetStore/images/products/AssetPush/wol-web-proof-medium-w/std.lang.all/75/84/667584_wm.jpg,,,,N,FP3450,Condensate Removal Pump,N,Ultra quiet operation,"Offers fast, easy installation","Compact, discreet design",With removable reservoir,,,,,,,,,,,,,,,,,,,,,,,,,
140,P667666,Pump House Easy-Fit lightweight condensate collection tray 940 x 420mm,Pump House,82.92,"This Pump House Easy-Fit 420 x 940mm lightweight condensate collection tray is made of 100% rust-free, UV-stabilised, rigid and reinforced PVC and fits to any make of brackets. Weighing less than 1kg, this tray is much easier to handle than metal versions and has a tapered outlet to fit a 16mm or 18mm hose pipe.",Refrigeration/Refrigeration Parts and Accessories/Accessories/Accessories.csv -> Pump House Easy-Fit lightweight condensate collection tray 940 x 420mm,,,https://www.wolseley.co.uk/wcsstore/ExtendedSitesCatalogAssetStore/images/products/AssetPush/wol-web-proof-medium-w/std.lang.all/76/66/NW-667665_667666_wm.jpg,https://www.wolseley.co.uk/wcsstore/ExtendedSitesCatalogAssetStore/images/products/AssetPush/DTP_AssetPushHighRes/std.lang.all/hu/re/Pump_House_RAC_Brochure.pdf,https://www.wolseley.co.uk/wcsstore/ExtendedSitesCatalogAssetStore/images/products/AssetPush/DTP_AssetPushHighRes/std.lang.all/ic/al/Pump_House_Easy_Fit_Trays_Technical.pdf,,,,,,,,,,,,,,,,,,,,,,,,,,,,,,,,,,
141,P686635,Aspen Pumps Smartlock union straight 7/8,Aspen Pumps,158.72,"Doing away with the need for brazing or flaring, this Aspen Pumps Smartlock 7/8"" straight union connects copper or aluminium tubes of the same size securely and quickly without complex tools or a hot works permit.",Refrigeration/Refrigeration Parts and Accessories/Accessories/Accessories.csv -> Aspen Pumps Smartlock union straight 7/8,,,https://www.wolseley.co.uk/wcsstore/ExtendedSitesCatalogAssetStore/images/products/AssetPush/wol-web-proof-medium-w/std.lang.all/66/35/686635_wm.jpg,,,,N,UNST7800,Union Straight,N,Connects copper/aluminum tube to copper/aluminum tube of same size,Design pressure 960 psig,Burst pressure 4800 psig,Temperature range -40°C to 150°C,Suitable for copper and aluminium tubing,Compatible with soft and hard copper tubes,Red,Smartlock,Metal ferrule,No dissimilar metal corrosion issues,No brazing required,No need for a hot works permit,0.890(internal); 1.417(external),,,,,,,,,No flaring,No specialist tools required,Leak-free connection,No nitrogen purging or oxidation,,,,
142,P686620,Aspen Pumps Smartlock flare connector MLT angle 3/4,Aspen Pumps,97.39,"Doing away with the need for brazing or flaring, this Aspen Pumps Smartlock 13/4"" MLT angle flare connection connects copper or aluminium tubes to flare valves securely and quickly without complex tools or a hot works permit.",Refrigeration/Refrigeration Parts and Accessories/Accessories/Accessories.csv -> Aspen Pumps Smartlock flare connector MLT angle 3/4,,,https://www.wolseley.co.uk/wcsstore/ExtendedSitesCatalogAssetStore/images/products/AssetPush/wol-web-proof-medium-w/std.lang.all/66/20/686620_wm.jpg,,,,N,FCMA3400,Flare connector multi angle,N,For 45 and 37.5 degree flares OR any degree flare,Temperature range -40°C to 150°C,Design pressure 960 psig,Burst pressure 4800 psig,Suitable for copper and aluminium tubing,Compatible with soft and hard copper tubes,Red,Smartlock,Metal ferrule,No dissimilar metal corrosion issues,No brazing required,No need for a hot works permit,0.772 (internal); 1.260 (external),,,,,,,,,No flaring,No specialist tools required,Leak-free connection,No nitrogen purging or oxidation,,,,
143,P671571,Aspen Pumps Xtra clip stud M8 x 20mm (Pack of 10),Aspen Pumps,16.28,"Made of nylon, this Aspen Pumps Xtra 3/4"" stud clip, suitable for 8 or 10mm studding incorporates a unique ratchet design for fast, easy installation and adjustment.",Refrigeration/Refrigeration Parts and Accessories/Accessories/Accessories.csv -> Aspen Pumps Xtra clip stud M8 x 20mm (Pack of 10),,,https://www.wolseley.co.uk/wcsstore/ExtendedSitesCatalogAssetStore/images/products/AssetPush/wol-web-proof-medium-w/std.lang.all/15/72/NW-671571_671572_wm.jpg,https://www.wolseley.co.uk/wcsstore/ExtendedSitesCatalogAssetStore/images/products/AssetPush/DTP_AssetPushHighRes/std.lang.all/te/ch/Aspen_Pumps_Stud_Clip_Tech.pdf,https://www.wolseley.co.uk/wcsstore/ExtendedSitesCatalogAssetStore/images/products/AssetPush/DTP_AssetPushHighRes/std.lang.all/og/ue/Aspen_Pumps_APG_Catalogue.pdf,,,,,,,,,,,,,,,,,,,,,,,,,,,,,,,,,,
144,P667500,"Aspen Pumps Xtra plastic non return valve 3/8"" (Pack of 5)",Aspen Pumps,15.68,"Supplied in a pack of five, Aspen Pumps Xtra 10mm non-return valve in white plastic prevent the backflow of water.","Refrigeration/Refrigeration Parts and Accessories/Accessories/Accessories.csv -> Aspen Pumps Xtra plastic non return valve 3/8"" (Pack of 5)",,,https://www.wolseley.co.uk/wcsstore/ExtendedSitesCatalogAssetStore/images/products/AssetPush/wol-web-proof-medium-w/std.lang.all/75/01/NW-667500_667501_wm.jpg,https://www.wolseley.co.uk/wcsstore/ExtendedSitesCatalogAssetStore/images/products/AssetPush/DTP_AssetPushHighRes/std.lang.all/te/ch/Aspen_Pumps_Tube-Connector_Tech.pdf,https://www.wolseley.co.uk/wcsstore/ExtendedSitesCatalogAssetStore/images/products/AssetPush/DTP_AssetPushHighRes/std.lang.all/og/ue/Aspen_Pumps_APG_Catalogue.pdf,,,,,,,,,,,,,,,,,,,,,,,,,,,,,,,,,,
145,P692221,Virgo unit housing (No.1),Virgo,179.86,"Made of fibreglass, this Virgo GRP 660 x 762 x 610mm hermetic condensing unit housing is ideal for the weatherproofing of refrigeration condensing units.",Refrigeration/Refrigeration Parts and Accessories/Accessories/Accessories.csv -> Virgo unit housing (No.1),,,https://www.wolseley.co.uk/wcsstore/ExtendedSitesCatalogAssetStore/images/products/AssetPush/wol-web-proof-medium-w/std.lang.all/22/21/692221_wm.jpg,,,,N,NO.1,Housing,N,Virgo 0.1 type,Suitable for weatherproofing of refrigeration condensing units,,,,,White,,Fibreglass,,,,,,,,,,,,,,,,,,762,,
146,P693344,Aspen Pumps SpeediDuct WC-105 duct wall cover White,Aspen Pumps,23.28,This Aspen SpeediDuct WC-105 105mm duct wall cover is made of rigid UV stabilised uPVC in white.,Refrigeration/Refrigeration Parts and Accessories/Accessories/Accessories.csv -> Aspen Pumps SpeediDuct WC-105 duct wall cover White,,,https://www.wolseley.co.uk/wcsstore/ExtendedSitesCatalogAssetStore/images/products/AssetPush/wol-web-proof-medium-w/std.lang.all/33/44/NW-693344_wm.jpg,https://www.wolseley.co.uk/wcsstore/ExtendedSitesCatalogAssetStore/images/products/AssetPush/DTP_AssetPushHighRes/std.lang.all/ic/al/AP_SpeediDuct_Trunking_Technical.pdf,https://www.wolseley.co.uk/wcsstore/ExtendedSitesCatalogAssetStore/images/products/AssetPush/DTP_AssetPushHighRes/std.lang.all/e_/uk/AP_Xtra_BigFoot_Catalogue_UK.pdf,,,,,,,,,,,,,,,,,,,,,,,,,,,,,,,,,,
147,P688673,Pump House Diversitech Products SCM-5 grip cut 38mm x 4.6mtr,Pump House,15.25,"Suitable for by-hand use or for use with portable tools, this Pump House SCM-5 open mesh sand screen grip cut cloth with aluminium oxide bonding is an effective choice for soft materials likely to cause clogging issues. Measuring 38mm x 4.6M, this grip cut cloth is 100% waterproof.",Refrigeration/Refrigeration Parts and Accessories/Accessories/Accessories.csv -> Pump House Diversitech Products SCM-5 grip cut 38mm x 4.6mtr,,,https://www.wolseley.co.uk/wcsstore/ExtendedSitesCatalogAssetStore/images/products/AssetPush/wol-web-proof-medium-w/std.lang.all/86/73/NW-688673_wm.jpg,https://www.wolseley.co.uk/wcsstore/ExtendedSitesCatalogAssetStore/images/products/AssetPush/DTP_AssetPushHighRes/std.lang.all/20/16/Pump_House_Catalogue_2016.pdf,,,,,,,,,,,,,,,,,,,,,,,,,,,,,,,,,,,
148,P685037,Aspen Pumps Xtra elbow connector (for tube 6mm) (Pack of 5),Aspen Pumps,27.3,A pack of Aspen Pumps Xtra 6mm elbow connectors in black.,Refrigeration/Refrigeration Parts and Accessories/Accessories/Accessories.csv -> Aspen Pumps Xtra elbow connector (for tube 6mm) (Pack of 5),,,https://www.wolseley.co.uk/wcsstore/ExtendedSitesCatalogAssetStore/images/products/AssetPush/wol-web-proof-medium-w/std.lang.all/50/37/NW-685037_wm.jpg,https://www.wolseley.co.uk/wcsstore/ExtendedSitesCatalogAssetStore/images/products/AssetPush/DTP_AssetPushHighRes/std.lang.all/ic/al/AP_Xtra_Fittings_Technical.pdf,https://www.wolseley.co.uk/wcsstore/ExtendedSitesCatalogAssetStore/images/products/AssetPush/DTP_AssetPushHighRes/std.lang.all/e_/uk/AP_Xtra_BigFoot_Catalogue_UK.pdf,,,,,,,,,,,,,,,,,,,,,,,,,,,,,,,,,,
149,P670042,"Aspen Pumps Xtra quick positioning clip 1/2"" (Pack of 10)",Aspen Pumps,25.07,"Made of black nylon, these Aspen Pumps Xtra 1/2"" quick positioning clips can be fitted into standard unistrut channels with a simple twist. Ideal for smaller installations, these QPCs are suitable to be used both externally and internally, giving a neat, professional finish to any installation while the thickness of the pipe clip is manufactured to be equal to the wall thickness of an insulation in order to maintain the vapour barrier.","Refrigeration/Refrigeration Parts and Accessories/Accessories/Accessories.csv -> Aspen Pumps Xtra quick positioning clip 1/2"" (Pack of 10)",,,https://www.wolseley.co.uk/wcsstore/ExtendedSitesCatalogAssetStore/images/products/AssetPush/wol-web-proof-medium-w/std.lang.all/00/45/NW-670042_670045_wm.jpg,https://www.wolseley.co.uk/wcsstore/ExtendedSitesCatalogAssetStore/images/products/AssetPush/DTP_AssetPushHighRes/std.lang.all/te/ch/Aspen_Pumps_QPC_Tech.pdf,https://www.wolseley.co.uk/wcsstore/ExtendedSitesCatalogAssetStore/images/products/AssetPush/DTP_AssetPushHighRes/std.lang.all/og/ue/Aspen_Pumps_APG_Catalogue.pdf,,,,,,,,,,,,,,,,,,,,,,,,,,,,,,,,,,
150,P675873,Aspen Pumps Condenser Support Bracket wall mount support bracket 250kg,Aspen Pumps,106.48,"Constructed in tough galvanised steel, this Aspen Pumps 250kg condenser support bracket is designed for reliable wall mounting of a pump unit. Supplied with all fittings, this bracket includes an inbuilt spirit level to ensure straight and true installation.",Refrigeration/Refrigeration Parts and Accessories/Accessories/Accessories.csv -> Aspen Pumps Condenser Support Bracket wall mount support bracket 250kg,,,https://www.wolseley.co.uk/wcsstore/ExtendedSitesCatalogAssetStore/images/products/AssetPush/wol-web-proof-medium-w/std.lang.all/58/73/675873_wm.jpg,,,,N,B2093,Wall Support Bracket,N,Integrated spirit level provided (not B2093),Adjustable unit fixing feet positions (not B2093),With pre-assembled arms,Supplied with arm levelling fixing bolt,Wall fixing kit included,With unit fixing feet kit,White / Steel,Condenser Support Bracket,Polyester powder coated galvanised steel construction,Manufactured in galvanised steel,White polyester powder-coated finish (approx 100m thickness),M8 8.8 zinc passivated carbon steel high strength fixings included,,,,,,,,,,,,,,,,,
151,P693426,Danfoss SGP SGP16N sight glass male 36mm,Danfoss,49.1,"Made of brass, this Danfoss SGP16N sight glass with 5/8"" flare connections is for installation after the filter drier in the liquid line of a refrigerating system and in the compressor, using socket type. The sight glass allows users to observe property changes in liquid or vapour refrigerant and uses colour to indicate moisture level.",Refrigeration/Refrigeration Parts and Accessories/Accessories/Accessories.csv -> Danfoss SGP SGP16N sight glass male 36mm,,,https://www.wolseley.co.uk/wcsstore/ExtendedSitesCatalogAssetStore/images/products/AssetPush/wol-web-proof-medium-w/std.lang.all/34/26/NW-693423_693426_wm.jpg,https://www.wolseley.co.uk/wcsstore/ExtendedSitesCatalogAssetStore/images/products/AssetPush/DTP_AssetPushHighRes/std.lang.all/ic/al/Danfoss_SG-SGP_Technical.pdf,https://www.wolseley.co.uk/wcsstore/ExtendedSitesCatalogAssetStore/images/products/AssetPush/DTP_AssetPushHighRes/std.lang.all/ui/de/Danfoss_SG-SGP_Installation_Guide.pdf,https://www.wolseley.co.uk/wcsstore/ExtendedSitesCatalogAssetStore/images/products/AssetPush/DTP_AssetPushHighRes/std.lang.all/ca/te/Danfoss_SG-SGP_Safety_Certificate.pdf,,,,,,,,,,,,,,,,,,,,,,,,,,,,,,,,,
152,P670043,"Aspen Pumps Xtra quick positioning clip 1/4"" (Pack of 10)",Aspen Pumps,23.6,"Made of black nylon, these Aspen Pumps Xtra 1/4"" quick positioning clips can be fitted into standard unistrut channels with a simple twist. Ideal for smaller installations, these QPCs are suitable to be used both externally and internally, giving a neat, professional finish to any installation while the thickness of the pipe clip is manufactured to be equal to the wall thickness of an insulation in order to maintain the vapour barrier.","Refrigeration/Refrigeration Parts and Accessories/Accessories/Accessories.csv -> Aspen Pumps Xtra quick positioning clip 1/4"" (Pack of 10)",,,https://www.wolseley.co.uk/wcsstore/ExtendedSitesCatalogAssetStore/images/products/AssetPush/wol-web-proof-medium-w/std.lang.all/00/45/NW-670042_670045_wm.jpg,https://www.wolseley.co.uk/wcsstore/ExtendedSitesCatalogAssetStore/images/products/AssetPush/DTP_AssetPushHighRes/std.lang.all/te/ch/Aspen_Pumps_QPC_Tech.pdf,https://www.wolseley.co.uk/wcsstore/ExtendedSitesCatalogAssetStore/images/products/AssetPush/DTP_AssetPushHighRes/std.lang.all/og/ue/Aspen_Pumps_APG_Catalogue.pdf,,,,,,,,,,,,,,,,,,,,,,,,,,,,,,,,,,
153,P690844,"Javac low pressure male auto coupler 1/4 "" flared",Javac,66.95,"This Javac low pressure automotive coupler with 1/4"" flare male connection is compatible with R1234YF refrigerant.","Refrigeration/Refrigeration Parts and Accessories/Accessories/Accessories.csv -> Javac low pressure male auto coupler 1/4 "" flared",,,https://www.wolseley.co.uk/wcsstore/ExtendedSitesCatalogAssetStore/images/products/AssetPush/wol-web-proof-medium-w/std.lang.all/08/44/NW-690844_wm.jpg,https://www.wolseley.co.uk/wcsstore/ExtendedSitesCatalogAssetStore/images/products/AssetPush/DTP_AssetPushHighRes/std.lang.all/20/21/Javac_Product_Guide_2021.pdf,,,,,,,,,,,,,,,,,,,,,,,,,,,,,,,,,,,
154,P695444,Pump House Klo-Shure insulation wall clamp 2-1/8 inner diameter 1,Pump House,21.66,"There's no need to double-wrap, glue and tape insulation onto strut-mounted clamps with the Pump House Klo-Shure  2 1/8"" diameter insulation wall clamp. A patented solution designed to reduce installation time and improve the appearance of your insulation, Klo-Shure secures closed-cell insulation at fixing points without the need for additional accessories.",Refrigeration/Refrigeration Parts and Accessories/Accessories/Accessories.csv -> Pump House Klo-Shure insulation wall clamp 2-1/8 inner diameter 1,,,https://www.wolseley.co.uk/wcsstore/ExtendedSitesCatalogAssetStore/images/products/AssetPush/wol-web-proof-medium-w/std.lang.all/54/12/695412_wm.jpg,https://www.wolseley.co.uk/wcsstore/ExtendedSitesCatalogAssetStore/images/products/AssetPush/DTP_AssetPushHighRes/std.lang.all/wi/ng/Pumphouse_Klo-Shure_LineDrawing.pdf,https://www.wolseley.co.uk/wcsstore/ExtendedSitesCatalogAssetStore/images/products/AssetPush/DTP_AssetPushHighRes/std.lang.all/he/et/Kloshure_Series_7DataSheet.pdf,https://www.wolseley.co.uk/wcsstore/ExtendedSitesCatalogAssetStore/images/products/AssetPush/DTP_AssetPushHighRes/std.lang.all/ti/on/Pumphouse_Klo-Shure_Instalation.pdf,,,,,,,,,,,,,,,,,,,,,,,https://www.wolseley.co.uk/wcsstore/ExtendedSitesCatalogAssetStore/images/products/AssetPush/DTP_AssetPushHighRes/std.lang.all/hu/re/KloShure_Brochure.pdf,,,,,,,,,,
155,P617118,"Javac Edge quick tube bender 3/8""",Javac,73.49,"With its unique dual hinge design, the Javac Edge 3/8"" OD quick tube bender allows for the reset of its handle position to provide additional leverage, making the second bend to 180° as simple as possible. This bender includes handles with an ergonomic design for comfortable and slip-free use.","Refrigeration/Refrigeration Parts and Accessories/Accessories/Accessories.csv -> Javac Edge quick tube bender 3/8""",,,https://www.wolseley.co.uk/wcsstore/ExtendedSitesCatalogAssetStore/images/products/AssetPush/wol-web-proof-medium-w/std.lang.all/71/22/NW-617118_617122_wm.jpg,https://www.wolseley.co.uk/wcsstore/ExtendedSitesCatalogAssetStore/images/products/AssetPush/DTP_AssetPushHighRes/std.lang.all/io/ns/Javac_Tube-Benders_Instructions.pdf,https://www.wolseley.co.uk/wcsstore/ExtendedSitesCatalogAssetStore/images/products/AssetPush/DTP_AssetPushHighRes/std.lang.all/20/21/Javac_Product_Guide_2021.pdf,,,,,,,,,,,,,,,,,,,,,,,,,,,,,,,,,,
156,P668193,Pump House Type 2 type-2 load condensing unit bracket 600kg,Pump House,52.29,"This Pump House Type 2 small steel bracket offers a 60kg safe working load. This flat-packed, self assembly bracket gives a professional finish to any installation of wall-mounted outdoor condensing units and air source heat pumps, with a crossbar for precise upright spacing and wall spacers to help level the unit on uneven walls. All components have a scratch-resistant, textured powder-coating finish designed to match in with most brands of condensing units and domestic air source heat pumps.",Refrigeration/Refrigeration Parts and Accessories/Accessories/Accessories.csv -> Pump House Type 2 type-2 load condensing unit bracket 600kg,,,https://www.wolseley.co.uk/wcsstore/ExtendedSitesCatalogAssetStore/images/products/AssetPush/wol-web-proof-medium-w/std.lang.all/81/93/NW-668193_wm.jpg,https://www.wolseley.co.uk/wcsstore/ExtendedSitesCatalogAssetStore/images/products/AssetPush/DTP_AssetPushHighRes/std.lang.all/ti/on/Pump_House_Type_2_CBR2_Installation.pdf,https://www.wolseley.co.uk/wcsstore/ExtendedSitesCatalogAssetStore/images/products/AssetPush/DTP_AssetPushHighRes/std.lang.all/wi/ng/Pump_House_Type_2_Brackets_Drawing.pdf,https://www.wolseley.co.uk/wcsstore/ExtendedSitesCatalogAssetStore/images/products/AssetPush/DTP_AssetPushHighRes/std.lang.all/ic/al/Pump_House_Type_2_Brackets_Technical.pdf,,,,,,,,,,,,,,,,,,,,,,,,,,,,,,,,,
157,P670048,"Aspen Pumps Xtra quick positioning clip 7/8"" (Pack of 10)",Aspen Pumps,27.26,"Made of black nylon, these Aspen Pumps Xtra 7/8"" quick positioning clips can be fitted into standard unistrut channels with a simple twist. Ideal for smaller installations, these QPCs are suitable to be used both externally and internally, giving a neat, professional finish to any installation while the thickness of the pipe clip is manufactured to be equal to the wall thickness of an insulation in order to maintain the vapour barrier.","Refrigeration/Refrigeration Parts and Accessories/Accessories/Accessories.csv -> Aspen Pumps Xtra quick positioning clip 7/8"" (Pack of 10)",,,https://www.wolseley.co.uk/wcsstore/ExtendedSitesCatalogAssetStore/images/products/AssetPush/wol-web-proof-medium-w/std.lang.all/00/49/NW-670047_670049_wm.jpg,https://www.wolseley.co.uk/wcsstore/ExtendedSitesCatalogAssetStore/images/products/AssetPush/DTP_AssetPushHighRes/std.lang.all/te/ch/Aspen_Pumps_QPC_Tech.pdf,https://www.wolseley.co.uk/wcsstore/ExtendedSitesCatalogAssetStore/images/products/AssetPush/DTP_AssetPushHighRes/std.lang.all/og/ue/Aspen_Pumps_APG_Catalogue.pdf,,,,,,,,,,,,,,,,,,,,,,,,,,,,,,,,,,
158,P670047,"Aspen Pumps Xtra quick positioning clip 5/8"" (Pack of 10)",Aspen Pumps,25.63,"Made of black nylon, these Aspen Pumps Xtra 5/8"" quick positioning clips can be fitted into standard unistrut channels with a simple twist. Ideal for smaller installations, these QPCs are suitable to be used both externally and internally, giving a neat, professional finish to any installation while the thickness of the pipe clip is manufactured to be equal to the wall thickness of an insulation in order to maintain the vapour barrier.","Refrigeration/Refrigeration Parts and Accessories/Accessories/Accessories.csv -> Aspen Pumps Xtra quick positioning clip 5/8"" (Pack of 10)",,,https://www.wolseley.co.uk/wcsstore/ExtendedSitesCatalogAssetStore/images/products/AssetPush/wol-web-proof-medium-w/std.lang.all/00/49/NW-670047_670049_wm.jpg,https://www.wolseley.co.uk/wcsstore/ExtendedSitesCatalogAssetStore/images/products/AssetPush/DTP_AssetPushHighRes/std.lang.all/te/ch/Aspen_Pumps_QPC_Tech.pdf,https://www.wolseley.co.uk/wcsstore/ExtendedSitesCatalogAssetStore/images/products/AssetPush/DTP_AssetPushHighRes/std.lang.all/og/ue/Aspen_Pumps_APG_Catalogue.pdf,,,,,,,,,,,,,,,,,,,,,,,,,,,,,,,,,,
