239,P633015,Worcester Bosch Solar-Lifestyle plain tile roof hook set,Worcester Bosch,96.32,"Easy, fast and safe to install, this Worcester Bosch Solar-Lifestyle roof hook set is a main roof kit part for the installation of a solar thermal system.",Renewables/Renewables.csv -> Worcester Bosch Solar-Lifestyle plain tile roof hook set,,,https://www.wolseley.co.uk/wcsstore/ExtendedSitesCatalogAssetStore/images/products/AssetPush/wol-web-proof-medium-w/std.lang.all/30/15/633015_wm.jpg,,,,,,,,,,,,,,,,,,,,,https://www.wolseley.co.uk/wcsstore/ExtendedSitesCatalogAssetStore/images/products/AssetPush/DTP_AssetPushHighRes/std.lang.all/ic/al/Worcester_Solar_Thermal_Technical.pdf,https://www.wolseley.co.uk/wcsstore/ExtendedSitesCatalogAssetStore/images/products/AssetPush/DTP_AssetPushHighRes/std.lang.all/20/15/Worcester_Product_Guide_2015.pdf,,,https://www.wolseley.co.uk/wcsstore/ExtendedSitesCatalogAssetStore/images/products/AssetPush/DTP_AssetPushHighRes/std.lang.all/ic/al/Worcester_Solar Thermal_Technical.pdf,https://www.wolseley.co.uk/wcsstore/ExtendedSitesCatalogAssetStore/images/products/AssetPush/DTP_AssetPushHighRes/std.lang.all/hu/re/Worcester_Renewable_Brochure.pdf,,,,,,,,,,,,,,,,,,,,,,,,,,,,
240,P633041,Worcester Bosch Solar-Lito solar fluid 20ltr,Worcester Bosch,153.86,This 20L bottle of Worcester Bosch Solar-Lito glycol fluid is for use in the brand's solar appliances,Renewables/Renewables.csv -> Worcester Bosch Solar-Lito solar fluid 20ltr,,,https://www.wolseley.co.uk/wcsstore/ExtendedSitesCatalogAssetStore/images/products/AssetPush/wol-web-proof-medium-w/std.lang.all/30/41/633040_633041_wm.jpg,,,,,,,,,,,,,,,,,,,,,https://www.wolseley.co.uk/wcsstore/ExtendedSitesCatalogAssetStore/images/products/AssetPush/DTP_AssetPushHighRes/std.lang.all/ic/al/Worcester_Solar_Thermal_Technical.pdf,https://www.wolseley.co.uk/wcsstore/ExtendedSitesCatalogAssetStore/images/products/AssetPush/DTP_AssetPushHighRes/std.lang.all/20/15/Worcester_Product_Guide_2015.pdf,,,https://www.wolseley.co.uk/wcsstore/ExtendedSitesCatalogAssetStore/images/products/AssetPush/DTP_AssetPushHighRes/std.lang.all/ic/al/Worcester_Solar Thermal_Technical.pdf,https://www.wolseley.co.uk/wcsstore/ExtendedSitesCatalogAssetStore/images/products/AssetPush/DTP_AssetPushHighRes/std.lang.all/hu/re/Worcester_Renewable_Brochure.pdf,,,,,,,,,,,,,,,,,,,,,,,,,,,,
241,P694131,Daikin Altherma EDLA08EV3 Low Temperature Small Monobloc - Heating Only 8KW,Daikin,3859.47,"Suitable for heating only use, the Daikin Altherma 8kW low temperature air-to-water monobloc has a compact, single package design that is ideal for installation in properties where indoor space is limited. In addition to supplying heat, the Altherma can be adapted to provide domestic hot water.",Renewables/Renewables.csv -> Daikin Altherma EDLA08EV3 Low Temperature Small Monobloc - Heating Only 8KW,,,https://www.wolseley.co.uk/wcsstore/ExtendedSitesCatalogAssetStore/images/products/AssetPush/wol-web-proof-medium-w/std.lang.all/41/31/694131_wm.jpg,Altherma,230 +/-10%,,88.0,N,62.0,8 kW,362,Floor,Hermetically sealed swing compressor,EDLA08EV3,Low Temperature Small Monobloc,N,Monobloc all-in-one concept including hydraulic parts,WLAN cartridge included,Can be combined with domestic hot water,Energy efficient,Heat only based on air-to-water heat pump technology,Separate back-up heater kit,,,,,,,,,,,,,,,,,,,,,,,,,,,,,,,,,,,
242,P694130,Daikin Altherma EDLA06EV3 Low Temperature Small Monobloc - Heating Only 6KW,Daikin,3699.14,"Suitable for heating only use, the Daikin Altherma 6kW low temperature air-to-water monobloc has a compact, single package design that is ideal for installation in properties where indoor space is limited. In addition to supplying heat, the Altherma can be adapted to provide domestic hot water.",Renewables/Renewables.csv -> Daikin Altherma EDLA06EV3 Low Temperature Small Monobloc - Heating Only 6KW,,,https://www.wolseley.co.uk/wcsstore/ExtendedSitesCatalogAssetStore/images/products/AssetPush/wol-web-proof-medium-w/std.lang.all/41/30/694130_wm.jpg,Altherma,230 +/-10%,,88.0,N,600,6 kW,362,Floor,Hermetically sealed swing compressor,EDLA06EV3,Low Temperature Small Monobloc,N,Monobloc all-in-one concept including hydraulic parts,WLAN cartridge included,Can be combined with domestic hot water,Energy efficient,Heat only based on air-to-water heat pump technology,Separate back-up heater kit,,,,,,,,,,,,,,,,,,,,,,,,,,,,,,,,,,,
243,P276284,Stelrad Compact K3 K3 radiator 600 x 1400mm,Stelrad,306.94,"A popular choice for installation in just about any room, the Stelrad Compact K3 triple panel triple convector radiator is perfectly designed for those domestic or commercial projects where space is limited. Designed to combine smart style with reliability, this 1400 x 600mm radiator offers excellent efficiency, thanks in large part to the precision-welding of the convector onto the waterways. Every Compact is designed with flexible connection options for ease of siting, while robust packaging that remains in place until fitting is complete makes the engineer's job even easier, limiting the risk of damage during transport and installation.",Renewables/Renewables.csv -> Stelrad Compact K3 K3 radiator 600 x 1400mm,,,https://www.wolseley.co.uk/wcsstore/ExtendedSitesCatalogAssetStore/images/products/AssetPush/wol-web-proof-medium-w/std.lang.all/63/00/NW-276269_276300_wm.jpg,,,,,,,,,,,,,,,,,,,,,https://www.wolseley.co.uk/wcsstore/ExtendedSitesCatalogAssetStore/images/products/AssetPush/DTP_AssetPushHighRes/std.lang.all/bo/ok/Stelrad_Specification_Radiator_Book.pdf,https://www.wolseley.co.uk/wcsstore/ExtendedSitesCatalogAssetStore/images/products/AssetPush/DTP_AssetPushHighRes/std.lang.all/20/19/Stelrad_Radiator_Book_Jan_2019.pdf,,,https://www.wolseley.co.uk/wcsstore/ExtendedSitesCatalogAssetStore/images/products/AssetPush/DTP_AssetPushHighRes/std.lang.all/ic/al/Stelrad_Compact_K3_Technical.pdf,,,,,,,,,,,,,,,,,,,,,,,,,,,,,
244,P175023,UK Cylinders Prolite WPHPD3150 Heat Pump Cylinder 150 ltr,UK Cylinders,893.18,"Offering high levels of performance, this UK Cylinders Prolite 150L capacity heat pump indirect cylinder incorporates a full bore coil for high flow and high gain. Made of tough duplex stainless steel, it is lagged using environmentally friendly 50mm insulation to help minimise heat loss.",Renewables/Renewables.csv -> UK Cylinders Prolite WPHPD3150 Heat Pump Cylinder 150 ltr,,Heat Pump cylinder;unvented components to comply with G3 regulations,https://www.wolseley.co.uk/wcsstore/ExtendedSitesCatalogAssetStore/images/products/AssetPush/wol-web-proof-medium-w/std.lang.all/3_/27/175023_27_wm.jpg,ProLite,230,Cylinder has a 25 year warranty against manufacturing defect and 2 years with supplied components.,37Kg,N,,,,,,WPHPD3150,,N,For domestic use,Duplex stainless steel construction,Silver colour,22mm compression fittings,Includes 50mm CFC and HCFC-free insulation,25 year warranty against manufacturing defects,2 year warranty on supplied components,,,150 l,,,,Silver,,,,,Duplex Stainless Steel,,,,,,,,,545mm,,,,22mm compression fittings,3 bar,Yes,Indirect,50mm CFC and HCFC free insulation,Domestic,,,,
245,P243615,Stelrad Vita Compact K3 K3 radiator 600 x 1000mm,Stelrad,177.16,"Ideal for installation in low energy heating systems, the 600 x 1000mm Stelrad Vita Compact K3 rectangular radiator is designed with three panels and three fins. This layout makes the most of the heat output from a renewable system, allowing the user to enjoy generous and reliable 8151 BTU/h heat. Made of a powder-coated steel finished in glossy Traffic White, the Vita Compact is suitable for wall or floor mounting and has a BOE connection for installation flexibility, even in small or awkward spaces.",Renewables/Renewables.csv -> Stelrad Vita Compact K3 K3 radiator 600 x 1000mm,,Compact radiator;Fixing brackets;Vents ;plugs,https://www.wolseley.co.uk/wcsstore/ExtendedSitesCatalogAssetStore/images/products/AssetPush/wol-web-proof-medium-w/std.lang.all/36/18/243609_243618_wm.jpg,,,,,,,,,,,,,,,,,,,,,https://www.wolseley.co.uk/wcsstore/ExtendedSitesCatalogAssetStore/images/products/AssetPush/DTP_AssetPushHighRes/std.lang.all/20/20/Stelrad_Vita_Series_Brochure_2020.pdf,https://www.wolseley.co.uk/wcsstore/ExtendedSitesCatalogAssetStore/images/products/AssetPush/DTP_AssetPushHighRes/std.lang.all/ic/al/Stelrad_Vita_Compact_K3_Technical.pdf,,,,,,,,,,,,,,,,,,,,,,,,,,,,,,,,
246,P490591,Bosch CS AW 5800i Heat Pump 4kW Outdoor Unit,Bosch,3419.0,"Operating on environmentally sound R290 refrigerant, the Bosch Compress AW 5800i 4kW monobloc outdoor heat pump unit holds an ErP A+++ rating for heating at 35°C and an A rating for hot water delivery, helping homeowners to save on costs while reducing their carbon footprints. Suitable for installation in new build and renovation projects, this quiet heat pump unit is simple to install as well as being easy to use and effortless to maintain.",Renewables/Renewables.csv -> Bosch CS AW 5800i Heat Pump 4kW Outdoor Unit,,,https://www.wolseley.co.uk/wcsstore/ExtendedSitesCatalogAssetStore/images/products/AssetPush/wol-web-proof-medium-w/std.lang.all/05/91/490591_wm.jpg,CS AW,230,257,143Kg,N,31,5 kW,540,Free standing,Rotary,8738213464,Air to Water Heat Pump,N,High flow for hot water comfort,Futureproof design,Uses environmentally friendly R290 refrigerant,Rotary-type compressor,Freestanding installation for flexibility,"2, 5 and 7 year warranties available",,,,,,,,,,,,,,,,,,,,,,,,,,,,,,,,,,,
247,P619521,MITS 150L MONO PP CYL SLIM SMALL 22MM,Mitsubishi,2893.48,"An efficient unit featuring a high capacity coil heat exchanger, the pre-plumbed Mitsubishi Ecodan 150L mono slimline cylinder is part of a versatile range designed to meet the needs of a wide variety of hot water applications. These adaptable MELCloud enabled cylinders offer fast heat-up times, thanks to their integral plate heat exchangers, and are suitable for integration with the brand's monobloc air source heat pumps, helping to reduce a system's carbon footprint.",Renewables/Renewables.csv -> MITS 150L MONO PP CYL SLIM SMALL 22MM,,,https://www.wolseley.co.uk/wcsstore/ExtendedSitesCatalogAssetStore/images/products/AssetPush/wol-web-proof-medium-w/std.lang.all/95/21/619521_wm.jpg,,220 - 240,3 Years,59 kg,N,,,,,,607774,Cylinder,N,Plug-and-play installation,Unvented,"For efficient, rapid heating",With premium insulation,Flexible 2-zone space heating control,MELCloud enabled,3 year warranty,,,150 l,,,,,,,,,,,,,,,,,,,,,,,,,,,,,,,
248,P613547,Diversitech SpeediChannel 230-D3W duct 2 M 70 mm White,Diversitech,16.66,"Measuring 6 1/2ft in length, this DiversiTech SpeediChannel 230-D3W 70mm lineset cover channel is supplied with a pack of SpeediClips for ease of fitting.",Renewables/Renewables.csv -> Diversitech SpeediChannel 230-D3W duct 2 M 70 mm White,,,https://www.wolseley.co.uk/wcsstore/ExtendedSitesCatalogAssetStore/images/products/AssetPush/wol-web-proof-medium-w/std.lang.all/35/47/613547_wm.jpg,SpeediChannel,,,,N,,,,,,230-D3W,,N,PVC construction,UV-resistant to resist fading and damage,Paintable finish,SpeediClip slides into place on railing moulding into interior of Speedichannel,Suitable for one person installation,,,,,,,,,,,,,,,,,,,,,,,,,,,,,,,,,,,,
249,P648514,JA Solar 445W PV Dbl Glass Bifacial LB Traceable,JA Solar,95.4,TBC,Renewables/Renewables.csv -> JA Solar 445W PV Dbl Glass Bifacial LB Traceable,,,https://www.wolseley.co.uk/wcsstore/ExtendedSitesCatalogAssetStore/images/products/AssetPush/wol-web-proof-medium-w/std.lang.all/85/14/648514_wm.jpg,,,,22,N,,,,,,25490,,N,JA Solar Integrated Traceable System,25 year product warranty,30 year linear power output warranty,,,,,,,,,,,,,,,,,,,,,,,,,,,,,,,,,,,,1.99,,
250,P619179,ECODAN 210L VERSATILE STANDARD CYL,Mitsubishi,2353.93,"An efficient unit featuring a high capacity coil heat exchanger, the pre-plumbed Mitsubishi Ecodan 210L standard cylinder is part of a versatile range designed to meet the needs of a wide variety of hot water applications. These adaptable MELCloud enabled cylinders offer fast heat-up times, thanks to their integral plate heat exchangers, and are suitable for integration with the brand's monobloc air source heat pumps, helping to reduce a system's carbon footprint.",Renewables/Renewables.csv -> ECODAN 210L VERSATILE STANDARD CYL,,,https://www.wolseley.co.uk/wcsstore/ExtendedSitesCatalogAssetStore/images/products/AssetPush/wol-web-proof-medium-w/std.lang.all/91/79/619179_wm.jpg,Ecodan,220 - 240,3 Years,53 kg,N,,,,,,678157,Cylinder,N,Plug-and-play installation,Unvented,"For efficient, rapid heating",With premium insulation,Flexible 2-zone space heating control,MELCloud enabled,3 year warranty,,,210 l,,,,,,,,,,,,,,,,,,,,,,,,,,,,,,,
251,PT21878,Panasonic Aquarea WH-MDC09J3E5 mono-bloc air source heat pump R32 9kW,Panasonic,3693.3,"Supplying hot water at 55°C, the high performance Panasonic Aquarea WH-MDC09J3E5 9kW air source heat pump is designed to deliver in the UK's always varied climate, working at outdoor temperatures right down to -20°C with constant full capacity at external temperatures down to -7°C. Designed for outdoor installation, this single unit supplies water for cooling, heating and for domestic hot water storage and can be used in new builds or for renovation projects in any property. Ideal for homes with low temperature radiators or underfloor heating, the high performance Aquarea heat pump is suitable for use as a standalone unit or for use alongside an existing gas or oil heating system. Smart grid-ready for compatibility with PV or solar, and suitable for connection to a thermostat for complete control, the Aquarea heat pump provides homeowners with a variety of solutions for improved efficiency.",Renewables/Renewables.csv -> Panasonic Aquarea WH-MDC09J3E5 mono-bloc air source heat pump R32 9kW,,,https://www.wolseley.co.uk/wcsstore/ExtendedSitesCatalogAssetStore/images/products/AssetPush/wol-web-proof-medium-w/std.lang.all/18/78/T21878_wm.jpg,,,,,,,,,,,,,,,,,,,,,https://www.wolseley.co.uk/wcsstore/ExtendedSitesCatalogAssetStore/images/products/AssetPush/DTP_AssetPushHighRes/std.lang.all/c_/ds/Panasonic_J-Gen_Monobloc_DS.pdf,,,,,,,,,,,,,,,,,,,,,,,,,,,,,,,,,
252,PT21877,Panasonic Aquarea WH-MDC07J3E5 mono-bloc air source heat pump R32 7kW,Panasonic,3346.2,"Supplying hot water at 55°C, the high performance Panasonic Aquarea WH-MDC07J3E5 7kW air source heat pump is designed to deliver in the UK's always varied climate, working at outdoor temperatures right down to -20°C with constant full capacity at external temperatures down to -7°C. Designed for outdoor installation, this single unit supplies water for cooling, heating and for domestic hot water storage and can be used in new builds or for renovation projects in any property. Ideal for homes with low temperature radiators or underfloor heating, the high performance Aquarea heat pump is suitable for use as a standalone unit or for use alongside an existing gas or oil heating system. Smart grid-ready for compatibility with PV or solar, and suitable for connection to a thermostat for complete control, the Aquarea heat pump provides homeowners with a variety of solutions for improved efficiency.",Renewables/Renewables.csv -> Panasonic Aquarea WH-MDC07J3E5 mono-bloc air source heat pump R32 7kW,,,https://www.wolseley.co.uk/wcsstore/ExtendedSitesCatalogAssetStore/images/products/AssetPush/wol-web-proof-medium-w/std.lang.all/18/77/T21877_wm.jpg,,,,,,,,,,,,,,,,,,,,,https://www.wolseley.co.uk/wcsstore/ExtendedSitesCatalogAssetStore/images/products/AssetPush/DTP_AssetPushHighRes/std.lang.all/c_/ds/Panasonic_J-Gen_Monobloc_DS.pdf,,,,,,,,,,,,,,,,,,,,,,,,,,,,,,,,,
253,P635950,Grant Aerona inverter driver air source heat pump - R32 6kW,Grant,2132.27,"Compatible with eco-friendly R32 refrigerant, the Grant Aerona³ 6kW inverter driver air source heat pump is highly efficient for cleaner running and improved convenience. Compact in design, this pump runs extremely quietly, making it a great choice for home systems. A reliable unit, Aerona³ has a simplified design for ease of installation and maintenance and hassle-free operation.",Renewables/Renewables.csv -> Grant Aerona inverter driver air source heat pump - R32 6kW,,,https://www.wolseley.co.uk/wcsstore/ExtendedSitesCatalogAssetStore/images/products/AssetPush/wol-web-proof-medium-w/std.lang.all/59/50/635950_wm.jpg,Aerona,230,"2 Years minimum, subject to T&C's",.51 Kg,N,65.2 dB(A),6 kW,379.4,Floor or Wall,DC twin rotary - inverter driven,HPID6R32BODY,R32 Air Source Heat Pump,N,Inverter driven,Excellent SCOPs across range,Compact footprint for minimal impact on surroundings,2 year warranty subject to T&Cs,,,,,,,,,,,,,,,,,,,,,,,,,,,,,,,,,,,,,
254,P648511,Fox ESS EP5 5.18kWh Battery,Fox ESS,1552.06,TBC,Renewables/Renewables.csv -> Fox ESS EP5 5.18kWh Battery,,,https://www.wolseley.co.uk/wcsstore/ExtendedSitesCatalogAssetStore/images/products/AssetPush/wol-web-proof-medium-w/std.lang.all/85/11/648511_wm.jpg,,,1,50.5,N,,5.18 kW,,,,24952,,N,Easy Installation with flexible configuration,Plug and play sert-up,IP65 rated,Remote monitoring via smartphone or web portal.,,,,,,,,,,,,,,,,,,,,,,,,,,,,,,,,,,,,,
255,P433070,Grant 30ltr ext volumiser w/3kw backup htr,Grant,429.0,This Grant 30L W/3kW external volumiser back-up heater is compatible with the brand's Aerona³ heat pump systems.,Renewables/Renewables.csv -> Grant 30ltr ext volumiser w/3kw backup htr,,,https://www.wolseley.co.uk/wcsstore/ExtendedSitesCatalogAssetStore/images/products/AssetPush/wol-web-proof-medium-w/std.lang.all/30/70/433070_wm.jpg,,N/A,Subject to T&C'S,30,N,,,815,N/A,,HPIDVOL30EXT,,N,For use with Grant Aerona³ heat pump systems,30L volume,Warranty subject to T&Cs,,,,,,,,,,,,,,,,,,,,,,,,,,,,,,,,,,,,,,
256,P175027,UK Cylinders Prolite WPHPD3300 Heat Pump Cylinder 300 ltr,UK Cylinders,1105.68,"Offering high levels of performance, this UK Cylinders Prolite 300L capacity heat pump indirect cylinder incorporates a full bore coil for high flow and high gain. Made of tough duplex stainless steel, it is lagged using environmentally friendly 50mm insulation to help minimise heat loss.",Renewables/Renewables.csv -> UK Cylinders Prolite WPHPD3300 Heat Pump Cylinder 300 ltr,,Heat Pump cylinder;unvented components to comply with G3 regulations,https://www.wolseley.co.uk/wcsstore/ExtendedSitesCatalogAssetStore/images/products/AssetPush/wol-web-proof-medium-w/std.lang.all/3_/27/175023_27_wm.jpg,ProLite,230,Cylinder has a 25 year warranty against manufacturing defect and 2 years with supplied components.,57kg,N,,,,,,WPHPD3300,,N,For domestic use,Duplex stainless steel construction,Silver colour,22mm compression fittings,Includes 50mm CFC and HCFC-free insulation,25 year warranty against manufacturing defects,2 year warranty on supplied components,,,300 l,,,,Silver,,,,,Duplex Stainless Steel,,,,,,,,,545mm,,,,22mm compression fittings,5 bar,Yes,Indirect,50mm CFC and HCFC free insulation,Domestic,,,,
257,P276265,Stelrad Compact K3 K3 radiator 500 x 800mm,Stelrad,169.86,"A popular choice for installation in just about any room, the Stelrad Compact K3 triple panel triple convector radiator is perfectly designed for those domestic or commercial projects where space is limited. Designed to combine smart style with reliability, this 800 x 500mm radiator offers excellent efficiency, thanks in large part to the precision-welding of the convector onto the waterways. Every Compact is designed with flexible connection options for ease of siting, while robust packaging that remains in place until fitting is complete makes the engineer's job even easier, limiting the risk of damage during transport and installation.",Renewables/Renewables.csv -> Stelrad Compact K3 K3 radiator 500 x 800mm,,,https://www.wolseley.co.uk/wcsstore/ExtendedSitesCatalogAssetStore/images/products/AssetPush/wol-web-proof-medium-w/std.lang.all/62/67/NW-276261_276267_wm.jpg,,,,,,,,,,,,,,,,,,,,,https://www.wolseley.co.uk/wcsstore/ExtendedSitesCatalogAssetStore/images/products/AssetPush/DTP_AssetPushHighRes/std.lang.all/bo/ok/Stelrad_Specification_Radiator_Book.pdf,https://www.wolseley.co.uk/wcsstore/ExtendedSitesCatalogAssetStore/images/products/AssetPush/DTP_AssetPushHighRes/std.lang.all/20/19/Stelrad_Radiator_Book_Jan_2019.pdf,,,https://www.wolseley.co.uk/wcsstore/ExtendedSitesCatalogAssetStore/images/products/AssetPush/DTP_AssetPushHighRes/std.lang.all/ic/al/Stelrad_Compact_K3_Technical.pdf,,,,,,,,,,,,,,,,,,,,,,,,,,,,,
258,P506184,"Intatec Zero - Anti freeze valve 1"" male",Intatec,97.73,"Providing unique protection to your air source heat pump system, this Intatec antifreeze valve with 1"" male connections protects water-operated pump systems from the potential damage that can be caused in freezing temperatures.","Renewables/Renewables.csv -> Intatec Zero - Anti freeze valve 1"" male",,,https://www.wolseley.co.uk/wcsstore/ExtendedSitesCatalogAssetStore/images/products/AssetPush/wol-web-proof-medium-w/std.lang.all/84/_1/506184_1_wm.jpg,,N/A,2 years,0.42KG,N,,,245,Pipework,,ZERO01,Heat Pump,N,Discharges when system water temperature drops to 3°C,Reduces risk of ice formation,Reduces risk of circuit breakdown or damage,2 year warranty,,,,,,,,,,,,,,,,,,,,,,,,,,,,,,,,,,,,,
259,P276268,Stelrad Compact K3 radiator 500 x 1100mm,Stelrad,223.06,"Robustly built in steel, the Stelrad Compact K3 radiator has an integrated grille and panels to minimise movement and precision-welded convectors for improved economy. Measuring 500 x 1100mm, this radiator combines long-lasting strength with an elegant traditional design and a reliable heat output of 7718 BTU/h.",Renewables/Renewables.csv -> Stelrad Compact K3 radiator 500 x 1100mm,,,https://www.wolseley.co.uk/wcsstore/ExtendedSitesCatalogAssetStore/images/products/AssetPush/wol-web-proof-medium-w/std.lang.all/pa/ct/Caradon Stelrad_Compact_wm.jpg,,,,,,,,,,,,,,,,,,,,,https://www.wolseley.co.uk/wcsstore/ExtendedSitesCatalogAssetStore/images/products/AssetPush/DTP_AssetPushHighRes/std.lang.all/hu/re/Stelrad_Radiator_Brochure.pdf,,,,,,,,,,,,,,,,,,,,,,,,,,,,,,,,,
260,PP84018,Rehau Rauthermex meter of uno pre insulated pipe 125/182,Rehau,292.28,"Offering quick installation, the Rehau Rauthermex 125/182mm pre-insulated pipe, supplied in a 1M length, is part of a optimised pre-insulated pipe system. Rauthermex is a cutting-edge district heating compatible pipe system promising flexibility and low energy losses for reliable efficiency in renewables.",Renewables/Renewables.csv -> Rehau Rauthermex meter of uno pre insulated pipe 125/182,,n/a,https://www.wolseley.co.uk/wcsstore/ExtendedSitesCatalogAssetStore/images/products/AssetPush/wol-web-proof-medium-w/std.lang.all/40/18/P84018_wm.jpg,RAUTHERMEX,,5 Years,,N,,,185,,,352241-002,Pre Insulated Pipe,N,Flexible design,For quick installation,With secure Everloc joints,Leakproof fitting,CFC-free polyethylene construction,5 year warranty,,,,,,,,,,,,,PolyethyleneCFC Free flexible polyurethane Foam,,,,,,,,,185,,,,,,,,,,,,,
261,P614110,Daikin Altherma BRC1HHDW R32 Madoka White,Daikin,103.68,"Offering ease of operation for a better user experience, the Daikin Altherma R32 Madoka wired remote control in white provides homeowners with an intuitive interface through which basic heating and hot water functions are controlled.",Renewables/Renewables.csv -> Daikin Altherma BRC1HHDW R32 Madoka White,,,https://www.wolseley.co.uk/wcsstore/ExtendedSitesCatalogAssetStore/images/products/AssetPush/wol-web-proof-medium-w/std.lang.all/41/10/614110_wm.jpg,Altherma,,,,N,,,,,,BRC1HHDW,,N,White colour to match interior,Symbol driven end user interface,Intuitive touch button control,Basic functions focus on space heating and DHW,Basic functions on/off and temperature set point,Compact design for ease of integration into standard electrical installation boxes,,,,,,,,,,,,,,,,,,,,,,,,,,,,,,,,,,,R-32
262,PP84015,Rehau Rauthermex meter of uno pre insulated pipe 75/162,Rehau,135.93,"Offering quick installation, the Rehau Rauthermex 75/162mm pre-insulated pipe, supplied in a 1M length, is part of a optimised pre-insulated pipe system. Rauthermex is a cutting-edge district heating compatible pipe system promising flexibility and low energy losses for reliable efficiency in renewables.",Renewables/Renewables.csv -> Rehau Rauthermex meter of uno pre insulated pipe 75/162,,,https://www.wolseley.co.uk/wcsstore/ExtendedSitesCatalogAssetStore/images/products/AssetPush/wol-web-proof-medium-w/std.lang.all/40/15/P84015_wm.jpg,RAUTHERMEX,,55 YEAR,,N,,3 kW,162,,,352211-001,Pipe,N,Flexible design,For quick installation,With secure Everloc joints,Leakproof fitting,PE-Xa construction,5 year warranty,,,,,,,,,,,,,PE-Xa,,,,,,,,,75,,,,,,,,,,,,,
