,pid,Title,Brand,Price,Description,category,mfpartnumber,whatisincluded,Image,Attachment 1,Attachment 2,Attachment 3,Colour,Range,Warranty,Hazardous,Soft Close Seat,Hinge Fixing,Hole Centres,Hinge Material,Material,Shape,Supplier Product Code,Type,WEEE Compliant,Feature 1,Feature 2,Feature 3,Feature 4,Feature 5,Depth (mm),Cistern Size,Design Type,Fittings Included,Toilet Pack Contents,Feature 6,Feature 7,Feature 8,Feature 9,Flush Type,Overflow Type,Air Pipe Supplied,Inlet Position,Flush Mechanism,Capacity Litre,Finish,Anti Slip,Pre-Drilled Waste Hole,Pre-Drilled Overflow,Grips/Handles,Attachment 4,Attachment 5,Feature 10,Feature 11,Feature 12,Feature 13,Feature 14,Feature 15,Attachment 6,Pack Quantity,Feature 16,Seat Projection,Material Type,Sector,Position,Thickness,Anti Slip Surface,Grips or Handles,Weight,Style,Mounting Type,Application
103,PB90400,Thomas Dudley Elite panel bottom supply bottom outlet cistern 6/9litre White,Thomas Dudley,96.25,"Traditionally designed, this low profile Thomas Dudley Elite plastic toilet cistern is designed to suit a wide range of settings, domestic, local authority and commercial alike. Compatible with close coupled and low level installation, this lever-operated cistern is fitted with a convertible siphon for 6 - 9L flushing while a one piece Dudley Duo flush siphon is additionally supplied as standard, providing a full and water-saving reduced flush.",Bathrooms and Kitchens/Toilets/Toilets.csv -> Thomas Dudley Elite panel bottom supply bottom outlet cistern 6/9litre White,,,https://www.wolseley.co.uk/wcsstore/ExtendedSitesCatalogAssetStore/images/products/AssetPush/wol-web-proof-medium-w/std.lang.all/04/00/NW-B90400_wm.jpg,https://www.wolseley.co.uk/wcsstore/ExtendedSitesCatalogAssetStore/images/products/AssetPush/DTP_AssetPushHighRes/std.lang.all/hu/re/TDudley_LightDutyCisterns_Brochure.pdf,,,,,,,,,,,,,,,,,,,,,,,,,,,,,,,,,,,,,,,,,,,,,,,,,,,,,,,,,,,,,,
104,PB79334,Twyford Alcona wc seat soft close,Twyford,73.33,"Offering slow-close for slam-free use, the Twyford Alcona toilet seat is fitted with a neat wrapover cover. It is suitable for use with a range of Twyford Alcona WC pans. Manufactured in a smooth, non-porous Duroplast, this seat is resistant to fading and discolouration and will not yellow over time.",Bathrooms and Kitchens/Toilets/Toilets.csv -> Twyford Alcona wc seat soft close,,,https://www.wolseley.co.uk/wcsstore/ExtendedSitesCatalogAssetStore/images/products/AssetPush/wol-web-proof-medium-w/std.lang.all/ma/ge/B79334_Primary_Image_wm.jpg,https://www.wolseley.co.uk/wcsstore/ExtendedSitesCatalogAssetStore/images/products/AssetPush/DTP_AssetPushHighRes/std.lang.all/he/et/B79334_Tech_Sheet.pdf,,,,,,,,,,,,,,,,,,,,,,,,,,,,,,,,,,,,,,,,,,,,,,,,,,,,,,,,,,,,,,
105,PB97415,Macdee Hideaway side inlet side outlet cistern plus number 1 lever Chrome Plated,Macdee,74.47,"Designed with a side inlet, the Macdee Hideaway toilet cistern is suitable for installation directly against a flat wall. Made of black plastic, this simple lever-operated cistern with Metro rapid siphon and Silenta three-part ball valve supplies a 6/7/9L single flush.",Bathrooms and Kitchens/Toilets/Toilets.csv -> Macdee Hideaway side inlet side outlet cistern plus number 1 lever Chrome Plated,,,https://www.wolseley.co.uk/wcsstore/ExtendedSitesCatalogAssetStore/images/products/AssetPush/wol-web-proof-medium-w/std.lang.all/74/15/NW-B97415_wm.jpg,https://www.wolseley.co.uk/wcsstore/ExtendedSitesCatalogAssetStore/images/products/AssetPush/DTP_AssetPushHighRes/std.lang.all/ic/al/Macdee_Hideaway_Cistern_Technical.pdf,https://www.wolseley.co.uk/wcsstore/ExtendedSitesCatalogAssetStore/images/products/AssetPush/DTP_AssetPushHighRes/std.lang.all/st/ru/Macdee_Hideway_Cistern_Asse_Instru.pdf,,,,,,,,,,,,,,,,,,,,,,,,,,,,,,,,,,,,,,,,,,,,,,,,,,,,,,,,,,,,,
106,PB90155,Celmac Sonata toilet seat with cover and hinges Black/Stainless Steel,Celmac,32.04,"Made of heavyweight black thermoset, this Celmac Sonata oval toilet seat and cover has a robust 304 stainless steel hinge for secure, long lasting fitting. Resistant to damage, the Sonata is easy to clean and designed for comfort and durability.",Bathrooms and Kitchens/Toilets/Toilets.csv -> Celmac Sonata toilet seat with cover and hinges Black/Stainless Steel,,,https://www.wolseley.co.uk/wcsstore/ExtendedSitesCatalogAssetStore/images/products/AssetPush/wol-web-proof-medium-w/std.lang.all/01/55/NW-B90155_wm.jpg,https://www.wolseley.co.uk/wcsstore/ExtendedSitesCatalogAssetStore/images/products/AssetPush/DTP_AssetPushHighRes/std.lang.all/8-/19/Wirquin_Product_Catalogue_UK_2018-19.pdf,https://www.wolseley.co.uk/wcsstore/ExtendedSitesCatalogAssetStore/images/products/AssetPush/DTP_AssetPushHighRes/std.lang.all/fl/et/Celmac_Toilet_Seats_Instrct_Leaflet.pdf,,,,,,,,,,,,,,,,,,,,,,,,,,,,,,,,,,,,,,,,,,,,,,,,,,,,,,,,,,,,,
107,PB47403,"Twyford Alcona AR2342WH Alcona Close coupled cistern, dual flush, 4/2.6ltr, white",Twyford,71.66,The Twyford Alcona flush wise close coupled cistern provides water savings of up to 60% with every 4/2.6L push button flush. This eco-friendly toilet cistern is designed to help reach articles 5 and 6 of the Code For Sustainable Homes.,"Bathrooms and Kitchens/Toilets/Toilets.csv -> Twyford Alcona AR2342WH Alcona Close coupled cistern, dual flush, 4/2.6ltr, white",,,https://www.wolseley.co.uk/wcsstore/ExtendedSitesCatalogAssetStore/images/products/AssetPush/wol-web-proof-medium-w/std.lang.all/74/03/NW-B47401_B47403_wm.jpg,https://www.wolseley.co.uk/wcsstore/ExtendedSitesCatalogAssetStore/images/products/AssetPush/DTP_AssetPushHighRes/std.lang.all/ti/on/Twyford_967362000_Instruction.pdf,https://www.wolseley.co.uk/wcsstore/ExtendedSitesCatalogAssetStore/images/products/AssetPush/DTP_AssetPushHighRes/std.lang.all/ic/al/Twyford_AR2342WH_Technical.pdf,,,,,,,,,,,,,,,,,,,,,,,,,,,,,,,,,,,,,,,,,,,,,,,,,,,,,,,,,,,,,
108,PD00637,Roca Laura back to wall WC pan White,Roca,221.66,"A traditional and functional design ideal for public bathrooms, the Roca Laura back to wall round toilet pan with double outlet includes a washdown flush and is supplied with floor fixings. Part of a wider range combining usability and elegance, the Laura is a versatile, tried-and-tested choice.",Bathrooms and Kitchens/Toilets/Toilets.csv -> Roca Laura back to wall WC pan White,,WC pan;Fixing kit,https://www.wolseley.co.uk/wcsstore/ExtendedSitesCatalogAssetStore/images/products/AssetPush/wol-web-proof-medium-w/std.lang.all/06/37/NW-D00637_wm.jpg,https://www.wolseley.co.uk/wcsstore/ExtendedSitesCatalogAssetStore/images/products/AssetPush/DTP_AssetPushHighRes/std.lang.all/ic/al/Roca_A347396000_Technical.pdf,,,,,,,,,,,,,,,,,,,,,,,,,,,,,,,,,,,,,,,,,,,,,,,,,,,,,,,,,,,,,,
109,PB90332,Thomas Dudley Mirage Auto concealed auto cistern 6/9ltr,Thomas Dudley,71.78,"Ideal for use with commercial urinals, the compact, plastic Thomas Dudley Mirage Auto automatic concealed 6-9L cistern can be effortlessly screwed to a wide range of materials for easy installation.",Bathrooms and Kitchens/Toilets/Toilets.csv -> Thomas Dudley Mirage Auto concealed auto cistern 6/9ltr,,,https://www.wolseley.co.uk/wcsstore/ExtendedSitesCatalogAssetStore/images/products/AssetPush/wol-web-proof-medium-w/std.lang.all/03/32/B90332_wm.jpg,https://www.wolseley.co.uk/wcsstore/ExtendedSitesCatalogAssetStore/images/products/AssetPush/DTP_AssetPushHighRes/std.lang.all/hu/re/TDudley_Brochure.pdf,https://www.wolseley.co.uk/wcsstore/ExtendedSitesCatalogAssetStore/images/products/AssetPush/DTP_AssetPushHighRes/std.lang.all/ic/al/TDudley_AutomaticCisterns_Technical.pdf,,,,,,,,,,,,,,,,,,,,,,,,,,,,,,,,,,,,,,,,,,,,,,,,,,,,,,,,,,,,,
110,PD45110,Roca The Gap rimless toilet pan no cutout for isolation valve,Roca,168.88,"Designed by Antonio Bullo, Roca's The Gap rimless back to wall, close coupled square toilet pan with dual outlet delivers on style and functionality. This compact design makes the most of a modern bathroom space, bringing a touch of designer style to even the smallest room.",Bathrooms and Kitchens/Toilets/Toilets.csv -> Roca The Gap rimless toilet pan no cutout for isolation valve,,,https://www.wolseley.co.uk/wcsstore/ExtendedSitesCatalogAssetStore/images/products/AssetPush/wol-web-proof-medium-w/std.lang.all/51/10/NW-D45110_wm.jpg,https://www.wolseley.co.uk/wcsstore/ExtendedSitesCatalogAssetStore/images/products/AssetPush/DTP_AssetPushHighRes/std.lang.all/ic/al/Roca_A342737000_Technical.pdf,,,,,,,,,,,,,,,,,,,,,,,,,,,,,,,,,,,,,,,,,,,,,,,,,,,,,,,,,,,,,,
111,PU96825,"Geberit low-height furniture cistern, 6/3 litres, pneumatic flush for single or dual flush buttons",Geberit,55.91,"Suitable for installation with back-to-wall or floor-mounted toilets, the Geberit 6/3L concealed low height in-furniture cistern allows for neat concealed fitting into bathroom furniture. This cistern has a bottom left water supply connection and a factory set flush volume of 5.8L. Offering complete compatibility with all pneumatic flush buttons, the cistern is supplied with a 90 flush bend and fastening materials for ease of installation.","Bathrooms and Kitchens/Toilets/Toilets.csv -> Geberit low-height furniture cistern, 6/3 litres, pneumatic flush for single or dual flush buttons",,,https://www.wolseley.co.uk/wcsstore/ExtendedSitesCatalogAssetStore/images/products/AssetPush/wol-web-proof-medium-w/std.lang.all/ma/ge/U96825_Primary_Image_wm.jpg,https://www.wolseley.co.uk/wcsstore/ExtendedSitesCatalogAssetStore/images/products/AssetPush/DTP_AssetPushHighRes/std.lang.all/ta/ll/U96825_Install.pdf,https://www.wolseley.co.uk/wcsstore/ExtendedSitesCatalogAssetStore/images/products/AssetPush/DTP_AssetPushHighRes/std.lang.all/he/et/U96825_Tech_Sheet.pdf,,,,,,,,,,,,,,,,,,,,,,,,,,,,,,,,,,,,,,,,,,,,,,,,,,,,,,,,,,,,,
112,PB90482,Thomas Dudley Vantage single flush round button 73.5mm Chrome Plated,Thomas Dudley,27.35,A Thomas Dudley Vantage chrome-finish single flush button for use in a range of cisterns.,Bathrooms and Kitchens/Toilets/Toilets.csv -> Thomas Dudley Vantage single flush round button 73.5mm Chrome Plated,,,https://www.wolseley.co.uk/wcsstore/ExtendedSitesCatalogAssetStore/images/products/AssetPush/wol-web-proof-medium-w/std.lang.all/04/82/NW-B90482_wm.jpg,https://www.wolseley.co.uk/wcsstore/ExtendedSitesCatalogAssetStore/images/products/AssetPush/DTP_AssetPushHighRes/std.lang.all/og/ue/Thomas_Dudley_Product_Catalogue.pdf,,,,,,,,,,,,,,,,,,,,,,,,,,,,,,,,,,,,,,,,,,,,,,,,,,,,,,,,,,,,,,
113,PD00768,Roca Laura soft close toilet seat,Roca,96.18,"An elegant choice for any bathroom, the Roca Laura oval toilet seat and cover is made of a simple and strong white acrylic. Designed for use on the Laura toilet, this seat lifts off quickly and easily for fast, effective cleaning while a bottom fixing soft-close hinge improves comfort by keeping both seat and cover from slamming.",Bathrooms and Kitchens/Toilets/Toilets.csv -> Roca Laura soft close toilet seat,,Toilet seat;Cover;Hinge;Fixings,https://www.wolseley.co.uk/wcsstore/ExtendedSitesCatalogAssetStore/images/products/AssetPush/wol-web-proof-medium-w/std.lang.all/07/68/NW-D00768_wm.jpg,https://www.wolseley.co.uk/wcsstore/ExtendedSitesCatalogAssetStore/images/products/AssetPush/DTP_AssetPushHighRes/std.lang.all/ic/al/D00768_Technical.pdf,https://www.wolseley.co.uk/wcsstore/ExtendedSitesCatalogAssetStore/images/products/AssetPush/DTP_AssetPushHighRes/std.lang.all/ti/on/Roca_Soft_Close_WC_Installation.pdf,,,,,,,,,,,,,,,,,,,,,,,,,,,,,,,,,,,,,,,,,,,,,,,,,,,,,,,,,,,,,
114,PU94955,"Geberit Delta Geberit Delta concealed cistern, 6/3 litres, with flush plate Delta20 gloss chrome-plated 12 cm (1)",Geberit,146.58,"Easy to install and highly durable, the Geberit Delta 6/3L dual flush concealed cistern, supplied with the Delta20 chrome-plated 120mm flush plate, is built for a lifetime of trouble-free use. Manufactured in tried-and-tested materials, this cistern is the result of 60+ years of Geberit research and development, ensuring a functional, reliable and simple bathroom product that gets the job done.","Bathrooms and Kitchens/Toilets/Toilets.csv -> Geberit Delta Geberit Delta concealed cistern, 6/3 litres, with flush plate Delta20 gloss chrome-plated 12 cm (1)",,,https://www.wolseley.co.uk/wcsstore/ExtendedSitesCatalogAssetStore/images/products/AssetPush/wol-web-proof-medium-w/std.lang.all/49/55/U94955_wm.jpg,https://www.wolseley.co.uk/wcsstore/ExtendedSitesCatalogAssetStore/images/products/AssetPush/DTP_AssetPushHighRes/std.lang.all/he/et/U94955_Tech_Sheet.pdf,https://www.wolseley.co.uk/wcsstore/ExtendedSitesCatalogAssetStore/images/products/AssetPush/DTP_AssetPushHighRes/std.lang.all/ti/on/U94955_Installation.pdf,https://www.wolseley.co.uk/wcsstore/ExtendedSitesCatalogAssetStore/images/products/AssetPush/DTP_AssetPushHighRes/std.lang.all/wr/as/U94955_WRAS.pdf,,,,,,,,,,,,,,,,,,,,,,,,,,,,,,,,,,,,,,,,,,,,,,,,,,,,,,,,,,,,
115,PT02633,Ideal Standard Tesi Overwrap seat and cover (slow closing),Ideal Standard,96.02,"A contemporary design with the convenience of a bottom fixing soft-close hinge, the Ideal Standard Tesi D-shaped toilet seat and cover is made of hardwearing plastic. This modern loo seat is intended to complement the geometric Tesi range of bathroom furniture.",Bathrooms and Kitchens/Toilets/Toilets.csv -> Ideal Standard Tesi Overwrap seat and cover (slow closing),,,https://www.wolseley.co.uk/wcsstore/ExtendedSitesCatalogAssetStore/images/products/AssetPush/wol-web-proof-medium-w/std.lang.all/26/33/NW-T02633_wm.jpg,https://www.wolseley.co.uk/wcsstore/ExtendedSitesCatalogAssetStore/images/products/AssetPush/DTP_AssetPushHighRes/std.lang.all/ar/ts/IS_s_Tesi_Spare_Parts.pdf,,,,,,,,,,,,,,,,,,,,,,,,,,,,,,,,,,,,,,,,,,,,,,,,,,,,,,,,,,,,,,
116,PB82010,Celmac Sonata heavy weight toilet seat and hinges Black/Brushed Chrome Plated,Celmac,27.73,"Made of heavyweight black thermoset, this Celmac Sonata oval toilet seat and cover has a robust 304 stainless steel hinge for secure, long lasting fitting. Resistant to damage, the Sonata is easy to clean and designed for comfort and durability.",Bathrooms and Kitchens/Toilets/Toilets.csv -> Celmac Sonata heavy weight toilet seat and hinges Black/Brushed Chrome Plated,,,https://www.wolseley.co.uk/wcsstore/ExtendedSitesCatalogAssetStore/images/products/AssetPush/wol-web-proof-medium-w/std.lang.all/20/10/NW-B82010_wm.jpg,https://www.wolseley.co.uk/wcsstore/ExtendedSitesCatalogAssetStore/images/products/AssetPush/DTP_AssetPushHighRes/std.lang.all/og/ue/Celmac_Toilet_Seats_Catalogue.pdf,https://www.wolseley.co.uk/wcsstore/ExtendedSitesCatalogAssetStore/images/products/AssetPush/DTP_AssetPushHighRes/std.lang.all/8-/19/Wirquin_Product_Catalogue_UK_2018-19.pdf,https://www.wolseley.co.uk/wcsstore/ExtendedSitesCatalogAssetStore/images/products/AssetPush/DTP_AssetPushHighRes/std.lang.all/fl/et/Celmac_Toilet_Seats_Instrct_Leaflet.pdf,,,,,,,,,,,,,,,,,,,,,,,,,,,,,,,,,,,,,,,,,,,,,,,,,,,,,,,,,,,,
117,PD04659,Ideal Standard Tempo close coupled dual flush cistern 4/2.6ltr White,Ideal Standard,98.1,"Offering a 4/2.6L push button operated dual flush, the Ideal Standard Tempo bottom inlet close-coupled cistern is made of a robust vitreous china with a smart white gloss finish.",Bathrooms and Kitchens/Toilets/Toilets.csv -> Ideal Standard Tempo close coupled dual flush cistern 4/2.6ltr White,,,https://www.wolseley.co.uk/wcsstore/ExtendedSitesCatalogAssetStore/images/products/AssetPush/wol-web-proof-medium-w/std.lang.all/46/59/NW-D04659_wm.jpg,https://www.wolseley.co.uk/wcsstore/ExtendedSitesCatalogAssetStore/images/products/AssetPush/DTP_AssetPushHighRes/std.lang.all/ic/al/IS_T427101_Technical.pdf,,,,,,,,,,,,,,,,,,,,,,,,,,,,,,,,,,,,,,,,,,,,,,,,,,,,,,,,,,,,,,
118,PJ01676,Twyford Avalon Sola AV7886BE seat ring top fix Blue,Twyford,119.19,"This Twyford Avalon Sola round, blue toilet seat ring is supplied with stainless steel top fix hinges and stability buffers for more stable use.",Bathrooms and Kitchens/Toilets/Toilets.csv -> Twyford Avalon Sola AV7886BE seat ring top fix Blue,,,https://www.wolseley.co.uk/wcsstore/ExtendedSitesCatalogAssetStore/images/products/AssetPush/wol-web-proof-medium-w/std.lang.all/16/76/NW-J01676_wm.jpg,https://www.wolseley.co.uk/wcsstore/ExtendedSitesCatalogAssetStore/images/products/AssetPush/DTP_AssetPushHighRes/std.lang.all/20/19/Twyford_Specification_Manual_2019.pdf,https://www.wolseley.co.uk/wcsstore/ExtendedSitesCatalogAssetStore/images/products/AssetPush/DTP_AssetPushHighRes/std.lang.all/wi/ng/Twyford_Avalon_Sola_Drawing.pdf,https://www.wolseley.co.uk/wcsstore/ExtendedSitesCatalogAssetStore/images/products/AssetPush/DTP_AssetPushHighRes/std.lang.all/ic/al/Twyford_WC_Seats_Technical.pdf,,,,,,,,,,,,,,,,,,,,,,,,,,,,,,,,,,,,,,,https://www.wolseley.co.uk/wcsstore/ExtendedSitesCatalogAssetStore/images/products/AssetPush/DTP_AssetPushHighRes/std.lang.all/ti/on/Twyford_Avalon_Sola_Installation.pdf,,,,,,,,,,,,,,,,,,,,,
119,PB61735,Nabis Vector II soft close seat and cover,Nabis,34.88,"Made of white gloss plastic, the Nabis Vector II toilet seat and cover is a finishing touch for bathrooms fitted with the contemporary Vector II range. Top fixing EVA soft-close hinges ensure slam-free, quiet use.",Bathrooms and Kitchens/Toilets/Toilets.csv -> Nabis Vector II soft close seat and cover,,Toilet seat;Cover,https://www.wolseley.co.uk/wcsstore/ExtendedSitesCatalogAssetStore/images/products/AssetPush/wol-web-proof-medium-w/std.lang.all/17/35/B61735_wm.jpg,https://www.wolseley.co.uk/wcsstore/ExtendedSitesCatalogAssetStore/images/products/AssetPush/DTP_AssetPushHighRes/std.lang.all/ic/al/B61735_Nabis_Technical.pdf,https://www.wolseley.co.uk/wcsstore/ExtendedSitesCatalogAssetStore/images/products/AssetPush/DTP_AssetPushHighRes/std.lang.all/tr/ix/Toilet Seats & Pans Matrix.pdf,,,,,,,,,,,,,,,,,,,,,,,,,,,,,,,,,,,,,,,,,,,,,,,,,,,,,,,,,,,,,
120,PB90331,Thomas Dudley Mirage Auto concealed auto cistern 4.5ltr,Thomas Dudley,68.89,"Ideal for use with commercial urinals, the compact, plastic Thomas Dudley Mirage Auto automatic concealed 4.5L cistern can be effortlessly screwed to a wide range of materials for easy installation.",Bathrooms and Kitchens/Toilets/Toilets.csv -> Thomas Dudley Mirage Auto concealed auto cistern 4.5ltr,,,https://www.wolseley.co.uk/wcsstore/ExtendedSitesCatalogAssetStore/images/products/AssetPush/wol-web-proof-medium-w/std.lang.all/03/31/B90331_wm.jpg,https://www.wolseley.co.uk/wcsstore/ExtendedSitesCatalogAssetStore/images/products/AssetPush/DTP_AssetPushHighRes/std.lang.all/hu/re/TDudley_Brochure.pdf,https://www.wolseley.co.uk/wcsstore/ExtendedSitesCatalogAssetStore/images/products/AssetPush/DTP_AssetPushHighRes/std.lang.all/ic/al/TDudley_AutomaticCisterns_Technical.pdf,,,,,,,,,,,,,,,,,,,,,,,,,,,,,,,,,,,,,,,,,,,,,,,,,,,,,,,,,,,,,
121,PJ57817,Twyford Option Dual flush lever cistern White,Twyford,64.06,"Twyford Option provides a series of fully adaptable and durable products that are not only affordable, but offer stylish bathroom solutions. Operated via a simple button, this Twyford Option 455mm close-coupled white ceramic cistern offers a 4/6L dual flush. Combine with Twyford Option CC Pan & Seat.",Bathrooms and Kitchens/Toilets/Toilets.csv -> Twyford Option Dual flush lever cistern White,,,https://www.wolseley.co.uk/wcsstore/ExtendedSitesCatalogAssetStore/images/products/AssetPush/wol-web-proof-medium-w/std.lang.all/ma/ge/J57817_Primary_Image_wm.jpg,https://www.wolseley.co.uk/wcsstore/ExtendedSitesCatalogAssetStore/images/products/AssetPush/DTP_AssetPushHighRes/std.lang.all/wi/ng/Twyford_Option_Drawing.pdf,https://www.wolseley.co.uk/wcsstore/ExtendedSitesCatalogAssetStore/images/products/AssetPush/DTP_AssetPushHighRes/std.lang.all/io/ns/J57817_Dimensions.pdf,https://www.wolseley.co.uk/wcsstore/ExtendedSitesCatalogAssetStore/images/products/AssetPush/DTP_AssetPushHighRes/std.lang.all/ic/al/Twyford_Option_CC_WC_Technical.pdf,,,,,,,,,,,,,,,,,,,,,,,,,,,,,,,,,,,,,,,,,,,,,,,,,,,,,,,,,,,,
122,PB98077,"Thomas Dudley Vantage dual flush concealed cistern with side inlet, flushbend, no button, no poly-jacket",Thomas Dudley,125.34,"Offering fast and stress-free installation, this Thomas Dudley Vantage concealed dual flush toilet cistern is supplied factory assembled and incorporates a push-fit flush bend and inlet elbow. With the option to install the push button up to 750mm away, this cistern is designed for flexibility.","Bathrooms and Kitchens/Toilets/Toilets.csv -> Thomas Dudley Vantage dual flush concealed cistern with side inlet, flushbend, no button, no poly-jacket",,,https://www.wolseley.co.uk/wcsstore/ExtendedSitesCatalogAssetStore/images/products/AssetPush/wol-web-proof-medium-w/std.lang.all/80/77/B98077_wm.jpg,,,,White,Vantage,3 Years,N,,,,,Polyethylene,,313330W,Cistern,N,"Supplied factory assembled for quick, easy installation",WRAS approved Dudley Niagara flushing valve,WRAS approved Dudley Hydroflo quiet inlet valve,Push-fit water inlet elbow,Push-fit flush bend,125,,,Yes,,Integral isolating valve,"Air tubes enable button, plate or sensor to be installed up to 750mm away from cistern",Front and top access panels,Unique cistern fixing brackets,Dual Flush,Internal,No,Side,Button,,,,,,,,,No need to cut access holes into vanity tops,Side inlet,Cistern body in high density polyethylene,Internal overflow warning,Internal parts comply with the Regulator's Specification,White polyethylene,,,,,,,,,,,,,,
123,PD00709,Roca Laura toilet seat and cover,Roca,55.25,"Made of a robust acrylic, the Roca Laura oval toilet seat and cover is supplied with top-fixing stainless steel L-shaped standard close hinges and all necessary pan connections for quick, easy fitting. This smart loo seat is the ideal finishing touch for the Laura bathroom suite.",Bathrooms and Kitchens/Toilets/Toilets.csv -> Roca Laura toilet seat and cover,,Toilet seat;Cover;Hinge;Fixings,https://www.wolseley.co.uk/wcsstore/ExtendedSitesCatalogAssetStore/images/products/AssetPush/wol-web-proof-medium-w/std.lang.all/07/09/NW-D00709_wm.jpg,https://www.wolseley.co.uk/wcsstore/ExtendedSitesCatalogAssetStore/images/products/AssetPush/DTP_AssetPushHighRes/std.lang.all/ti/on/Roca_Laura_A801_Installation.pdf,https://www.wolseley.co.uk/wcsstore/ExtendedSitesCatalogAssetStore/images/products/AssetPush/DTP_AssetPushHighRes/std.lang.all/20/20/Roca_Discovery_Brochure_2020.pdf,,,,,,,,,,,,,,,,,,,,,,,,,,,,,,,,,,,,,,,,,,,,,,,,,,,,,,,,,,,,,
124,PB82200,Celmac Sonata toilet seat and cover top fix White,Celmac,48.47,"Made of heavyweight white thermoset, this Celmac Sonata oval toilet seat and cover has a robust top fix 304 stainless steel hinge for secure, long lasting fitting. Resistant to damage, the Sonata is easy to clean and designed for comfort and durability.",Bathrooms and Kitchens/Toilets/Toilets.csv -> Celmac Sonata toilet seat and cover top fix White,,,https://www.wolseley.co.uk/wcsstore/ExtendedSitesCatalogAssetStore/images/products/AssetPush/wol-web-proof-medium-w/std.lang.all/22/00/NW-B82200_wm.jpg,https://www.wolseley.co.uk/wcsstore/ExtendedSitesCatalogAssetStore/images/products/AssetPush/DTP_AssetPushHighRes/std.lang.all/8-/19/Wirquin_Product_Catalogue_UK_2018-19.pdf,https://www.wolseley.co.uk/wcsstore/ExtendedSitesCatalogAssetStore/images/products/AssetPush/DTP_AssetPushHighRes/std.lang.all/fl/et/Celmac_Toilet_Seats_Instrct_Leaflet.pdf,,,,,,,,,,,,,,,,,,,,,,,,,,,,,,,,,,,,,,,,,,,,,,,,,,,,,,,,,,,,,
125,PB79337,Twyford Alcona wc seat bottom fix,Twyford,38.53,"With its smooth, non-porous surface, the Twyford Alcona bottom-fix toilet seat offers long lasting durability. Not only is this seat resistant to chemicals and scratches its Duroplast surface also resists discolouration and fading over time.",Bathrooms and Kitchens/Toilets/Toilets.csv -> Twyford Alcona wc seat bottom fix,,Toilet seat;Cover;Hinge,https://www.wolseley.co.uk/wcsstore/ExtendedSitesCatalogAssetStore/images/products/AssetPush/wol-web-proof-medium-w/std.lang.all/ma/ge/B79337_Primary_Image_wm.jpg,https://www.wolseley.co.uk/wcsstore/ExtendedSitesCatalogAssetStore/images/products/AssetPush/DTP_AssetPushHighRes/std.lang.all/io/ns/B79337_Dimensions.pdf,,,,,,,,,,,,,,,,,,,,,,,,,,,,,,,,,,,,,,,,,,,,,,,,,,,,,,,,,,,,,,
126,PB88700,Armitage Shanks Bakasan toilet seat only White,Armitage Shanks,57.37,This Armitage Shanks Bakasan oval toilet seat is made of white plastic and includes a stainless steel rod and plastic top fixing hinges.,Bathrooms and Kitchens/Toilets/Toilets.csv -> Armitage Shanks Bakasan toilet seat only White,,,https://www.wolseley.co.uk/wcsstore/ExtendedSitesCatalogAssetStore/images/products/AssetPush/wol-web-proof-medium-w/std.lang.all/87/00/NW-B88700_wm.jpg,https://www.wolseley.co.uk/wcsstore/ExtendedSitesCatalogAssetStore/images/products/AssetPush/DTP_AssetPushHighRes/std.lang.all/te/ch/Armitage_Shanks_Bakasan_Seats_Tech.pdf,https://www.wolseley.co.uk/wcsstore/ExtendedSitesCatalogAssetStore/images/products/AssetPush/DTP_AssetPushHighRes/std.lang.all/te/ch/Armitage_Shanks_Bakasan_S4062_Tech.pdf,https://www.wolseley.co.uk/wcsstore/ExtendedSitesCatalogAssetStore/images/products/AssetPush/DTP_AssetPushHighRes/std.lang.all/ic/al/B88700_Technical.pdf,,,,,,,,,,,,,,,,,,,,,,,,,,,,,,,,,,,,,,,,,,,,,,,,,,,,,,,,,,,,
