,pid,Title,Brand,Price,Description,category,mfpartnumber,whatisincluded,Image,Attachment 1,Attachment 2,Attachment 3,Colour,Range,Warranty,Hazardous,Soft Close Seat,Hinge Fixing,Hole Centres,Hinge Material,Material,Shape,Supplier Product Code,Type,WEEE Compliant,Feature 1,Feature 2,Feature 3,Feature 4,Feature 5,Depth (mm),Cistern Size,Design Type,Fittings Included,Toilet Pack Contents,Feature 6,Feature 7,Feature 8,Feature 9,Flush Type,Overflow Type,Air Pipe Supplied,Inlet Position,Flush Mechanism,Capacity Litre,Finish,Anti Slip,Pre-Drilled Waste Hole,Pre-Drilled Overflow,Grips/Handles,Attachment 4,Attachment 5,Feature 10,Feature 11,Feature 12,Feature 13,Feature 14,Feature 15,Attachment 6,Pack Quantity,Feature 16,Seat Projection,Material Type,Sector,Position,Thickness,Anti Slip Surface,Grips or Handles,Weight,Style,Mounting Type,Application
181,PD44952,Roca Debba Toilet seat with cover white including stainless steel hinges,Roca,67.66,"Made of tough white plastic to suit most bathrooms, the Roca Debba square toilet seat and cover includes long lasting stainless steel hinges for bottom fixing.",Bathrooms and Kitchens/Toilets/Toilets.csv -> Roca Debba Toilet seat with cover white including stainless steel hinges,,Toilet seat;Cover;Hinge,https://www.wolseley.co.uk/wcsstore/ExtendedSitesCatalogAssetStore/images/products/AssetPush/wol-web-proof-medium-w/std.lang.all/49/52/NW-D44952_wm.jpg,https://www.wolseley.co.uk/wcsstore/ExtendedSitesCatalogAssetStore/images/products/AssetPush/DTP_AssetPushHighRes/std.lang.all/ti/on/D44952_D00673_Installation.pdf,https://www.wolseley.co.uk/wcsstore/ExtendedSitesCatalogAssetStore/images/products/AssetPush/DTP_AssetPushHighRes/std.lang.all/ic/al/D44952_Technical.pdf,,,,,,,,,,,,,,,,,,,,,,,,,,,,,,,,,,,,,,,,,,,,,,,,,,,,,,,,,,,,,
182,PC03130,Ideal Standard Concept back to wall close coupled horizontal outlet isolated access pan White,Ideal Standard,257.54,"The Ideal Standard Concept close coupled, back to wall toilet pan with horizontal outlet has a contemporary elongated design and features the brand's cutting-edge water-saving Aquablade flush technology for higher performance, improved hygiene and easier cleaning.",Bathrooms and Kitchens/Toilets/Toilets.csv -> Ideal Standard Concept back to wall close coupled horizontal outlet isolated access pan White,,,https://www.wolseley.co.uk/wcsstore/ExtendedSitesCatalogAssetStore/images/products/AssetPush/wol-web-proof-medium-w/std.lang.all/31/30/NW-C03130_wm.jpg,https://www.wolseley.co.uk/wcsstore/ExtendedSitesCatalogAssetStore/images/products/AssetPush/DTP_AssetPushHighRes/std.lang.all/te/ch/IS_E801101_WC_Pan_Tech.pdf,,,,,,,,,,,,,,,,,,,,,,,,,,,,,,,,,,,,,,,,,,,,,,,,,,,,,,,,,,,,,,
183,PD74709,Ideal Standard i.Life S compact back-to-wall rimless WC pan with horizontal outlet,Ideal Standard,216.25,"A designer choice for a modern bathroom, the Ideal Standard iLife S compact back-to-wall rimless WC bowl is manufactured in robust vitreous china with a glossy white finish. With a reliably powerful flush and no overhanging rim, this toilet ensures thorough flushing and easy cleaning. Part of a broad collection of space saving pieces complete with furniture units, soft close toilet seats and more, this toilet pan can form part of a stylish matching suite.",Bathrooms and Kitchens/Toilets/Toilets.csv -> Ideal Standard i.Life S compact back-to-wall rimless WC pan with horizontal outlet,,,https://www.wolseley.co.uk/wcsstore/ExtendedSitesCatalogAssetStore/images/products/AssetPush/wol-web-proof-medium-w/std.lang.all/47/09/D74709_wm.jpg,,,,White,i.Life S,Lifetime,N,,,,,Vitreous China,Oval,T519701,,N,Compact design,Designed by Palomba Serafini Associati,Slow close seat option,Quick release seat for ease of cleaning,Water efficient design,,,Contemporary,Yes,,RimLS+ flush technology,Dedicated furniture unit available,Vitreous china construction,White gloss finish,,,,,,,,,,,,,,Horizontal outlet,With fixings,Lifetime warranty,,,,,,,,,,,,,,,,,
184,PD58817,Roca The Gap back to wall toilet pan White,Roca,302.51,"Designed by Antonio Bullo, Roca's The Gap back to wall toilet pan with horizontal outlet delivers on style and functionality. Comfort height for taller users or those with back and joint problems, this compact, closed rim toilet design makes the most of a modern bathroom space, bringing a touch of designer style to even the smallest room.",Bathrooms and Kitchens/Toilets/Toilets.csv -> Roca The Gap back to wall toilet pan White,,WC pan;Elbow;Fixing kit,https://www.wolseley.co.uk/wcsstore/ExtendedSitesCatalogAssetStore/images/products/AssetPush/wol-web-proof-medium-w/std.lang.all/88/17/NW-D58817_wm.jpg,https://www.wolseley.co.uk/wcsstore/ExtendedSitesCatalogAssetStore/images/products/AssetPush/DTP_AssetPushHighRes/std.lang.all/ic/al/Roca_A34747C00U_Technical.pdf,,,,,,,,,,,,,,,,,,,,,,,,,,,,,,,,,,,,,,,,,,,,,,,,,,,,,,,,,,,,,,
185,PC24476,Ideal Standard Concept wall hung toilet pan with AquaBlade technology White,Ideal Standard,287.82,"The Ideal Standard Concept wall hung toilet pan has a contemporary curved design and features the brand's cutting-edge water-saving flush technology for higher performance, improved hygiene and easier cleaning.",Bathrooms and Kitchens/Toilets/Toilets.csv -> Ideal Standard Concept wall hung toilet pan with AquaBlade technology White,,Toilet pan;Bots;Hidden fixing set,https://www.wolseley.co.uk/wcsstore/ExtendedSitesCatalogAssetStore/images/products/AssetPush/wol-web-proof-medium-w/std.lang.all/44/76/NW-C24476_wm.jpg,https://www.wolseley.co.uk/wcsstore/ExtendedSitesCatalogAssetStore/images/products/AssetPush/DTP_AssetPushHighRes/std.lang.all/te/ch/IS_E047301_WC_Pan_Tech.pdf,,,,,,,,,,,,,,,,,,,,,,,,,,,,,,,,,,,,,,,,,,,,,,,,,,,,,,,,,,,,,,
186,PJ57806,Twyford Option Push button dual flush cistern White,Twyford,64.06,"Twyford Option provides a series of fully adaptable and durable products that are not only affordable, but offer stylish bathroom solutions. This Twyford Option 380mm close-coupled white ceramic cistern has a 4/6L dual flush operated via a simple chrome push-button. Combine with Twyford Option CC Pan & Seat.",Bathrooms and Kitchens/Toilets/Toilets.csv -> Twyford Option Push button dual flush cistern White,,,https://www.wolseley.co.uk/wcsstore/ExtendedSitesCatalogAssetStore/images/products/AssetPush/wol-web-proof-medium-w/std.lang.all/ma/ge/J57806_Primary_Image_wm.jpg,https://www.wolseley.co.uk/wcsstore/ExtendedSitesCatalogAssetStore/images/products/AssetPush/DTP_AssetPushHighRes/std.lang.all/io/ns/J57806_Dimensions.pdf,https://www.wolseley.co.uk/wcsstore/ExtendedSitesCatalogAssetStore/images/products/AssetPush/DTP_AssetPushHighRes/std.lang.all/ti/on/Twyford_OT2396WH_Installation.pdf,https://www.wolseley.co.uk/wcsstore/ExtendedSitesCatalogAssetStore/images/products/AssetPush/DTP_AssetPushHighRes/std.lang.all/wi/ng/Twyford_Option_Drawing.pdf,,,,,,,,,,,,,,,,,,,,,,,,,,,,,,,,,,,,,,,https://www.wolseley.co.uk/wcsstore/ExtendedSitesCatalogAssetStore/images/products/AssetPush/DTP_AssetPushHighRes/std.lang.all/ic/al/Twyford_Option_CC_WC_Technical.pdf,,,,,,,,,,,,,,,,,,,,,
187,PB00191,Ideal Standard Tesi cloakroom toilet pack,Ideal Standard,300.0,"Making bathroom design easy, this Ideal Standard Tesi cloakroom WC pack with AquaBlade flush technology includes a back-to-wall toilet pan, close-coupled cistern and a thin toilet seat and cover. Slimline and elegant, the Tesi range is effortlessly modern with a classic feel that will stand the test of time, helping to ensure your bathroom will be loved for longer.",Bathrooms and Kitchens/Toilets/Toilets.csv -> Ideal Standard Tesi cloakroom toilet pack,,,https://www.wolseley.co.uk/wcsstore/ExtendedSitesCatalogAssetStore/images/products/AssetPush/wol-web-proof-medium-w/std.lang.all/1_/pk/B00191 PK_wm.jpg,https://www.wolseley.co.uk/wcsstore/ExtendedSitesCatalogAssetStore/images/products/AssetPush/DTP_AssetPushHighRes/std.lang.all/ic/al/T02635_Technical.pdf,https://www.wolseley.co.uk/wcsstore/ExtendedSitesCatalogAssetStore/images/products/AssetPush/DTP_AssetPushHighRes/std.lang.all/te/ch/IS_T355701_WC_Pan_Tech.pdf,https://www.wolseley.co.uk/wcsstore/ExtendedSitesCatalogAssetStore/images/products/AssetPush/DTP_AssetPushHighRes/std.lang.all/te/ch/IS_Tesi_CC_Toilet_Tech.pdf,,,,,,,,,,,,,,,,,,,,,,,,,,,,,,,,,,,,,,,https://www.wolseley.co.uk/wcsstore/ExtendedSitesCatalogAssetStore/images/products/AssetPush/DTP_AssetPushHighRes/std.lang.all/20/18/IS_Bathrooms_Brchr_2018.pdf,https://www.wolseley.co.uk/wcsstore/ExtendedSitesCatalogAssetStore/images/products/AssetPush/DTP_AssetPushHighRes/std.lang.all/ar/ts/IS_s_Tesi_Spare_Parts.pdf,,,,,,,,,,,,,,,,,,,,
188,PT02635,Ideal Standard Tesi thin seat and cover (slow closing),Ideal Standard,96.02,"Made of tough Duroplast plastic, the Ideal Standard Tesi D-shaped toilet seat and cover is supplied with easy take-off hinges for ease of cleaning. Designed to complement the Tesi bathroom range, this toilet seat has a smart modern design and soft close action for quieter use.",Bathrooms and Kitchens/Toilets/Toilets.csv -> Ideal Standard Tesi thin seat and cover (slow closing),,,https://www.wolseley.co.uk/wcsstore/ExtendedSitesCatalogAssetStore/images/products/AssetPush/wol-web-proof-medium-w/std.lang.all/26/35/T02635_wm.jpg,https://www.wolseley.co.uk/wcsstore/ExtendedSitesCatalogAssetStore/images/products/AssetPush/DTP_AssetPushHighRes/std.lang.all/ic/al/T02635_Technical.pdf,https://www.wolseley.co.uk/wcsstore/ExtendedSitesCatalogAssetStore/images/products/AssetPush/DTP_AssetPushHighRes/std.lang.all/20/18/IS_Bathrooms_Brchr_2018.pdf,https://www.wolseley.co.uk/wcsstore/ExtendedSitesCatalogAssetStore/images/products/AssetPush/DTP_AssetPushHighRes/std.lang.all/ar/ts/IS_s_Tesi_Spare_Parts.pdf,,,,,,,,,,,,,,,,,,,,,,,,,,,,,,,,,,,,,,,,,,,,,,,,,,,,,,,,,,,,
189,PB11920,Ideal Standard Studio Echo back to wall bowl White,Ideal Standard,171.99,The Ideal Standard Studio Echo back to wall rectangular toilet pan with horizontal outlet is easy to install and incorporates up-to-the-minute water saving technology along with a shorter projection ideal for use in smaller bathrooms.,Bathrooms and Kitchens/Toilets/Toilets.csv -> Ideal Standard Studio Echo back to wall bowl White,,Toilet pan;Concealed brackets,https://www.wolseley.co.uk/wcsstore/ExtendedSitesCatalogAssetStore/images/products/AssetPush/wol-web-proof-medium-w/std.lang.all/19/20/B11920_wm.jpg,https://www.wolseley.co.uk/wcsstore/ExtendedSitesCatalogAssetStore/images/products/AssetPush/DTP_AssetPushHighRes/std.lang.all/te/ch/IS_T282701_WC_Pan_Tech.pdf,,,,,,,,,,,,,,,,,,,,,,,,,,,,,,,,,,,,,,,,,,,,,,,,,,,,,,,,,,,,,,
190,PB61746,Nabis Vector 2 push button cistern cc pan,Nabis,74.8,"Operated with a simple push-button, the Nabis Vector close-coupled cistern and pan offers a 4/6L dual flush to help you save on water waste.",Bathrooms and Kitchens/Toilets/Toilets.csv -> Nabis Vector 2 push button cistern cc pan,,,https://www.wolseley.co.uk/wcsstore/ExtendedSitesCatalogAssetStore/images/products/AssetPush/wol-web-proof-medium-w/std.lang.all/17/46/B61746_wm.jpg,,,,White,Vector 2,5 Years,N,,,,,Ceramic,,C6602,Cistern,N,Ceramic construction,White finish,Push-button operation,4/6L dual flush,Close-coupled installation,142,,,Yes,,Left hand inlet,5 year warranty,,,Dual Flush,N/A,No,Left,Button,6 l,,,,,,,,,,,,,,,,,,,,,,,,,,,
191,PD58906,Roca The Gap square compact standard close seat and cover UF White,Roca,55.62,"Manufactured in robust urea, the Roca the Gap compact toilet seat and cover has a modern square shape and offers compatibility with a variety of WC pans from the same Roca range.",Bathrooms and Kitchens/Toilets/Toilets.csv -> Roca The Gap square compact standard close seat and cover UF White,,,https://www.wolseley.co.uk/wcsstore/ExtendedSitesCatalogAssetStore/images/products/AssetPush/wol-web-proof-medium-w/std.lang.all/89/07/D58906_D58907_wm.jpg,,,,White,The Gap,2,N,No,Top,160,Steel,Urea,Square,A801730002,,N,Easy installation,Urea construction,White finish,Steel hinges,Square-shaped,,,,,,Soft-close action,2 year warranty,,,,,,,,,,,,,,,,,,,,,,,,,,,,,,,,,,,
192,PT74820,RAK Ceramics Resort maxi close coupled full access open back wc pan (1),RAK Ceramics,231.66,"A practical yet stylish product, the RAK Resort Maxi close-coupled WC pan is ideal for modern family bathrooms. Extremely hygienic and easy to maintain, this full access open back toilet pan is manufactured in an extremely hardwearing ceramic with a neat, clean white gloss finish.",Bathrooms and Kitchens/Toilets/Toilets.csv -> RAK Ceramics Resort maxi close coupled full access open back wc pan (1),,WC Pan,https://www.wolseley.co.uk/wcsstore/ExtendedSitesCatalogAssetStore/images/products/AssetPush/wol-web-proof-medium-w/std.lang.all/48/20/T74820_wm.jpg,,,,White,Resort,25 Years,N,,,,,Ceramic,D Shaped,RSTPAN-MX,,N,Modern design,D-shaped,Durable ceramic construction,White colour,Full access for ease of maintenance,,,D Shaped,No,,25 year warranty,,,,,,,,,,,,,,,,,,,,,,,,1,,,,,,,,,,,,
193,PD21794,Ideal Standard i.life B Toilet Seat and Cover,Ideal Standard,66.25,"Part of a comprehensive modern bathroom range, the Ideal Standard i.Life toilet seat and cover is suitable for installation on rectangular WC pans. Manufactured in robust plastic, this toilet seat and cover set is finished in a high gloss white and has quick-release hinges for easy, quick cleaning.",Bathrooms and Kitchens/Toilets/Toilets.csv -> Ideal Standard i.life B Toilet Seat and Cover,,,https://www.wolseley.co.uk/wcsstore/ExtendedSitesCatalogAssetStore/images/products/AssetPush/wol-web-proof-medium-w/std.lang.all/17/94/D21794_wm.jpg,,,,White/Gloss,,5 Years,N,No,yes,180,Stainless Steel,Plastic,Rectangle,T468201,,N,Quick-release for easy cleaning,Stainless steel hinges,Normal close,Rectangular shape,Plastic construction,,,,,,Gloss white finish,5 year warranty,,,,,,,,,,,,,,,,,,,,,,,,,,,,,,,,,,,
194,PC21358,ARC/SPHERE E786001 C/C BSIO CISTERN 6/4L,Ideal Standard,168.19,"Sleekly designed and highly durable, the Ideal Concept Arc in-wall cistern is suitable for commercial use, offering a push button 4/6L dual flush for convenience.",Bathrooms and Kitchens/Toilets/Toilets.csv -> ARC/SPHERE E786001 C/C BSIO CISTERN 6/4L,,,https://www.wolseley.co.uk/wcsstore/ExtendedSitesCatalogAssetStore/images/products/AssetPush/wol-web-proof-medium-w/std.lang.all/13/58/NW-C21358_wm.jpg,https://www.wolseley.co.uk/wcsstore/ExtendedSitesCatalogAssetStore/images/products/AssetPush/DTP_AssetPushHighRes/std.lang.all/hu/re/IS_Concept_Brochure.pdf,https://www.wolseley.co.uk/wcsstore/ExtendedSitesCatalogAssetStore/images/products/AssetPush/DTP_AssetPushHighRes/std.lang.all/ic/al/IS_E786001_Technical.pdf,,,,,,,,,,,,,,,,,,,,,,,,,,,,,,,,,,,,,,,,,,,,,,,,,,,,,,,,,,,,,
195,PC34371,Ideal Standard i. life 170 x 70cm bath - two tap holes - White,Ideal Standard,251.43,"A simple rectangular design, the Ideal Standard i.Life 1700 x 700mm bath is manufactured in acrylic with a smart white finish. Two pre-drilled tapholes are included for the bath taps of your choice. This bath is part of the comprehensive i.Life range which includes a wide variety of fixtures and fittings to suit most bathroom designs.",Bathrooms and Kitchens/Toilets/Toilets.csv -> Ideal Standard i. life 170 x 70cm bath - two tap holes - White,,,https://www.wolseley.co.uk/wcsstore/ExtendedSitesCatalogAssetStore/images/products/AssetPush/wol-web-proof-medium-w/std.lang.all/43/71/C34371_wm.jpg,,,,White,,12 Months,N,,,,,Acrylic,Rectangular,T477501,,N,Acrylic construction,With 2x tapholes,White finish,12 month warranty,,,,BATH,Yes,,,,,,,,,,,,,,,,,,,,,,,,,,,,,,,,,,,,,,
196,PD44937,Roca The Gap cistern White,Roca,167.65,"The close coupled Roca The Gap toilet cistern is highly economical, saving water with every flush. This smart cistern flushes from an efficient distributor at the back of the toilet, providing push button-operated 4/2L flushing.",Bathrooms and Kitchens/Toilets/Toilets.csv -> Roca The Gap cistern White,,,https://www.wolseley.co.uk/wcsstore/ExtendedSitesCatalogAssetStore/images/products/AssetPush/wol-web-proof-medium-w/std.lang.all/49/37/NW-D44937_wm.jpg,https://www.wolseley.co.uk/wcsstore/ExtendedSitesCatalogAssetStore/images/products/AssetPush/DTP_AssetPushHighRes/std.lang.all/ti/on/Roca_A34173C000_Installation.pdf,https://www.wolseley.co.uk/wcsstore/ExtendedSitesCatalogAssetStore/images/products/AssetPush/DTP_AssetPushHighRes/std.lang.all/ic/al/Roca_A34173C000_Technical.pdf,,,,,,,,,,,,,,,,,,,,,,,,,,,,,,,,,,,,,,,,,,,,,,,,,,,,,,,,,,,,,
197,PT02634,Ideal Standard Tesi overwrap seat and cover (normal closing),Ideal Standard,52.38,The wrapover Ideal Standard Tesi D-shaped toilet seat and cover with normal bottom fixing hinges has a smart design in robust plastic. This simple loo seat is designed for compatibility with the Tesi bathroom range.,Bathrooms and Kitchens/Toilets/Toilets.csv -> Ideal Standard Tesi overwrap seat and cover (normal closing),,Toilet seat;Cover,https://www.wolseley.co.uk/wcsstore/ExtendedSitesCatalogAssetStore/images/products/AssetPush/wol-web-proof-medium-w/std.lang.all/26/34/NW-T02634_wm.jpg,https://www.wolseley.co.uk/wcsstore/ExtendedSitesCatalogAssetStore/images/products/AssetPush/DTP_AssetPushHighRes/std.lang.all/ar/ts/IS_s_Tesi_Spare_Parts.pdf,,,,,,,,,,,,,,,,,,,,,,,,,,,,,,,,,,,,,,,,,,,,,,,,,,,,,,,,,,,,,,
198,PP07588,Geberit Selnova close coupled toilet horizontal outlet,Geberit,136.61,"A classic design, the Geberit Selnova floor standing WC pan is a simple, understated toilet that will suit any bathroom. With its high-quality build and versatility, this round WC pan is made of robust vitreous china with a white finish.",Bathrooms and Kitchens/Toilets/Toilets.csv -> Geberit Selnova close coupled toilet horizontal outlet,,,https://www.wolseley.co.uk/wcsstore/ExtendedSitesCatalogAssetStore/images/products/AssetPush/wol-web-proof-medium-w/std.lang.all/75/88/NW-P07588_wm.jpg,https://www.wolseley.co.uk/wcsstore/ExtendedSitesCatalogAssetStore/images/products/AssetPush/DTP_AssetPushHighRes/std.lang.all/ic/al/Geberit_501041006_Technical.pdf,https://www.wolseley.co.uk/wcsstore/ExtendedSitesCatalogAssetStore/images/products/AssetPush/DTP_AssetPushHighRes/std.lang.all/hu/re/Geberit_Select_Series_Brochure.pdf,,,,,,,,,,,,,,,,,,,,,,,,,,,,,,,,,,,,,,,,,,,,,,,,,,,,,,,,,,,,,
199,PD44947,Roca Debba close coupled cistern with push button White,Roca,145.51,"The Roca Debba moulded close coupled cistern features an eco-friendly 3/4.5L dual flush. With its clean, contemporary look, this toilet cistern has been designed to complement the wider Debba range.",Bathrooms and Kitchens/Toilets/Toilets.csv -> Roca Debba close coupled cistern with push button White,,,https://www.wolseley.co.uk/wcsstore/ExtendedSitesCatalogAssetStore/images/products/AssetPush/wol-web-proof-medium-w/std.lang.all/49/47/NW-D44947_wm.jpg,https://www.wolseley.co.uk/wcsstore/ExtendedSitesCatalogAssetStore/images/products/AssetPush/DTP_AssetPushHighRes/std.lang.all/ti/on/Roca_TheGap_Installation.pdf,https://www.wolseley.co.uk/wcsstore/ExtendedSitesCatalogAssetStore/images/products/AssetPush/DTP_AssetPushHighRes/std.lang.all/ic/al/Roca_34199C00F_Technical.pdf,,,,,,,,,,,,,,,,,,,,,,,,,,,,,,,,,,,,,,,,,,,,,,,,,,,,,,,,,,,,,
200,PU94993,Geberit duofix elem WC+omega C/cist 12 cm,Geberit,372.3,"A robust and highly flexible design, the Geberit Duofix frame and 120mm Omega concealed cistern is the ideal choice for bathroom installations you can rely on. Not only are all aspects of this design tried and tested but it offers tool-free maintenance using parts that are always easy to get hold of, even years after installation. Reducing cleaning requirements and bacteria and dirt traps, this quiet concealed cistern solution is compatible with a wide range of flush plates, making it easy to find a solution that suits your interior while a dual flush with volume adjustment helps you to save water. Individually tested to ensure water tightness, the blow-moulded Omega cistern is capable of withstanding up to 400kg when combined with a Geberit wall-hung toilet pan.",Bathrooms and Kitchens/Toilets/Toilets.csv -> Geberit duofix elem WC+omega C/cist 12 cm,,,https://www.wolseley.co.uk/wcsstore/ExtendedSitesCatalogAssetStore/images/products/AssetPush/wol-web-proof-medium-w/std.lang.all/49/93/U94993_wm.jpg,https://www.wolseley.co.uk/wcsstore/ExtendedSitesCatalogAssetStore/images/products/AssetPush/DTP_AssetPushHighRes/std.lang.all/ta/ll/U94993_Install.pdf,https://www.wolseley.co.uk/wcsstore/ExtendedSitesCatalogAssetStore/images/products/AssetPush/DTP_AssetPushHighRes/std.lang.all/he/et/U94993_Tech_Sheet.pdf,,,,,,,,,,,,,,,,,,,,,,,,,,,,,,,,,,,,,,,,,,,,,,,,,,,,,,,,,,,,,
201,PU77323,Geberit iCon WC seat,Geberit,168.08,"The Geberit iCon range has a dynamic modern look, this seat is made of quality Duroplast. This gives the seat & lid a smooth non-porous surface, making it resistant to chemicals and scratch resistant, no fading, discolouration or yellowing. With a soft closing mechanism, a light touch is all thats needed to close the WC lid. The lid always closes slowly, even when given an occasional added push. This results in reduced material wear and ensures it can remain in use for longer. Combine with Geberit iCon Pans Overlapping lid Brass chrome-plated hinges Two year warranty Supplied with all necessary fittings",Bathrooms and Kitchens/Toilets/Toilets.csv -> Geberit iCon WC seat,,Toilet seat;Cover;Hinge,https://www.wolseley.co.uk/wcsstore/ExtendedSitesCatalogAssetStore/images/products/AssetPush/wol-web-proof-medium-w/std.lang.all/ma/ge/U77323_Primary_Image_wm.jpg,https://www.wolseley.co.uk/wcsstore/ExtendedSitesCatalogAssetStore/images/products/AssetPush/DTP_AssetPushHighRes/std.lang.all/io/ns/U77323_Dimensions.pdf,,,,,,,,,,,,,,,,,,,,,,,,,,,,,,,,,,,,,,,,,,,,,,,,,,,,,,,,,,,,,,
202,PB45273,Center CB 4-piece pack White,Center CB,109.2,"Making it easy to create a complete bathroom for any home, this Center CB complete bathroom pack includes a pedestal basin and close-coupled toilet with 6/3L water saving dual flush.",Bathrooms and Kitchens/Toilets/Toilets.csv -> Center CB 4-piece pack White,,,https://www.wolseley.co.uk/wcsstore/ExtendedSitesCatalogAssetStore/images/products/AssetPush/wol-web-proof-medium-w/std.lang.all/52/73/NW-B45273_wm.jpg,,,,,,,N,,,,,,,B45273 PK,Bathroom Pack,N,4-piece pack,With single tap hole basin,Close-coupled toilet,6/3L dual flush,,,,,,,,,,,,,,,,,,Yes,Yes,No,No,,,,,,,,,,,,,,,,,,,,,,
203,PB61669,Nabis Arno square back to wall pan,Nabis,165.16,"A compact design ideal for smaller sized bathrooms, the Nabis Arno back to wall pan has a stylish, modern square shape and shorter projection. Easy to clean and maintain, the Arno is finished in a high gloss white glaze.",Bathrooms and Kitchens/Toilets/Toilets.csv -> Nabis Arno square back to wall pan,,,https://www.wolseley.co.uk/wcsstore/ExtendedSitesCatalogAssetStore/images/products/AssetPush/wol-web-proof-medium-w/std.lang.all/16/69/NW-B61669_wm.jpg,https://www.wolseley.co.uk/wcsstore/ExtendedSitesCatalogAssetStore/images/products/AssetPush/DTP_AssetPushHighRes/std.lang.all/20/18/Nabis_PhaseII_Ceramic_Info_30Aug2018.pdf,https://www.wolseley.co.uk/wcsstore/ExtendedSitesCatalogAssetStore/images/products/AssetPush/DTP_AssetPushHighRes/std.lang.all/tr/ix/Toilet Seats & Pans Matrix.pdf,,,,,,,,,,,,,,,,,,,,,,,,,,,,,,,,,,,,,,,,,,,,,,,,,,,,,,,,,,,,,
204,PB61666,* NAB VECTOR II BTW HORIZ OUTLET PAN,Nabis,143.64,"The Nabis Vector 2 back to wall square toilet pan combines high performance and stylish design. Wall hung, the Vector has a modern finish ideal for installation in luxury bathrooms.",Bathrooms and Kitchens/Toilets/Toilets.csv -> * NAB VECTOR II BTW HORIZ OUTLET PAN,,,https://www.wolseley.co.uk/wcsstore/ExtendedSitesCatalogAssetStore/images/products/AssetPush/wol-web-proof-medium-w/std.lang.all/16/66/NW-B61666_wm.jpg,https://www.wolseley.co.uk/wcsstore/ExtendedSitesCatalogAssetStore/images/products/AssetPush/DTP_AssetPushHighRes/std.lang.all/tr/ix/Toilet Seats & Pans Matrix.pdf,,,,,,,,,,,,,,,,,,,,,,,,,,,,,,,,,,,,,,,,,,,,,,,,,,,,,,,,,,,,,,
205,PB61023,Center CB Lever operated cistern in gloss white,Center,78.05,"Operated with a simple lever, this Center CB white ceramic toilet cistern offers a single 6L flush.",Bathrooms and Kitchens/Toilets/Toilets.csv -> Center CB Lever operated cistern in gloss white,,,https://www.wolseley.co.uk/wcsstore/ExtendedSitesCatalogAssetStore/images/products/AssetPush/wol-web-proof-medium-w/std.lang.all/10/23/NW-B61023_wm.jpg,https://www.wolseley.co.uk/wcsstore/ExtendedSitesCatalogAssetStore/images/products/AssetPush/DTP_AssetPushHighRes/std.lang.all/wi/ng/Center_CB_B61023_Line_Drawing.pdf,https://www.wolseley.co.uk/wcsstore/ExtendedSitesCatalogAssetStore/images/products/AssetPush/DTP_AssetPushHighRes/std.lang.all/me/nt/BMA-Defra-WCo_Voluntary Agreement.pdf,,,,,,,,,,,,,,,,,,,,,,,,,,,,,,,,,,,,,,,,,,,,,,,,,,,,,,,,,,,,,
206,PB61036,Nabis Pride close coupled pan White,Nabis,98.47,"A real space saver, the Nabis Pride close coupled, elongated toilet pan is designed to add a contemporary touch to your bathroom dcor.",Bathrooms and Kitchens/Toilets/Toilets.csv -> Nabis Pride close coupled pan White,,,https://www.wolseley.co.uk/wcsstore/ExtendedSitesCatalogAssetStore/images/products/AssetPush/wol-web-proof-medium-w/std.lang.all/10/36/NW-B61036_wm.jpg,https://www.wolseley.co.uk/wcsstore/ExtendedSitesCatalogAssetStore/images/products/AssetPush/DTP_AssetPushHighRes/std.lang.all/ic/al/B61036_Nabis_Technical.pdf,https://www.wolseley.co.uk/wcsstore/ExtendedSitesCatalogAssetStore/images/products/AssetPush/DTP_AssetPushHighRes/std.lang.all/io/ns/Nabis_WC_Fitting_Instructions.pdf,https://www.wolseley.co.uk/wcsstore/ExtendedSitesCatalogAssetStore/images/products/AssetPush/DTP_AssetPushHighRes/std.lang.all/tr/ix/Toilet Seats & Pans Matrix.pdf,,,,,,,,,,,,,,,,,,,,,,,,,,,,,,,,,,,,,,,https://www.wolseley.co.uk/wcsstore/ExtendedSitesCatalogAssetStore/images/products/AssetPush/DTP_AssetPushHighRes/std.lang.all/20/18/Nabis_Care_Instructions_22Aug2018.pdf,,,,,,,,,,,,,,,,,,,,,
