,pid,Title,Brand,Price,Description,category,mfpartnumber,whatisincluded,Image,Attachment 1,Attachment 2
0,PF87779,Calder hank lead wool 500g,Calder,16.62,"Suitable for use as a caulking agent for sealing joints between lead and steel fittings, this 1/2kg hank of Calder lead wool is made of thin strands of lead. Supplied in a range of lead alloy specifications ranging from 0 to 0.5% antimony to chemical A, lead wool is available in different make-ups to suit a variety of applications.",Drainage/Rainwater Guttering and Fittings/Lead and Flashing/Flashing Fittings/Flashing Fittings.csv -> Calder hank lead wool 500g,,,https://www.wolseley.co.uk/wcsstore/ExtendedSitesCatalogAssetStore/images/products/AssetPush/wol-web-proof-medium-w/std.lang.all/77/79/NW-F87779_wm.jpg,https://www.wolseley.co.uk/wcsstore/ExtendedSitesCatalogAssetStore/images/products/AssetPush/DTP_AssetPushHighRes/std.lang.all/hu/re/Calder_Lead-Related_Prods_Brochure.pdf,https://www.wolseley.co.uk/wcsstore/ExtendedSitesCatalogAssetStore/images/products/AssetPush/DTP_AssetPushHighRes/std.lang.all/ms/ds/Calder_Lead_Metal_Sheet_MSDS.pdf
1,PF47350,"McAlpine Macflash RS1 roof flashing pipe 4"" 18 x 18",McAlpine,29.96,"Made of high grade aluminium, this easy to install McAlpine Macflash 4"" 18 x 18 RS1 roof flashing pipe is designed with a die-formed synthetic rubber collar. Suitable for flat roof use, this flashing pipe can also be installed in a roof with a pitch of up to 45°.","Drainage/Rainwater Guttering and Fittings/Lead and Flashing/Flashing Fittings/Flashing Fittings.csv -> McAlpine Macflash RS1 roof flashing pipe 4"" 18 x 18",,,https://www.wolseley.co.uk/wcsstore/ExtendedSitesCatalogAssetStore/images/products/AssetPush/wol-web-proof-medium-w/std.lang.all/73/50/F47350_wm.jpg,https://www.wolseley.co.uk/wcsstore/ExtendedSitesCatalogAssetStore/images/products/AssetPush/DTP_AssetPushHighRes/std.lang.all/wi/ng/McAlpine_RS1_Drawing.pdf,
2,PF87721,Calder 42130032 lead flashing clips (Pack of 50),Calder,9.79,"Suitable for use with lead flashings, this pack of Calder clips provides a strong, secure alternative to lead wedges, putting less pressure on the surrounding joints. Ensuring a reliable hold on the flashing, these clips also allow for natural thermal expansion.",Drainage/Rainwater Guttering and Fittings/Lead and Flashing/Flashing Fittings/Flashing Fittings.csv -> Calder 42130032 lead flashing clips (Pack of 50),,,https://www.wolseley.co.uk/wcsstore/ExtendedSitesCatalogAssetStore/images/products/AssetPush/wol-web-proof-medium-w/std.lang.all/77/21/NW-F87721_wm.jpg,https://www.wolseley.co.uk/wcsstore/ExtendedSitesCatalogAssetStore/images/products/AssetPush/DTP_AssetPushHighRes/std.lang.all/hu/re/Calder_Lead-Related_Prods_Brochure.pdf,https://www.wolseley.co.uk/wcsstore/ExtendedSitesCatalogAssetStore/images/products/AssetPush/DTP_AssetPushHighRes/std.lang.all/ms/ds/Calder_Lead_Metal_Sheet_MSDS.pdf
3,PF87775,Calder expansion joint wide 3mtr x 390mm,Calder,390.56,"Cost-effective, durable and easy to install, this Calder 3M x 390mm gutter expansion joint is ideal for use in roof designs where traditional lead-lined gutter installations are not suitable and won't fulfil the required drip provision. The joint is made up of two lead strips connected by a vulcanised double-sided EPDM synthetic rubber band.",Drainage/Rainwater Guttering and Fittings/Lead and Flashing/Flashing Fittings/Flashing Fittings.csv -> Calder expansion joint wide 3mtr x 390mm,,,https://www.wolseley.co.uk/wcsstore/ExtendedSitesCatalogAssetStore/images/products/AssetPush/wol-web-proof-medium-w/std.lang.all/77/75/NW-F87775_wm.jpg,https://www.wolseley.co.uk/wcsstore/ExtendedSitesCatalogAssetStore/images/products/AssetPush/DTP_AssetPushHighRes/std.lang.all/hu/re/Calder_Lead-Related_Prods_Brochure.pdf,
4,PF87697,Calder Geotec 220PY 220py underlay 25mtr x 1000mm,Calder,44.1,"Calder Geotec 220PY 25M x 1000mm textile underlay is designed to prevent ridges and fractures in lead sheet where thermal movement causes it to pass over the edges of boards. Easy to work with, Geotec weighs just 220g/M² and is made of a durable, high quality non-woven polyester.",Drainage/Rainwater Guttering and Fittings/Lead and Flashing/Flashing Fittings/Flashing Fittings.csv -> Calder Geotec 220PY 220py underlay 25mtr x 1000mm,,,https://www.wolseley.co.uk/wcsstore/ExtendedSitesCatalogAssetStore/images/products/AssetPush/wol-web-proof-medium-w/std.lang.all/76/97/NW-F87697_wm.jpg,https://www.wolseley.co.uk/wcsstore/ExtendedSitesCatalogAssetStore/images/products/AssetPush/DTP_AssetPushHighRes/std.lang.all/hu/re/Calder_Lead-Related_Prods_Brochure.pdf,
5,PF68764,Polypipe vent flashing sleeve 110mm Black,Polypipe,15.51,"Suitable for domestic use, this Polypipe weathering apron is made of black plastic and incorporates 110mm solvent weld connections.",Drainage/Rainwater Guttering and Fittings/Lead and Flashing/Flashing Fittings/Flashing Fittings.csv -> Polypipe vent flashing sleeve 110mm Black,,,https://www.wolseley.co.uk/wcsstore/ExtendedSitesCatalogAssetStore/images/products/AssetPush/wol-web-proof-medium-w/std.lang.all/87/64/NW-F68764_wm.jpg,https://www.wolseley.co.uk/wcsstore/ExtendedSitesCatalogAssetStore/images/products/AssetPush/DTP_AssetPushHighRes/std.lang.all/20/15/Polypipe_Building_Prod_Guide_May2015.pdf,
