,pid,Title,Brand,Price,Description,category,mfpartnumber,whatisincluded,Image,Attachment 1,Attachment 2,Attachment 3,Attachment 4,Attachment 5
0,PF15130,"Center CB 90deg knuckle bend 3/4""",Center CB,1.16,"Made of PVC-U, this Center CB 21.5mm knuckle bend is part of the brand's solvent weld overflow range designed for secure, reliable joints with a built-to-last professional finish. Offering quick, hassle-free installation, this compact system is ideal for toilet overflows and boiler condensate use.","Drainage/Overflow/Overflow Pipe Bends/Overflow Pipe Bends.csv -> Center CB 90deg knuckle bend 3/4""",,,https://www.wolseley.co.uk/wcsstore/ExtendedSitesCatalogAssetStore/images/products/AssetPush/wol-web-proof-medium-w/std.lang.all/51/30/NW-F15130_wm.jpg,https://www.wolseley.co.uk/wcsstore/ExtendedSitesCatalogAssetStore/images/products/AssetPush/DTP_AssetPushHighRes/std.lang.all/20/19/Center_CB_DrainageProductGuide_2019.pdf,,,,
1,PF15131,"Center CB 45deg bend 3/4""",Center CB,0.73,"Made of durable PVC-U, this Center CB 21.5mm bend is part of the brand's solvent weld overflow range designed for secure, reliable joints with a built-to-last professional finish. Offering quick, hassle-free installation, this compact system is ideal for toilet overflows and boiler condensate use.","Drainage/Overflow/Overflow Pipe Bends/Overflow Pipe Bends.csv -> Center CB 45deg bend 3/4""",,,https://www.wolseley.co.uk/wcsstore/ExtendedSitesCatalogAssetStore/images/products/AssetPush/wol-web-proof-medium-w/std.lang.all/51/31/NW-F15131_wm.jpg,https://www.wolseley.co.uk/wcsstore/ExtendedSitesCatalogAssetStore/images/products/AssetPush/DTP_AssetPushHighRes/std.lang.all/20/19/Center_CB_DrainageProductGuide_2019.pdf,,,,
2,PF68152,Polypipe 90deg solvent-weld overflow knuckle bend 21.5mm White,Polypipe,2.94,"Suitable for domestic use, this Polypipe knuckle bend is made of white ABS and incorporates 21.5mm solvent weld connections.",Drainage/Overflow/Overflow Pipe Bends/Overflow Pipe Bends.csv -> Polypipe 90deg solvent-weld overflow knuckle bend 21.5mm White,,,https://www.wolseley.co.uk/wcsstore/ExtendedSitesCatalogAssetStore/images/products/AssetPush/wol-web-proof-medium-w/std.lang.all/81/52/NW-F68152_wm.jpg,https://www.wolseley.co.uk/wcsstore/ExtendedSitesCatalogAssetStore/images/products/AssetPush/DTP_AssetPushHighRes/std.lang.all/20/15/Polypipe_Building_Prod_Guide_May2015.pdf,,,,
3,PF68161,Polypipe 45deg solvent-weld overflow bend 21.5mm White,Polypipe,3.18,"Suitable for domestic use, this Polypipe bend is made of white ABS and incorporates 21.5mm solvent weld connections.",Drainage/Overflow/Overflow Pipe Bends/Overflow Pipe Bends.csv -> Polypipe 45deg solvent-weld overflow bend 21.5mm White,,,https://www.wolseley.co.uk/wcsstore/ExtendedSitesCatalogAssetStore/images/products/AssetPush/wol-web-proof-medium-w/std.lang.all/81/61/NW-F68161_wm.jpg,https://www.wolseley.co.uk/wcsstore/ExtendedSitesCatalogAssetStore/images/products/AssetPush/DTP_AssetPushHighRes/std.lang.all/20/15/Polypipe_Building_Prod_Guide_May2015.pdf,,,,
4,PQ66708,Wavin Osma Waste 90deg ABS bend 21.5mm White,Wavin,3.06,This Wavin Osma Waste 21.5mm bend is made of white ABS and is part of a solvent weld system designed to remove overflow water from condensing boilers and cisterns or tanks.,Drainage/Overflow/Overflow Pipe Bends/Overflow Pipe Bends.csv -> Wavin Osma Waste 90deg ABS bend 21.5mm White,,,https://www.wolseley.co.uk/wcsstore/ExtendedSitesCatalogAssetStore/images/products/AssetPush/wol-web-proof-medium-w/std.lang.all/67/08/NW-Q66708_wm.jpg,https://www.wolseley.co.uk/wcsstore/ExtendedSitesCatalogAssetStore/images/products/AssetPush/DTP_AssetPushHighRes/std.lang.all/ms/ds/Wavin_ABS_MSDS.pdf,https://www.wolseley.co.uk/wcsstore/ExtendedSitesCatalogAssetStore/images/products/AssetPush/DTP_AssetPushHighRes/std.lang.all/ti/on/Wavin_Osma_Soil-Waste_Installation.pdf,https://www.wolseley.co.uk/wcsstore/ExtendedSitesCatalogAssetStore/images/products/AssetPush/DTP_AssetPushHighRes/std.lang.all/ta/ll/Wavin_Osma_Waste_Water_Drain_Install.pdf,https://www.wolseley.co.uk/wcsstore/ExtendedSitesCatalogAssetStore/images/products/AssetPush/DTP_AssetPushHighRes/std.lang.all/br/cr/Wavin_Osma_RoundLine_Drainage_Brcr.pdf,https://www.wolseley.co.uk/wcsstore/ExtendedSitesCatalogAssetStore/images/products/AssetPush/DTP_AssetPushHighRes/std.lang.all/ca/te/Wavin_OsmaSoil_Waste_Certificate.pdf
5,PF41619,"McAlpine R2M 90deg multi-fit overflow bend 3/4""",McAlpine,2.0,A McAlpine 90° overflow bend with 19/23mm universal compression connections.,"Drainage/Overflow/Overflow Pipe Bends/Overflow Pipe Bends.csv -> McAlpine R2M 90deg multi-fit overflow bend 3/4""",,,https://www.wolseley.co.uk/wcsstore/ExtendedSitesCatalogAssetStore/images/products/AssetPush/wol-web-proof-medium-w/std.lang.all/16/19/F41619_wm.jpg,https://www.wolseley.co.uk/wcsstore/ExtendedSitesCatalogAssetStore/images/products/AssetPush/DTP_AssetPushHighRes/std.lang.all/wi/ng/F41619_Drawing.pdf,https://www.wolseley.co.uk/wcsstore/ExtendedSitesCatalogAssetStore/images/products/AssetPush/DTP_AssetPushHighRes/std.lang.all/ic/al/McAlpine_Plumbing_Products_Technical.pdf,https://www.wolseley.co.uk/wcsstore/ExtendedSitesCatalogAssetStore/images/products/AssetPush/DTP_AssetPushHighRes/std.lang.all/og/ue/McAlpine_Plumbing_Products_Catalogue.pdf,,
6,PF24984,21.5MM X 45DEG OVERFLOW BEND        OB45,Marley,3.14,"Suitable for overflow and boiler condensate use, this Marley Overflow 45° bend in white is supplied with 21.5mm solvent weld connections.",Drainage/Overflow/Overflow Pipe Bends/Overflow Pipe Bends.csv -> 21.5MM X 45DEG OVERFLOW BEND        OB45,,,https://www.wolseley.co.uk/wcsstore/ExtendedSitesCatalogAssetStore/images/products/AssetPush/wol-web-proof-medium-w/std.lang.all/49/84/NW-F24984_wm.jpg,https://www.wolseley.co.uk/wcsstore/ExtendedSitesCatalogAssetStore/images/products/AssetPush/DTP_AssetPushHighRes/std.lang.all/hu/re/Marley_Soil-Waste_Brochure.pdf,,,,
7,PF24983,MLY 21.5MMX90D OVERFLOW BEND  OB90,Marley,3.14,"Suitable for overflow and boiler condensate use, this Marley Overflow 90° bend in white is supplied with 21.5mm solvent weld connections.",Drainage/Overflow/Overflow Pipe Bends/Overflow Pipe Bends.csv -> MLY 21.5MMX90D OVERFLOW BEND  OB90,,,https://www.wolseley.co.uk/wcsstore/ExtendedSitesCatalogAssetStore/images/products/AssetPush/wol-web-proof-medium-w/std.lang.all/49/83/NW-F24983_wm.jpg,https://www.wolseley.co.uk/wcsstore/ExtendedSitesCatalogAssetStore/images/products/AssetPush/DTP_AssetPushHighRes/std.lang.all/hu/re/Marley_Soil-Waste_Brochure.pdf,,,,
