248,P443766,Glow-worm tube clip,Glow-worm,8.53,"A small accessory, this genuine Glow-worm clip is used to safely secure parts in the heat exchanger of British Gas, Flexicom, Ultimate and Ultrapower boilers.  The heat exchanger transfers heat from a boiler's burner to water. A primary heat exchanger is found in all boilers, using heat from a burner to raise the temperature of the water in the system while a secondary heat exchanger is present only in combis and allows the heat to be transferred between closed systems.  As the UK’s leading parts specialist, Wolseley carry the widest range of spares, stocking all the big name brands for the trade. Now, to give our customers even more support, we’re adding a greater number of specified parts from leading manufacturers into our branches with the introduction of the Wolseley Branch Parts Accreditation Scheme. Many branches will now be Silver and Gold accredited, a sign that they hold more stock than anyone else, so you can be confident you’ll get the parts you need to fix it first time. Fast.",Parts and Spares/sub_categories/Domestic Boiler Parts/sub_categories/Glow Worm Boiler Parts/Glow Worm Boiler Parts.csv -> Glow-worm tube clip,,,https://www.wolseley.co.uk/wcsstore/ExtendedSitesCatalogAssetStore/images/products/AssetPush/wol-web-proof-medium-w/std.lang.all/37/66/443766_wm.jpg,,N,"BG330+, 24CX, 30SX, 18HX, 24HX, 30CX, 24H, SXI 100, 35CX, 35HX, 30HX, 12HX, 15HX, 18SX, SXI 170",Heat Exchanger,"British Gas, Flexicom, Ultimate, Ultrapower",H42714,"35CX,18HX,24CX,15HX,30CX,35HX,24HX,24H,12HX,BG330,SXI 170,30SX,SXI 100,30HX,18SX",0020020742,Clip,N,,,,,,,,
249,P410647,Glow-worm hydrobloc return group,Glow-worm,52.17,"A Glow-worm part, this hydroblock return group is for fitting in the diverter valve of Betacom appliances.  A directional water device in combi boilers, a diverter valve directs hot water into a heating system or a hot water system. This feature means that combis are able to provide both heating and hot water without the need for a storage cylinder.  As the UK’s leading parts specialist, Wolseley carry the widest range of spares, stocking all the big name brands for the trade. Now, to give our customers even more support, we’re adding a greater number of specified parts from leading manufacturers into our branches with the introduction of the Wolseley Branch Parts Accreditation Scheme. Many branches will now be Silver and Gold accredited, a sign that they hold more stock than anyone else, so you can be confident you’ll get the parts you need to fix it first time. Fast.",Parts and Spares/sub_categories/Domestic Boiler Parts/sub_categories/Glow Worm Boiler Parts/Glow Worm Boiler Parts.csv -> Glow-worm hydrobloc return group,,"Flow sensor, impeller, filter and seals",https://www.wolseley.co.uk/wcsstore/ExtendedSitesCatalogAssetStore/images/products/AssetPush/wol-web-proof-medium-w/std.lang.all/06/47/410647_wm.jpg,,N,"Betacom 30C, Betacom 24C",Diverter Valve,Betacom,,"Betacom 30C,Betacom 24C",0020061630,Return Group,N,,,,,,,,
250,P442278,Glow-worm tap,Glow-worm,32.01,"A Glow-worm filling loop tap for CXI and Eden boilers.  For use in central heating boilers and systems, allowing the user to manually top-up the amount of water in the system if the pressure drops. External loops are usually removable in keeping with regulations, while internal filling loops normally feature a key that can be removed to interrupt the connection after use.  As the UK’s leading parts specialist, Wolseley carry the widest range of spares, stocking all the big name brands for the trade. Now, to give our customers even more support, we’re adding a greater number of specified parts from leading manufacturers into our branches with the introduction of the Wolseley Branch Parts Accreditation Scheme. Many branches will now be Silver and Gold accredited, a sign that they hold more stock than anyone else, so you can be confident you’ll get the parts you need to fix it first time. Fast.",Parts and Spares/sub_categories/Domestic Boiler Parts/sub_categories/Glow Worm Boiler Parts/Glow Worm Boiler Parts.csv -> Glow-worm tap,,,https://www.wolseley.co.uk/wcsstore/ExtendedSitesCatalogAssetStore/images/products/AssetPush/wol-web-proof-medium-w/std.lang.all/22/78/442278_wm.jpg,,N,"38CXI, 30CXI, Cb, 24CXI",Heat Exchanger,"CXI, Eden",E88848,"30CXI,38CXI,24CXI,Cb",801679,Tap,N,,,,,,,,
251,P443892,Glow-worm 2000802452 gas valve assembly,Glow-worm,364.66,"A replacement gas valve for Glow-worm British Gas and HXI appliances.  The gas valve is employed in the distribution of gas. When gas is required in the burner the printed circuit board (PCB) sends a signal to the gas valve, which opens to allow gas to flow into the burner or the pilot assembly (depending on the model of the appliance).  As the leading supplier of parts for all the major boiler manufacturers we’ve got a wealth of experience and knowledge in this area, and with over 450 branches we carry more heating spare parts in more places than any other merchant to help you improve your first time fix rate.",Parts and Spares/sub_categories/Domestic Boiler Parts/sub_categories/Glow Worm Boiler Parts/Glow Worm Boiler Parts.csv -> Glow-worm 2000802452 gas valve assembly,,,https://www.wolseley.co.uk/wcsstore/ExtendedSitesCatalogAssetStore/images/products/AssetPush/wol-web-proof-medium-w/std.lang.all/38/92/443892_wm.jpg,https://www.wolseley.co.uk/wcsstore/ExtendedSitesCatalogAssetStore/images/products/AssetPush/DTP_AssetPushHighRes/std.lang.all/ti/on/Glow-worm_DungsGasValve_Instruction.pdf,,,,,,,,,,,,,,,,,
252,P410626,Glow-worm plate to plate 24kw,Glow-worm,172.26,"A Glow-worm heat exchanger suitable for Betacom boilers.  The heat exchanger transfers heat from a boiler's burner to water. A primary heat exchanger is found in all boilers, using heat from a burner to raise the temperature of the water in the system while a secondary heat exchanger is present only in combis and allows the heat to be transferred between closed systems.  We carry over 300 of the most in demand parts in-branch and stock over 25,000 spare parts available for next-day timed delivery.",Parts and Spares/sub_categories/Domestic Boiler Parts/sub_categories/Glow Worm Boiler Parts/Glow Worm Boiler Parts.csv -> Glow-worm plate to plate 24kw,,,https://www.wolseley.co.uk/wcsstore/ExtendedSitesCatalogAssetStore/images/products/AssetPush/wol-web-proof-medium-w/std.lang.all/06/26/410626_wm.jpg,,N,"Betacom 30C, Betacom 24C",Heat Exchanger,Betacom,723931,"Betacom 30C,Betacom 24C",0020061614,Heat Exchanger,N,,,,,,,,
253,P443776,Glow-worm fibre washer seal,Glow-worm,8.53,"A Glow-worm brand replacement washer for use in Betacom, Flexicom, Ultimate and Easicom boilers.  Washers, along with O-rings and gaskets, are used in many different areas of the boiler to join parts to pipework. Among others sections, heat exchangers and gas valves require these parts to prevent gas and water leaks.  To help you find the right parts for your jobs, go to the industry leading parts identification tool, PartsArena, giving you quick access to over 20,000 exploded diagrams, 10,000 images & 20,000 products. FREE to Wolseley trade account customers.",Parts and Spares/sub_categories/Domestic Boiler Parts/sub_categories/Glow Worm Boiler Parts/Glow Worm Boiler Parts.csv -> Glow-worm fibre washer seal,,,https://www.wolseley.co.uk/wcsstore/ExtendedSitesCatalogAssetStore/images/products/AssetPush/wol-web-proof-medium-w/std.lang.all/37/76/443776_wm.jpg,,N,"Betacom 2 28, Betacom 24A, 24CX, 35CX, 18SX, 30C, Betacom 28A, Betacom 2 24, Easicom 24, 35C, Easicom 28, 30SX, 30CX",Hydraulics,"Betacom, Flexicom, Ultimate, Easicom",H42747,"35CX,24CX,35C,Betacom 2 24,30CX,30C,Betacom 28A,30SX,Betacom 24A,Easicom 28,18SX,Betacom 2 28,Easicom 24",0020020755,Washer,N,,,,,,,,
254,P410663,Glow-worm 0020020501 packing ring,Glow-worm,17.62,"A Glow-worm spare, this packing ring pack is for use in the heat exchanger of CXI, Easicom, Energy, Energy 7, Flexicom, Home, HXI, Ultimate, Ultracom, Ultracom2, Ultrapower, Ultimate 3, Energy 2, Essential, Sustain, Ultimate 2, Betacom, British Gas, Eden, SXI and Xtramax units,  O-rings, gaskets and washers are used in many different areas of the boiler to join parts to pipework. Among others sections, heat exchangers and gas valves require these parts to prevent gas and water leaks.  As the UK’s leading parts specialist, Wolseley carry the widest range of spares, stocking all the big name brands for the trade. Now, to give our customers even more support, we’re adding a greater number of specified parts from leading manufacturers into our branches with the introduction of the Wolseley Branch Parts Accreditation Scheme. Many branches will now be Silver and Gold accredited, a sign that they hold more stock than anyone else, so you can be confident you’ll get the parts you need to fix it first time. Fast.",Parts and Spares/sub_categories/Domestic Boiler Parts/sub_categories/Glow Worm Boiler Parts/Glow Worm Boiler Parts.csv -> Glow-worm 0020020501 packing ring,,Sealing ring,https://www.wolseley.co.uk/wcsstore/ExtendedSitesCatalogAssetStore/images/products/AssetPush/wol-web-proof-medium-w/std.lang.all/06/63/410663_wm.jpg,,N,"30CXI, 38CXI, Easicom 2 28, Easicom 28, Easicom 3 25s, 15s, 18s, 25r, 15r, 24HX, 35HX, 15r, 15HXI, 38HXI, 24H, 15HXi, 30SXi, 18 SXi, SXI 170, Easicom 24, Easicom 3 25r, 18r, 25s, 35c, 18r, 30SX, 30c, Ultimate 3 30c, 24CX, 38HXi, 24CXI, Easicom 2 24, 30r,",Heat Exchanger,"CXI, Easicom, Energy, Energy 7, Flexicom, Home, HXI, Ultimate, Ultracom, Ultracom2, Ultrapower, Ultimate 3, Energy 2, Essential, Sustain, Ultimate 2, Betacom, British Gas, Eden, SXI, Xtramax",722818,"35CX,24C,12 S,24HX,30CX,38CXI,30C,30 S,24c P,Betacom 3 24C,Betacom 28A,18 S,15r,25r,15s,35r,30CXI,30HXI,Easicom 2 24,Easicom 28,18SX,Betacom 4 24C,38HXI,Easicom 2 28,15HXI,18HX,24CX,35C,25 S,35HX,Easicom 3 25s,24CXI,25 C,12r,12HXI,30r,30HX",0020020501,Packing Ring Pack,N,,,,,,,,
255,P441881,Glow-worm thermocouple,Glow-worm,30.09,"This Glow-worm thermocouple is a spare part for boilers in the Economy Plus, Fuelsaver, Fuelsaver UFB and Economy ranges.  Made of two metals, each producing a slight electrical charge when heated on one side, the thermocouple is involved in the opening and closing of the boiler's valves.  As the leading supplier of parts for all the major boiler manufacturers we’ve got a wealth of experience and knowledge in this area, and with over 450 branches we carry more heating spare parts in more places than any other merchant to help you improve your first time fix rate.",Parts and Spares/sub_categories/Domestic Boiler Parts/sub_categories/Glow Worm Boiler Parts/Glow Worm Boiler Parts.csv -> Glow-worm thermocouple,,,https://www.wolseley.co.uk/wcsstore/ExtendedSitesCatalogAssetStore/images/products/AssetPush/wol-web-proof-medium-w/std.lang.all/18/81/441881_wm.jpg,,N,"30B, 30C, 50B MK2, 60BR MK2, 40B, 40C, 60C, 60B MK2, 24B, 30C, 75B, 30B MK2, 75B MK2, 40B, 40C, 75C, 50R MK2, 24, 40BR MK2, 60C MK2, 75R MK2, 40, 50C, 60B, 60C, 75C, 40C MK2, 30B, 30, 50, 30R MK2, 50BR MK2, 60R MK2, 75BR MK2, 75C MK2, 60, 50B, 50C, 30BR",Control Panel,"Economy Plus, Fuelsaver, Fuelsaver UFB, Economy",394162,"60R MK2,24B,75B MK2,30B MK2,24,60C MK2,30B,40 B,30C,50B,40 C,60B,50C,60C,30R MK2,75R MK2,60B MK2,40C MK2,30BR MK2,40BR MK2,50,30,75BR MK2,50BR MK2,60BR MK2,40B MK2,75B,75C,50R MK2,50C MK2,40R MK2,60,30C MK2,40,75C MK2,50B MK2",S900000,Thermocouple,N,,,,,,,,
256,P440761,Glow-worm seal case side,Glow-worm,10.82,"This Glow-worm seal is suitable for use in the casing of Xeon, Ultimate and Micron boilers.  Seals are used in many different boiler parts and are designed to prevent leaks of water or harmful gases as they move through the unit.  We carry over 300 of the most in demand parts in-branch and stock over 25,000 spare parts available for next-day timed delivery.",Parts and Spares/sub_categories/Domestic Boiler Parts/sub_categories/Glow Worm Boiler Parts/Glow Worm Boiler Parts.csv -> Glow-worm seal case side,,,https://www.wolseley.co.uk/wcsstore/ExtendedSitesCatalogAssetStore/images/products/AssetPush/wol-web-proof-medium-w/std.lang.all/07/61/440761_wm.jpg,,N,"120 FF, 120 FF, 100FF, 100 FF, 120FF, 120FF, 100FF, 100 FF",Casing,"Xeon, Ultimate, Micron",278170,"120FF,100 FF",S212231,Seal,N,,,,,,,,
257,P464528,Glow-worm plate heat exchanger,Glow-worm,204.81,"This secondary plate heat exchanger is suitable for use in Glow-worm's Betacom boiler.  The heat exchanger transfers heat from a boiler's burner to water. A primary heat exchanger is found in all boilers, using heat from a burner to raise the temperature of the water in the system, while a secondary heat exchanger is present only in combis and allows the heat to be transferred between closed systems.  As the UK’s leading parts specialist, Wolseley carry the widest range of spares, stocking all the big name brands for the trade. Now, to give our customers even more support, we’re adding a greater number of specified parts from leading manufacturers into our branches with the introduction of the Wolseley Branch Parts Accreditation Scheme. Many branches will now be Silver and Gold accredited, a sign that they hold more stock than anyone else, so you can be confident you’ll get the parts you need to fix it first time. Fast.",Parts and Spares/sub_categories/Domestic Boiler Parts/sub_categories/Glow Worm Boiler Parts/Glow Worm Boiler Parts.csv -> Glow-worm plate heat exchanger,,Heat exchanger;4x gaskets,https://www.wolseley.co.uk/wcsstore/ExtendedSitesCatalogAssetStore/images/products/AssetPush/wol-web-proof-medium-w/std.lang.all/45/28/464528_wm.jpg,https://www.wolseley.co.uk/wcsstore/ExtendedSitesCatalogAssetStore/images/products/AssetPush/DTP_AssetPushHighRes/std.lang.all/ti/on/Glow-worm_Betacom_Installation.pdf,,,,,,,,,,,,,,,,,
258,P427168,Glow-worm packing ring set (Pack of 10),Glow-worm,8.53,"A Glow-worm spare, this packing ring set contains 10x packing rings for use in the heat exchanger of Ultracom units,  O-rings, gaskets and washers are used in many different areas of the boiler to join parts to pipework. Among others sections, heat exchangers and gas valves require these parts to prevent gas and water leaks.  As the UK’s leading parts specialist, Wolseley carry the widest range of spares, stocking all the big name brands for the trade. Now, to give our customers even more support, we’re adding a greater number of specified parts from leading manufacturers into our branches with the introduction of the Wolseley Branch Parts Accreditation Scheme. Many branches will now be Silver and Gold accredited, a sign that they hold more stock than anyone else, so you can be confident you’ll get the parts you need to fix it first time. Fast.",Parts and Spares/sub_categories/Domestic Boiler Parts/sub_categories/Glow Worm Boiler Parts/Glow Worm Boiler Parts.csv -> Glow-worm packing ring set (Pack of 10),,10x packing rings,https://www.wolseley.co.uk/wcsstore/ExtendedSitesCatalogAssetStore/images/products/AssetPush/wol-web-proof-medium-w/std.lang.all/71/68/427168_wm.jpg,,N,"30CXi, 38CXi, 24CX, 30CX, 30SXi, 18SXi, 24CXi",Heat Exchanger,Ultracom,H55397,"24CX,18SXI,30CXI,30SXI,30CX,38CXI,24CXI",0020038089,Packing Ring Set,N,,,pack of 10,,,,,
259,P417836,Glow-worm 0020195507 fan plus combus chamber cover,Glow-worm,482.79,"This Glow-worm replacement fan is supplied with a combustion chamber cover.  The fan introduces fresh air into a boiler's combustion chamber, ensuring that gas is burnt correctly and extracting burnt gas at the end of the combustion process. Your boiler's safety parameters ensure that no gas passes through to the main burner if the fan is not functioning correctly.  To help you find the right parts for your jobs, go to the industry leading parts identification tool, PartsArena, giving you quick access to over 20,000 exploded diagrams, 10,000 images & 20,000 products. FREE to Wolseley trade account customers.",Parts and Spares/sub_categories/Domestic Boiler Parts/sub_categories/Glow Worm Boiler Parts/Glow Worm Boiler Parts.csv -> Glow-worm 0020195507 fan plus combus chamber cover,,,https://www.wolseley.co.uk/wcsstore/ExtendedSitesCatalogAssetStore/images/products/AssetPush/wol-web-proof-medium-w/std.lang.all/78/36/417836_wm.jpg,,N,,,,,,0020195507,,N,,,,,,,,
260,P441795,Glow-worm 2000802636 thermistor control,Glow-worm,52.26,"A genuine Glow-worm part, this thermistor is designed for use in Micron boilers and is supplied with a lead.  The thermistor decreases circuit resistance in line with temperature increases. A boiler's printed control board (PCB) sends a current to the thermistor, deciding whether a decrease or increase in heat is required by reading the relative resistance.  As the leading supplier of parts for all the major boiler manufacturers we’ve got a wealth of experience and knowledge in this area, and with over 450 branches we carry more heating spare parts in more places than any other merchant to help you improve your first time fix rate.",Parts and Spares/sub_categories/Domestic Boiler Parts/sub_categories/Glow Worm Boiler Parts/Glow Worm Boiler Parts.csv -> Glow-worm 2000802636 thermistor control,,ThermistorLead,https://www.wolseley.co.uk/wcsstore/ExtendedSitesCatalogAssetStore/images/products/AssetPush/wol-web-proof-medium-w/std.lang.all/17/95/441795_wm.jpg,,N,"70FF, 70FF, 80FF, 60FF, 60FF, 80FF",Control Panel,Micron,H44936,"70FF,80 FF,60FF",2000802636,Thermistor,N,,,,,,,,
261,P485912,Glow-worm 0020054164 heat exchanger,Glow-worm,715.54,"A Glow-worm heat exchanger suitable for Flexicom boilers.  The heat exchanger transfers heat from a boiler's burner to water. A primary heat exchanger is found in all boilers, using heat from a burner to raise the temperature of the water in the system while a secondary heat exchanger is present only in combis and allows the heat to be transferred between closed systems.  We carry over 300 of the most in demand parts in-branch and stock over 25,000 spare parts available for next-day timed delivery.",Parts and Spares/sub_categories/Domestic Boiler Parts/sub_categories/Glow Worm Boiler Parts/Glow Worm Boiler Parts.csv -> Glow-worm 0020054164 heat exchanger,,Heat exchanger only,https://www.wolseley.co.uk/wcsstore/ExtendedSitesCatalogAssetStore/images/products/AssetPush/wol-web-proof-medium-w/std.lang.all/59/12/485912_wm.jpg,,N,"30CX, 30SX, 24CX, 35CX, 18SX",Heat Exchanger,Flexicom,H57446,"24CX,35CX,30SX,30CX,18SX",0020054164,Heat Exchanger,N,,,,,,,,
262,P443721,Glow-worm screw 4.2 x 13.5mm,Glow-worm,8.53,"A Glow-worm appliance screw pack for the hydraulics of Flexicom, CXI, HXI, SXI, Ultracom, Xeon, British Gas, Eden and Ultimate boilers.  Spare screw packs, for assembling an appliance or holding it in place, are supplied in various sizes and groupings to suit different jobs and appliances.  To help you find the right parts for your jobs, go to the industry leading parts identification tool, PartsArena, giving you quick access to over 20,000 exploded diagrams, 10,000 images & 20,000 products. FREE to Wolseley trade account customers.",Parts and Spares/sub_categories/Domestic Boiler Parts/sub_categories/Glow Worm Boiler Parts/Glow Worm Boiler Parts.csv -> Glow-worm screw 4.2 x 13.5mm,,,https://www.wolseley.co.uk/wcsstore/ExtendedSitesCatalogAssetStore/images/products/AssetPush/wol-web-proof-medium-w/std.lang.all/37/21/443721_wm.jpg,,N,"12HX, 15HX, 18HX, 30CXI, 24HX, 15HXI, 38HXI, 18SXI, 30CX, 30SXi, 30SX, 24CX, 38HXi, 24CXI, 35CX, 12HXI, 30HXI, 12HXi, 38CXi, Condens 18, BG330, Sb, Vb, 30CX, 24HXI, 24H, 15HXi, 24CXi, 24CX, BG330+, Cb, 18HXI, 18HXi, 24HXi, 30CXi, Condens 30, 38CXI, 18SX,",Hydraulics,"Flexicom, CXI, HXI, SXI, Ultracom, Xeon, British Gas, Eden, Ultimate",E85084,"35CX,24HX,30CX,24H,38CXI,Vb,30CXI,30SX,30HXI,18SX,38HXI,15HXI,18HX,24CX,30SXI,15HX,Condens 30,35HX,12HX,BG330,24CXI,24HXI,Condens 18,Sb,18SXI,12HXI,30HX,Cb,18HXI",801700,Screw Pack,N,,,,,,,,
263,P440333,Glow-worm S202629 electrode,Glow-worm,12.37,"A Glow-worm spare part, this ignition spark electrode is suitable for Ultimate, Xeon and Micron boilers.  An ignition (spark) electrode causes the spark that begins combustion within the burner while flame sensing electrodes are responsible for checking if there is a flame present in the burner to make sure that the boiler doesn't keep supplying gas without a flame.  We know you’re busy and need to get repair jobs done quickly and efficiently. Your local parts specialist is always on hand to support you. They offer help, advice and they can get you the part you need.  Your local branch stocks an in-depth range of domestic gas and oil spare parts from leading manufacturers, so you can fix it first time.",Parts and Spares/sub_categories/Domestic Boiler Parts/sub_categories/Glow Worm Boiler Parts/Glow Worm Boiler Parts.csv -> Glow-worm S202629 electrode,,Electrode;Lead,https://www.wolseley.co.uk/wcsstore/ExtendedSitesCatalogAssetStore/images/products/AssetPush/wol-web-proof-medium-w/std.lang.all/03/33/440333_wm.jpg,,N,"100 FF, 120 FF, 120FF, 120 FF, 120FF, 100 FF",Gas Assembly,"Ultimate, Xeon, Micron",278238,"120FF,100 FF",S202629,Electrode,N,,,,,,,,
264,P427142,Glow-worm insulation - heat exchanger,Glow-worm,54.45,"This Glow-worm insulation is designed to prevent the escape of heat from the combustion chamber of HXI, Ultracom, Eden, British Gas and Xtramax boilers.  The combustion chamber is a sealed box that contains the burner and electrodes along with combusted gases ready to be cleared by the appliance's fan.  As the leading supplier of parts for all the major boiler manufacturers we’ve got a wealth of experience and knowledge in this area, and with over 450 branches we carry more heating spare parts in more places than any other merchant to help you improve your first time fix rate.",Parts and Spares/sub_categories/Domestic Boiler Parts/sub_categories/Glow Worm Boiler Parts/Glow Worm Boiler Parts.csv -> Glow-worm insulation - heat exchanger,,,https://www.wolseley.co.uk/wcsstore/ExtendedSitesCatalogAssetStore/images/products/AssetPush/wol-web-proof-medium-w/std.lang.all/71/42/427142_wm.jpg,,N,"18HXI, 18SXi, 30SXi, Vb, 24HXI, 24CX, 12HXI, 38CXi, BG330, 30HXI, 24CXi, Xtramax HE, 12HXi, 15HXI, 38HXI, 18HXi, 30CX, 30HXi, 38HXi, 15HXi, 24HXi, 30CXi",Fan Combustion Chamber,"HXI, Ultracom, Eden, British Gas, Xtramax",,,0020010866,Insulation,N,,,,,,,,
265,P485937,Glow-worm condensing trap cap,Glow-worm,16.78,"This Glow-worm condensing trap cap is compatible with Betacom boilers.  The condensate trap holds discharge that accumulates in the primary heating or cooling system caused by changes in pressure and temperature. A discharge pipe connected to the condensate trap sends held water out of the property. This pipe is ordinarily made of plastic that can withstand the low levels of acid present due to CO2 from the combustion process dissolving in the water.  We carry over 300 of the most in demand parts in-branch and stock over 25,000 spare parts available for next-day timed delivery.",Parts and Spares/sub_categories/Domestic Boiler Parts/sub_categories/Glow Worm Boiler Parts/Glow Worm Boiler Parts.csv -> Glow-worm condensing trap cap,,,https://www.wolseley.co.uk/wcsstore/ExtendedSitesCatalogAssetStore/images/products/AssetPush/wol-web-proof-medium-w/std.lang.all/59/37/485937_wm.jpg,,N,"Betacom 24C, Betacom 30C, Betacom 24C, Betacom 30C",Condensate Trap,Betacom,724525,"Betacom 30C,Betacom 24C",0020080622,Traps,N,,,,,,,,
266,P443910,Glow-worm reset switch,Glow-worm,28.06,"A replacement Glow-worm reset switch for the control panel of Xeon, Eden, CXI, HXI, SXI and British Gas boilers.  The boiler control panel usually features control knobs and a digital display for switching the boiler on and off, viewing fault info and setting modes.  As the leading supplier of parts for all the major boiler manufacturers we’ve got a wealth of experience and knowledge in this area, and with over 450 branches we carry more heating spare parts in more places than any other merchant to help you improve your first time fix rate.",Parts and Spares/sub_categories/Domestic Boiler Parts/sub_categories/Glow Worm Boiler Parts/Glow Worm Boiler Parts.csv -> Glow-worm reset switch,,,https://www.wolseley.co.uk/wcsstore/ExtendedSitesCatalogAssetStore/images/products/AssetPush/wol-web-proof-medium-w/std.lang.all/39/10/443910_wm.jpg,https://www.wolseley.co.uk/wcsstore/ExtendedSitesCatalogAssetStore/images/products/AssetPush/DTP_AssetPushHighRes/std.lang.all/ti/on/Glow-worm_SXI_Installation.pdf,,,,,,,,,,,,,,,,,
