77,P486851,Glow-worm gasket kit,Glow-worm,50.53,"This useful gasket kit is designed for the heat exchanger of Glow-worm Easicom, Energy, Energy 7, Sustain, Ultimate 2, Betacom, Essential, Home, Ultimate 3 and Energy 2 boilers.  O-rings, gaskets and washers are used in many different areas of the boiler to join parts to pipework. Among others sections, heat exchangers and gas valves require these parts to prevent gas and water leaks.  As the leading supplier of parts for all the major boiler manufacturers we’ve got a wealth of experience and knowledge in this area, and with over 450 branches we carry more heating spare parts in more places than any other merchant to help you improve your first time fix rate.",Parts and Spares/sub_categories/Domestic Boiler Parts/sub_categories/Glow Worm Boiler Parts/Glow Worm Boiler Parts.csv -> Glow-worm gasket kit,,"Graphite seal, silicone seal, screws, nuts, instruction sheet",https://www.wolseley.co.uk/wcsstore/ExtendedSitesCatalogAssetStore/images/products/AssetPush/wol-web-proof-medium-w/std.lang.all/68/51/486851_wm.jpg,,N,"Easicom 2 28, Easicom 3 28c, 12s, 15s, 25c, 15r, 18r, 35c, 35c, Betacom 4 30C, 24c, 30r, 25s, Betacom 3 30C, Easicom 2 24, 15r, 30c, 30r, 28c, 35c, 12r, 15r, 25r, Ultimate 3 25s, Ultimate 3 35c, 12r, 18s, 12r, 25c, 25r, 30s, 25r, 18r, Betacom 3 24C, Beta",Heat Exchanger,EasicomEnergyEnergy 7SustainUltimate 2BetacomEssentialHomeUltimate 3Energy 2,J27508,,0020195512,Gasket Kit,N,,,,,,,,
78,P441796,Glow-worm 0020053616 air pressure switch,Glow-worm,62.72,"This Glow-worm air pressure switch is designed for use in Micron boilers.  A vital safety device, an air pressure switch ensures the boiler fan is working correctly and prevents a build up of toxic gases with no means of venting them in case of a fan failure. The unit's PCB closely monitors the air pressure switch to ensure it's fully functional before firing the system up, keeping the appliance from starting without the presence and operation of key safety features.  We know you’re busy and need to get repair jobs done quickly and efficiently. Your local parts specialist is always on hand to support you. They offer help, advice and they can get you the part you need.  Your local branch stocks an in-depth range of domestic gas and oil spare parts from leading manufacturers, so you can fix it first time.",Parts and Spares/sub_categories/Domestic Boiler Parts/sub_categories/Glow Worm Boiler Parts/Glow Worm Boiler Parts.csv -> Glow-worm 0020053616 air pressure switch,,,https://www.wolseley.co.uk/wcsstore/ExtendedSitesCatalogAssetStore/images/products/AssetPush/wol-web-proof-medium-w/std.lang.all/17/96/441796_wm.jpg,,N,"60FF, 60FF, 80FF, 80FF",Fan Combustion Chamber,Micron,722273,"60FF,80 FF",0020053616,Pressure Switch,N,,,,,,,,
79,P479513,Glow-worm main printed circuit board,Glow-worm,326.15,"This Glow-worm printed circuit board is a genuine spare part for Betacom boilers.  The control centre of a boiler, the printed circuit board (PCB) monitors and controls every process occurring throughout a system via switches, thermostats and sensors. It enforces safety measures too, shutting down boiler functions if internal readings indicate any fault such as high pressure or low water levels.  To help you find the right parts for your jobs, go to the industry leading parts identification tool, PartsArena, giving you quick access to over 20,000 exploded diagrams, 10,000 images & 20,000 products. FREE to Wolseley trade account customers.",Parts and Spares/sub_categories/Domestic Boiler Parts/sub_categories/Glow Worm Boiler Parts/Glow Worm Boiler Parts.csv -> Glow-worm main printed circuit board,,,https://www.wolseley.co.uk/wcsstore/ExtendedSitesCatalogAssetStore/images/products/AssetPush/wol-web-proof-medium-w/std.lang.all/95/13/479513_wm.jpg,,N,"Betacom 30C, Betacom 24C",Control Panel,Betacom,722366,"Betacom 30C,Betacom 24C",0020061654,Printed Circuit Board,N,,,,,,,,
80,P443724,Glow-worm harness,Glow-worm,39.57,"A Glow-worm wiring harness suitable for use in Flexicom boilers.  These groups of wires are designed to give the PCB complete control over the boiler's processes and safety protocols.  As the UK’s leading parts specialist, Wolseley carry the widest range of spares, stocking all the big name brands for the trade. Now, to give our customers even more support, we’re adding a greater number of specified parts from leading manufacturers into our branches with the introduction of the Wolseley Branch Parts Accreditation Scheme. Many branches will now be Silver and Gold accredited, a sign that they hold more stock than anyone else, so you can be confident you’ll get the parts you need to fix it first time. Fast.",Parts and Spares/sub_categories/Domestic Boiler Parts/sub_categories/Glow Worm Boiler Parts/Glow Worm Boiler Parts.csv -> Glow-worm harness,,,https://www.wolseley.co.uk/wcsstore/ExtendedSitesCatalogAssetStore/images/products/AssetPush/wol-web-proof-medium-w/std.lang.all/37/24/443724_wm.jpg,,N,"35CX, 24CX, 30CX",Control Panel,Flexicom,H43165,,0020014162,Wiring Harness,N,,,,,,,,
81,P486221,Glow-worm 0020197555 flow sensor,Glow-worm,37.45,"This Glow-worm sensor is designed for use in the control panel of Betacom, Essential, Energy 7, Ultimate 3, Easicom, MicraCom, Energy, Home, Ultimate 2, Energy 2 and Sustain units.  The boiler control panel usually features control knobs and a digital display for switching the boiler on and off, viewing fault info and setting modes.  As the UK’s leading parts specialist, Wolseley carry the widest range of spares, stocking all the big name brands for the trade. Now, to give our customers even more support, we’re adding a greater number of specified parts from leading manufacturers into our branches with the introduction of the Wolseley Branch Parts Accreditation Scheme. Many branches will now be Silver and Gold accredited, a sign that they hold more stock than anyone else, so you can be confident you’ll get the parts you need to fix it first time. Fast.",Parts and Spares/sub_categories/Domestic Boiler Parts/sub_categories/Glow Worm Boiler Parts/Glow Worm Boiler Parts.csv -> Glow-worm 0020197555 flow sensor,,,https://www.wolseley.co.uk/wcsstore/ExtendedSitesCatalogAssetStore/images/products/AssetPush/wol-web-proof-medium-w/std.lang.all/62/21/486221_wm.jpg,,N,"Betacom 4 24C, 24c, Betacom 4 30C, 30c, 35c, 28c, Ultimate 3 35c, Easicom 2 28, 24c, 25c, 35c, 30c, 35c, Ultimate 3 30c, Betacom 3 24C, Betacom 3 30C, Easicom 3 24c, 28c, Easicom 2 24, 30c P, 24c P, 25c, 25c, 25c, 35c, 30c, Easicom 3 28c, 30c, 35c, 30c",Control Panel,BetacomEssentialEnergy 7Ultimate 3EasicomMicraComEnergyHomeUltimate 2Energy 2Sustain,J27571,,0020197555,Flow Sensor,N,,,,,,,,
82,P479507,Glow-worm switch - low water pressure,Glow-worm,55.84,"This Glow-worm pressure switch is suitable for installation in Betacom boilers.  A pressure switch controls internal pressure in boilers and closed systems.  To help you find the right parts for your jobs, go to the industry leading parts identification tool, PartsArena, giving you quick access to over 20,000 exploded diagrams, 10,000 images & 20,000 products. FREE to Wolseley trade account customers.",Parts and Spares/sub_categories/Domestic Boiler Parts/sub_categories/Glow Worm Boiler Parts/Glow Worm Boiler Parts.csv -> Glow-worm switch - low water pressure,,,https://www.wolseley.co.uk/wcsstore/ExtendedSitesCatalogAssetStore/images/products/AssetPush/wol-web-proof-medium-w/std.lang.all/95/07/479507_wm.jpg,,N,"Betacom 30C, Betacom 24C",Fan Combustion Chamber,Betacom,724589,"Betacom 30C,Betacom 24C",0020061607,Pressure Switch,N,,,,,,,,
83,P441506,Glow-worm overheat thermostat,Glow-worm,46.38,"This Glow-worm thermostat is designed for Economy, Fuelsaver, Fuelsaver UFB and Economy Plus boilers.  The thermostat allows the user to change or set the temperature of a boiler. As well as wired thermostats, Wi-Fi enabled and wireless versions can also be used with selected boilers.  We know you’re busy and need to get repair jobs done quickly and efficiently. Your local parts specialist is always on hand to support you. They offer help, advice and they can get you the part you need.  Your local branch stocks an in-depth range of domestic gas and oil spare parts from leading manufacturers, so you can fix it first time.",Parts and Spares/sub_categories/Domestic Boiler Parts/sub_categories/Glow Worm Boiler Parts/Glow Worm Boiler Parts.csv -> Glow-worm overheat thermostat,,,https://www.wolseley.co.uk/wcsstore/ExtendedSitesCatalogAssetStore/images/products/AssetPush/wol-web-proof-medium-w/std.lang.all/15/06/441506_wm.jpg,,N,"30, 30R MK2, 50BR MK2, 60R MK2, 40B, 75B, 50, 60, 24B, 50B, 50C, 75C, 40R MK2, 60B, 30C, 60BR MK2, 30B, 40B, 40C, 60C, 75C, 30BR MK2, 50B, 24, 40BR MK2, 75R MK2, 40, 50C, 60B, 60C, 30B, 30C, 75BR MK2, 40C, 75B, 50R MK2",Flue,"Economy, Fuelsaver, Fuelsaver UFB, Economy Plus",313064,"60R MK2,24B,24,30B,40 B,30C,50B,40 C,60B,50C,60C,30R MK2,75R MK2,50,30BR MK2,40BR MK2,30,75BR MK2,60BR MK2,50BR MK2,75B,75C,50R MK2,40R MK2,60,40",2000800014,Thermostat,N,,,,,,,,
84,P485885,Glow-worm thermistor assembly,Glow-worm,51.31,"A Glow-worm brand thermistor and lead suitable for Eden and CXI appliances.  The thermistor decreases circuit resistance in line with temperature increases. A boiler's printed control board (PCB) sends a current to the thermistor, deciding whether a decrease or increase in heat is required by reading the relative resistance.  We carry over 300 of the most in demand parts in-branch and stock over 25,000 spare parts available for next-day timed delivery.",Parts and Spares/sub_categories/Domestic Boiler Parts/sub_categories/Glow Worm Boiler Parts/Glow Worm Boiler Parts.csv -> Glow-worm thermistor assembly,,ThermistorLead,https://www.wolseley.co.uk/wcsstore/ExtendedSitesCatalogAssetStore/images/products/AssetPush/wol-web-proof-medium-w/std.lang.all/58/85/485885_wm.jpg,,N,"Cb, 30CXI, 38CXI, 24CXI",Control Panel,"Eden, CXI",E88860,"30CXI,38CXI,24CXI,Cb",2000801726,Thermistor,N,,,,,,,,
85,P443734,Glow-worm 0020014174 flow sensor,Glow-worm,43.44,"A Glow-worm pressure sensor or switch for Ultracom and Flexicom boilers.  Pressure sensors control internal water, gas and air pressure inside a boiler or closed system.  As the UK’s leading parts specialist, Wolseley carry the widest range of spares, stocking all the big name brands for the trade. Now, to give our customers even more support, we’re adding a greater number of specified parts from leading manufacturers into our branches with the introduction of the Wolseley Branch Parts Accreditation Scheme. Many branches will now be Silver and Gold accredited, a sign that they hold more stock than anyone else, so you can be confident you’ll get the parts you need to fix it first time. Fast.",Parts and Spares/sub_categories/Domestic Boiler Parts/sub_categories/Glow Worm Boiler Parts/Glow Worm Boiler Parts.csv -> Glow-worm 0020014174 flow sensor,,,https://www.wolseley.co.uk/wcsstore/ExtendedSitesCatalogAssetStore/images/products/AssetPush/wol-web-proof-medium-w/std.lang.all/37/34/443734_wm.jpg,,N,"30CXi, 35CX, 30CX, 24CXi, 30CX, 24CX, 38CXi, 24CX",Control Panel,UltracomFlexicom,H43155,"24CX,35CX,30CXI,30CX,38CXI,24CXI",0020014174,Sensor,N,,,,,,,,
86,P427162,Glow-worm 0020038227 connection piece,Glow-worm,18.45,"A genuine Glow-worm connection piece for the diverter valve of Ultracom and Ultrapower boilers.  A directional water device in combi boilers, a diverter valve directs hot water into a heating system or a hot water system. This feature means that combis are able to provide both heating and hot water without the need for a storage cylinder.  As the UK’s leading parts specialist, Wolseley carry the widest range of spares, stocking all the big name brands for the trade. Now, to give our customers even more support, we’re adding a greater number of specified parts from leading manufacturers into our branches with the introduction of the Wolseley Branch Parts Accreditation Scheme. Many branches will now be Silver and Gold accredited, a sign that they hold more stock than anyone else, so you can be confident you’ll get the parts you need to fix it first time. Fast.",Parts and Spares/sub_categories/Domestic Boiler Parts/sub_categories/Glow Worm Boiler Parts/Glow Worm Boiler Parts.csv -> Glow-worm 0020038227 connection piece,,Connection piece6x O-rings,https://www.wolseley.co.uk/wcsstore/ExtendedSitesCatalogAssetStore/images/products/AssetPush/wol-web-proof-medium-w/std.lang.all/71/62/427162_wm.jpg,,N,"24CXi, 24CX, SXI 100, SXI 170, 30CXi, 30CX, 30SXi, 38CXi, 18SXi",Diverter Valve,"Ultracom, Ultrapower",H52605,"24CX,18SXI,30CXI,30SXI,30CX,SXI 100,38CXI,24CXI,SXI 170",0020038227,Connection Piece,N,,,,,,,,
87,P443698,Glow-worm 0020014160 NTC sensor,Glow-worm,11.56,"This Glow-worm NTC sensor is compatible with Ultrapower, CXI, Ultracom, Flexicom and Eden boilers.  The sensor is employed to decrease circuit resistance in line with temperature increases. A boiler's printed control board (PCB) sends a current to the thermistor, deciding whether a decrease or increase in heat is required by reading the relative resistance.  We know you’re busy and need to get repair jobs done quickly and efficiently. Your local parts specialist is always on hand to support you. They offer help, advice and they can get you the part you need.  Your local branch stocks an in-depth range of domestic gas and oil spare parts from leading manufacturers, so you can fix it first time.",Parts and Spares/sub_categories/Domestic Boiler Parts/sub_categories/Glow Worm Boiler Parts/Glow Worm Boiler Parts.csv -> Glow-worm 0020014160 NTC sensor,,,https://www.wolseley.co.uk/wcsstore/ExtendedSitesCatalogAssetStore/images/products/AssetPush/wol-web-proof-medium-w/std.lang.all/36/98/443698_wm.jpg,https://www.wolseley.co.uk/wcsstore/ExtendedSitesCatalogAssetStore/images/products/AssetPush/DTP_AssetPushHighRes/std.lang.all/ta/ll/Glow-worm_Ultrapower_SXI_Install.pdf,,,,,,,,,,,,,,,,,
88,P443786,Glow-worm 0020020778 cable tree,Glow-worm,38.0,"A Glow-worm spare, this cable tree is specifically for Flexicom, Ultimate and British Gas boilers.  Cables give the PCB complete control over the boiler's processes and safety protocols.  As the leading supplier of parts for all the major boiler manufacturers we’ve got a wealth of experience and knowledge in this area, and with over 450 branches we carry more heating spare parts in more places than any other merchant to help you improve your first time fix rate.",Parts and Spares/sub_categories/Domestic Boiler Parts/sub_categories/Glow Worm Boiler Parts/Glow Worm Boiler Parts.csv -> Glow-worm 0020020778 cable tree,,,https://www.wolseley.co.uk/wcsstore/ExtendedSitesCatalogAssetStore/images/products/AssetPush/wol-web-proof-medium-w/std.lang.all/37/86/443786_wm.jpg,,N,"12HX, 15HX, 24HX, 35CX, 24H, 18HX, BG330+, 35HX, 30HX, 30SX, 30CX, 18SX, 24CX",Control Panel,"Flexicom, Ultimate, British Gas",H42787,"35CX,18HX,24CX,15HX,30CX,35HX,24HX,12HX,24H,BG330,30SX,30HX,18SX",0020020778,Cable Tree,N,,,,,,,,
89,P411475,Glow-worm 0020186165 hydroblock,Glow-worm,64.35,"This Glow-worm brand hydroblock is suitable for use in the brand's Betcom 3, Betacom 4, Energy, Energy 7, Essential, Home, Easicom 2, Easicom 3, Sustain, Ultimate 2 and Ultimate 3 boilers.  Located at the bottom of a boiler and normally connected to the diverter valve, pump and heat exchanger, the hydraulic block assists in the transfer of hot and cold water around the appliance.  To help you find the right parts for your jobs, go to the industry leading parts identification tool, PartsArena, giving you quick access to over 20,000 exploded diagrams, 10,000 images & 20,000 products. FREE to Wolseley trade account customers.",Parts and Spares/sub_categories/Domestic Boiler Parts/sub_categories/Glow Worm Boiler Parts/Glow Worm Boiler Parts.csv -> Glow-worm 0020186165 hydroblock,,,https://www.wolseley.co.uk/wcsstore/ExtendedSitesCatalogAssetStore/images/products/AssetPush/wol-web-proof-medium-w/std.lang.all/14/75/411475_wm.jpg,,N,,Control Panel,Betacom 3;Betacom 4;Energy;Energy 7;Essential;Home;Easicom 2;Easicom 3;Sustain;Ultimate 2;Ultimate 3,,,0020186165,Hydroblock,N,,,,,,,,
90,P413244,Glow-worm 20019799 control harness,Glow-worm,56.67,"A Glow-worm wiring harness for boilers in the CXI and Eden ranges.  These groups of wires give the PCB complete control over the boiler's processes and safety protocols.  We carry over 300 of the most in demand parts in-branch and stock over 25,000 spare parts available for next-day timed delivery.",Parts and Spares/sub_categories/Domestic Boiler Parts/sub_categories/Glow Worm Boiler Parts/Glow Worm Boiler Parts.csv -> Glow-worm 20019799 control harness,,,https://www.wolseley.co.uk/wcsstore/ExtendedSitesCatalogAssetStore/images/products/AssetPush/wol-web-proof-medium-w/std.lang.all/32/44/413244_wm.jpg,,N,"38CXI, 24CXI, Cb, 30CXI",Control Panel,"CXI, Eden",721652,"30CXI,38CXI,24CXI,Cb",0020019799,Wiring Harness,N,,,,,,,,
91,P442373,Glow-worm sealing washer 24.5 x 18.2mm,Glow-worm,8.48,"This Glow-worm washer is a useful spare part for Compact, CXI, Eden, HXI, Ultracom, SD, SXI and British Gas boilers.  Washers, along with O-rings and gaskets, are used in many different areas of the boiler to join parts to pipework. Among others sections, heat exchangers and gas valves require these parts to prevent gas and water leaks.  We know you’re busy and need to get repair jobs done quickly and efficiently. Your local parts specialist is always on hand to support you. They offer help, advice and they can get you the part you need.  Your local branch stocks an in-depth range of domestic gas and oil spare parts from leading manufacturers, so you can fix it first time.",Parts and Spares/sub_categories/Domestic Boiler Parts/sub_categories/Glow Worm Boiler Parts/Glow Worm Boiler Parts.csv -> Glow-worm sealing washer 24.5 x 18.2mm,,,https://www.wolseley.co.uk/wcsstore/ExtendedSitesCatalogAssetStore/images/products/AssetPush/wol-web-proof-medium-w/std.lang.all/23/73/442373_wm.jpg,,N,"100E, 24CXI, Sb, 12HXI, 30CX, 30CXi, 80E, 80P, 24CX, 75E, 38CXI, SB30E, 38CXi, 38HXi, 100SS, Cb, 18HXI, 12HXi, 15HXi, 18SXi, 24HXi, 30SXI, 24CXi, 30HXi, 30SXi, 30E, 30CXI, Vb, 30E, BG330, 100P, 75P, 24HXI, 30HXI, 18SXI, 18HXi, 60SS, 15HXI, 38HXI, SB 30E",Heat Exchanger,"Compact, CXI, Eden, HXI, Ultracom, SD, SXI, British Gas",E26728,"60SS,30CX,38CXI,80 E,30E,Vb,30CXI,80P,100SS,30HXI,38HXI,15HXI,24CX,30SXI,100E,75E,100P,BG330,SB30E,24CXI,24HXI,Sb,18SXI,75P,12HXI,18HXI,Cb",S212332,Washer,N,,,,,,,,
92,P440002,Glow-worm S900001 thermocouple,Glow-worm,34.9,"This Glow-worm thermocouple is a suitable replacement part for boilers in the Hideaway, Buckingham III and Cast Iron ranges.  Made of two metals, each producing a slight electrical charge when heated on one side, the thermocouple is involved in the opening and closing of the boiler's valves.  As the UK’s leading parts specialist, Wolseley carry the widest range of spares, stocking all the big name brands for the trade. Now, to give our customers even more support, we’re adding a greater number of specified parts from leading manufacturers into our branches with the introduction of the Wolseley Branch Parts Accreditation Scheme. Many branches will now be Silver and Gold accredited, a sign that they hold more stock than anyone else, so you can be confident you’ll get the parts you need to fix it first time. Fast.",Parts and Spares/sub_categories/Domestic Boiler Parts/sub_categories/Glow Worm Boiler Parts/Glow Worm Boiler Parts.csv -> Glow-worm S900001 thermocouple,,,https://www.wolseley.co.uk/wcsstore/ExtendedSitesCatalogAssetStore/images/products/AssetPush/wol-web-proof-medium-w/std.lang.all/00/02/440002_wm.jpg,,N,"100 BF, 100 CF, 40 BF, 100 CF, 50 BF, BBU 52, 60 CF, 80 BF, BBU 56, BBU 56F, 50 CF, 80 CF, 90 OF, 120 CF, 50 CF, 60 BF, 70 CF, 40 CF, 60 BF, 80 CF, BBU 45, 120 BF, 50 OF, 80 BF, 100 BF, 60 CF, 70 BF, 100 OF, 90 BF, 120 OF, 40 OF, 60 OF, 120 BF, 40 BF, 70",Control Panel,"Hideaway, Buckingham III, Cast Iron",,"120 CF,90Cf,BBU 56F,BBU 45,70Cf,50Cf,80 BF,40 OF,100 BF,80 OF,40 BF,120 OF,120 BF,80Cf,BBU 52,BBU 45F,70 OF,60Cf,BBU 56,60 BF,40Cf,50 BF,70 BF,60,50 OF,100Cf,100 OF",S900001,Thermocouple,N,,,,,,,,
93,P417917,Glow-worm 0010032752 cable,Glow-worm,10.95,"A genuine Glow-worm spare part, this cable is suitable for use in Flexicom, Ultracom and Ultrapower boilers.  Wires and cables connect the printed circuit board (PCB) to thermostats, switches and sensors, giving it complete control over the boiler's processes and safety protocols.  As the UK’s leading parts specialist, Wolseley carries the widest range of spares, stocking all the big name brands for the trade. Now, to give our customers even more support, we’re adding a greater number of specified parts from leading manufacturers into our branches with the introduction of the Wolseley Branch Parts Accreditation Scheme. Many branches will now be Silver and Gold accredited, a sign that they hold more stock than anyone else, so you can be confident you’ll get the parts you need to fix it first time. Fast.",Parts and Spares/sub_categories/Domestic Boiler Parts/sub_categories/Glow Worm Boiler Parts/Glow Worm Boiler Parts.csv -> Glow-worm 0010032752 cable,,Cable,https://www.wolseley.co.uk/wcsstore/ExtendedSitesCatalogAssetStore/images/products/AssetPush/wol-web-proof-medium-w/std.lang.all/79/17/417917_wm.jpg,,N,,Hydraulics,"Flexicom, Ultracom, Ultrapower",n/a,,0010032752,,N,,,,,,,,
94,P486856,Glow-worm 0020084501 fan,Glow-worm,243.56,"This genuine Glow-worm fan is a replacement part designed for use in CaprizPlus, Ultracom2, Monza, Ultimate, Easicom, Betacom and Energy boilers.  The fan introduces fresh air into a boiler's combustion chamber, ensuring that gas is burnt correctly and extracting burnt gas at the end of the combustion process. Your boiler's safety parameters ensure that no gas passes through to the main burner if the fan is not functioning correctly.  To help you find the right parts for your jobs, go to the industry leading parts identification tool, PartsArena, giving you quick access to over 20,000 exploded diagrams, 10,000 images & 20,000 products. FREE to Wolseley trade account customers.",Parts and Spares/sub_categories/Domestic Boiler Parts/sub_categories/Glow Worm Boiler Parts/Glow Worm Boiler Parts.csv -> Glow-worm 0020084501 fan,,,https://www.wolseley.co.uk/wcsstore/ExtendedSitesCatalogAssetStore/images/products/AssetPush/wol-web-proof-medium-w/std.lang.all/68/56/486856_wm.jpg,https://www.wolseley.co.uk/wcsstore/ExtendedSitesCatalogAssetStore/images/products/AssetPush/DTP_AssetPushHighRes/std.lang.all/li/st/SD_Therma_Condens_F_AS_18_Parts_List.pdf,,,,,,,,,,,,,,,,,
95,P485919,Glow-worm tandem gas valve,Glow-worm,158.04,"A genuine Glow-worm part, this gas valve is compatible with Protherm, Ultimate, Xeon, Fuelsaver, Spacesaver Complheat, Spacesaver KFB, Micron and Ikon boilers.  The gas valve is employed in the distribution of gas. When gas is required in the burner the printed circuit board (PCB) sends a signal to the gas valve, which opens to allow gas to flow into the burner or the pilot assembly (depending on the model of the appliance).  We know you’re busy and need to get repair jobs done quickly and efficiently. Your local parts specialist is always on hand to support you. They offer help, advice and they can get you the part you need.  Your local branch stocks an in-depth range of domestic gas and oil spare parts from leading manufacturers, so you can fix it first time.",Parts and Spares/sub_categories/Domestic Boiler Parts/sub_categories/Glow Worm Boiler Parts/Glow Worm Boiler Parts.csv -> Glow-worm tandem gas valve,,,https://www.wolseley.co.uk/wcsstore/ExtendedSitesCatalogAssetStore/images/products/AssetPush/wol-web-proof-medium-w/std.lang.all/59/19/485919_wm.jpg,,N,"60-80 CI From Ser No.0104001, 100 FF, 120FF, 100F, 30, 50, 70, 20, 60, 80FF, 120FF, 40, 30, 70, 80FF LPG, 100FF, 60, 70FF, 60-80 CI, 120 FF, 80 FF, 60-80 CI, 100FF, 120 FF, 80FF, 60-80 CI From Ser No.0204001, 40, 50, 100 FF, 70FF, 80FF",Gas Assembly,"Protherm, Ultimate, Xeon, Fuelsaver, Spacesaver Complheat, Spacesaver KFB, Micron, Ikon",278021,"70FF,100F,80 FF,60-80 CI From Ser No.0204001,120FF,60-80 CI From Ser No.0104001,80FF LPG,100 FF,70,60,60-80 CI,50,40,30,20",800442,Gas Valve,N,,,,,,,,
