151,P442269,Glow-worm syphon gasket,Glow-worm,8.53,"A Glow-worm gasket for use in the condensate trap of CXI, Eden, HXI, SXI and British Gas boilers.  O-rings, gaskets and washers are used in many different areas of the boiler to join parts to pipework. Among others sections, heat exchangers and gas valves require these parts to prevent gas and water leaks.  As the leading supplier of parts for all the major boiler manufacturers we’ve got a wealth of experience and knowledge in this area, and with over 450 branches we carry more heating spare parts in more places than any other merchant to help you improve your first time fix rate.",Parts and Spares/sub_categories/Domestic Boiler Parts/sub_categories/Glow Worm Boiler Parts/Glow Worm Boiler Parts.csv -> Glow-worm syphon gasket,,,https://www.wolseley.co.uk/wcsstore/ExtendedSitesCatalogAssetStore/images/products/AssetPush/wol-web-proof-medium-w/std.lang.all/22/69/442269_wm.jpg,,N,"24CXI, Cb, 12HXI, 24HXI, 30SXI, Sb, Vb, 38HXI, 30CXI, 18HXI, 38CXI, 18SXI, BG330, 15HXI, 30HXI",Condensate Trap,"CXI, Eden, HXI, SXI, British Gas",E85028,"30SXI,38CXI,BG330,24CXI,Vb,24HXI,Sb,18SXI,30CXI,12HXI,30HXI,38HXI,15HXI,Cb,18HXI",801662,Gasket,N,,,,,,,,
152,P443760,Glow-worm electrode seal,Glow-worm,8.53,"This Glow-worm seal is suitable for use in the heat exchanger of Flexicom, British Gas and Ultimate boilers.  Seals are used in many different boiler parts and are designed to prevent leaks of water or harmful gases as they move through the unit.  We carry over 300 of the most in demand parts in-branch and stock over 25,000 spare parts available for next-day timed delivery.",Parts and Spares/sub_categories/Domestic Boiler Parts/sub_categories/Glow Worm Boiler Parts/Glow Worm Boiler Parts.csv -> Glow-worm electrode seal,,,https://www.wolseley.co.uk/wcsstore/ExtendedSitesCatalogAssetStore/images/products/AssetPush/wol-web-proof-medium-w/std.lang.all/37/60/443760_wm.jpg,,N,"18SX, 30HX, 30SX, 35HX, BG330+, 15HX, 24CX, 35CX, 12HX, 18HX, 30CX, 24H, 24HX",Heat Exchanger,"Flexicom, British Gas, Ultimate",H42722,"35CX,18HX,24CX,15HX,35HX,30CX,24HX,24H,12HX,BG330,30SX,30HX,18SX",0020020732,Seal,N,,,,,,,,
153,P440505,Glow-worm pilot pipe,Glow-worm,31.05,"This Glow-worm pilot pipe kit is a replacement part for the pilot assembly of Ultimate, Ikon, Protherm and Xeon boilers.  A pilot assembly normally includes a pilot bracket, injector, electrode and thermocouple. The pilot flame ignites gas entering the boiler's main burner via the gas valve when the system is switched on. The pilot flame operates alongside the printed circuit board (PCB) and the rest of the pilot assembly for safe and efficient ignition.  We know you’re busy and need to get repair jobs done quickly and efficiently. Your local parts specialist is always on hand to support you. They offer help, advice and they can get you the part you need.  Your local branch stocks an in-depth range of domestic gas and oil spare parts from leading manufacturers, so you can fix it first time.",Parts and Spares/sub_categories/Domestic Boiler Parts/sub_categories/Glow Worm Boiler Parts/Glow Worm Boiler Parts.csv -> Glow-worm pilot pipe,,Pilot pipe;Nuts,https://www.wolseley.co.uk/wcsstore/ExtendedSitesCatalogAssetStore/images/products/AssetPush/wol-web-proof-medium-w/std.lang.all/05/05/440505_wm.jpg,,N,"50FF, 60FF, 70FF, 80FF, 40-50 CI, 60-80 CI, 40-50 CI From Ser No.0204001, 40-50 CI, 30FF LPG, 50FF LPG, 60FF HONEYWELL, 60-80 CI From Ser No.0204001, 40-50 CI From Ser No.0204001, 60-80 CI, 60-80 CI From Ser No.0104001, 30FF, 30FF, 50FF, 70FF, 80FF LPG,",Gas Assembly,"Ultimate, Ikon, Protherm, Xeon",278022,"70FF,50FF,60FF,80 FF,40FF,30FF LPG,60-80 CI From Ser No.0204001,60-80 CI From Ser No.0104001,40-50 CI,30FF,60FF HONEYWELL,60FF S.I.T,40-50 CI From Ser No.0204001,50FF LPG,40FF LPG,60FF LPG,60-80 CI",800441,Pilot Pipe Kit,N,,,,,,,,
154,P442127,Glow-worm 2000801020 gas valve,Glow-worm,174.4,"This Glow-worm gas valve is suitable for Economy Plus, Protherm, Ultimate, Ikon and Xeon boilers.  The gas valve is employed in the distribution of gas. When gas is required in the burner the printed circuit board (PCB) sends a signal to the gas valve, which opens to allow gas to flow into the burner or the pilot assembly (depending on the model of the appliance).  To help you find the right parts for your jobs, go to the industry leading parts identification tool, PartsArena, giving you quick access to over 20,000 exploded diagrams, 10,000 images & 20,000 products. FREE to Wolseley trade account customers.",Parts and Spares/sub_categories/Domestic Boiler Parts/sub_categories/Glow Worm Boiler Parts/Glow Worm Boiler Parts.csv -> Glow-worm 2000801020 gas valve,,,https://www.wolseley.co.uk/wcsstore/ExtendedSitesCatalogAssetStore/images/products/AssetPush/wol-web-proof-medium-w/std.lang.all/21/27/442127_wm.jpg,,N,"60F, 40-50 CI, 40FF LPG, 60FF HONEYWELL, 30F, 80F, 40-50 CI From Ser No.0204001, 30FF, 50FF, 50FF, 60FF, 30FF LPG, 60 FF, 60FF, 40F, 50F, 40FF, 40FF, 60FF LPG, 60FF S.I.T, 30FF, 50FF LPG, 30 FF, 40 FF, 50 FF, 30FF, 40FF, 40-50 CI, 50FF",Gas Assembly,"Economy Plus, Protherm, Ultimate, Ikon, Xeon",E25264,"50FF,60FF,30FF LPG,40FF,30F,40-50 CI,40F,30FF,50F,60F,80F,60FF HONEYWELL,60FF S.I.T,40-50 CI From Ser No.0204001,50FF LPG,40FF LPG,60FF LPG",2000801020,Gas Valve,N,,,,,,,,
155,P411494,Glow-worm 0020195525 electrode,Glow-worm,21.98,"This Glow-worm electrode with 2x screws is compatible with Easicom, Energy, Energy 7, Home, Betacom, Essential, Sustain, Ultimate 2, Ultimate 3 and Energy 2 boilers.  An ignition (spark) electrode causes the spark that begins combustion within the burner while flame sensing electrodes are responsible for checking if there is a flame present in the burner to make sure that the boiler doesn't keep supplying gas without a flame.  As the leading supplier of parts for all the major boiler manufacturers we’ve got a wealth of experience and knowledge in this area, and with over 450 branches we carry more heating spare parts in more places than any other merchant to help you improve your first time fix rate.",Parts and Spares/sub_categories/Domestic Boiler Parts/sub_categories/Glow Worm Boiler Parts/Glow Worm Boiler Parts.csv -> Glow-worm 0020195525 electrode,,Gas Assembley,https://www.wolseley.co.uk/wcsstore/ExtendedSitesCatalogAssetStore/images/products/AssetPush/wol-web-proof-medium-w/std.lang.all/14/94/411494_wm.jpg,,N,"Easicom 2 28, Easicom 3 28c, 12s, 15r, 15s, Betacom 4 30C, 24c, 28c, 30r, 35c, 35c, 25s, Betacom 3 30C, Easicom 2 24, 18r, 25r, 30r, 12r, 15r, 25r, Ultimate 3 25s, Ultimate 3 35c, Betacom 3 24C, 12r, 30s, 12r, 25c, 25s, 30c, 30s, 12r, 18s, 25r, 18r, 15r,",Gas Assembly,"Easicom, Energy, Energy 7, Home, Betacom, Essential, Sustain, Ultimate 2, Ultimate 3, Energy 2",J27520,,0020195525,Electrode,N,,,,,,,,
156,P410662,Glow-worm ignition electrode LH,Glow-worm,25.59,"This Glow-worm brand ignition spark electrode is a replacement part for Betacom boilers.  An ignition (spark) electrode causes the spark that begins combustion within the burner while flame sensing electrodes are responsible for checking if there is a flame present in the burner to make sure that the boiler doesn't keep supplying gas without a flame.  As the UK’s leading parts specialist, Wolseley carry the widest range of spares, stocking all the big name brands for the trade. Now, to give our customers even more support, we’re adding a greater number of specified parts from leading manufacturers into our branches with the introduction of the Wolseley Branch Parts Accreditation Scheme. Many branches will now be Silver and Gold accredited, a sign that they hold more stock than anyone else, so you can be confident you’ll get the parts you need to fix it first time. Fast.",Parts and Spares/sub_categories/Domestic Boiler Parts/sub_categories/Glow Worm Boiler Parts/Glow Worm Boiler Parts.csv -> Glow-worm ignition electrode LH,,,https://www.wolseley.co.uk/wcsstore/ExtendedSitesCatalogAssetStore/images/products/AssetPush/wol-web-proof-medium-w/std.lang.all/06/62/410662_wm.jpg,,N,"Betacom 24C, Betacom 30C",Gas Assembly,Betacom,723960,,0020061572,Electrode,N,,,,,,,,
157,P443745,Glow-worm 0020014193 packing ring (Pack of 10),Glow-worm,8.53,"This Glow-worm pack of 10x sealing rings is suitable for the heat exchanger of Flexicom and Atmosorb units.  O-rings, gaskets and washers are used in many different areas of the boiler to join parts to pipework. Among others sections, heat exchangers and gas valves require these parts to prevent gas and water leaks.  To help you find the right parts for your jobs, go to the industry leading parts identification tool, PartsArena, giving you quick access to over 20,000 exploded diagrams, 10,000 images & 20,000 products. FREE to Wolseley trade account customers.",Parts and Spares/sub_categories/Domestic Boiler Parts/sub_categories/Glow Worm Boiler Parts/Glow Worm Boiler Parts.csv -> Glow-worm 0020014193 packing ring (Pack of 10),,10x sealing rings,https://www.wolseley.co.uk/wcsstore/ExtendedSitesCatalogAssetStore/images/products/AssetPush/wol-web-proof-medium-w/std.lang.all/37/45/443745_wm.jpg,,N,"30SX, 30CX, 35CX, 24CX, 18SX, HRD 350, HRD 275",Heat Exchanger,"Flexicom, Atmosorb",H43146,"24CX,35CX,HRD 275,HRD 350,30SX,30CX,18SX",0020014193,Sealing Ring Pack,N,,,pack of 10,,,,,
158,P410661,Glow-worm ignition electrode RH,Glow-worm,25.59,"This Glow-worm brand ignition spark electrode is a replacement part for Betacom boilers.  An ignition (spark) electrode causes the spark that begins combustion within the burner while flame sensing electrodes are responsible for checking if there is a flame present in the burner to make sure that the boiler doesn't keep supplying gas without a flame.  As the UK’s leading parts specialist, Wolseley carry the widest range of spares, stocking all the big name brands for the trade. Now, to give our customers even more support, we’re adding a greater number of specified parts from leading manufacturers into our branches with the introduction of the Wolseley Branch Parts Accreditation Scheme. Many branches will now be Silver and Gold accredited, a sign that they hold more stock than anyone else, so you can be confident you’ll get the parts you need to fix it first time. Fast.",Parts and Spares/sub_categories/Domestic Boiler Parts/sub_categories/Glow Worm Boiler Parts/Glow Worm Boiler Parts.csv -> Glow-worm ignition electrode RH,,,https://www.wolseley.co.uk/wcsstore/ExtendedSitesCatalogAssetStore/images/products/AssetPush/wol-web-proof-medium-w/std.lang.all/06/61/410661_wm.jpg,,N,"Betacom 24C, Betacom 30C",Gas Assembly,Betacom,723959,,0020061571,Electrode,N,,,,,,,,
159,P486283,"Glow-worm sealing rings 3/4"" (Pack of 10)",Glow-worm,36.47,"This Glow-worm pack of ten sealing rings is suitable for the heat exchanger of Easicom, Energy 2, Energy 7, Essential, Flexicom, Home, Betacom, Energy, Miscellaneous, Sustain, Ultimate 2, Ultimate 3, Ultracom2, Xtramax, Ultimate, C-CI and British Gas units.  O-rings, gaskets and washers are used in many different areas of the boiler to join parts to pipework. Among others sections, heat exchangers and gas valves require these parts to prevent gas and water leaks.  To help you find the right parts for your jobs, go to the industry leading parts identification tool, PartsArena, giving you quick access to over 20,000 exploded diagrams, 10,000 images & 20,000 products. FREE to Wolseley trade account customers.","Parts and Spares/sub_categories/Domestic Boiler Parts/sub_categories/Glow Worm Boiler Parts/Glow Worm Boiler Parts.csv -> Glow-worm sealing rings 3/4"" (Pack of 10)",,10x sealing rings,https://www.wolseley.co.uk/wcsstore/ExtendedSitesCatalogAssetStore/images/products/AssetPush/wol-web-proof-medium-w/std.lang.all/62/83/486283_wm.jpg,,N,"Easicom 2 24, Easicom 3 25s, 30c P, 12s, 30s, 24c P, 24HX, 12s, 25c, 25s, 35c, Betacom 24A, Easicom 24, Easicom 3 24c, 25s, 30c, 35c, Hydraulic Module BU, Hydraulic Module HB, 18s, 30c, 35c, Betacom 3 24C, Betacom 3 30C, 25c, 35 Store, 25s, 30c, 12HX, 30",Heat Exchanger,"Easicom, Energy 2, Energy 7, Essential, Flexicom, Home, Betacom, Energy, Miscellaneous, Sustain, Ultimate 2, Ultimate 3, Ultracom2, Xtramax, Ultimate, C-CI, British Gas",E92000,"Hydraulic Module HB,Betacom 2 24,12 S,Betacom 3 30C,30C,30 S,Betacom 3 24C,15s,Hydraulic Modul,Betacom 4 30C,30SX,Easicom 3 24c,Betacom 24A,Hydraulic Module BU,Easicom 24,Easicom 2 28,35C,25 S,15HX,12HX,BG330,Easicom 3 28c,35 Store,25 C,Betacom 2 28,28C",2000801883,SEALING RING,N,,,pack of 10,,,,,
160,P443709,Glow-worm burner,Glow-worm,261.09,"A Glow-worm replacement part, this burner is compatible with Flexicom, Ultimate and British Gas boilers.  The burner produces heat in a combustible heating appliance. In natural gas appliances gas is transferred to a gas valve and into the burner for ignition. The heat created is used to heat the water in the master heat exchanger.  We know you’re busy and need to get repair jobs done quickly and efficiently. Your local parts specialist is always on hand to support you. They offer help, advice and they can get you the part you need.  Your local branch stocks an in-depth range of domestic gas and oil spare parts from leading manufacturers, so you can fix it first time.",Parts and Spares/sub_categories/Domestic Boiler Parts/sub_categories/Glow Worm Boiler Parts/Glow Worm Boiler Parts.csv -> Glow-worm burner,,,https://www.wolseley.co.uk/wcsstore/ExtendedSitesCatalogAssetStore/images/products/AssetPush/wol-web-proof-medium-w/std.lang.all/37/09/443709_wm.jpg,https://www.wolseley.co.uk/wcsstore/ExtendedSitesCatalogAssetStore/images/products/AssetPush/DTP_AssetPushHighRes/std.lang.all/ti/on/Glow-worm_Flexicom_Installation.pdf,,,,,,,,,,,,,,,,,
161,P443707,Glow-worm heat exchanger and sump,Glow-worm,725.51,"A Glow-worm heat exchanger suitable for Flexicom boilers.  The heat exchanger transfers heat from a boiler's burner to water. A primary heat exchanger is found in all boilers, using heat from a burner to raise the temperature of the water in the system while a secondary heat exchanger is present only in combis and allows the heat to be transferred between closed systems.  We carry over 300 of the most in demand parts in-branch and stock over 25,000 spare parts available for next-day timed delivery.",Parts and Spares/sub_categories/Domestic Boiler Parts/sub_categories/Glow Worm Boiler Parts/Glow Worm Boiler Parts.csv -> Glow-worm heat exchanger and sump,,,https://www.wolseley.co.uk/wcsstore/ExtendedSitesCatalogAssetStore/images/products/AssetPush/wol-web-proof-medium-w/std.lang.all/37/07/443707_wm.jpg,,N,"30SX, 24CX, 18SX, 30CX",Heat Exchanger,Flexicom,H42712,"24CX,30SX,30CX,18SX",0020020707,Heat Exchanger,N,,,,,,,,
162,P700568,Glow-worm heat exchanger and sump,Glow-worm,767.88,"This genuine Glow-worm heat exchanger and sump is a replacement part suitable for Flexicom boilers.  The heat exchanger transfers heat from a boiler's burner to water. A primary heat exchanger is found in all boilers, using heat from a burner to raise the temperature of the water in the system while a secondary heat exchanger is present only in combis and allows the heat to be transferred between closed systems.  We carry over 300 of the most in demand parts in-branch and stock over 25,000 spare parts available for next-day timed delivery.",Parts and Spares/sub_categories/Domestic Boiler Parts/sub_categories/Glow Worm Boiler Parts/Glow Worm Boiler Parts.csv -> Glow-worm heat exchanger and sump,,,https://www.wolseley.co.uk/wcsstore/ExtendedSitesCatalogAssetStore/images/products/AssetPush/wol-web-proof-medium-w/std.lang.all/05/68/700568_wm.jpg,,N,"12HX, 15HX, 30HX, 24HX, 18HX",Heat Exchanger,Flexicom,H42933,,0020026488,Heat Exchanger and Sump,N,,,,,,,,
163,P457605,Glow-worm 2000801159 gas valve assembly,Glow-worm,205.08,"This gas valve is for use in Glow-worm Micron boilers.  The gas valve is employed in the distribution of gas. When gas is required in the burner the printed circuit board (PCB) sends a signal to the gas valve, which opens to allow gas to flow into the burner or the pilot assembly (depending on the model of the appliance).  As the UK’s leading parts specialist, Wolseley carry the widest range of spares, stocking all the big name brands for the trade. Now, to give our customers even more support, we’re adding a greater number of specified parts from leading manufacturers into our branches with the introduction of the Wolseley Branch Parts Accreditation Scheme. Many branches will now be Silver and Gold accredited, a sign that they hold more stock than anyone else, so you can be confident you’ll get the parts you need to fix it first time. Fast.",Parts and Spares/sub_categories/Domestic Boiler Parts/sub_categories/Glow Worm Boiler Parts/Glow Worm Boiler Parts.csv -> Glow-worm 2000801159 gas valve assembly,,,https://www.wolseley.co.uk/wcsstore/ExtendedSitesCatalogAssetStore/images/products/AssetPush/wol-web-proof-medium-w/std.lang.all/76/05/457605_wm.jpg,,N,"30FF, 40FF, 50FF",Control Panel,Micron,E24851,,ALT2000801159,Gas Valve,N,,,,,,,,
164,P440549,Glow-worm olive adaptor reducer,Glow-worm,9.0,"An adaptor olive reducer for the hydraulics section of Glow-worm Economy, Economy Plus, Fuelsaver, Fuelsaver Complheat, Fuelsaver UFB, Protherm, Ultimate, Micron, Xeon, Ikon, Swiftflow and Express units.  To help you find the right parts for your jobs, go to the industry leading parts identification tool, PartsArena, giving you quick access to over 20,000 exploded diagrams, 10,000 images & 20,000 products. FREE to Wolseley trade account customers.",Parts and Spares/sub_categories/Domestic Boiler Parts/sub_categories/Glow Worm Boiler Parts/Glow Worm Boiler Parts.csv -> Glow-worm olive adaptor reducer,,,https://www.wolseley.co.uk/wcsstore/ExtendedSitesCatalogAssetStore/images/products/AssetPush/wol-web-proof-medium-w/std.lang.all/05/49/440549_wm.jpg,,N,"24, 24FF, 30C, 75C, 40R MK2, 50C MK2, 50R MK2, 60B MK2, 60R MK2, 65, 80F, 60-80 CI From Ser No.0104001, 100 FF, 30BF, 30BF SS, 30FF, 30FF, 50FF, 40, 50B, 50F, 60C, 40BR MK2, 75B MK2, 100FF, 30FF LPG, 50FF LPG, 60FF S.I.T, 80FF, 60 FF, 60FF, 40C, 60C, 40C",Hydraulics,"Economy, Economy Plus, Fuelsaver, Fuelsaver Complheat, Fuelsaver UFB, Protherm, Ultimate, Micron, Xeon, Ikon, Swiftflow, Express",312799,"24B,75B MK2,30B MK2,60-80 CI From Ser No.0204001,40 B,30C,50B,60B,50C,60C,30F,40-50 CI,40F,50F,60F,30R MK2,75R MK2,40-50 CI From Ser No.0204001,100 FF,40BR MK2,50,60-80 CI,30,50BR MK2,60BR MK2,40B MK2,75B,75C,100,80,40,30C MK2,40-50",S204185,Adaptor Olive Reducer,N,,,,,,,,
165,P413290,Glow-worm front panel,Glow-worm,102.52,"A Glow-worm casing front panel designed for Flexicom boilers.  Casings vary from model to model, designed to suit different locations, offering differing levels of robustness and a variety of finishes.  As the UK’s leading parts specialist, Wolseley carry the widest range of spares, stocking all the big name brands for the trade. Now, to give our customers even more support, we’re adding a greater number of specified parts from leading manufacturers into our branches with the introduction of the Wolseley Branch Parts Accreditation Scheme. Many branches will now be Silver and Gold accredited, a sign that they hold more stock than anyone else, so you can be confident you’ll get the parts you need to fix it first time. Fast.",Parts and Spares/sub_categories/Domestic Boiler Parts/sub_categories/Glow Worm Boiler Parts/Glow Worm Boiler Parts.csv -> Glow-worm front panel,,,https://www.wolseley.co.uk/wcsstore/ExtendedSitesCatalogAssetStore/images/products/AssetPush/wol-web-proof-medium-w/std.lang.all/32/90/413290_wm.jpg,,N,"18SX, 35CX, 30SX, 24CX, 30CX",Casing,Flexicom,H42703,,0020020696,Front Panel,N,,,,,,,,
166,P457602,PARTS 2000801020 GAS VALVE ASSEMBLY,Glow-worm,156.96,"This gas valve is for Glow-worm Xeon, Economy Plus, Ultimate, Ikon and Protherm boilers.  The gas valve is employed in the distribution of gas. When gas is required in the burner the printed circuit board (PCB) sends a signal to the gas valve, which opens to allow gas to flow into the burner or the pilot assembly (depending on the model of the appliance).  As the UK’s leading parts specialist, Wolseley carry the widest range of spares, stocking all the big name brands for the trade. Now, to give our customers even more support, we’re adding a greater number of specified parts from leading manufacturers into our branches with the introduction of the Wolseley Branch Parts Accreditation Scheme. Many branches will now be Silver and Gold accredited, a sign that they hold more stock than anyone else, so you can be confident you’ll get the parts you need to fix it first time. Fast.",Parts and Spares/sub_categories/Domestic Boiler Parts/sub_categories/Glow Worm Boiler Parts/Glow Worm Boiler Parts.csv -> PARTS 2000801020 GAS VALVE ASSEMBLY,,Gas valve;O-rings,https://www.wolseley.co.uk/wcsstore/ExtendedSitesCatalogAssetStore/images/products/AssetPush/wol-web-proof-medium-w/std.lang.all/76/02/457602_wm.jpg,,N,"30FF, 40FF, 50FF, 60FF, 30F, 40F, 50F, 60F, 80F, 30FF LPG, 40FF LPG, 50FF LPG, 60FF HONEYWELL, 60FF LPG, 60FF S.I.T, 40-50 CI, 40-50 CI From Ser No.0204001, 30 FF, 40 FF, 50 FF, 60 FF",Control Panel,"Economy Plus, Protherm, Ultimate, Ikon, Xeon",E25264,,ALT2000801020,Gas Valve,N,,,,"30FF, 40FF, 50FF, 60FF, 30F, 40F, 50F, 60F, 80F, 30FF LPG, 40FF LPG, 50FF LPG, 60FF HONEYWELL, 60FF LPG, 60FF S.I.T, 40-50 CI, 40-50 CI From Ser No.0204001, 30 FF, 40 FF, 50 FF, 60 FF",,,,
167,P441798,Glow-worm 2000802635 thermistor control,Glow-worm,26.8,"A genuine Glow-worm part, this thermistor is designed for use in Micron boilers and is supplied with a lead.  The thermistor decreases circuit resistance in line with temperature increases. A boiler's printed control board (PCB) sends a current to the thermistor, deciding whether a decrease or increase in heat is required by reading the relative resistance.  As the leading supplier of parts for all the major boiler manufacturers we’ve got a wealth of experience and knowledge in this area, and with over 450 branches we carry more heating spare parts in more places than any other merchant to help you improve your first time fix rate.",Parts and Spares/sub_categories/Domestic Boiler Parts/sub_categories/Glow Worm Boiler Parts/Glow Worm Boiler Parts.csv -> Glow-worm 2000802635 thermistor control,,ThermistorLead,https://www.wolseley.co.uk/wcsstore/ExtendedSitesCatalogAssetStore/images/products/AssetPush/wol-web-proof-medium-w/std.lang.all/17/98/441798_wm.jpg,,N,"30FF, 50FF, 30FF, 40FF, 40FF, 50FF",Control Panel,Micron,H55718,"50FF,40FF,30FF",2000802635,Thermistor,N,,,,,,,,
168,P411507,Glow-worm hydraulic valve,Glow-worm,361.56,"A Glow-worm replacement part, this hydraulic valve is suitable for use in Betacom 3 and 4, Energy, Energy 2 and 7 and Eltimate 2 and 3 boilers.  We know you’re busy and need to get repair jobs done quickly and efficiently. Your local parts specialist is always on hand to support you. They offer help, advice and they can get you the part you need.  Your local branch stocks an in-depth range of domestic gas and oil spare parts from leading manufacturers, so you can fix it, first time.",Parts and Spares/sub_categories/Domestic Boiler Parts/sub_categories/Glow Worm Boiler Parts/Glow Worm Boiler Parts.csv -> Glow-worm hydraulic valve,,hydraulic valveseals,https://www.wolseley.co.uk/wcsstore/ExtendedSitesCatalogAssetStore/images/products/AssetPush/wol-web-proof-medium-w/std.lang.all/15/07/411507_wm.jpg,,N,,Hydraulics,Betacom 3Betacom 4EnergyEnergy 2Energy 7Ultimate 2Ultimate 3,n/a,,0020195592,Hydraulic Valve,N,,,,,,,,
169,P443788,Glow-worm 0020020780 cable tree,Glow-worm,19.11,"This Glow-worm brand cable tree is designed for use in Flexicom, Ultimate, British Gas and Ultrapower boilers.  Cables connect the printed circuit board (PCB) to thermostats, switches and sensors, giving it complete control over the boiler's processes and safety protocols.  As the UK’s leading parts specialist, Wolseley carry the widest range of spares, stocking all the big name brands for the trade. Now, to give our customers even more support, we’re adding a greater number of specified parts from leading manufacturers into our branches with the introduction of the Wolseley Branch Parts Accreditation Scheme. Many branches will now be Silver and Gold accredited, a sign that they hold more stock than anyone else, so you can be confident you’ll get the parts you need to fix it first time. Fast.",Parts and Spares/sub_categories/Domestic Boiler Parts/sub_categories/Glow Worm Boiler Parts/Glow Worm Boiler Parts.csv -> Glow-worm 0020020780 cable tree,,,https://www.wolseley.co.uk/wcsstore/ExtendedSitesCatalogAssetStore/images/products/AssetPush/wol-web-proof-medium-w/std.lang.all/37/88/NW-443788_wm.jpg,,N,"12HX, 18SX, 30HX, 24H, 30CX, 30SX, 35CX, 24CX, BG330+, 15HX, 18HX, SXI 100, SXI 170, 24HX, 35HX",Control Panel,"Flexicom, Ultimate, British Gas, Ultrapower",H42789,,0020020780,Cable Tree,N,,,,,,,,
