,pid,Title,Brand,Price,Description,category,mfpartnumber,whatisincluded,Image,Colour,Range,Thickness,Warranty,Hazardous,Frame Colour,Material,Supplier Product Code,Type,WEEE Compliant,Feature 1,Feature 2,Feature 3,Feature 4,Feature 5,Feature 6,Feature 7,Feature 8,Attachment 1,Attachment 2,Attachment 3,Attachment 4,Diameter,Sector,Pack Quantity,Depth (mm),Feature 9
76,PD16381,Roman Haven side panel 900mm,Roman,161.74,"Compatible with the Haven bi-fold, pivot or sliding doors, the Roman Haven 900 x 1900mm shower side panel is a simple, attractive design that will look great in most bathrooms. Made with thick clear glass, this shower panel has a bright silver frame to complement existing taps and shower fittings.",Showering/Shower Curtains and Screens/Shower Curtains and Screens.csv -> Roman Haven side panel 900mm,,Panel; fixing pack; instructions; Guarantee card,https://www.wolseley.co.uk/wcsstore/ExtendedSitesCatalogAssetStore/images/products/AssetPush/wol-web-proof-medium-w/std.lang.all/an/el/Haven_Side_Panel_wm.jpg,Bright Silver,Haven,6mm,Truelife Lifetime,N,Bright Silver,Glass & Aluminium,H3R9CS,Side Panel,N,With 6mm thick glass,Bright silver frame,Plastic top caps with chrome finish,Reversible design for left or right-handed fixing,Lifetime warranty,,,,,,,,,,,,
77,PD03942,Ideal Standard Tempo Cube shower bath screen White,Ideal Standard,322.01,"This Ideal Standard Tempo Cube shower/bath screen incorporates a luxuriant cube-shaped back rest for a little extra indulgence while you soak. Designed to complement the Tempo range of bathroom furniture, this simple, understated screen will also look good with other ranges.",Showering/Shower Curtains and Screens/Shower Curtains and Screens.csv -> Ideal Standard Tempo Cube shower bath screen White,,,https://www.wolseley.co.uk/wcsstore/ExtendedSitesCatalogAssetStore/images/products/AssetPush/wol-web-proof-medium-w/std.lang.all/39/42/UP-D03942_wm.jpg,,,,,,,,,,,,,,,,,,,https://www.wolseley.co.uk/wcsstore/ExtendedSitesCatalogAssetStore/images/products/AssetPush/DTP_AssetPushHighRes/std.lang.all/20/15/IS_Bath_Book_Brchr_2015.pdf,https://www.wolseley.co.uk/wcsstore/ExtendedSitesCatalogAssetStore/images/products/AssetPush/DTP_AssetPushHighRes/std.lang.all/20/14/IS_Essentials_Brcr_2014.pdf,,,,,,,
78,PD28959,Ionic curtain rail bath screen,Ionic,158.84,"Combining the flexibility of a shower curtain with the security of glass, this Ionic curtain rail bath screen protects from splashes and does away with that annoying gap between wall and curtain. Manufactured in 6mm toughened glass, this panel can be used with any shower curtain.",Showering/Shower Curtains and Screens/Shower Curtains and Screens.csv -> Ionic curtain rail bath screen,,,https://www.wolseley.co.uk/wcsstore/ExtendedSitesCatalogAssetStore/images/products/AssetPush/wol-web-proof-medium-w/std.lang.all/89/59/UP-D28959_wm.jpg,,,,,,,,,,,,,,,,,,,https://www.wolseley.co.uk/wcsstore/ExtendedSitesCatalogAssetStore/images/products/AssetPush/DTP_AssetPushHighRes/std.lang.all/ic/al/D28959_Technical.pdf,https://www.wolseley.co.uk/wcsstore/ExtendedSitesCatalogAssetStore/images/products/AssetPush/DTP_AssetPushHighRes/std.lang.all/3_/14/Ionic_Showering_Brochure_2013_14.pdf,https://www.wolseley.co.uk/wcsstore/ExtendedSitesCatalogAssetStore/images/products/AssetPush/DTP_AssetPushHighRes/std.lang.all/ti/on/D28959_Installation.pdf,,,,,,
79,PD47409,Croydex high performance curtain,Croydex,27.47,"Designed for long-lasting use, this Croydex clean, bright white shower curtain is made from 100% polyester with a Proseal coating for unbeatable water repellency. Machine washable and strong, this ready-to-hang shower curtain remains opaque even when wet for added privacy.",Showering/Shower Curtains and Screens/Shower Curtains and Screens.csv -> Croydex high performance curtain,,,https://www.wolseley.co.uk/wcsstore/ExtendedSitesCatalogAssetStore/images/products/AssetPush/wol-web-proof-medium-w/std.lang.all/74/09/UP-D47409_wm.jpg,,,,,,,,,,,,,,,,,,,https://www.wolseley.co.uk/wcsstore/ExtendedSitesCatalogAssetStore/images/products/AssetPush/DTP_AssetPushHighRes/std.lang.all/20/19/Croydex_Product_Catalogue_2019.pdf,https://www.wolseley.co.uk/wcsstore/ExtendedSitesCatalogAssetStore/images/products/AssetPush/DTP_AssetPushHighRes/std.lang.all/hu/re/Croydex_ShowerCurtains_Brochure.pdf,,,,,,,
80,PD30020,Croydex bendy shower rail 2000mm Silver,Croydex,48.82,"This 2M Croydex silver bendy shower rail is supplied with ceiling support, hooks, gliders. With two separate aluminium extrusions and a central flexible PVC core, this rail can be bent at any point to follow the curve of a bath or shower.",Showering/Shower Curtains and Screens/Shower Curtains and Screens.csv -> Croydex bendy shower rail 2000mm Silver,,Bendy rail;2 piece wall brackets;24 piece gliders;26 piece hooks;Ceiling hanger support;Ceiling support bracket;2 piece end stop;2 piece fixing nut;5 piece wall plug;No.6 x 1 inch self tapping screw;No.4 x 1/4 inch self tapping screw;5 piece No.8 x 1-1/4,https://www.wolseley.co.uk/wcsstore/ExtendedSitesCatalogAssetStore/images/products/AssetPush/wol-web-proof-medium-w/std.lang.all/00/20/UP-D30020_wm.jpg,,,,,,,,,,,,,,,,,,,https://www.wolseley.co.uk/wcsstore/ExtendedSitesCatalogAssetStore/images/products/AssetPush/DTP_AssetPushHighRes/std.lang.all/20/19/Croydex_Product_Catalogue_2019.pdf,https://www.wolseley.co.uk/wcsstore/ExtendedSitesCatalogAssetStore/images/products/AssetPush/DTP_AssetPushHighRes/std.lang.all/ti/on/Croydex_BendyRail_Installation.pdf,,,,,,,
