,pid,Title,Brand,Price,Description,category,mfpartnumber,whatisincluded,Image,Colour,Range,Thickness,Warranty,Hazardous,Frame Colour,Material,Supplier Product Code,Type,WEEE Compliant,Feature 1,Feature 2,Feature 3,Feature 4,Feature 5,Feature 6,Feature 7,Feature 8,Attachment 1,Attachment 2,Attachment 3,Attachment 4,Diameter,Sector,Pack Quantity,Depth (mm),Feature 9
25,PD12208,Saracen straight rail 1830mm Silver,Saracen,30.32,Saracen straight rail is made up of aluminium. Behind every shower curtain is a great way to hang it up. Croydex rod and rail comes in a range of styles and offer several choices to complete bathroom look.,Showering/Shower Curtains and Screens/Shower Curtains and Screens.csv -> Saracen straight rail 1830mm Silver,,Straight railTwelve hooksGlidersAll fixings,https://www.wolseley.co.uk/wcsstore/ExtendedSitesCatalogAssetStore/images/products/AssetPush/wol-web-proof-medium-w/std.lang.all/22/11/NW-D12207_D12211_wm.jpg,,,,,,,,,,,,,,,,,,,https://www.wolseley.co.uk/wcsstore/ExtendedSitesCatalogAssetStore/images/products/AssetPush/DTP_AssetPushHighRes/std.lang.all/ic/al/D12208_Saracen_Technical.pdf,https://www.wolseley.co.uk/wcsstore/ExtendedSitesCatalogAssetStore/images/products/AssetPush/DTP_AssetPushHighRes/std.lang.all/io/ns/D12208_Saracen_Instructions.pdf,,,,,,,
26,PD12203,Saracen AE100022 vinyl curtain 1800 x 1800mm White,Saracen,13.82,"Measuring 1.8 x 1.8M, this white vinyl Saracen shower curtain is a simple, classy choice for any bathroom. Fully waterproof on one side and featuring tear-resistant eyelets, this shower curtain is machine washable for convenience.",Showering/Shower Curtains and Screens/Shower Curtains and Screens.csv -> Saracen AE100022 vinyl curtain 1800 x 1800mm White,,,https://www.wolseley.co.uk/wcsstore/ExtendedSitesCatalogAssetStore/images/products/AssetPush/wol-web-proof-medium-w/std.lang.all/22/03/NW-D12203_wm.jpg,,,,,,,,,,,,,,,,,,,https://www.wolseley.co.uk/wcsstore/ExtendedSitesCatalogAssetStore/images/products/AssetPush/DTP_AssetPushHighRes/std.lang.all/ic/al/D12203_Saracen_Technical.pdf,,,,,,,,
27,PD12218,Saracen GP89500 curtain rod 2000mm Stainless Steel,Saracen,42.76,This trimmable Saracen curtain rod is made of durable stainless steel with a chrome wall bracket for reliably strong shower curtain hanging.,Showering/Shower Curtains and Screens/Shower Curtains and Screens.csv -> Saracen GP89500 curtain rod 2000mm Stainless Steel,,Curtain rodAll fixings,https://www.wolseley.co.uk/wcsstore/ExtendedSitesCatalogAssetStore/images/products/AssetPush/wol-web-proof-medium-w/std.lang.all/22/18/NW-D12218_wm.jpg,Steel,,,,N,,Stainless Steel,GP89500PCC,Curtain Rod,N,Stainless steel rod,Chrome-plated zinc wall bracket,2000mm standard size,Can be trimmed to size,25mm diameter,All fixings are included,,,,,,,25 mm,"Healthcare,Assisted Living,Hotels/Leisure,Sport/Fitness",,,
28,PD25382,Coram curved bath screen 800mm Chrome Plated/Clear,Coram,114.65,"The Coram 800mm curved bath screen includes concealed fixings and a smooth hinge for easier cleaning and a neat, unobtrusive look. The chrome-finished aluminium frame is corrosion-resistant for a longer, rust-free life.",Showering/Shower Curtains and Screens/Shower Curtains and Screens.csv -> Coram curved bath screen 800mm Chrome Plated/Clear,,,https://www.wolseley.co.uk/wcsstore/ExtendedSitesCatalogAssetStore/images/products/AssetPush/wol-web-proof-medium-w/std.lang.all/53/82/UP-D25382_wm.jpg,,,,,,,,,,,,,,,,,,,https://www.wolseley.co.uk/wcsstore/ExtendedSitesCatalogAssetStore/images/products/AssetPush/DTP_AssetPushHighRes/std.lang.all/ta/ll/Coram_Frameless_Bathscreen_Install.pdf,https://www.wolseley.co.uk/wcsstore/ExtendedSitesCatalogAssetStore/images/products/AssetPush/DTP_AssetPushHighRes/std.lang.all/20/21/Coram_Showers_Brochure_July_2021.pdf,https://www.wolseley.co.uk/wcsstore/ExtendedSitesCatalogAssetStore/images/products/AssetPush/DTP_AssetPushHighRes/std.lang.all/ic/al/Coram_Bathscreen_Technical.pdf,,,,,,
29,PD12213,Saracen spare hooks and gliders (Pack of 12),Saracen,4.01,Saracen hooks and gliders available in 12 per pack. Suitable for use with both Profile 400 and 800 rails where more than one shower curtain is required.,Showering/Shower Curtains and Screens/Shower Curtains and Screens.csv -> Saracen spare hooks and gliders (Pack of 12),,12x hooks and gliders,https://www.wolseley.co.uk/wcsstore/ExtendedSitesCatalogAssetStore/images/products/AssetPush/wol-web-proof-medium-w/std.lang.all/22/13/NW-D12213_wm.jpg,,,,,,,,,,,,,,,,,,,https://www.wolseley.co.uk/wcsstore/ExtendedSitesCatalogAssetStore/images/products/AssetPush/DTP_AssetPushHighRes/std.lang.all/ic/al/D12213_Saracen_Technical.pdf,,,,,,,,
30,PT41185,Scudo P-shaped bath screen,Scudo,101.43,"Designed for P-shaped baths, this Scudo 800 x 1700mm P-shaped barrel hinge shower screen, manufactured in Aquashield protected glass, reduces splashing when using an over bath shower.",Showering/Shower Curtains and Screens/Shower Curtains and Screens.csv -> Scudo P-shaped bath screen,,,https://www.wolseley.co.uk/wcsstore/ExtendedSitesCatalogAssetStore/images/products/AssetPush/wol-web-proof-medium-w/std.lang.all/11/85/T41185_wm.jpg,Clear,,6mm,"Lifetime (fixed parts only) parts, 2 years moving parts and seals",N,Chrome,Aluminium,SCREEN002,P Shaped barrel hinge,N,Universal right or left-handed fitting,With Aquashield protection,6mm thick glass construction,Clear glass,Aluminium frame,Lifetime warranty on fixed parts,2 year warranty on moving parts and seals,,,,,,,,,,
31,PT41182,Scudo S6 Square Edge Bath Screen 1400 x 800mm,Scudo,88.28,The Scudo S6 1400 x 800mm square edge bath screen offers universal fitting for left- or right-handed opening to suit your bathroom design. This smart chrome framed screen is manufactured in a robust toughened safety glass.,Showering/Shower Curtains and Screens/Shower Curtains and Screens.csv -> Scudo S6 Square Edge Bath Screen 1400 x 800mm,,Bath Screen,https://www.wolseley.co.uk/wcsstore/ExtendedSitesCatalogAssetStore/images/products/AssetPush/wol-web-proof-medium-w/std.lang.all/82/_a/T41182_A_wm.jpg,White,,6mm,Lifetimes,N,Chrome,Glass & Aluminium,LS099N,Bath Screen,N,Manufactured in 6mm thick toughened safety glass,Reversible fitting for ease of installation,Aluminium frame construction,Polished chrome frame finish,Lifetime warranty,,,,,,,,,,,,
32,PD12211,"Saracen straight rail 915mm, Silver",Saracen,21.73,Saracen straight rail is made up of aluminium. Behind every shower curtain is a great way to hang it up. Croydex rod and rail comes in a range of styles and offer several choices to complete bathroom look.,"Showering/Shower Curtains and Screens/Shower Curtains and Screens.csv -> Saracen straight rail 915mm, Silver",,Straight railTwelve hooksGlidersAll fixings,https://www.wolseley.co.uk/wcsstore/ExtendedSitesCatalogAssetStore/images/products/AssetPush/wol-web-proof-medium-w/std.lang.all/22/11/NW-D12207_D12211_wm.jpg,,,,,,,,,,,,,,,,,,,https://www.wolseley.co.uk/wcsstore/ExtendedSitesCatalogAssetStore/images/products/AssetPush/DTP_AssetPushHighRes/std.lang.all/io/ns/D12211_Saracen_Instructions.pdf,https://www.wolseley.co.uk/wcsstore/ExtendedSitesCatalogAssetStore/images/products/AssetPush/DTP_AssetPushHighRes/std.lang.all/ic/al/D12211_Saracen_Technical.pdf,,,,,,,
33,PD30322,Croydex high performance textile shower curtain White,Croydex,34.31,"Designed for long-lasting use, this Croydex clean, bright white shower curtain is made from 100% polyester with a Proseal coating for unbeatable water repellency. Machine washable and strong, this ready-to-hang shower curtain remains opaque even when wet for added privacy.",Showering/Shower Curtains and Screens/Shower Curtains and Screens.csv -> Croydex high performance textile shower curtain White,,,https://www.wolseley.co.uk/wcsstore/ExtendedSitesCatalogAssetStore/images/products/AssetPush/wol-web-proof-medium-w/std.lang.all/03/22/UP-D30322_wm.jpg,,,,,,,,,,,,,,,,,,,https://www.wolseley.co.uk/wcsstore/ExtendedSitesCatalogAssetStore/images/products/AssetPush/DTP_AssetPushHighRes/std.lang.all/20/19/Croydex_Product_Catalogue_2019.pdf,,,,,,,,
34,PD12206,Saracen shower curtain rings White (Pack of 12),Saracen,2.98,A pack of 12 Saracen white shower curtain rings.,Showering/Shower Curtains and Screens/Shower Curtains and Screens.csv -> Saracen shower curtain rings White (Pack of 12),,,https://www.wolseley.co.uk/wcsstore/ExtendedSitesCatalogAssetStore/images/products/AssetPush/wol-web-proof-medium-w/std.lang.all/22/06/NW-D12206_wm.jpg,White,,,n/a,N,,,GP90051PCC,Shower Curtain Ring,N,Pack of 12 rings,White colour,For use with curtain rods up to 29mm diameter,,,,,,,,,,,Hotels/Leisure,pack of 12,N/A,
35,PD12216,Saracen telescopic rod 1100 - 2600mm Chrome,Saracen,20.46,This Saracen 1100-2600mm telescopic shower curtain rod is made from ABS with a chrome finish.,Showering/Shower Curtains and Screens/Shower Curtains and Screens.csv -> Saracen telescopic rod 1100 - 2600mm Chrome,,,https://www.wolseley.co.uk/wcsstore/ExtendedSitesCatalogAssetStore/images/products/AssetPush/wol-web-proof-medium-w/std.lang.all/22/17/NW-D12216_D12217_wm.jpg,Chrome,,,,N,,,AD109541PCC,Telescopic Rod,N,Abs chrome plated wall bracketsbright anodised aluminium tubetelescopicadhesive pads for additional support,,,,,,,,,,,,,"Healthcare,Hotels/Leisure,Assisted Living,Sport/Fitness",,,
36,PD65402,Coram Premier 8 1100 return panel 200mm Chrome,Coram,278.68,"A modern and attractive semi-frameless design, this Coram Premier 8 shower panel has a 1100mm width and stands at 2000mm for full coverage. Helping to create a spacious shower enclosure, this easy to clean thick glass panel is available in a wide variety of additional dimensions.",Showering/Shower Curtains and Screens/Shower Curtains and Screens.csv -> Coram Premier 8 1100 return panel 200mm Chrome,,,https://www.wolseley.co.uk/wcsstore/ExtendedSitesCatalogAssetStore/images/products/AssetPush/wol-web-proof-medium-w/std.lang.all/54/03/NW-D65401_D65403_wm.jpg,,,,,,,,,,,,,,,,,,,https://www.wolseley.co.uk/wcsstore/ExtendedSitesCatalogAssetStore/images/products/AssetPush/DTP_AssetPushHighRes/std.lang.all/ti/on/Coram_Premier_8_Installation.pdf,https://www.wolseley.co.uk/wcsstore/ExtendedSitesCatalogAssetStore/images/products/AssetPush/DTP_AssetPushHighRes/std.lang.all/ic/al/Coram_Premier_8_Technical.pdf,,,,,,,
37,PD28917,Ionic Express side panel shower enclosure 800mm,Ionic,289.97,"This 800mm Ionic Express shower side panel is suitable for use with shower enclosures in the Ionic Express range. Built in 6mm toughened glass, this panel is treated with Mershield Stayclear for ongoing easy cleaning.",Showering/Shower Curtains and Screens/Shower Curtains and Screens.csv -> Ionic Express side panel shower enclosure 800mm,,,https://www.wolseley.co.uk/wcsstore/ExtendedSitesCatalogAssetStore/images/products/AssetPush/wol-web-proof-medium-w/std.lang.all/89/17/UP-D28916_D28917_wm.jpg,,,,,,,,,,,,,,,,,,,https://www.wolseley.co.uk/wcsstore/ExtendedSitesCatalogAssetStore/images/products/AssetPush/DTP_AssetPushHighRes/std.lang.all/hu/re/Ionic_Shower_Brochure.pdf,https://www.wolseley.co.uk/wcsstore/ExtendedSitesCatalogAssetStore/images/products/AssetPush/DTP_AssetPushHighRes/std.lang.all/ta/ll/Merlyn_IonicExpress_PDoor_Install.pdf,https://www.wolseley.co.uk/wcsstore/ExtendedSitesCatalogAssetStore/images/products/AssetPush/DTP_AssetPushHighRes/std.lang.all/te/ch/Merlyn_IonicExpress_PDoorPanel_Tech.pdf,,,,,,
38,PD12209,Saracen straight rail 2135mm Silver,Saracen,32.16,Saracen straight rail is made up of aluminium. Behind every shower curtain is a great way to hang it up. Croydex rod and rail comes in a range of styles and offer several choices to complete bathroom look.,Showering/Shower Curtains and Screens/Shower Curtains and Screens.csv -> Saracen straight rail 2135mm Silver,,Straight railTwelve hooksGlidersAll fixings,https://www.wolseley.co.uk/wcsstore/ExtendedSitesCatalogAssetStore/images/products/AssetPush/wol-web-proof-medium-w/std.lang.all/22/11/NW-D12207_D12211_wm.jpg,,,,,,,,,,,,,,,,,,,https://www.wolseley.co.uk/wcsstore/ExtendedSitesCatalogAssetStore/images/products/AssetPush/DTP_AssetPushHighRes/std.lang.all/ic/al/D12209_Saracen_Technical.pdf,https://www.wolseley.co.uk/wcsstore/ExtendedSitesCatalogAssetStore/images/products/AssetPush/DTP_AssetPushHighRes/std.lang.all/io/ns/D12209_Saracen_Instructions.pdf,,,,,,,
39,PD12202,Saracen AF160000 textile curtain 1800 x 1800mm White,Saracen,19.41,"Measuring 1.8 x 1.8M, this white textile Saracen shower curtain is a simple, classy choice for any bathroom. Fully waterproof on one side and featuring tear-resistant eyelets, this shower curtain is machine washable for convenience.",Showering/Shower Curtains and Screens/Shower Curtains and Screens.csv -> Saracen AF160000 textile curtain 1800 x 1800mm White,,,https://www.wolseley.co.uk/wcsstore/ExtendedSitesCatalogAssetStore/images/products/AssetPush/wol-web-proof-medium-w/std.lang.all/22/02/NW-D12202_wm.jpg,,,,,,,,,,,,,,,,,,,https://www.wolseley.co.uk/wcsstore/ExtendedSitesCatalogAssetStore/images/products/AssetPush/DTP_AssetPushHighRes/std.lang.all/ic/al/D12202_Saracen_Technical.pdf,,,,,,,,
40,PD12217,Saracen telescopic rod 1100 - 1830mm Chrome,Saracen,12.97,This Saracen 1100-1830mm telescopic shower curtain rod is made from ABS with a chrome finish.,Showering/Shower Curtains and Screens/Shower Curtains and Screens.csv -> Saracen telescopic rod 1100 - 1830mm Chrome,,,https://www.wolseley.co.uk/wcsstore/ExtendedSitesCatalogAssetStore/images/products/AssetPush/wol-web-proof-medium-w/std.lang.all/22/17/NW-D12216_D12217_wm.jpg,Chrome,,,,N,,,AD109641PCC,Telescopic Rod,N,Abs chrome plated wall bracketsbright anodised aluminium tubetelescopicadhesive pads for additional support,,,,,,,,,,,,,"Healthcare,Hotels/Leisure,Assisted Living,Sport/Fitness",,,
41,PD12210,Saracen angled rail 915 x 915mm Silver,Saracen,35.72,Saracen angled rail is made up of aluminium. Behind every shower curtain is a great way to hang it up. Croydex rod and rail comes in a range of styles and offer several choices to complete bathroom look.,Showering/Shower Curtains and Screens/Shower Curtains and Screens.csv -> Saracen angled rail 915 x 915mm Silver,,Angled railTwelve hooksGlidersAll fixings,https://www.wolseley.co.uk/wcsstore/ExtendedSitesCatalogAssetStore/images/products/AssetPush/wol-web-proof-medium-w/std.lang.all/22/11/NW-D12207_D12211_wm.jpg,,,,,,,,,,,,,,,,,,,https://www.wolseley.co.uk/wcsstore/ExtendedSitesCatalogAssetStore/images/products/AssetPush/DTP_AssetPushHighRes/std.lang.all/ic/al/D12210_Saracen_Technical.pdf,https://www.wolseley.co.uk/wcsstore/ExtendedSitesCatalogAssetStore/images/products/AssetPush/DTP_AssetPushHighRes/std.lang.all/io/ns/D12210_Saracen_Instructions.pdf,,,,,,,
42,PD30242,Croydex Profile 800 shower rail 2135mm Silver,Croydex,34.39,"The lightweight and strong 2135mm Croydex Profile 800 straight shower rail is a professional rail system designed to effortlessly hold a shower curtain. Supplied with hooks and gliders, this curtain rail is pre-formed and incorporates a rigid H section for bends without sagging.",Showering/Shower Curtains and Screens/Shower Curtains and Screens.csv -> Croydex Profile 800 shower rail 2135mm Silver,,Straight shower rail;Wall plugs x 4-10;No.8 x 1 1/4 inch screws x 4 -10;No.6 x 1 inch self tapping screw x 1 or 2;No.4 x 1/4 inch self tapping screw x 1 or 2;Gliders ;hooks x 12 - 24;End stop ;fixing nut x 1 or 2;Ceiling hanger support x 1 or 2;Ceiling s,https://www.wolseley.co.uk/wcsstore/ExtendedSitesCatalogAssetStore/images/products/AssetPush/wol-web-proof-medium-w/std.lang.all/02/42/UP-D30242_wm.jpg,,,,,,,,,,,,,,,,,,,https://www.wolseley.co.uk/wcsstore/ExtendedSitesCatalogAssetStore/images/products/AssetPush/DTP_AssetPushHighRes/std.lang.all/ti/on/Croydex_SlenderlineKit_Installation.pdf,https://www.wolseley.co.uk/wcsstore/ExtendedSitesCatalogAssetStore/images/products/AssetPush/DTP_AssetPushHighRes/std.lang.all/20/19/Croydex_Product_Catalogue_2019.pdf,,,,,,,
43,PD25063,CORAM FXD 250 SCRN PANEL C/W BASKT CH/PL,Coram,112.2,"This Coram 1400 x 250mm narrow fixed panel is designed for use with a Coram bath screen to increase its overall length. Ideal for use on longer baths or where a powerful shower creates spray, this glass panel offers additional protection with no need for a shower curtain. All Coram bath screens are well-built, with aluminium framing resistant to corrosion and toughened safety glass. The frame is finished in chrome for a neat look.",Showering/Shower Curtains and Screens/Shower Curtains and Screens.csv -> CORAM FXD 250 SCRN PANEL C/W BASKT CH/PL,,,https://www.wolseley.co.uk/wcsstore/ExtendedSitesCatalogAssetStore/images/products/AssetPush/wol-web-proof-medium-w/std.lang.all/50/63/D25063_wm.jpg,,,,,,,,,,,,,,,,,,,https://www.wolseley.co.uk/wcsstore/ExtendedSitesCatalogAssetStore/images/products/AssetPush/DTP_AssetPushHighRes/std.lang.all/hu/re/Coram_Showers_Brochure.pdf,,,,,,,,
44,PD16379,Roman Haven side panel 760mm,Roman,148.03,"Compatible with the Haven bi-fold, pivot or sliding doors, the Roman Haven 760 x 1900mm shower side panel is a simple, attractive design that will look great in most bathrooms. Made with thick clear glass, this shower panel has a bright silver frame to complement existing taps and shower fittings.",Showering/Shower Curtains and Screens/Shower Curtains and Screens.csv -> Roman Haven side panel 760mm,,,https://www.wolseley.co.uk/wcsstore/ExtendedSitesCatalogAssetStore/images/products/AssetPush/wol-web-proof-medium-w/std.lang.all/an/el/Haven_Side_Panel_wm.jpg,Bright Silver,Haven,6mm,Truelife Lifetime Guarantee,N,Bright Silver,Glass & Aluminium,H3R76CS,Side Panel,N,With 6mm thick glass,Bright silver frame,Plastic top caps with chrome finish,Reversible design for left or right-handed fixing,Lifetime warranty,,,,,,,,,,,,
45,PT41186,Scudo L-shaped bath screen,Scudo,131.2,"Designed for L-shaped baths, this Scudo 850 x 1700mm L-shaped barrel hinge shower screen, manufactured in Aquashield protected glass, reduces splashing when using an over bath shower.",Showering/Shower Curtains and Screens/Shower Curtains and Screens.csv -> Scudo L-shaped bath screen,,,https://www.wolseley.co.uk/wcsstore/ExtendedSitesCatalogAssetStore/images/products/AssetPush/wol-web-proof-medium-w/std.lang.all/11/86/T41186_wm.jpg,Clear,,6mm,"Lifetime (fixed parts only) parts, 2 years moving parts and seals",N,Chrome,Aluminium,SCREEN003,L Shaped barrel Hinge,N,Universal right or left-handed fitting,With Aquashield protection,6mm thick glass construction,Clear glass,Aluminium frame,Lifetime warranty on fixed parts,2 year warranty on moving parts and seals,,,,,,,,,,
46,PT41931,Scudo fixed panel 1000 x 1400mm,Scudo,142.23,"Made with thick toughened glass for reliable safety, the Scudo S6 1000 x 1400mm fixed shower panel has a simple, practical design with a smart chrome frame. Designed for left or right-handed opening, this shower panel offers easy installation and easy cleaning.",Showering/Shower Curtains and Screens/Shower Curtains and Screens.csv -> Scudo fixed panel 1000 x 1400mm,,,https://www.wolseley.co.uk/wcsstore/ExtendedSitesCatalogAssetStore/images/products/AssetPush/wol-web-proof-medium-w/std.lang.all/19/31/T41931_wm.jpg,Clear,,6mm,"Lifetime (fixed parts only), 2 years moving parts and seals",N,Chrome,Aluminium,SCREEN006,Pivot bath panel,N,Manufactured in 6mm thick toughened safety glass,Chrome frame,Universal design for left and right-handed opening,Aquashield glass treatment for ease of cleaning,Smooth sliding action,Large adjustment for out of true walls,Easy installation,Lifetime warranty on fixed parts,,,,,,,,,2 year warranty on moving parts and seals
47,PD47300,Croydex PVC curtain White,Croydex,10.55,"This Croydex shower curtain is made of a clean white PVC designed to suit any bathroom. Easy to clean and ready to hang, this tear-resistant curtain is entirely waterproof to prevent leaks.",Showering/Shower Curtains and Screens/Shower Curtains and Screens.csv -> Croydex PVC curtain White,,,https://www.wolseley.co.uk/wcsstore/ExtendedSitesCatalogAssetStore/images/products/AssetPush/wol-web-proof-medium-w/std.lang.all/73/00/UP-D47300_wm.jpg,,,,,,,,,,,,,,,,,,,https://www.wolseley.co.uk/wcsstore/ExtendedSitesCatalogAssetStore/images/products/AssetPush/DTP_AssetPushHighRes/std.lang.all/20/19/Croydex_Product_Catalogue_2019.pdf,,,,,,,,
48,PC93058,AKW 24083 2.4M X 2M SHOWER CURTAIN,AKW,25.48,"Machine washable and hardwearing, this AKW 2400 x 2000mm heavy duty shower curtain in white is made with heavyweight woven polyester with a weighted hem, keeping it contained within the shower area, reducing splashes and flooding with no annoying clinging. Breathable yet completely waterproof, this practical shower curtain helps to keep your bathroom neat and safe during and after showering.",Showering/Shower Curtains and Screens/Shower Curtains and Screens.csv -> AKW 24083 2.4M X 2M SHOWER CURTAIN,,,https://www.wolseley.co.uk/wcsstore/ExtendedSitesCatalogAssetStore/images/products/AssetPush/wol-web-proof-medium-w/std.lang.all/30/58/NW-C93058_wm.jpg,,,,,,,,,,,,,,,,,,,https://www.wolseley.co.uk/wcsstore/ExtendedSitesCatalogAssetStore/images/products/AssetPush/DTP_AssetPushHighRes/std.lang.all/ic/al/AKW_HD_Curtains_Technical.pdf,https://www.wolseley.co.uk/wcsstore/ExtendedSitesCatalogAssetStore/images/products/AssetPush/DTP_AssetPushHighRes/std.lang.all/ic/al/AKW_BathroomProducts_Technical.pdf,https://www.wolseley.co.uk/wcsstore/ExtendedSitesCatalogAssetStore/images/products/AssetPush/DTP_AssetPushHighRes/std.lang.all/hu/re/AKW_Brochure.pdf,https://www.wolseley.co.uk/wcsstore/ExtendedSitesCatalogAssetStore/images/products/AssetPush/DTP_AssetPushHighRes/std.lang.all/ic/al/AKW_HD curtains_Technical.pdf,,,,,
49,PD28958,Ionic 4 fold bath screen,Ionic,239.18,"A great space-saver, the Ionic four fold bath/shower screen is an ideal choice for small bathrooms, folding neatly away flush to the wall when not in use. Extending to 850mm and manufactured in toughened safety glass, this screen is treated with Mershield Stayclear glass protection for ongoing clarity with minimal cleaning effort.",Showering/Shower Curtains and Screens/Shower Curtains and Screens.csv -> Ionic 4 fold bath screen,,,https://www.wolseley.co.uk/wcsstore/ExtendedSitesCatalogAssetStore/images/products/AssetPush/wol-web-proof-medium-w/std.lang.all/89/58/UP-D28958_wm.jpg,,,,,,,,,,,,,,,,,,,https://www.wolseley.co.uk/wcsstore/ExtendedSitesCatalogAssetStore/images/products/AssetPush/DTP_AssetPushHighRes/std.lang.all/3_/14/Ionic_Showering_Brochure_2013_14.pdf,https://www.wolseley.co.uk/wcsstore/ExtendedSitesCatalogAssetStore/images/products/AssetPush/DTP_AssetPushHighRes/std.lang.all/ti/on/D28958_Installation.pdf,https://www.wolseley.co.uk/wcsstore/ExtendedSitesCatalogAssetStore/images/products/AssetPush/DTP_AssetPushHighRes/std.lang.all/ic/al/D28958_Technical.pdf,,,,,,
50,PD30449,Croydex Profile 800 shower rail 760 x 1675mm Silver,Croydex,46.06,"The lightweight and strong 760 x 1675mm Croydex Profile 800 L-shaped shower rail is a professional rail system designed to effortlessly hold a shower curtain. Supplied with hooks and gliders, this curtain rail is pre-formed and incorporates a rigid H section for bends without sagging.",Showering/Shower Curtains and Screens/Shower Curtains and Screens.csv -> Croydex Profile 800 shower rail 760 x 1675mm Silver,,L shaped shower rail;Wall plugs x 4-10;No.8 x 1 1/4 inch screws x 4 -10;No.6 x 1 inch self tapping screw x 1 or 2;No.4 x 1/4 inch self tapping screw x 1 or 2;Gliders and hooks x 12 - 24;End stop and fixing nut x 1 or 2;Ceiling hanger support x 1 or 2;Cei,https://www.wolseley.co.uk/wcsstore/ExtendedSitesCatalogAssetStore/images/products/AssetPush/wol-web-proof-medium-w/std.lang.all/04/49/UP-D30449_wm.jpg,,,,,,,,,,,,,,,,,,,https://www.wolseley.co.uk/wcsstore/ExtendedSitesCatalogAssetStore/images/products/AssetPush/DTP_AssetPushHighRes/std.lang.all/ti/on/Croydex_SlenderlineKit_Installation.pdf,https://www.wolseley.co.uk/wcsstore/ExtendedSitesCatalogAssetStore/images/products/AssetPush/DTP_AssetPushHighRes/std.lang.all/20/19/Croydex_Product_Catalogue_2019.pdf,,,,,,,
51,PD30236,Croydex Profile 800 shower rail 760 x 1830mm Silver,Croydex,48.27,"The lightweight and strong 760 x 1830mm Croydex Profile 800 L-shaped shower rail is a professional rail system designed to effortlessly hold a shower curtain. Supplied with hooks and gliders, this curtain rail is pre-formed and incorporates a rigid H section for bends without sagging.",Showering/Shower Curtains and Screens/Shower Curtains and Screens.csv -> Croydex Profile 800 shower rail 760 x 1830mm Silver,,L shaped shower rail;Wall plugs x 4-10;No.8 x 1 1/4 inch screws x 4 -10;No.6 x 1 inch self tapping screw x 1 or 2;No.4 x 1/4 inch self tapping screw x 1 or 2;Gliders and hooks x 12 - 24;End stop and fixing nut x 1 or 2;Ceiling hanger support x 1 or 2;Cei,https://www.wolseley.co.uk/wcsstore/ExtendedSitesCatalogAssetStore/images/products/AssetPush/wol-web-proof-medium-w/std.lang.all/02/36/UP-D30236_wm.jpg,,,,,,,,,,,,,,,,,,,https://www.wolseley.co.uk/wcsstore/ExtendedSitesCatalogAssetStore/images/products/AssetPush/DTP_AssetPushHighRes/std.lang.all/ti/on/Croydex_SlenderlineKit_Installation.pdf,https://www.wolseley.co.uk/wcsstore/ExtendedSitesCatalogAssetStore/images/products/AssetPush/DTP_AssetPushHighRes/std.lang.all/20/19/Croydex_Product_Catalogue_2019.pdf,,,,,,,
