,pid,Title,Brand,Price,Description,category,mfpartnumber,whatisincluded,Image,Attachment 1,Attachment 2,Attachment 3,Attachment 4,Attachment 5,Attachment 6,Attachment 7,Attachment 8
0,P619160,Daikin Sky Air Advance FBA125A R32 Ducted Unit 12.5KW,Daikin,1330.16,"Quiet and efficient, the Daikin Sky Air Advance ducted air conditioning unit incorporates an inverter fan designed to adapt available pressure for ideal comfort in all conditions. By lowering the fan revolutions, this helps to not only reduce energy consumption but make the unit significantly quieter too. Just 245mm tall, this compact unit is easily concealed for discreet installation.",Air Conditioning/Daikin R32 Indoor Units/Ducted/Ducted.csv -> Daikin Sky Air Advance FBA125A R32 Ducted Unit 12.5KW,,,https://www.wolseley.co.uk/wcsstore/ExtendedSitesCatalogAssetStore/images/products/AssetPush/wol-web-proof-medium-w/std.lang.all/91/61/NW-619155_619161_wm.jpg,https://www.wolseley.co.uk/wcsstore/ExtendedSitesCatalogAssetStore/images/products/AssetPush/DTP_AssetPushHighRes/std.lang.all/nu/al/Daikin_FBA35P_18031_Photo_Manual.pdf,https://www.wolseley.co.uk/wcsstore/ExtendedSitesCatalogAssetStore/images/products/AssetPush/DTP_AssetPushHighRes/std.lang.all/nu/al/Daikin_FBA_4PEN456964-1C_Oper_Manual.pdf,https://www.wolseley.co.uk/wcsstore/ExtendedSitesCatalogAssetStore/images/products/AssetPush/DTP_AssetPushHighRes/std.lang.all/ta/ll/Daikin_FBA-A_4PEN456962-1E_Install.pdf,https://www.wolseley.co.uk/wcsstore/ExtendedSitesCatalogAssetStore/images/products/AssetPush/DTP_AssetPushHighRes/std.lang.all/ti/on/Daikin_FBA-A_RoHS_Declaration.pdf,https://www.wolseley.co.uk/wcsstore/ExtendedSitesCatalogAssetStore/images/products/AssetPush/DTP_AssetPushHighRes/std.lang.all/ic/al/Daikin_FBA-A_RZASG_102AA_Technical.pdf,https://www.wolseley.co.uk/wcsstore/ExtendedSitesCatalogAssetStore/images/products/AssetPush/DTP_AssetPushHighRes/std.lang.all/nu/al/Daikin_FBA35P_17116_Photo_Manual.pdf,https://www.wolseley.co.uk/wcsstore/ExtendedSitesCatalogAssetStore/images/products/AssetPush/DTP_AssetPushHighRes/std.lang.all/ui/de/Daikin_4PEN550955_Install_Ref_Guide.pdf,https://www.wolseley.co.uk/wcsstore/ExtendedSitesCatalogAssetStore/images/products/AssetPush/DTP_AssetPushHighRes/std.lang.all/ui/de/Daikin_FBA-A_4PEN543324-2_User_Guide.pdf
1,P619155,Daikin Bluevolution FBA35A9 R32 Ducted Unit 3.5KW,Daikin,592.95,"Quieter and even more efficient than its predecessors, the Daikin Bluevolution ducted air conditioning unit incorporates inverter fans designed to adapt available pressure for optimised comfort at all times while reducing both the sound level and energy consumption by lowering fan revolutions. Just 245mm in height, this compact unit provides easy and flexible installation.",Air Conditioning/Daikin R32 Indoor Units/Ducted/Ducted.csv -> Daikin Bluevolution FBA35A9 R32 Ducted Unit 3.5KW,,,https://www.wolseley.co.uk/wcsstore/ExtendedSitesCatalogAssetStore/images/products/AssetPush/wol-web-proof-medium-w/std.lang.all/91/61/NW-619155_619161_wm.jpg,https://www.wolseley.co.uk/wcsstore/ExtendedSitesCatalogAssetStore/images/products/AssetPush/DTP_AssetPushHighRes/std.lang.all/nu/al/Daikin_FBA35P_18031_Photo_Manual.pdf,https://www.wolseley.co.uk/wcsstore/ExtendedSitesCatalogAssetStore/images/products/AssetPush/DTP_AssetPushHighRes/std.lang.all/nu/al/Daikin_FBA_4PEN456964-1C_Oper_Manual.pdf,https://www.wolseley.co.uk/wcsstore/ExtendedSitesCatalogAssetStore/images/products/AssetPush/DTP_AssetPushHighRes/std.lang.all/ta/ll/Daikin_FBA-A_4PEN456962-1E_Install.pdf,https://www.wolseley.co.uk/wcsstore/ExtendedSitesCatalogAssetStore/images/products/AssetPush/DTP_AssetPushHighRes/std.lang.all/ti/on/Daikin_FBA-A_RoHS_Declaration.pdf,https://www.wolseley.co.uk/wcsstore/ExtendedSitesCatalogAssetStore/images/products/AssetPush/DTP_AssetPushHighRes/std.lang.all/nu/al/Daikin_FBA35P_17116_Photo_Manual.pdf,https://www.wolseley.co.uk/wcsstore/ExtendedSitesCatalogAssetStore/images/products/AssetPush/DTP_AssetPushHighRes/std.lang.all/ui/de/Daikin_4PEN550955_Install_Ref_Guide.pdf,https://www.wolseley.co.uk/wcsstore/ExtendedSitesCatalogAssetStore/images/products/AssetPush/DTP_AssetPushHighRes/std.lang.all/ui/de/Daikin_FBA-A_4PEN543324-2_User_Guide.pdf,https://www.wolseley.co.uk/wcsstore/ExtendedSitesCatalogAssetStore/images/products/AssetPush/DTP_AssetPushHighRes/std.lang.all/ic/al/Daikin_FBA-A_RXM-M9_102B_Technical.pdf
2,P619156,Daikin Bluevolution FBA50A9 R32 Ducted Unit 5KW,Daikin,630.12,"Quieter and even more efficient than its predecessors, the Daikin Bluevolution ducted air conditioning unit incorporates inverter fans designed to adapt available pressure for optimised comfort at all times while reducing both the sound level and energy consumption by lowering fan revolutions. Just 245mm in height, this compact unit provides easy and flexible installation.",Air Conditioning/Daikin R32 Indoor Units/Ducted/Ducted.csv -> Daikin Bluevolution FBA50A9 R32 Ducted Unit 5KW,,,https://www.wolseley.co.uk/wcsstore/ExtendedSitesCatalogAssetStore/images/products/AssetPush/wol-web-proof-medium-w/std.lang.all/91/61/NW-619155_619161_wm.jpg,https://www.wolseley.co.uk/wcsstore/ExtendedSitesCatalogAssetStore/images/products/AssetPush/DTP_AssetPushHighRes/std.lang.all/nu/al/Daikin_FBA35P_18031_Photo_Manual.pdf,https://www.wolseley.co.uk/wcsstore/ExtendedSitesCatalogAssetStore/images/products/AssetPush/DTP_AssetPushHighRes/std.lang.all/nu/al/Daikin_FBA_4PEN456964-1C_Oper_Manual.pdf,https://www.wolseley.co.uk/wcsstore/ExtendedSitesCatalogAssetStore/images/products/AssetPush/DTP_AssetPushHighRes/std.lang.all/ta/ll/Daikin_FBA-A_4PEN456962-1E_Install.pdf,https://www.wolseley.co.uk/wcsstore/ExtendedSitesCatalogAssetStore/images/products/AssetPush/DTP_AssetPushHighRes/std.lang.all/ti/on/Daikin_FBA-A_RoHS_Declaration.pdf,https://www.wolseley.co.uk/wcsstore/ExtendedSitesCatalogAssetStore/images/products/AssetPush/DTP_AssetPushHighRes/std.lang.all/nu/al/Daikin_FBA35P_17116_Photo_Manual.pdf,https://www.wolseley.co.uk/wcsstore/ExtendedSitesCatalogAssetStore/images/products/AssetPush/DTP_AssetPushHighRes/std.lang.all/ui/de/Daikin_4PEN550955_Install_Ref_Guide.pdf,https://www.wolseley.co.uk/wcsstore/ExtendedSitesCatalogAssetStore/images/products/AssetPush/DTP_AssetPushHighRes/std.lang.all/ui/de/Daikin_FBA-A_4PEN543324-2_User_Guide.pdf,https://www.wolseley.co.uk/wcsstore/ExtendedSitesCatalogAssetStore/images/products/AssetPush/DTP_AssetPushHighRes/std.lang.all/ic/al/Daikin_FBA-A_RXM-M9_102B_Technical.pdf
3,P619157,Daikin Bluevolution FBA60A9 R32 Ducted Unit 6KW,Daikin,706.23,"Quieter and even more efficient than its predecessors, the Daikin Bluevolution ducted air conditioning unit incorporates inverter fans designed to adapt available pressure for optimised comfort at all times while reducing both the sound level and energy consumption by lowering fan revolutions. Just 245mm in height, this compact unit provides easy and flexible installation.",Air Conditioning/Daikin R32 Indoor Units/Ducted/Ducted.csv -> Daikin Bluevolution FBA60A9 R32 Ducted Unit 6KW,,,https://www.wolseley.co.uk/wcsstore/ExtendedSitesCatalogAssetStore/images/products/AssetPush/wol-web-proof-medium-w/std.lang.all/91/61/NW-619155_619161_wm.jpg,https://www.wolseley.co.uk/wcsstore/ExtendedSitesCatalogAssetStore/images/products/AssetPush/DTP_AssetPushHighRes/std.lang.all/nu/al/Daikin_FBA35P_18031_Photo_Manual.pdf,https://www.wolseley.co.uk/wcsstore/ExtendedSitesCatalogAssetStore/images/products/AssetPush/DTP_AssetPushHighRes/std.lang.all/nu/al/Daikin_FBA_4PEN456964-1C_Oper_Manual.pdf,https://www.wolseley.co.uk/wcsstore/ExtendedSitesCatalogAssetStore/images/products/AssetPush/DTP_AssetPushHighRes/std.lang.all/ta/ll/Daikin_FBA-A_4PEN456962-1E_Install.pdf,https://www.wolseley.co.uk/wcsstore/ExtendedSitesCatalogAssetStore/images/products/AssetPush/DTP_AssetPushHighRes/std.lang.all/ti/on/Daikin_FBA-A_RoHS_Declaration.pdf,https://www.wolseley.co.uk/wcsstore/ExtendedSitesCatalogAssetStore/images/products/AssetPush/DTP_AssetPushHighRes/std.lang.all/nu/al/Daikin_FBA35P_17116_Photo_Manual.pdf,https://www.wolseley.co.uk/wcsstore/ExtendedSitesCatalogAssetStore/images/products/AssetPush/DTP_AssetPushHighRes/std.lang.all/ui/de/Daikin_4PEN550955_Install_Ref_Guide.pdf,https://www.wolseley.co.uk/wcsstore/ExtendedSitesCatalogAssetStore/images/products/AssetPush/DTP_AssetPushHighRes/std.lang.all/ui/de/Daikin_FBA-A_4PEN543324-2_User_Guide.pdf,https://www.wolseley.co.uk/wcsstore/ExtendedSitesCatalogAssetStore/images/products/AssetPush/DTP_AssetPushHighRes/std.lang.all/ic/al/Daikin_FBA-A_RXM-M9_102B_Technical.pdf
4,P619159,Daikin Sky Air Advance FBA100A R32 Fba100A Ducted Unit 10KW,Daikin,1110.68,"Quiet and efficient, the Daikin Sky Air Advance ducted air conditioning unit incorporates an inverter fan designed to adapt available pressure for ideal comfort in all conditions. By lowering the fan revolutions, this helps to not only reduce energy consumption but make the unit significantly quieter too. Just 245mm tall, this compact unit is easily concealed for discreet installation.",Air Conditioning/Daikin R32 Indoor Units/Ducted/Ducted.csv -> Daikin Sky Air Advance FBA100A R32 Fba100A Ducted Unit 10KW,,,https://www.wolseley.co.uk/wcsstore/ExtendedSitesCatalogAssetStore/images/products/AssetPush/wol-web-proof-medium-w/std.lang.all/91/61/NW-619155_619161_wm.jpg,https://www.wolseley.co.uk/wcsstore/ExtendedSitesCatalogAssetStore/images/products/AssetPush/DTP_AssetPushHighRes/std.lang.all/nu/al/Daikin_FBA35P_18031_Photo_Manual.pdf,https://www.wolseley.co.uk/wcsstore/ExtendedSitesCatalogAssetStore/images/products/AssetPush/DTP_AssetPushHighRes/std.lang.all/nu/al/Daikin_FBA_4PEN456964-1C_Oper_Manual.pdf,https://www.wolseley.co.uk/wcsstore/ExtendedSitesCatalogAssetStore/images/products/AssetPush/DTP_AssetPushHighRes/std.lang.all/ta/ll/Daikin_FBA-A_4PEN456962-1E_Install.pdf,https://www.wolseley.co.uk/wcsstore/ExtendedSitesCatalogAssetStore/images/products/AssetPush/DTP_AssetPushHighRes/std.lang.all/ti/on/Daikin_FBA-A_RoHS_Declaration.pdf,https://www.wolseley.co.uk/wcsstore/ExtendedSitesCatalogAssetStore/images/products/AssetPush/DTP_AssetPushHighRes/std.lang.all/ic/al/Daikin_FBA-A_RZASG_102AA_Technical.pdf,https://www.wolseley.co.uk/wcsstore/ExtendedSitesCatalogAssetStore/images/products/AssetPush/DTP_AssetPushHighRes/std.lang.all/ui/de/Daikin_4PEN550955_Install_Ref_Guide.pdf,https://www.wolseley.co.uk/wcsstore/ExtendedSitesCatalogAssetStore/images/products/AssetPush/DTP_AssetPushHighRes/std.lang.all/nu/al/Daikin_FBA35P_17116_Photo_Manual.pdf,https://www.wolseley.co.uk/wcsstore/ExtendedSitesCatalogAssetStore/images/products/AssetPush/DTP_AssetPushHighRes/std.lang.all/ui/de/Daikin_FBA-A_4PEN543324-2_User_Guide.pdf
5,P619161,Daikin Sky Air Advance FBA140A R32 Ducted Unit 14KW,Daikin,1558.49,"Quiet and efficient, the Daikin Sky Air Advance ducted air conditioning unit incorporates an inverter fan designed to adapt available pressure for ideal comfort in all conditions. By lowering the fan revolutions, this helps to not only reduce energy consumption but make the unit significantly quieter too. Just 245mm tall, this compact unit is easily concealed for discreet installation.",Air Conditioning/Daikin R32 Indoor Units/Ducted/Ducted.csv -> Daikin Sky Air Advance FBA140A R32 Ducted Unit 14KW,,,https://www.wolseley.co.uk/wcsstore/ExtendedSitesCatalogAssetStore/images/products/AssetPush/wol-web-proof-medium-w/std.lang.all/91/61/NW-619155_619161_wm.jpg,https://www.wolseley.co.uk/wcsstore/ExtendedSitesCatalogAssetStore/images/products/AssetPush/DTP_AssetPushHighRes/std.lang.all/nu/al/Daikin_FBA35P_18031_Photo_Manual.pdf,https://www.wolseley.co.uk/wcsstore/ExtendedSitesCatalogAssetStore/images/products/AssetPush/DTP_AssetPushHighRes/std.lang.all/nu/al/Daikin_FBA_4PEN456964-1C_Oper_Manual.pdf,https://www.wolseley.co.uk/wcsstore/ExtendedSitesCatalogAssetStore/images/products/AssetPush/DTP_AssetPushHighRes/std.lang.all/ta/ll/Daikin_FBA-A_4PEN456962-1E_Install.pdf,https://www.wolseley.co.uk/wcsstore/ExtendedSitesCatalogAssetStore/images/products/AssetPush/DTP_AssetPushHighRes/std.lang.all/ti/on/Daikin_FBA-A_RoHS_Declaration.pdf,https://www.wolseley.co.uk/wcsstore/ExtendedSitesCatalogAssetStore/images/products/AssetPush/DTP_AssetPushHighRes/std.lang.all/ic/al/Daikin_FBA-A_RZASG_102AA_Technical.pdf,https://www.wolseley.co.uk/wcsstore/ExtendedSitesCatalogAssetStore/images/products/AssetPush/DTP_AssetPushHighRes/std.lang.all/ui/de/Daikin_4PEN550955_Install_Ref_Guide.pdf,https://www.wolseley.co.uk/wcsstore/ExtendedSitesCatalogAssetStore/images/products/AssetPush/DTP_AssetPushHighRes/std.lang.all/nu/al/Daikin_FBA35P_17116_Photo_Manual.pdf,https://www.wolseley.co.uk/wcsstore/ExtendedSitesCatalogAssetStore/images/products/AssetPush/DTP_AssetPushHighRes/std.lang.all/ui/de/Daikin_FBA-A_4PEN543324-2_User_Guide.pdf
6,P619151,Daikin FDXM25F9 R32/R410A Slim Ducted Unit 2.5KW,Daikin,431.88,"Ideal for small-to-medium sized business premises, the Daikin ducted air conditioning system is compact and easy to install. This small unit includes a Wi-Fi control option for complete app control of the air conditioning and heat pump ducted system while its R32 compatibility ensures maximum efficiency.",Air Conditioning/Daikin R32 Indoor Units/Ducted/Ducted.csv -> Daikin FDXM25F9 R32/R410A Slim Ducted Unit 2.5KW,,,https://www.wolseley.co.uk/wcsstore/ExtendedSitesCatalogAssetStore/images/products/AssetPush/wol-web-proof-medium-w/std.lang.all/91/54/NW-619151_619154_wm.jpg,https://www.wolseley.co.uk/wcsstore/ExtendedSitesCatalogAssetStore/images/products/AssetPush/DTP_AssetPushHighRes/std.lang.all/ta/ll/Daikin_FDXM-F_3PEN417664-1A_Install.pdf,https://www.wolseley.co.uk/wcsstore/ExtendedSitesCatalogAssetStore/images/products/AssetPush/DTP_AssetPushHighRes/std.lang.all/nu/al/Daikin_FDXM_F_Opera_Manual.pdf,https://www.wolseley.co.uk/wcsstore/ExtendedSitesCatalogAssetStore/images/products/AssetPush/DTP_AssetPushHighRes/std.lang.all/ti/on/Daikin_EASYZONE_Installation.pdf,https://www.wolseley.co.uk/wcsstore/ExtendedSitesCatalogAssetStore/images/products/AssetPush/DTP_AssetPushHighRes/std.lang.all/ec/la/Daikin_FDXM-F_RoHS_Decla.pdf,https://www.wolseley.co.uk/wcsstore/ExtendedSitesCatalogAssetStore/images/products/AssetPush/DTP_AssetPushHighRes/std.lang.all/ic/al/Daikin_FDXM_F3_EEDEN17_Technical.pdf,,,
7,P619158,Daikin Sky Air Advance FBA71A9 R32 Ducted Unit 7KW,Daikin,1058.46,"Quieter and even more efficient than its predecessors, the Daikin Sky Air Advance ducted air conditioning unit incorporates inverter fans designed to adapt available pressure for optimised comfort at all times while reducing both the sound level and energy consumption by lowering fan revolutions. Just 245mm in height, this compact unit provides easy and flexible installation.",Air Conditioning/Daikin R32 Indoor Units/Ducted/Ducted.csv -> Daikin Sky Air Advance FBA71A9 R32 Ducted Unit 7KW,,,https://www.wolseley.co.uk/wcsstore/ExtendedSitesCatalogAssetStore/images/products/AssetPush/wol-web-proof-medium-w/std.lang.all/91/61/NW-619155_619161_wm.jpg,https://www.wolseley.co.uk/wcsstore/ExtendedSitesCatalogAssetStore/images/products/AssetPush/DTP_AssetPushHighRes/std.lang.all/nu/al/Daikin_FBA35P_18031_Photo_Manual.pdf,https://www.wolseley.co.uk/wcsstore/ExtendedSitesCatalogAssetStore/images/products/AssetPush/DTP_AssetPushHighRes/std.lang.all/nu/al/Daikin_FBA_4PEN456964-1C_Oper_Manual.pdf,https://www.wolseley.co.uk/wcsstore/ExtendedSitesCatalogAssetStore/images/products/AssetPush/DTP_AssetPushHighRes/std.lang.all/ta/ll/Daikin_FBA-A_4PEN456962-1E_Install.pdf,https://www.wolseley.co.uk/wcsstore/ExtendedSitesCatalogAssetStore/images/products/AssetPush/DTP_AssetPushHighRes/std.lang.all/ti/on/Daikin_FBA-A_RoHS_Declaration.pdf,https://www.wolseley.co.uk/wcsstore/ExtendedSitesCatalogAssetStore/images/products/AssetPush/DTP_AssetPushHighRes/std.lang.all/ic/al/Daikin_FBA-A_RZASG_102AA_Technical.pdf,https://www.wolseley.co.uk/wcsstore/ExtendedSitesCatalogAssetStore/images/products/AssetPush/DTP_AssetPushHighRes/std.lang.all/ui/de/Daikin_4PEN550955_Install_Ref_Guide.pdf,https://www.wolseley.co.uk/wcsstore/ExtendedSitesCatalogAssetStore/images/products/AssetPush/DTP_AssetPushHighRes/std.lang.all/nu/al/Daikin_FBA35P_17116_Photo_Manual.pdf,https://www.wolseley.co.uk/wcsstore/ExtendedSitesCatalogAssetStore/images/products/AssetPush/DTP_AssetPushHighRes/std.lang.all/ui/de/Daikin_FBA-A_4PEN543324-2_User_Guide.pdf
8,P619153,Daikin FDXM50F9 R32/R410A Slim Ducted Unit 5KW,Daikin,543.39,"Ideal for small-to-medium sized business premises, the Daikin ducted air conditioning system is compact and easy to install. This small unit includes a Wi-Fi control option for complete app control of the air conditioning and heat pump ducted system while its R32 compatibility ensures maximum efficiency.",Air Conditioning/Daikin R32 Indoor Units/Ducted/Ducted.csv -> Daikin FDXM50F9 R32/R410A Slim Ducted Unit 5KW,,,https://www.wolseley.co.uk/wcsstore/ExtendedSitesCatalogAssetStore/images/products/AssetPush/wol-web-proof-medium-w/std.lang.all/91/54/NW-619151_619154_wm.jpg,https://www.wolseley.co.uk/wcsstore/ExtendedSitesCatalogAssetStore/images/products/AssetPush/DTP_AssetPushHighRes/std.lang.all/ta/ll/Daikin_FDXM-F_3PEN417664-1A_Install.pdf,https://www.wolseley.co.uk/wcsstore/ExtendedSitesCatalogAssetStore/images/products/AssetPush/DTP_AssetPushHighRes/std.lang.all/nu/al/Daikin_FDXM_F_Opera_Manual.pdf,https://www.wolseley.co.uk/wcsstore/ExtendedSitesCatalogAssetStore/images/products/AssetPush/DTP_AssetPushHighRes/std.lang.all/ti/on/Daikin_EASYZONE_Installation.pdf,https://www.wolseley.co.uk/wcsstore/ExtendedSitesCatalogAssetStore/images/products/AssetPush/DTP_AssetPushHighRes/std.lang.all/ec/la/Daikin_FDXM-F_RoHS_Decla.pdf,https://www.wolseley.co.uk/wcsstore/ExtendedSitesCatalogAssetStore/images/products/AssetPush/DTP_AssetPushHighRes/std.lang.all/ic/al/Daikin_FDXM_F3_EEDEN17_Technical.pdf,,,
9,P619152,Daikin FDXM35F9 R32/R410A Slim Ducted Unit 3.5KW,Daikin,493.83,"Ideal for small-to-medium sized business premises, the Daikin ducted air conditioning system is compact and easy to install. This small unit includes a Wi-Fi control option for complete app control of the air conditioning and heat pump ducted system while its R32 compatibility ensures maximum efficiency.",Air Conditioning/Daikin R32 Indoor Units/Ducted/Ducted.csv -> Daikin FDXM35F9 R32/R410A Slim Ducted Unit 3.5KW,,,https://www.wolseley.co.uk/wcsstore/ExtendedSitesCatalogAssetStore/images/products/AssetPush/wol-web-proof-medium-w/std.lang.all/91/54/NW-619151_619154_wm.jpg,https://www.wolseley.co.uk/wcsstore/ExtendedSitesCatalogAssetStore/images/products/AssetPush/DTP_AssetPushHighRes/std.lang.all/nu/al/Daikin_FDXM_F_Opera_Manual.pdf,https://www.wolseley.co.uk/wcsstore/ExtendedSitesCatalogAssetStore/images/products/AssetPush/DTP_AssetPushHighRes/std.lang.all/ta/ll/Daikin_FDXM-F_3PEN417664-1A_Install.pdf,https://www.wolseley.co.uk/wcsstore/ExtendedSitesCatalogAssetStore/images/products/AssetPush/DTP_AssetPushHighRes/std.lang.all/ti/on/Daikin_EASYZONE_Installation.pdf,https://www.wolseley.co.uk/wcsstore/ExtendedSitesCatalogAssetStore/images/products/AssetPush/DTP_AssetPushHighRes/std.lang.all/ec/la/Daikin_FDXM-F_RoHS_Decla.pdf,https://www.wolseley.co.uk/wcsstore/ExtendedSitesCatalogAssetStore/images/products/AssetPush/DTP_AssetPushHighRes/std.lang.all/ic/al/Daikin_FDXM_F3_EEDEN17_Technical.pdf,,,
10,P619154,Daikin FDXM60F9 R32/R410A Slim Ducted Unit 6KW,Daikin,606.23,"Ideal for small-to-medium sized business premises, the Daikin ducted air conditioning system is compact and easy to install. This small unit includes a Wi-Fi control option for complete app control of the air conditioning and heat pump ducted system while its R32 compatibility ensures maximum efficiency.",Air Conditioning/Daikin R32 Indoor Units/Ducted/Ducted.csv -> Daikin FDXM60F9 R32/R410A Slim Ducted Unit 6KW,,,https://www.wolseley.co.uk/wcsstore/ExtendedSitesCatalogAssetStore/images/products/AssetPush/wol-web-proof-medium-w/std.lang.all/91/54/NW-619151_619154_wm.jpg,https://www.wolseley.co.uk/wcsstore/ExtendedSitesCatalogAssetStore/images/products/AssetPush/DTP_AssetPushHighRes/std.lang.all/ta/ll/Daikin_FDXM-F_3PEN417664-1A_Install.pdf,https://www.wolseley.co.uk/wcsstore/ExtendedSitesCatalogAssetStore/images/products/AssetPush/DTP_AssetPushHighRes/std.lang.all/nu/al/Daikin_FDXM_F_Opera_Manual.pdf,https://www.wolseley.co.uk/wcsstore/ExtendedSitesCatalogAssetStore/images/products/AssetPush/DTP_AssetPushHighRes/std.lang.all/ti/on/Daikin_EASYZONE_Installation.pdf,https://www.wolseley.co.uk/wcsstore/ExtendedSitesCatalogAssetStore/images/products/AssetPush/DTP_AssetPushHighRes/std.lang.all/ec/la/Daikin_FDXM-F_RoHS_Decla.pdf,https://www.wolseley.co.uk/wcsstore/ExtendedSitesCatalogAssetStore/images/products/AssetPush/DTP_AssetPushHighRes/std.lang.all/ic/al/Daikin_FDXM_F3_EEDEN17_Technical.pdf,,,
11,P687972,Daikin FXDQ20A3 R410A Slim Concealed Ceiling Unit,Daikin,778.8,"Ideal for use in hotels or office blocks, the slim and discreet Daikin indoor heating and cooling ceiling unit offers flexible installation into a ceiling void as small as 240mm. Suitable for multi-zoning, this unit includes an auto-cleaning function to minimise maintenance while ensuring good levels of comfort and efficiency.",Air Conditioning/Daikin R32 Indoor Units/Ducted/Ducted.csv -> Daikin FXDQ20A3 R410A Slim Concealed Ceiling Unit,,,https://www.wolseley.co.uk/wcsstore/ExtendedSitesCatalogAssetStore/images/products/AssetPush/wol-web-proof-medium-w/std.lang.all/79/76/NW-687971_687976_wm.jpg,https://www.wolseley.co.uk/wcsstore/ExtendedSitesCatalogAssetStore/images/products/AssetPush/DTP_AssetPushHighRes/std.lang.all/_m/an/Daikin_FXDQ_4PEN324678-1F_Operat_Man.pdf,https://www.wolseley.co.uk/wcsstore/ExtendedSitesCatalogAssetStore/images/products/AssetPush/DTP_AssetPushHighRes/std.lang.all/de/cl/Daikin_FXDQ15-63A3_3P481419-1_Decl.pdf,https://www.wolseley.co.uk/wcsstore/ExtendedSitesCatalogAssetStore/images/products/AssetPush/DTP_AssetPushHighRes/std.lang.all/ic/al/Daikin_FXDQ-A3_Technical.pdf,https://www.wolseley.co.uk/wcsstore/ExtendedSitesCatalogAssetStore/images/products/AssetPush/DTP_AssetPushHighRes/std.lang.all/ta/ll/Daikin_FXDQ15_4PEN325876-1F_Install.pdf,,,,
12,P687975,Daikin FXDQ40A3 R410A Slim Concealed Ceiling Unit,Daikin,864.16,"With its slimline design, the Daikin VRV concealed indoor heating and cooling ceiling unit can be discreetly installed into a ceiling void as shallow as 240mm. Ideal for hotel or office use and suitable for multi-zone installations controlled by a single indoor unit, this compact climate control unit has a range of handy features including an auto-cleaning function for improved comfort and efficiency while reducing the need for costly maintenance.",Air Conditioning/Daikin R32 Indoor Units/Ducted/Ducted.csv -> Daikin FXDQ40A3 R410A Slim Concealed Ceiling Unit,,,https://www.wolseley.co.uk/wcsstore/ExtendedSitesCatalogAssetStore/images/products/AssetPush/wol-web-proof-medium-w/std.lang.all/79/76/NW-687971_687976_wm.jpg,https://www.wolseley.co.uk/wcsstore/ExtendedSitesCatalogAssetStore/images/products/AssetPush/DTP_AssetPushHighRes/std.lang.all/_m/an/Daikin_FXDQ_4PEN324678-1F_Operat_Man.pdf,https://www.wolseley.co.uk/wcsstore/ExtendedSitesCatalogAssetStore/images/products/AssetPush/DTP_AssetPushHighRes/std.lang.all/de/cl/Daikin_FXDQ15-63A3_3P481419-1_Decl.pdf,https://www.wolseley.co.uk/wcsstore/ExtendedSitesCatalogAssetStore/images/products/AssetPush/DTP_AssetPushHighRes/std.lang.all/ic/al/Daikin_FXDQ-A3_Technical.pdf,https://www.wolseley.co.uk/wcsstore/ExtendedSitesCatalogAssetStore/images/products/AssetPush/DTP_AssetPushHighRes/std.lang.all/ta/ll/Daikin_FXDQ15_4PEN325876-1F_Install.pdf,,,,
